,0,1,2,3
0,frankspencer,2022-11-19 01:58:39+00:00,https://twitter.com/frankspencer/status/1593785797886476290,Federal Judge Tells Ron DeSantis to Sit Down and STFU https://t.co/Y48h3jSmbn via @VanityFair
1,frankspencer,2022-11-18 02:24:04+00:00,https://twitter.com/frankspencer/status/1593429803519967233,"This might be my last tweet. If so, good night my friends - may a better future await us all!"
2,frankspencer,2022-11-13 16:42:25+00:00,https://twitter.com/frankspencer/status/1591833875810074632,"@GirlFuturist @yashar After years of disgusting behavior, that's what made her question him as a human being? (BTW, this is a completely made up story; she's been told to dump Trump so the base will hopefully do the same.)"
3,frankspencer,2022-11-13 16:19:55+00:00,https://twitter.com/frankspencer/status/1591828212186742790,One of these individuals knows foresight and is an alumni of The Futures School. @learnforesight
4,frankspencer,2022-11-13 05:18:26+00:00,https://twitter.com/frankspencer/status/1591661746544164864,Important because UAE now has strong influence over the foresight field due to their GOV SPONSORED future foresight body. They recently signed an alliance with 3 other long-standing associations in the field to form a new global entity. https://t.co/xiTVbpMenJ
5,frankspencer,2022-11-13 04:40:12+00:00,https://twitter.com/frankspencer/status/1591652125263675392,"@filljoyner Oh, no doubt. If asking what's the Twitter alternative, there's not one. Probably never will be. SM has peaked."
6,frankspencer,2022-11-13 04:39:03+00:00,https://twitter.com/frankspencer/status/1591651836200615936,I've said it before and I'll say it again: Don't listen to @billmaher. He parrots MAGA talking points while disguising himself as a liberal. He's another cranky boomer.
7,frankspencer,2022-11-13 04:18:38+00:00,https://twitter.com/frankspencer/status/1591646698501185537,"@filljoyner Mastodon is the leading candidate, with already a 1/2 mil new users since Musk took control. I see some starting Discord communities."
8,frankspencer,2022-11-13 04:08:29+00:00,https://twitter.com/frankspencer/status/1591644142974783488,"DeSantis is on a high having won big in FL. He thinks this means he's popular. He's not. As a matter of fact, the rest of the nation just voted against the same authoritarian garbage he stands for. Enjoy your bubble Ron. Nobody outside FL likes you.  https://t.co/YUlnHYRk21"
9,frankspencer,2022-11-10 12:37:26+00:00,https://twitter.com/frankspencer/status/1590685060872617984,@BobOne4All An alumni of The Futures School!
10,frankspencer,2022-11-09 20:00:10+00:00,https://twitter.com/frankspencer/status/1590434088120651776,@MaxwellFrostFL @pamelaschied @POTUS So excited for you! So happy for all of us! And so proud that you are an alumni of The Futures School! @learnforesight
11,frankspencer,2022-11-06 16:09:15+00:00,https://twitter.com/frankspencer/status/1589288813217472517,“Immunity Debt” shares something in common with the Devil or the Tooth Fairy. Neither are real.
12,frankspencer,2022-10-26 14:07:48+00:00,https://twitter.com/frankspencer/status/1585271983926919168,"@SeamusOhAilin Yes, gimme 10x or an impossible growth trajectory - just as long as futuring isn’t changing our core perspective."
13,frankspencer,2022-10-26 14:06:21+00:00,https://twitter.com/frankspencer/status/1585271620553392130,@ryonck Very punny Richard!
14,frankspencer,2022-10-26 02:46:23+00:00,https://twitter.com/frankspencer/status/1585100499233095682,"Ask most clients what they want to do with foresight, and they'll tell you they want a faster horse. 😉"
15,frankspencer,2022-10-24 17:08:05+00:00,https://twitter.com/frankspencer/status/1584592575842787333,"@AFcrew I know what will get taught most… and that’s the problem. As Nora says in this video, “If we are teaching our children to adapt to the system as it is - to get their degree, get a good job, work within the system - we will have failed them.”"
16,frankspencer,2022-10-24 00:45:37+00:00,https://twitter.com/frankspencer/status/1584345332120682496,"Not only should we teach a different future, and teach the future differently, but we must teach a different context, a different purpose, a different way of being."
17,frankspencer,2022-10-22 19:08:18+00:00,https://twitter.com/frankspencer/status/1583898056486834177,@threadreaderapp please unroll
18,frankspencer,2022-10-22 01:59:45+00:00,https://twitter.com/frankspencer/status/1583639211906719744,@BobOne4All Lol… I was just referring to the human connection to the bigger universal story.
19,frankspencer,2022-10-22 01:25:19+00:00,https://twitter.com/frankspencer/status/1583630546802200576,"@BobOne4All Thanks for the reply Bob, because - believe it or not - this isn’t an anti-AI screed. Rather, it’s about a “great technological scam” that even sucks in us futurists without questioning the deeper purpose and impact of futures thinking on consciousness and the cosmic story."
20,frankspencer,2022-10-21 20:56:23+00:00,https://twitter.com/frankspencer/status/1583562865662840833,"Humans aren't bad at foresight; the systems we have been shoved into are bad at foresight. So, as the computer scientist said in Willy Wonka. ""I'm now telling the computer what it can do with a lifetime supply of chocolate."" 10/fin"
21,frankspencer,2022-10-21 20:52:44+00:00,https://twitter.com/frankspencer/status/1583561948125229058,"When I hear ""AI will help us predict the future &amp; make human involvement in foresight obsolete,"" what I hear is a misunderstanding of futures thinking's role in the human experience - a natural ability that needs to be fostered for a greater expression of life, not replaced. 9/n"
22,frankspencer,2022-10-21 20:42:22+00:00,https://twitter.com/frankspencer/status/1583559339947589632,"As a matter of fact, our colonized systems that dehumanize, enslave and diminish keep stripping us of our collaborative role in the ""life equation"" - perceiving, sensing, emerging, meshing, co-creating, transforming consciousness. Where's the hype around that?! 8/n"
23,frankspencer,2022-10-21 20:37:36+00:00,https://twitter.com/frankspencer/status/1583558140033142784,"Because humans aren't the problem! (Shocker, I know.) Like forests, oceans, all other animals and the rest of the cosmos... we are life! The problem is our present system that silos EVERYTHING. We silo education, policies, groups of people - &amp; AI will reinforce that system. 7/n"
24,frankspencer,2022-10-21 20:29:13+00:00,https://twitter.com/frankspencer/status/1583556030092390400,"The AI trajectory is to make flawed human involvement in life irrelevant. To remove us from the system. To make the wheels of consumption run as smoothly as possible. To boil life down to an equation. But, as the computer in Willy Wonka said, that's cheating. Do you know why? 6/n"
25,frankspencer,2022-10-21 20:20:10+00:00,https://twitter.com/frankspencer/status/1583553752103292928,"""No Frank, AI will be the ultimate human helpmate. It will solve humanity's greatest problems, it will open doors for human development that we could never open on our on. It's the obvious next step in our intentional evolution."" Don't hold your breathe! 5/n"
26,frankspencer,2022-10-21 20:17:31+00:00,https://twitter.com/frankspencer/status/1583553086492381184,"We bought into a lie created by technocrats, industrialists, our modern mechanistic (i.e. efficiency, rationality, quantification, perfection). Our western philosophy &amp; goal devalues the human experience as inferior, &amp; we now we're ready to hand AI the keys. 4/n"
27,frankspencer,2022-10-21 20:11:04+00:00,https://twitter.com/frankspencer/status/1583551464424714240,"2. Why don't we spend the time, effort and money being put into AI to enhance the human experience in terms of ""intelligence amplification"" (i.e. the development of human cognition, critical thinking, futures thinking, consciousness expansion)? I'll attempt an answer... 3/n"
28,frankspencer,2022-10-21 20:04:23+00:00,https://twitter.com/frankspencer/status/1583549782391652352,"This brings up a host of questions. 1. What is the point of having AI predict the future? If it happens, it becomes a self-fulfilling prophecy that a.) sets us on a linear &amp; brittle path - the opposite of foresight’s prime utility, or b.) becomes a target of human rebellion. 2/n"
29,frankspencer,2022-10-21 18:41:08+00:00,https://twitter.com/frankspencer/status/1583528831679201280,On AI and it’s potential to predict our future being a “used future… let’s start with this clip from Willy Wonka and the Chocolate Factory where investors ask the computer to “predict” the location of the golden tickets. This was made 50 YEARS AGO! https://t.co/Agw1laHRVd 1/n
30,frankspencer,2022-10-21 18:31:29+00:00,https://twitter.com/frankspencer/status/1583526403353432064,@BobOne4All How do I double like this?!
31,frankspencer,2022-10-18 23:23:12+00:00,https://twitter.com/frankspencer/status/1582512650990551040,😒🤨https://t.co/yA3lYpN8hW
32,frankspencer,2022-10-18 00:52:18+00:00,https://twitter.com/frankspencer/status/1582172687446994944,@refuturing Tetrad of media effects.
33,frankspencer,2022-10-14 00:34:10+00:00,https://twitter.com/frankspencer/status/1580718569846734850,"@incognitosum Wow, there have been some doozies lately!"
34,frankspencer,2022-10-13 22:05:54+00:00,https://twitter.com/frankspencer/status/1580681258258300928,"New futures, old metrics? If you're trying to measure the value of foresight - a critical approach to organizational, governmental and social life - you won't find the answer in status quo metrics and evaluations. https://t.co/7jvA4cq0Qa"
35,frankspencer,2022-10-13 21:19:13+00:00,https://twitter.com/frankspencer/status/1580669511102976000,"@refuturing @GlenHiemstra @NikolasFuturist Didn’t mean to force your hand Baby Yoda, but we all know that we know that we know."
36,frankspencer,2022-10-13 20:59:41+00:00,https://twitter.com/frankspencer/status/1580664594737278976,@refuturing @GlenHiemstra @NikolasFuturist Rhymes with Doobye?
37,frankspencer,2022-10-13 20:53:42+00:00,https://twitter.com/frankspencer/status/1580663089879400448,@refuturing You just did. ;-)
38,frankspencer,2022-10-12 02:05:32+00:00,https://twitter.com/frankspencer/status/1580016788653633537,@refuturing @Cekent They read it in Week 1. A distant memory by the time they are knighted to defend the honor of capitalism at all costs.
39,frankspencer,2022-10-12 02:01:45+00:00,https://twitter.com/frankspencer/status/1580015837901385734,@Annhattan A great example of using metrics of scarcity for transformational change. We can’t measure ontologically different futures with data/measurements created by destructive systems.
40,frankspencer,2022-10-09 17:30:17+00:00,https://twitter.com/frankspencer/status/1579162344541736961,Thank god that the US isn’t a severely and violently racist country.
41,frankspencer,2022-10-09 17:24:05+00:00,https://twitter.com/frankspencer/status/1579160786991448064,"Happy to see a conversation on the @profuturists listserv deeply questioning the validity of the #blackswan concept. By its nature, futures work should not believe in black swans - the surprise they offer is really a lack of robust provocation."
42,frankspencer,2022-10-09 17:15:34+00:00,https://twitter.com/frankspencer/status/1579158644855549952,@SenTuberville is as racist as they come.
43,frankspencer,2022-10-09 17:10:56+00:00,https://twitter.com/frankspencer/status/1579157475311648769,@refuturing Sigh… a huge &amp; important voice for futures work in term of cosmic wholesight and process ontology. Foresight professionals would do well to include more of Latour’s thinking in their work as a means to escape the colonized constructs of reductionist and positivist ideologies.
44,frankspencer,2022-10-08 21:19:35+00:00,https://twitter.com/frankspencer/status/1578857665018875904,"@refuturing @dschatsky The integration is the interesting part, going “back up” the sign order to dig into hidden cosmic “realties.”"
45,frankspencer,2022-10-08 21:17:26+00:00,https://twitter.com/frankspencer/status/1578857124251467777,@refuturing @dschatsky I did a side-by-side comparison of CLA and the four stages of sign/order of Simulacra and Simulation about 10 years ago. You’ve inspired me to bust it out and maybe write something on it.
46,frankspencer,2022-10-08 19:50:42+00:00,https://twitter.com/frankspencer/status/1578835295155339265,"@refuturing @dschatsky Im a huge Baudrillard fan, and the pumpkin meme is great explainer. Reality? What reality?"
47,frankspencer,2022-10-08 19:45:39+00:00,https://twitter.com/frankspencer/status/1578834023102631937,"@refuturing MV marketers have done a good job of getting companies to jump on the bandwagon &amp; spend money. So, foresight pros are expected to lead w/ it instead of questioning. Q: I wonder how often it will come up at the Dubai Future Forum next week? A: Enough to get alcohol poisoning."
48,frankspencer,2022-10-08 04:25:13+00:00,https://twitter.com/frankspencer/status/1578602390517088261,"@avantgame One of my all-time favs! Of course, it didn't come out until I was 17, but I will say that my dad took me to see Omega Man when I was 6-7. Scared me silly, but I love him all the more for it. ;-)"
49,frankspencer,2022-10-08 04:19:42+00:00,https://twitter.com/frankspencer/status/1578601000314998784,"Werewolf By Night... EXCELLENT! Hey @MarvelStudios, give us the Monsterverse we never got from Universal. We want to see more. HAPPY HALLOWEEN!"
50,frankspencer,2022-10-07 21:59:49+00:00,https://twitter.com/frankspencer/status/1578505403066765312,SUPER DARK BRANDON !!!
51,frankspencer,2022-10-07 21:57:35+00:00,https://twitter.com/frankspencer/status/1578504838836457473,"You need to understand that EVERY TIME a cop approaches you, they’re playing out a firearm and shooting scenario. They can’t wait to pull the trigger."
52,frankspencer,2022-10-07 17:24:10+00:00,https://twitter.com/frankspencer/status/1578436032441503744,"@GlenHiemstra @NikolasFuturist @refuturing One of the things that we had the pleasure of discussing with attendees at our recent Transformations of Natural Foresight retreat is that much of foresight work and practice focuses on things, objects, endings. Cooperatively perceiving process and emergence sees beginnings."
53,frankspencer,2022-10-07 17:21:45+00:00,https://twitter.com/frankspencer/status/1578435423940272128,"@refuturing @GlenHiemstra @NikolasFuturist To paraphrase my good friend @ytashawomack, white people are going through their apocalypse, while black people have already been there. Don't try to put your apocalypse on me!"
54,frankspencer,2022-10-07 02:32:01+00:00,https://twitter.com/frankspencer/status/1578211513726558208,Best of luck @DubaiFuture &amp; fellow futurists at next week's Dubai Future Forum. While The Futures School team is hard at work in our offices creating amazing experiences for 2023 - our 2nd decade of elevating the field around the world - we're cheering you on from afar!
55,frankspencer,2022-10-06 20:05:27+00:00,https://twitter.com/frankspencer/status/1578114230196248583,WOOOOOW!
56,frankspencer,2022-10-06 02:52:37+00:00,https://twitter.com/frankspencer/status/1577854309009690624,"@futuristpaul @refuturing All of the amazing things we could be doing or working on, and this is what we chose. Sigh."
57,frankspencer,2022-10-03 04:17:37+00:00,https://twitter.com/frankspencer/status/1576788537336164353,The DeSantis’ are grifters. Don’t send them a dime.
58,frankspencer,2022-10-02 14:32:43+00:00,https://twitter.com/frankspencer/status/1576580944206565377,@NikolasFuturist Lol!
59,frankspencer,2022-10-01 21:59:39+00:00,https://twitter.com/frankspencer/status/1576331032264986624,"@GirlFuturist Agreed, all living systems transform."
60,frankspencer,2022-10-01 19:07:20+00:00,https://twitter.com/frankspencer/status/1576287665493659648,@TheGreenMerrie Thanks Andrew!!!
61,frankspencer,2022-10-01 19:06:40+00:00,https://twitter.com/frankspencer/status/1576287498241642496,@GirlFuturist Yes. How can you see what the future needs &amp; actively reinforce anti-life/anti-emergent systems? After 20+ years of working w/ the world’s largest companies I find myself increasingly transitioning to a biz model of empowering people who are ready to embrace transformation.
62,frankspencer,2022-10-01 19:00:53+00:00,https://twitter.com/frankspencer/status/1576286043703103489,"@gasperak I certainly agree Tim. As a foresight professional, I was addressing the practice, and I would add that the systems you mention are exactly what I was referring to. Foresight often gets the “square peg/round hole” treatment in service of preserving the non-life status quo."
63,frankspencer,2022-10-01 18:10:32+00:00,https://twitter.com/frankspencer/status/1576273372450652161,"It’s extremely hard to be in the field of foresight for an extended period of time &amp; not realize that using futures thinking to reinforce systems disconnected from nature, equity, compassion, empathy and life-generating practices is an untenable application of deep knowledge."
64,frankspencer,2022-10-01 17:14:39+00:00,https://twitter.com/frankspencer/status/1576259309389766656,"Seen on a mural yesterday in San Francisco: “It’s ok if you fall apart. Tacos fall apart, and we still love them.”"
65,frankspencer,2022-10-01 16:53:36+00:00,https://twitter.com/frankspencer/status/1576254011396669441,"When I go to @Starbucks I always order a Trenta Black Tea Lemonade w/ 9 pumps of Classic sweetener. At every Starbucks, it’s always a completely different drink. My last was the worst. How can a company’s product have so much variance from location to location and remain viable?"
66,frankspencer,2022-09-23 21:40:00+00:00,https://twitter.com/frankspencer/status/1573426986055262216,The police are awful.
67,frankspencer,2022-09-18 16:48:11+00:00,https://twitter.com/frankspencer/status/1571541608327249920,"Vote to secure democracy.
https://t.co/ZWsNG5yN5n"
68,frankspencer,2022-09-18 16:20:43+00:00,https://twitter.com/frankspencer/status/1571534695891959808,"Yes, the MAGA party is the American equivalent of the Nazi movement, and will only become more so over time."
69,frankspencer,2022-09-16 18:51:56+00:00,https://twitter.com/frankspencer/status/1570847973827051520,Ron DeSantis is inhumane… and a human trafficker… and a criminal… and an asshole.
70,frankspencer,2022-09-16 18:39:57+00:00,https://twitter.com/frankspencer/status/1570844958894231552,@sandymaxey Lol!
71,frankspencer,2022-09-16 18:30:33+00:00,https://twitter.com/frankspencer/status/1570842592476274688,I know @CNN @jaketapper your a fascist MAGA shill media outlet now… I wish you the worst.
72,frankspencer,2022-09-16 18:23:44+00:00,https://twitter.com/frankspencer/status/1570840874829123591,The gospel according to American Christianity.
73,frankspencer,2022-09-16 01:31:38+00:00,https://twitter.com/frankspencer/status/1570586171725713408,Judge Aileen Cannon is a unqualified hack modelling third world corruption.
74,frankspencer,2022-09-15 21:43:48+00:00,https://twitter.com/frankspencer/status/1570528836533755904,Ron DeSantis is a criminal. #HumanTrafficking
75,frankspencer,2022-09-15 21:30:04+00:00,https://twitter.com/frankspencer/status/1570525381345837056,Ron DeSantis is a criminal.
76,frankspencer,2022-09-15 21:29:47+00:00,https://twitter.com/frankspencer/status/1570525308293611521,Ron DeSantis is a criminal.
77,frankspencer,2022-09-14 17:29:47+00:00,https://twitter.com/frankspencer/status/1570102525709139968,Please go do something else with your life you big bully. (Please read that sentence as if it’s full of curse words.)
78,frankspencer,2022-09-14 16:33:58+00:00,https://twitter.com/frankspencer/status/1570088479261851653,OMG @Hardees wins the internet today! 😂
79,frankspencer,2022-09-13 15:31:15+00:00,https://twitter.com/frankspencer/status/1569710307974516739,"If you vote republican in November, there will be a total national ban on abortions shortly after they take over Congress."
80,frankspencer,2022-09-13 15:11:12+00:00,https://twitter.com/frankspencer/status/1569705261702709248,Wondering if your vote counts this November? Wonder no more.
81,frankspencer,2022-09-13 13:09:28+00:00,https://twitter.com/frankspencer/status/1569674627412103168,"Now we know why he went to DC, and why it didn’t make the news."
82,frankspencer,2022-09-13 03:51:32+00:00,https://twitter.com/frankspencer/status/1569534215917830144,"Saying that modern-day Republicans hate democracy isn't a partisan statement, it's a fact. Check out this blurb from a recent Vox article, and consider what the next 2+ years will be like if Repubs win in November. #VoteBlue2022 https://t.co/RAaPwRClMZ"
83,frankspencer,2022-09-11 17:28:52+00:00,https://twitter.com/frankspencer/status/1569015129903349760,@pamelaschied Hard to understand how someone could read this and immediately revert back to their “constitutional rights.”
84,frankspencer,2022-09-11 17:25:39+00:00,https://twitter.com/frankspencer/status/1569014319551053826,America is a gun.
85,frankspencer,2022-09-09 21:34:48+00:00,https://twitter.com/frankspencer/status/1568352245770780672,"Politics DOES matter, both sides are NOT the same, and voting conservative in is voting for oppression. PLEASE VOTE IN NOVEMBER like democracy and freedom depends on it - because it does."
86,frankspencer,2022-09-07 23:22:27+00:00,https://twitter.com/frankspencer/status/1567654562353258497,Those who work forces are the same who burn crosses.
87,frankspencer,2022-09-07 23:09:13+00:00,https://twitter.com/frankspencer/status/1567651232344334336,"If you’re a Christian, justify this."
88,frankspencer,2022-09-07 00:19:40+00:00,https://twitter.com/frankspencer/status/1567306569947168768,AI makes everything better! &lt;sarcasm&gt;
89,frankspencer,2022-09-06 22:46:45+00:00,https://twitter.com/frankspencer/status/1567283187042189320,"@leighacevedo Wow, thank god for Jordan Peterson, otherwise all of society’s incels would flounder. That’s exactly what Savannah needs - another midnight in the garden cult leader."
90,frankspencer,2022-09-06 20:52:12+00:00,https://twitter.com/frankspencer/status/1567254361687953410,@leighacevedo What the hell is a Ralston College?
91,frankspencer,2022-09-06 20:42:03+00:00,https://twitter.com/frankspencer/status/1567251806975152130,Jordan Peterson is a grifter with zero redeeming insights.
92,frankspencer,2022-09-03 23:16:03+00:00,https://twitter.com/frankspencer/status/1566203397358977024,"@futuristpaul I’ve always said that I’m going to write a book one day called “How To Be Unprofessional,” and I have no end to everyday examples. The epilogue is all about how to respond in kind."
93,frankspencer,2022-09-03 23:01:19+00:00,https://twitter.com/frankspencer/status/1566199692140093440,@Reannabrowne @gasperak @davidwengrow @camerontw One of the reasons a futuring lens is critical to design. I saw a designer this week say that design has always been about the future. But has it?
94,frankspencer,2022-09-03 16:33:57+00:00,https://twitter.com/frankspencer/status/1566102208730566657,"The US is a very, very scary place with very scary people."
95,frankspencer,2022-09-03 02:57:40+00:00,https://twitter.com/frankspencer/status/1565896782516731907,"Everything “good” is white, everything “bad” is black. But tell me again how we already live in a post-racist world?"
96,frankspencer,2022-09-02 14:36:21+00:00,https://twitter.com/frankspencer/status/1565710224799027201,@ABC @pamelaschied @ABC had to know that this is what the comments would look like when you try to pretend that you care after ignoring the speech when it was actually happening.
97,frankspencer,2022-09-02 03:43:58+00:00,https://twitter.com/frankspencer/status/1565546046180278272,"She-Hulk was bad from the start, and gets worse every week."
98,frankspencer,2022-09-02 02:28:30+00:00,https://twitter.com/frankspencer/status/1565527052626919424,The @POTUS tonight had to give a speech condemning the rise of fascism and anti-democratic forces in the US. Let that sink in.
99,frankspencer,2022-09-02 01:36:32+00:00,https://twitter.com/frankspencer/status/1565513974724034568,foresight
100,frankspencer,2022-08-31 17:02:19+00:00,https://twitter.com/frankspencer/status/1565022179799990272,@Sohailfutures No doubt. Super strange to see it coming from the futurist community.
101,frankspencer,2022-08-31 13:26:46+00:00,https://twitter.com/frankspencer/status/1564967938247069696,@tyronemagwagwa @ymsalvatico LOL! 😂
102,frankspencer,2022-08-30 21:56:13+00:00,https://twitter.com/frankspencer/status/1564733756887519238,"Right when we most need to defend democracy in the US against a political party turned fascist terrorists, @CNN has decided that the public isn't being tolerant enough toward the insane MAGA viewpoint. #BoycottCNN"
103,frankspencer,2022-08-30 21:15:37+00:00,https://twitter.com/frankspencer/status/1564723538602463235,"@okanaga86 Yes, I knew that this one individual is a Peterson acolyte, but to see others confirm their reverence of such a horrific figure... all I can say is be VERY careful when someone tells you that they are a futurist. Not all are equal."
104,frankspencer,2022-08-30 21:11:57+00:00,https://twitter.com/frankspencer/status/1564722616321048581,@okanaga86 And people commenting on the post about how much they have been positively influenced by Peterson in their thinking. Ugh!
105,frankspencer,2022-08-30 21:05:26+00:00,https://twitter.com/frankspencer/status/1564720974372737024,"@NikolasFuturist Peterson is awful in every single way! Why would someone who claims to leverage foresight promote the work of an individual who lies about his academic accomplishments, body-shames women, denies climate change, shills for white supremacists, etc.?"
