,0,1,2,3
385,frankspencer,2021-11-10 22:41:52+00:00,https://twitter.com/frankspencer/status/1458565599026683910,"@briefanomaly @refuturing And it’s certainly NOT controversial as stated, but I fully understand “smoke and mirrors” marketing, or inflation for perception of importance and attention. My tweets were meant to inform followers of foresight’s more dynamic capability &amp; application."
386,frankspencer,2021-11-10 22:35:05+00:00,https://twitter.com/frankspencer/status/1458563892108476423,"@briefanomaly @refuturing Absolutely! I knew anyone could find it if they wanted. It’s certainly “A” conversation. ;-) One that’s been had many times just in my 20+ years in the field. There’s a TON of research that already supersedes his premise, &amp; a multitude of reasons that it’s biased &amp; faulty."
387,frankspencer,2021-11-10 20:01:57+00:00,https://twitter.com/frankspencer/status/1458525354788798464,"As long as she doesn’t support a voting rights act, she’s aiding and abetting just as much as any of them."
388,frankspencer,2021-11-10 16:35:11+00:00,https://twitter.com/frankspencer/status/1458473320974852098,"@refuturing @briefanomaly Lol! So true… am such a structural anarchist. Well, I am. ;-)"
389,frankspencer,2021-11-10 16:32:18+00:00,https://twitter.com/frankspencer/status/1458472594290749447,@refuturing @briefanomaly A good starting place: https://t.co/cnI9BPsvDE
390,frankspencer,2021-11-10 16:29:54+00:00,https://twitter.com/frankspencer/status/1458471989966999559,"@refuturing @briefanomaly How do you even begin to have a deep conversation abt the biases of data/Econ sciences when they’re presented as some kind of gold standard? The 1960s called, they want their value prop back!"
391,frankspencer,2021-11-10 15:22:24+00:00,https://twitter.com/frankspencer/status/1458455002582851590,@refuturing Love it!
392,frankspencer,2021-11-10 14:00:31+00:00,https://twitter.com/frankspencer/status/1458434399578505217,"@briefanomaly @refuturing Just to be clear, the reason I did not post the original video was simply due to personal convictions. I realize that the video is public, and just like anything I may write or share, it’s open to fair and professional criticism."
393,frankspencer,2021-11-09 23:00:22+00:00,https://twitter.com/frankspencer/status/1458207867459211266,"@refuturing I’ll admit some bias as it reinforces my research, but as mom used to say, “It ain’t bragging if it’s true.” ;-)"
394,frankspencer,2021-11-09 22:57:21+00:00,https://twitter.com/frankspencer/status/1458207110454464516,"@refuturing Got my copy today, already enjoying the eviscerating of Harari. The potentially, the non-linearity and the opening of cooperative pasts/futures is so refreshing."
395,frankspencer,2021-11-09 22:11:19+00:00,https://twitter.com/frankspencer/status/1458195522532093952,Foresight (and futurists) aren't opposed to science or making the field more science-based (read: data analysis); they are opposed to limiting the exploration of emerging realities to an outdated approach that demands quantified results as the only evidence of value. 6/end
396,frankspencer,2021-11-09 22:04:12+00:00,https://twitter.com/frankspencer/status/1458193733179019274,"And to say foresight has strongly drawn from scary postmodernism to define an anti-science approach feels shallow at best. Futures by nature examines multiple ways of seeing, knowing, emerging. It's not abt mechanical prediction; it's abt organic possibilities. 5/x"
397,frankspencer,2021-11-09 21:21:43+00:00,https://twitter.com/frankspencer/status/1458183042732789769,"@NurtureGirl Ooof, Graeber and Wengrow wasted no time eviscerating Harari!"
398,frankspencer,2021-11-09 16:40:48+00:00,https://twitter.com/frankspencer/status/1458112347982254090,Just talked about this the other day… systems fail to take into account complex responsive processes/complex potential states. Read Nora Bateson’s new work on Aphanipoiesis.
399,frankspencer,2021-11-09 15:50:00+00:00,https://twitter.com/frankspencer/status/1458099563231862784,A dismissal of sociology &amp; anthropology as being unscientific/not science misses the overwhelming evidence &amp; consensus to the contrary. 4/x
400,frankspencer,2021-11-09 15:31:41+00:00,https://twitter.com/frankspencer/status/1458094954757115911,In addressing foresight as a field that should be based solely (or even largely) on scientific management or economic sciences is to miss decades upon decades of study on creative complexity (see Follett’s challenge to Taylor on scientific management). 3/x
401,frankspencer,2021-11-09 15:14:32+00:00,https://twitter.com/frankspencer/status/1458090637723590657,"For instance, the video questions the scientific rigour of metaphor in foresight study and practice, but fails to mention the mountain of research on metaphor in linguistics, narratology, psychology, critical discourse analysis, cognition, dialectical behaviour, etc. 2/x"
402,frankspencer,2021-11-09 14:45:47+00:00,https://twitter.com/frankspencer/status/1458083401236455425,"A new video on the supposed resistance to scientific rigour in the field of foresight contains an army of straw men. I was introduced to a foresight field 20+ yrs ago that relied heavily on forecasting analysis but has grown to include more qual ways of knowing, rightly so. 1/x"
403,frankspencer,2021-11-09 13:27:09+00:00,https://twitter.com/frankspencer/status/1458063612724064257,"@NurtureGirl @aheadahead1 Yes, on the way!"
404,frankspencer,2021-11-09 13:22:13+00:00,https://twitter.com/frankspencer/status/1458062373009477641,@NurtureGirl @aheadahead1 I was just about to suggest the same concerning Graeber and Wengrow’s book!
405,frankspencer,2021-11-08 22:41:31+00:00,https://twitter.com/frankspencer/status/1457840736657977345,"@incognitosum @Sohailfutures Yes, have had fun overs the years tuning CLA and Simulacra side-by-side."
406,frankspencer,2021-11-08 22:05:47+00:00,https://twitter.com/frankspencer/status/1457831741545238530,"@incognitosum OMG, the best Baudrillard meme ever!"
407,frankspencer,2021-11-07 01:41:12+00:00,https://twitter.com/frankspencer/status/1457161178409488385,@okanaga86 Thank you my friend!
408,frankspencer,2021-11-07 00:41:07+00:00,https://twitter.com/frankspencer/status/1457146058874703877,Read it and rejoice!
409,frankspencer,2021-11-07 00:37:04+00:00,https://twitter.com/frankspencer/status/1457145038748721155,My story “Humanity’s Leap” is included.
410,frankspencer,2021-11-04 20:04:35+00:00,https://twitter.com/frankspencer/status/1456351692786741249,@ytashawomack @adidasoriginals When does it come out?
411,frankspencer,2021-11-04 02:32:10+00:00,https://twitter.com/frankspencer/status/1456086841573138433,"Agency is real, the problem has been in how we frame it. Healthy agency is related to transformative foresight (as opposed to force-fitting foresight into outdated practices of deterministic forecasting). We can culturally evolve foresight as a human trait for co-creation. 13/end"
412,frankspencer,2021-11-04 02:24:22+00:00,https://twitter.com/frankspencer/status/1456084879825940483,"""A new study suggests human culture may be driving evolution faster than genetic mutations... humans are evolving from individual genetic organisms to cultural groups which function as superorganisms... accumulated mutations of cultural knowledge."" 12/x"
413,frankspencer,2021-11-04 02:19:01+00:00,https://twitter.com/frankspencer/status/1456083533957566469,"""But we're just cogs in a biological evolutionary machine,"" you say. Not so fast! https://t.co/va80r1BJgm 11/x"
414,frankspencer,2021-11-04 02:17:11+00:00,https://twitter.com/frankspencer/status/1456083070583549957,"IOW, we can individually/socially/culturally employ ""agency"" to affect/impact transformative outcomes rather than agency being a force of will that the larger cosmos will prove to be nothing more than an illusion. The latter unwittingly disconnects us from nature... again. 10/x"
415,frankspencer,2021-11-04 02:08:52+00:00,https://twitter.com/frankspencer/status/1456080976069734407,"WE ARE ECOSYSTEM. We're not separate from nature, universe, cosmos, we're a part of it. As such, we are just as ""external"" as any living or non-living entity. We have impact &amp; are impacted upon. This reframes agency from dominant force to co-creative novelty. 9/x"
416,frankspencer,2021-11-04 01:57:59+00:00,https://twitter.com/frankspencer/status/1456078240670433283,"BTW, notice how foresight, futuring, anticipation play a huge role in ""self-as-agent."" This is important as fostering an anticipatory mindset suggests greater agency, but many might say that external factors render such agency an inflated illusion. Just remember this... 8/x"
417,frankspencer,2021-11-04 01:53:34+00:00,https://twitter.com/frankspencer/status/1456077128055803904,"Bandura saw ""self-agent"" encompassing 4 features of human agency: intentionality (will to act), forethought (ability to anticipate), self-regulation (goal-oriented behavior to navigate externalities), self-efficacy (ability to make corrective adjustments). IOW, we learn. 7/x"
418,frankspencer,2021-11-04 01:44:59+00:00,https://twitter.com/frankspencer/status/1456074966403895300,"Agency is a trifecta of personal choices, patterns of behavior, external influences. Agency is not just unidirectional, but multidirectional (simultaneous multiples), &amp; as such displays emergence (novelty through interaction). But does that make agency an illusion? 6/x"
419,frankspencer,2021-11-04 01:36:40+00:00,https://twitter.com/frankspencer/status/1456072875333533697,"""SCT understands human functioning in terms of processes of triadic reciprocal causation among internal personal factors, behavioral patterns, &amp; environmental influences, all operating as interacting determinants that affect one another bi-directionally"" (Bandura, 2006, 2001) 5/x"
420,frankspencer,2021-11-04 01:35:46+00:00,https://twitter.com/frankspencer/status/1456072649415794691,"It's important to note that Bandura (and others) noted that agency can be both individual and collective, and is certainly determined and determining. This means that there are a multitude of influences that impact agency, but does that mean that agency is just an illusion? 4/x"
421,frankspencer,2021-11-04 01:27:37+00:00,https://twitter.com/frankspencer/status/1456070598468251653,"Let's skip to Bandura: ""Central to social cog theory is the recognition.. of human agency, the fundamental human quality that directs.. the experiences of human living. Humans as agents can intentionally influence their functioning &amp; immediate circumstances (2001a, 2006). 3/x"
422,frankspencer,2021-11-04 01:23:57+00:00,https://twitter.com/frankspencer/status/1456069676161802246,"I'm going to skip over a ton in terms of human impact on climate &amp; the call for us to alter our individual/collective behavior to avoid ecological collapse. After all, this is Twitter, not a dissertation. I'll just say that it seems most believe we can act in this regard. 2/x"
423,frankspencer,2021-11-04 01:21:09+00:00,https://twitter.com/frankspencer/status/1456068970625253383,"I've been seeing quite a few posts recently on the idea of ""agency"" - is it real or just a pretentious fallacy? Of course, the idea of agency is important to futures/foresight regarding our involvement in affecting outcomes or directionality, so let's investigate. 1/x"
424,frankspencer,2021-10-31 00:38:10+00:00,https://twitter.com/frankspencer/status/1454608602866589697,@monganism Yes… especially the past!
425,frankspencer,2021-10-27 00:31:42+00:00,https://twitter.com/frankspencer/status/1453157421380145155,FIRE!Your understanding of American history is WRONG.
426,frankspencer,2021-10-26 23:33:36+00:00,https://twitter.com/frankspencer/status/1453142802578264067,@refuturing NFT : Corporate Scarcity Strategy :: Immortality : The Picture of Dorian Gray
427,frankspencer,2021-10-26 23:26:35+00:00,https://twitter.com/frankspencer/status/1453141034628681738,@refuturing NFT : Internet Development :: Generational Theory : Study of Complex Human Interactions That Actually Help Humanity In Any Significant Way
428,frankspencer,2021-10-22 20:09:00+00:00,https://twitter.com/frankspencer/status/1451641762104160256,@CreatvEmergence Timely!
429,frankspencer,2021-10-22 16:59:52+00:00,https://twitter.com/frankspencer/status/1451594165066813442,@threadreaderapp unroll
430,frankspencer,2021-10-22 03:48:24+00:00,https://twitter.com/frankspencer/status/1451394983714508801,"Lastly, true expertise in any field requires a diversity of voices beyond the ""lone genius"" (a fallacy that needs to end). We don't throw out the baby, just the old bathwater. And, in any healthy field, the container continues to grow and expand. 12/end."
431,frankspencer,2021-10-22 03:29:07+00:00,https://twitter.com/frankspencer/status/1451390129373949981,"If you're met w/ real gatekeeping (racism, patriarchy, control), fight it - I'll be fighting w/ you. If the cry of ""gatekeepers"" is to dismantle intellectual rigor (that helps whole world grow) then recognize who is fracturing garnered knowledge for manipulative gain. 11/x"
432,frankspencer,2021-10-22 03:29:06+00:00,https://twitter.com/frankspencer/status/1451390128245682199,"None of this negates the need for continued rigor in foresight (or any field). Don't fall prey to the pied-piper of anti-intellectualism &amp; the ""rejection of expertise."" Recognize the need for theoretical/methodological rigor (continually expanding of course), help add to it. 10/x"
433,frankspencer,2021-10-22 03:29:06+00:00,https://twitter.com/frankspencer/status/1451390126962225170,"Democratizing the future is a decentralization of power over the future, a recognition that many voices, cultures, ideas creates a prosperous future for all. Most studied/practiced ""futurists"" promote that idea &amp; welcome others into the fold of study/practice with open arms. 9/x"
434,frankspencer,2021-10-22 03:29:06+00:00,https://twitter.com/frankspencer/status/1451390125741690880,"Right or wrong, experts are labeled gatekeepers and rejected. We see this today in the besmirching of scientists warning about the pandemic or climate change, and other studied/practiced experts as well. But expertise isn't the enemy - the enemy is CENTRALIZED POWER! 8/x"
435,frankspencer,2021-10-22 03:29:05+00:00,https://twitter.com/frankspencer/status/1451390124558802945,"I've often said we've done a awful job of bringing everyone into the future, leaving many behind. This results in political, economic, social chaos as many lose trust in ""those in charge."" Expertise becomes an abhorred target, even though that expertise is desperately needed. 7/x"
436,frankspencer,2021-10-22 03:29:05+00:00,https://twitter.com/frankspencer/status/1451390123178876928,"We desperately need to ""democratize the future"" meaning we need EVERYONE engaged in imagining/co-creating actions that lead to prosperous futures for all. That doesn't negate expertise in ""futures studies"" ( philosophies, theories, methods) that help us achieve the former. 6/x"
437,frankspencer,2021-10-22 03:29:05+00:00,https://twitter.com/frankspencer/status/1451390121929019392,"So, even though there is some form of gatekeeping in foresight - that's a bad thing - most in the field are open to new ideas, new insights, new blood. However, foresight isn't as ill-defined as some have proclaimed, and this is where the cry of ""gatekeeping"" takes a turn. 5/x"
438,frankspencer,2021-10-22 03:29:04+00:00,https://twitter.com/frankspencer/status/1451390120683352072,"It's true that foresight/futures thinking is continuing to grow, morph, expand (as any living field should), and that largely happens when a field is open to new insights, perspectives, ways of knowing. 4/x"
439,frankspencer,2021-10-22 03:29:04+00:00,https://twitter.com/frankspencer/status/1451390119571861546,"One reason they scream ""gatekeeping"" is because they deem foresight to be a very ill-defined field that is wide-open for multiple interpretations. (Of course, there is also the idea that foresight has largely been a field full of and defined by white men, and that's true.) 3/x"
440,frankspencer,2021-10-22 03:29:04+00:00,https://twitter.com/frankspencer/status/1451390118389067817,Gatekeeping is the practice of controlling/limiting access by those who have experience or maybe some type of structural power. In this context it refers to new practitioners feeling as if long-standing figures are setting the standards by which they can practice foresight. 2/x
441,frankspencer,2021-10-22 03:29:03+00:00,https://twitter.com/frankspencer/status/1451390116321169408,"Over the past several years, I've heard a lot of talk about ""gatekeeping,"" not only in my own field of foresight, but in other fields too. What is gatekeeping, what does it mean to ""democratize the future,"" and how does this all relate to a general distrust in expertise? 1/x https://t.co/QAPeGFC9cQ"
442,frankspencer,2021-10-21 15:02:58+00:00,https://twitter.com/frankspencer/status/1451202358638120968,"So much talk about the #Metaverse, but the idea of living in, around and across the web has much deeper implications than just branding, entertainment or consumption. I just published Reimagining Life In The Cloud https://t.co/8EiftdVkzw"
443,frankspencer,2021-10-19 13:16:54+00:00,https://twitter.com/frankspencer/status/1450450890058571786,@CreatvEmergence Beautiful!
444,frankspencer,2021-10-19 13:16:18+00:00,https://twitter.com/frankspencer/status/1450450735423004674,Holoptic Foresight: Species-wide foresight trait development through intentional cooperative approaches resulting in perception and co-creation of emerging realities.
445,frankspencer,2021-10-18 01:34:02+00:00,https://twitter.com/frankspencer/status/1449911617219661825,"Love @NewRockstars Youtube breakdown of The Batman trailer suggesting this young Batman may unwittingly be the villain, a tool of the corrupt police &amp; city leaders who have redlined the ""undersirables"" of Gotham, and Riddler is their Robin Hood. Batman as a dirty patriot cop."
446,frankspencer,2021-10-17 19:37:51+00:00,https://twitter.com/frankspencer/status/1449821982996979716,"Not only seeing the world past constraining systems, but proclaiming it to be so, takes courage. But nothing is more needed! “New Realities, Old Definitions” by The Futures School
https://t.co/fCqbIFjxFB"
447,frankspencer,2021-10-17 05:27:35+00:00,https://twitter.com/frankspencer/status/1449608006107385857,Thread by @frankspencer on Thread Reader App https://t.co/3emxjdgs36
448,frankspencer,2021-10-17 05:26:36+00:00,https://twitter.com/frankspencer/status/1449607756055556098,@threadreaderapp unroll
449,frankspencer,2021-10-17 05:22:57+00:00,https://twitter.com/frankspencer/status/1449606839503630336,@threadreaderapp unroll
450,frankspencer,2021-10-17 03:53:10+00:00,https://twitter.com/frankspencer/status/1449584243475165186,https://t.co/HzDJYT6Gkz
451,frankspencer,2021-10-17 03:51:13+00:00,https://twitter.com/frankspencer/status/1449583753769234435,Face-palm. 🤦‍♂️
452,frankspencer,2021-10-17 03:49:31+00:00,https://twitter.com/frankspencer/status/1449583326893903872,Coal has been dead for a long-time.
453,frankspencer,2021-10-17 03:21:42+00:00,https://twitter.com/frankspencer/status/1449576326462152704,"As a foresight professional, it is my hope that orgs, govs, societies will understand this matrix of ""complexity thinking"" so that we can recognize emergence, novelty, change, transformation and creativity, and lead humanity into futures of cooperative vitality. 9/end"
454,frankspencer,2021-10-17 03:17:00+00:00,https://twitter.com/frankspencer/status/1449575142133219328,"Complexity has become a buzzword orgs use to describe conditions to overcome or master, but in reality it is a way of thinking, acting and living that centers a matrix of creativity. Building boxed-rule conditions belies our need to adopt this mindset for all conditions. 8/x"
455,frankspencer,2021-10-17 03:11:52+00:00,https://twitter.com/frankspencer/status/1449573851659227147,"Manifold is the natural order of the universe, a canvas of complexity on which we can co-create with all of life a beautiful masterpiece of ever-unfolding opportunities, capabilities, and next-order realities. 7/x"
456,frankspencer,2021-10-17 03:07:39+00:00,https://twitter.com/frankspencer/status/1449572788499533833,"Anarchic means that we don't understand (or refuse to recognize) the emergence and novelty being presented by complex systems (i.e. natural growth), refuse to change, and have moved well past convoluted conditions providing us any bulwark against change. 6/x"
457,frankspencer,2021-10-17 03:01:44+00:00,https://twitter.com/frankspencer/status/1449571298728988677,Straightforward conditions only means that we get away with applying the same operations for a period of time before our processes completely collapse. Convoluted is something we do to ourselves to fight against the natural change prompted by complexity. 5/x
458,frankspencer,2021-10-17 02:58:54+00:00,https://twitter.com/frankspencer/status/1449570589283340290,"Any boxed categorization of our world fails us, because it promotes the idea that we can control our environment through mechanical rules rather than collectively growing alongside evolutionary ecosystems. 4/x"
459,frankspencer,2021-10-17 02:53:46+00:00,https://twitter.com/frankspencer/status/1449569295785136130,"It's easy to think that we've shifted from straightforward to convoluted, manifold or anarchic conditions in our systems, and that means simply responding differently for now. This betrays the cooperative mindset needed to live in a world birthed upon beautiful complexity. 3/x"
460,frankspencer,2021-10-17 02:48:41+00:00,https://twitter.com/frankspencer/status/1449568015612252161,"Today's orgs, institutions &amp; societies are learning this the hard way, trying desperately to solidify what they believe to be straightforward operations &amp; conditions, but all the while actually fighting against needed change &amp; shifts. Hint: the straightforward never was. 2/x"
461,frankspencer,2021-10-17 02:45:00+00:00,https://twitter.com/frankspencer/status/1449567088775995394,"The idea that we can divide the world into separate categories or operating conditions such as straightforward, convoluted, manifold or anarchic only makes sense in non-natural systems, &amp; leaves us battling against the adoption of natural ways of thinking and acting. 1/x"
462,frankspencer,2021-10-15 11:25:35+00:00,https://twitter.com/frankspencer/status/1448973324625846298,"@thrivability Thanks Michelle, and thank you for your work."
463,frankspencer,2021-10-15 01:41:58+00:00,https://twitter.com/frankspencer/status/1448826451827073029,"Foresight, the kind that changes heads, hearts and hands, takes courage. Yes, it can be done in companies, governments, organizations of all types. There's more to foresight than agnostically watching trends. Be a futurist that safeguards the future today. 8/x"
464,frankspencer,2021-10-15 01:38:46+00:00,https://twitter.com/frankspencer/status/1448825644197060608,"I saw someone else saying that foresight is adopting too much religious language such as ""transformation"", and that it needs to stick to systemic development. I wonder how they feel about care, empathy and love? Believe me, we have enough uncourageous folks in this world. 7/x"
465,frankspencer,2021-10-15 01:35:54+00:00,https://twitter.com/frankspencer/status/1448824924429246465,"I recently had someone become defensive when I said foresight is a mentality/manifestation of care, empathy &amp; love in the now that will safeguard the future for generations to come, saying it's simply a field &amp; to think that way is a dangerous philosophy. What does that say? 6/x"
466,frankspencer,2021-10-15 01:30:22+00:00,https://twitter.com/frankspencer/status/1448823532503326720,"While working in NZ a few years ago, a Maori leader taught me about the word kaitiakitanga, which is a safeguarding of the future for generations to come. This is the heart of foresight, building a world of care, empathy and love today for generations yet to come. 5/x"
467,frankspencer,2021-10-15 01:22:41+00:00,https://twitter.com/frankspencer/status/1448821599952588800,"Foresight is not forecasting. It serves a larger purpose of expanding our mental maps, elevating our way of seeing the world and all it contains (and can be), moving through liminal spaces to embrace evolutionary transformation. 4/x"
468,frankspencer,2021-10-15 01:20:03+00:00,https://twitter.com/frankspencer/status/1448820936807944194,"Yes, people will miss the nature of foresight because they want to use it w/i the systems that exist, make it fit the parameters of those systems, have it reinforce those systems. They may want it to be a glorified version of industrialized forecasting. 3/x"
469,frankspencer,2021-10-15 01:16:14+00:00,https://twitter.com/frankspencer/status/1448819974588481543,"Foresight is at its fullest capacity when it's diverse, inclusive, &amp; celebrates multiple ways of knowing. Those who embrace &amp; practice foresight know that when it lacks these dynamics, it betrays its very essence (or it's being used in a way that betrays its essence). 2/x"
470,frankspencer,2021-10-15 01:11:10+00:00,https://twitter.com/frankspencer/status/1448818700476428290,"I’ve been digging deep into foresight study and practice for 20+ years now, and I firmly believe that it has care, empathy and love in its DNA. Why? Foresight is primarily a way of thinking, a mental model and a cognitive state that seeks better futures. 1/x https://t.co/CdemunfWYn"
471,frankspencer,2021-10-13 15:10:27+00:00,https://twitter.com/frankspencer/status/1448305138595151885,Often we look to solve problems rather than creating new histories. We call this shifting our mindsets from identifying wicked problems to constructing Wicked Opportunities. https://t.co/sZUYgqXVwK
