,0,1,2,3
210,frankspencer,2022-03-08 20:09:04+00:00,https://twitter.com/frankspencer/status/1501288915256463368,"This is Trump’s war just as much as it’s Putin’s war. He supported this, he emboldened this."
211,frankspencer,2022-03-07 05:03:03+00:00,https://twitter.com/frankspencer/status/1500698518616477699,"Oh well Moscow, no more Tiger King for you. EMOTIONAL DAMAGE! https://t.co/8KqAHvGbGG"
212,frankspencer,2022-03-07 05:02:17+00:00,https://twitter.com/frankspencer/status/1500698327041593344,"@CreatvEmergence LOVE IT! The emerging, co-created future!"
213,frankspencer,2022-03-05 16:14:24+00:00,https://twitter.com/frankspencer/status/1500142697037893640,"If you’ve completely missed the fact that capitalism is the reason that many Americans have been fairly unconcerned about individual and collective health during a pandemic, you’re not paying attention."
214,frankspencer,2022-02-28 18:03:49+00:00,https://twitter.com/frankspencer/status/1498358292971761667,"@refuturing I do not get how people are excited about further neutering a space of potential human abundance through the lamest form of digital expression that reinforces a mindset of scarcity… Oh, wait, that’s the technocrat vision of inevitable futures."
215,frankspencer,2022-02-28 09:46:14+00:00,https://twitter.com/frankspencer/status/1498233071925178373,"In the US, Trump played a major role in helping Putin wage the great misinformation war."
216,frankspencer,2022-02-28 06:18:50+00:00,https://twitter.com/frankspencer/status/1498180876882096128,WOW! Strangely inspiring. The change has been rapid.
217,frankspencer,2022-02-25 16:28:11+00:00,https://twitter.com/frankspencer/status/1497247059849748480,"@""Why Freedom Depends on Foresight""https://t.co/QWzD691T0L on @LinkedIn"
218,frankspencer,2022-02-24 21:10:45+00:00,https://twitter.com/frankspencer/status/1496955781572354053,"Don't forget that Trump played a role in Putin's aggression and invasion, and he hopes his dictatorial friend is listening to his ongoing devotion. Putin's Russia is the America Trump dreams of. https://t.co/LlKBPxY0b8"
219,frankspencer,2022-02-24 20:04:43+00:00,https://twitter.com/frankspencer/status/1496939166759899139,"The isolationism of nationalistic authoritarians leads to the weakening of coalitions of freedom, and the emboldening of warmongering dictators. And I’m not talking about Putin."
220,frankspencer,2022-02-24 05:06:07+00:00,https://twitter.com/frankspencer/status/1496713025851695106,"You see, he’s making Russia great again."
221,frankspencer,2022-02-22 22:33:21+00:00,https://twitter.com/frankspencer/status/1496251794065960968,"@refuturing I prefer to keep my demons, but I’m come for the fried chicken."
222,frankspencer,2022-02-17 01:18:14+00:00,https://twitter.com/frankspencer/status/1494118963504107520,"Worked with a local group of privileged individuals several years ago who were so out of touch that, when addressing this exact issue, literally said, “What’s the problem with that?”"
223,frankspencer,2022-02-16 15:39:47+00:00,https://twitter.com/frankspencer/status/1493973388343320577,The scam of publishing in academic journals. Check out Dr. Glaucomflecken's video! #TikTok https://t.co/z4Ev2waY69
224,frankspencer,2022-02-14 21:59:21+00:00,https://twitter.com/frankspencer/status/1493344136933654531,"Wow, how corrupt is the International Olympic Committee? Why compete? Why should we watch? It's all a farce! @iocmedia #FigureSkating #Valieva #IOC"
225,frankspencer,2022-02-12 18:50:10+00:00,https://twitter.com/frankspencer/status/1492571748495155203,This will be behind glass in a Smithsonian museum sometime in the future demonstrating without a doubt how disturbingly racist America was - or at least I hope.
226,frankspencer,2022-02-12 18:47:12+00:00,https://twitter.com/frankspencer/status/1492571003196694530,"MY GOD! The dripping ignorance, stupidity and xenophobia in this NYT article blurb. How abt ""America thrives thru immigration"" or ""Yes, because Asians make up 60% of the world's population."" Instead we get ""vividly overrepresented."" White supremacy isn't even hidden in this one."
227,frankspencer,2022-02-12 18:36:05+00:00,https://twitter.com/frankspencer/status/1492568206480973834,"I just can't w/ all the fans of market-driven scarcity in a space that should introduce greater abundance &amp; equity. Ask Gary the real questions about NFTs - how do they shrink the privilege gap, how do they regenerate and re-humanize? https://t.co/d1VAufh7wd"
228,frankspencer,2022-02-12 01:53:18+00:00,https://twitter.com/frankspencer/status/1492315847066587138,"@StephaniePride @refuturing Yes, and same. But apart from the generalized linearity, short-term interests &amp; desire to hijack foresight for non-generative outcomes (a grim picture), in-house foresight efforts in biz often lead to changed lives, challenged goals, &amp; more sustainable approaches. My experience."
229,frankspencer,2022-02-12 01:34:35+00:00,https://twitter.com/frankspencer/status/1492311138738053129,"@StephaniePride @refuturing Lastly, attempting to delineate “corporate foresight” from “social foresight/futures” is not as black/white as it sounds. The overlap, the outcomes, the surprises in process can often be very similar. 6/x"
230,frankspencer,2022-02-12 01:30:02+00:00,https://twitter.com/frankspencer/status/1492309990681497603,"@StephaniePride @refuturing Which in itself is interesting because (besides the seen and felt need of increased complexity - or at least the increased exposure), futures/foresight is growing in popularity. We have a lot of work to do, but the practice is on the right track. 5/n"
231,frankspencer,2022-02-12 01:25:50+00:00,https://twitter.com/frankspencer/status/1492308932974592003,"@StephaniePride @refuturing This is where much of the confusion arises, as well as the deluge of “overnight futurists” spawned by the pandemic on LinkedIn. 4/n"
232,frankspencer,2022-02-12 01:23:40+00:00,https://twitter.com/frankspencer/status/1492308389636067328,"@StephaniePride @refuturing Again, I’m not commenting directly on this particular article, that may have been the author’s point. But the “Wild West” that Stephanie speaks of is exacerbated by the deluge of terms and practices that become erroneously affiliated with rigorous futures/foresight. 3/n"
233,frankspencer,2022-02-12 01:16:25+00:00,https://twitter.com/frankspencer/status/1492306566451716098,"@StephaniePride @refuturing Can futures/foresight have synergies with those fields, work alongside them to strengthen, or add to their uniqueness? Certainly! Are all future-oriented fields variations of robust futures/foresight? No. 2/n"
234,frankspencer,2022-02-12 01:12:37+00:00,https://twitter.com/frankspencer/status/1492305607801675778,"@StephaniePride @refuturing Without referring directly to the actual article or author, various attempts to corral all “future-oriented” practices under one banner dilutes the focus and purpose of futures/foresight. Other fields or practices are accomplishing something quite different 1/n"
235,frankspencer,2022-02-07 18:12:48+00:00,https://twitter.com/frankspencer/status/1490750408222035968,@refuturing This week’s edition of The Wicked Opportunities Podcast will be all about it!
236,frankspencer,2022-02-03 22:10:20+00:00,https://twitter.com/frankspencer/status/1489360632881242114,"All of the individuals praising this meta-analysis most likely did not quarantine a single day, and flaunted any social contract around care for others and the larger society."
237,frankspencer,2022-02-03 22:08:49+00:00,https://twitter.com/frankspencer/status/1489360249517654019,"The Johns Hopkins study showing that lockdowns don't work are based on studies from the US &amp; Europe where people generally refused to honor any guidelines such as quarantines and masking. Take into account Asian countries, &amp; the story is very different. https://t.co/S1KsQ4zdWf"
238,frankspencer,2022-02-02 18:02:23+00:00,https://twitter.com/frankspencer/status/1488935847353270274,"@krash63 So sorry for this immeasurable loss. His consciousness was yours to share in, connect with &amp; envelop. That did &amp; does it’s creative work. It continues on, expanding into greater ripples of emerging novelty. Such a gift intensifies the sadness, but also gives it great meaning."
239,frankspencer,2022-02-02 17:42:46+00:00,https://twitter.com/frankspencer/status/1488930910196146178,Just say “I condemn nazis and will not tolerate their hate in Florida.” But he couldn’t.
240,frankspencer,2022-02-01 22:13:32+00:00,https://twitter.com/frankspencer/status/1488636664155103236,The powerful Christian and non-Christian cults behind the cult of Trump. Dominion over all things!
241,frankspencer,2022-02-01 03:06:59+00:00,https://twitter.com/frankspencer/status/1488348122392760321,@marwilliamson Why? They sued because Spotify wouldn’t pay them. What happened? Spotify just dropped them. Did Spotify ban them? No. De-platform them? No. Is Spotify greedy and unethical? Yep! https://t.co/QmiVfcLTAY
242,frankspencer,2022-01-31 18:50:43+00:00,https://twitter.com/frankspencer/status/1488223236118794241,"@marwilliamson Why is nuance in such short supply? Spotify can have a large public influence, &amp; therefore an ethical responsibility to the public. They can certainly ignore that responsibility (as is the case), &amp; at that point you would hope the public would reject them. No banning is involved."
243,frankspencer,2022-01-30 10:44:43+00:00,https://twitter.com/frankspencer/status/1487738538716278786,@Sohailfutures He’s the darling of alt-right incels.
244,frankspencer,2022-01-30 03:55:48+00:00,https://twitter.com/frankspencer/status/1487635632377802753,"Thank goodness that the ever enlightening Jordan Peterson is here to so eloquently explain the inanities of climate science to all of us lowly nimrods. (Sarcasm, of course; he’s a real nut.) https://t.co/W80cj7b4BF"
245,frankspencer,2022-01-26 16:06:15+00:00,https://twitter.com/frankspencer/status/1486369904190181383,"@leighacevedo Leigh, miss you!"
246,frankspencer,2022-01-26 14:21:16+00:00,https://twitter.com/frankspencer/status/1486343485309468677,"@NoraBateson Follett argued against a system built on efficiency and simplicity many years ago. Taylorism won, and we adopted a dehumanizing system."
247,frankspencer,2022-01-26 14:01:02+00:00,https://twitter.com/frankspencer/status/1486338392782737412,"@NoraBateson I can, and we should!"
248,frankspencer,2022-01-26 13:51:10+00:00,https://twitter.com/frankspencer/status/1486335908773257221,"Still can’t get over the super ridiculous rant by @bariweiss on @billmaher. The highest number of children to die of flu in one year is 188. 800 plus are dead from COVID. And they, like anyone, can spread it to others. You’re over it? Puh-leeze. The privilege and callousness."
249,frankspencer,2022-01-25 01:52:16+00:00,https://twitter.com/frankspencer/status/1485792605665476610,@MareeConway BINGO!
250,frankspencer,2022-01-25 00:06:40+00:00,https://twitter.com/frankspencer/status/1485766030471401479,"@MareeConway Oh, and I'm so glad that a growing number of people such as Bari and Bill are done with COVID, so I hope they enjoy dinner at their favorite restaurant... oh, it's closed due to lack of healthy workers? Then maybe a coffee from their favorite Barista... oh, they're sick too?"
251,frankspencer,2022-01-24 19:41:46+00:00,https://twitter.com/frankspencer/status/1485699365079506948,"@MareeConway Agreed Maree! And I understand that we will have to learn to live w/ Covid just like the flu instead of isolating forever, but these kind of rants ignore millions of dead (not 12-50k like the flu in the same time period) or the breaking of the healthcare system."
252,frankspencer,2022-01-24 19:06:28+00:00,https://twitter.com/frankspencer/status/1485690484123185160,So much bullshit. The moral crime that will be remembered is how people like her don’t take the pandemic or other concerns such as climate change serious just so they can get back to life as usual.
253,frankspencer,2022-01-24 18:38:56+00:00,https://twitter.com/frankspencer/status/1485683552113020933,@refuturing His alt right is showing.
254,frankspencer,2022-01-22 10:03:43+00:00,https://twitter.com/frankspencer/status/1484829120794087427,"Jordan Peterson, the voice of a new generation of neo-nazis, racists and toxic white males. https://t.co/COegIsj8OA"
255,frankspencer,2022-01-20 20:07:07+00:00,https://twitter.com/frankspencer/status/1484256192511807503,"@refuturing I’ve enjoyed several others, but it’s hard not to think of Tom when you think of Doctor Who."
256,frankspencer,2022-01-20 15:51:38+00:00,https://twitter.com/frankspencer/status/1484191899632164869,"I absolutely do wish that women led more (if not most or all) things. The world would be in much better shape, period."
257,frankspencer,2022-01-20 14:10:47+00:00,https://twitter.com/frankspencer/status/1484166518535503873,One of the greatest coups the anti-democracy republicans ever accomplished was installing fellow anti-democracy republicans @Sen_JoeManchin and @SenatorSinema as supposed democrats.
258,frankspencer,2022-01-13 05:06:51+00:00,https://twitter.com/frankspencer/status/1481492917529333765,"@refuturing In Savannah, Houston Street is pronounced HOUSE-ton. 🏠"
259,frankspencer,2022-01-13 04:11:57+00:00,https://twitter.com/frankspencer/status/1481479102943145985,Those last 2 episodes of #CobraKai #CobraKaiSeason4 … fantastic! Loved the #DefLeppard ending. I’m such a sucker for this show.
260,frankspencer,2022-01-09 19:15:58+00:00,https://twitter.com/frankspencer/status/1480257056728924167,"My god, after listening to this I literally became dumber. And the irony of him standing at a podium that says “Hurricane Preparedness.”"
261,frankspencer,2022-01-07 18:38:50+00:00,https://twitter.com/frankspencer/status/1479522933865336832,"The woman who was selling her bottled farts to guys via the net, but who felt she could no longer sustain the high fiber diet necessary for her business model, is now selling her farts as NFTs. All you need to know about many things."
262,frankspencer,2022-01-05 13:18:02+00:00,https://twitter.com/frankspencer/status/1478717426288242689,"The Futures School @learnforesight announces the 2022 Global Foresight Advisory Council. During our YEAR OF FREE, they will be hosting open meetings w/ thought leaders across the world to discuss how they are democratizing the future. Sign up to attend: https://t.co/1y7xqonMNw https://t.co/hH8eCYnowH"
263,frankspencer,2022-01-05 00:19:57+00:00,https://twitter.com/frankspencer/status/1478521616820846593,"@refuturing Everything you need to know indeed. Any real discussion about a supposed “Metaverse” would include creating common digital architecture, sociological research on virtual embodiment, cybertype inclusion, governance… but we got retail and expensive PDFs."
264,frankspencer,2022-01-05 00:05:22+00:00,https://twitter.com/frankspencer/status/1478517945340993545,"@refuturing Side note, I still don’t get the concept of the Metaverse being something more than what we already have. Suddenly tacking an actually old name on a hoped-for unified virtually simulated world that has the chops to simulate physical embodiment online… that doesn’t even exist?"
265,frankspencer,2022-01-04 23:56:47+00:00,https://twitter.com/frankspencer/status/1478515786822164490,@refuturing https://t.co/roVmbNways
266,frankspencer,2022-01-04 20:05:26+00:00,https://twitter.com/frankspencer/status/1478457562789986304,"I know they apologized and took down the post, but the internets never forget."
267,frankspencer,2022-01-03 22:57:45+00:00,https://twitter.com/frankspencer/status/1478138543390212103,"@adhansen @refuturing As a matter of fact, I'm now starting a consulting agency that does exactly that... dessert-choice segmentation to determine work habits and culture. I'll call it Ginger-relational Theory. (Long days end in bad dad jokes.)"
268,frankspencer,2022-01-03 16:21:37+00:00,https://twitter.com/frankspencer/status/1478038850048077826,"@refuturing Yes, I think I might have quoted from this one in one of my rants... I mean articles on the subject."
269,frankspencer,2022-01-03 14:52:38+00:00,https://twitter.com/frankspencer/status/1478016457636261892,"What if The Futures School @learnforesight made their foresight training programs, events and even their proprietary foresight framework FREE to everyone? IT HAPPENED... and we're calling it the YEAR OF FREE! https://t.co/9WVzmFAxUm #foresight #futuresthinking #thefuturesschool https://t.co/v5wFqTVOS4"
270,frankspencer,2022-01-03 11:13:15+00:00,https://twitter.com/frankspencer/status/1477961247786160130,"As a professional futurist, I’ve railed against the simplistic, siloed &amp; consumptive concept of generational theory because complexity, status, convergence, knowledge dissemination, etc. shred the idea. You should too. Thanks @refuturing https://t.co/zhUkh4ZD1q"
271,frankspencer,2021-12-31 05:05:39+00:00,https://twitter.com/frankspencer/status/1476781574905643014,"The CDC now says that soylent green is a great meal replacement, becoming solely nocturnal is perfectly normal, and one talking chimpanzee is not a cause for planetary alarm. #charltonhestonscifi"
272,frankspencer,2021-12-29 11:56:05+00:00,https://twitter.com/frankspencer/status/1476160087932735496,Forgot the decimal point in front of the 5.
273,frankspencer,2021-12-23 21:58:39+00:00,https://twitter.com/frankspencer/status/1474137403019476992,"@NikolasFuturist Great thing about movies, you can have your own opinion and there’s something for everyone."
274,frankspencer,2021-12-23 21:43:37+00:00,https://twitter.com/frankspencer/status/1474133620826812425,"@NikkiFried I’m definitely voting for you, but this message is wrong. You can still carry Covid and end up passing it along to others in society."
275,frankspencer,2021-12-23 21:38:44+00:00,https://twitter.com/frankspencer/status/1474132391937593354,"@Manoj_Pawar Opinion of course, but it lacks the soul of what made The Matrix great, it drags along, it wanders aimlessly, it’s an endless drive of cynicism, and it was made to literally mock the concept of the original movie. This is the movie no one wanted."
276,frankspencer,2021-12-23 19:48:06+00:00,https://twitter.com/frankspencer/status/1474104548285370379,I’m actually blown away by the new Matrix movie… and not in a good way.
277,frankspencer,2021-12-23 00:15:27+00:00,https://twitter.com/frankspencer/status/1473809439891333127,@jenjarratt He just needs a bribe from a source that would allow him to support the welfare of his constituents.
278,frankspencer,2021-12-22 19:04:46+00:00,https://twitter.com/frankspencer/status/1473731256210890759,"Just ran into @panerabread to get lunch because the drive-thru is closed.  Very crowded, no one wearing a mask except ONE employee. We’re in the middle of a GD pandemic, and the level of social care has probably decreased."
279,frankspencer,2021-12-22 17:36:02+00:00,https://twitter.com/frankspencer/status/1473708926600368128,"For those wanting more Hawkeye after today's finale, but with more of a Southern flair... https://t.co/TU9ELqrhsV"
280,frankspencer,2021-12-14 20:43:02+00:00,https://twitter.com/frankspencer/status/1470856882013282308,"@NikolasFuturist Really was, I got the feeling she was pretty angry with him."
281,frankspencer,2021-12-14 20:19:58+00:00,https://twitter.com/frankspencer/status/1470851077864046597,How awkward was Carrie Anne Moss during The Verge interview with she and Keanu Reeves?! She couldn't wait for that to be over.
282,frankspencer,2021-12-14 15:45:01+00:00,https://twitter.com/frankspencer/status/1470781883306979335,@NoraBateson @NurtureGirl I’d be very interested by a deep convo between the two of you!
283,frankspencer,2021-12-14 12:21:21+00:00,https://twitter.com/frankspencer/status/1470730627104264192,"@ymsalvatico Lol! C = Covid, P = Pandemic."
284,frankspencer,2021-12-14 03:52:07+00:00,https://twitter.com/frankspencer/status/1470602476327948292,"Participant at a client meeting told the room, “I don’t allow my staff to say the “C” word or the “P” word - they cause fear, discouragement &amp; demotivation. I need my staff motivated to perform.” Guessing he also doesn’t allow the “R” word? (It’s “reality” for those in the back.)"
285,frankspencer,2021-12-14 03:41:48+00:00,https://twitter.com/frankspencer/status/1470599881245007874,@refuturing Everything from John Carpenter was gold!
286,frankspencer,2021-12-09 19:16:42+00:00,https://twitter.com/frankspencer/status/1469023215272042498,"@marshallk Reinforces Bergsonian over Darwinian applications of evolutionary thought, giving more credence to creative evolutionary collaboration."
287,frankspencer,2021-12-09 19:14:54+00:00,https://twitter.com/frankspencer/status/1469022765147734017,@marshallk I hope it has a ripple effect on ongoing research and narratives. It certainly gives foresight professionals more fodder to promote human potential and transformative futures.
288,frankspencer,2021-12-09 18:45:50+00:00,https://twitter.com/frankspencer/status/1469015449031651333,@marshallk An amazing piece of work that reinforces creative consciousness and hopeful futures over the dominant narratives of immovable systems and inevitable linearity.
289,frankspencer,2021-12-09 13:00:08+00:00,https://twitter.com/frankspencer/status/1468928451361095682,@M_disciplined Lol! I always wear either my Dune inspired Stillsuit or my C3PO spandex onesie to all client engagements.
290,frankspencer,2021-12-01 14:48:41+00:00,https://twitter.com/frankspencer/status/1466056662633140230,I just published The Heart of Foresight: How Futures Thinking Can Foster a Human Revolution https://t.co/qr6xe6QiLm #foresight #futuresthinking #empathy #future #potential
291,frankspencer,2021-11-30 19:30:02+00:00,https://twitter.com/frankspencer/status/1465765081887780868,"@Thrivable Yes, and... positioning + (re)defining. Opening unknown/unused doors will reframe the whole thing. (Makes me think of quantum redefining classical physics). The value of deep foresight is in ""top of funnel"" whereas forecasting is ""tip of funnel."" The top defines the bottom."
292,frankspencer,2021-11-29 15:25:57+00:00,https://twitter.com/frankspencer/status/1465341266045067264,"@NikolasFuturist If you like that one, check out his work on constructivist chronotopes to overcome probabilistic dominant narratives. https://t.co/2ru63Yebvf"
293,frankspencer,2021-11-28 23:43:37+00:00,https://twitter.com/frankspencer/status/1465104123347484674,@MareeConway @PCOwen_a @atanasonline @shapingtomorrow @radha_mistry Super love!
294,frankspencer,2021-11-28 21:49:18+00:00,https://twitter.com/frankspencer/status/1465075353404203009,"In 2022, The Futures School will be unveiling a major global initiative to promote natural/organic foresight as a means to a greater unlocking of futures trait-cultivating, democratizing and practice across all systems and domains. Excited!"
295,frankspencer,2021-11-28 21:37:03+00:00,https://twitter.com/frankspencer/status/1465072268489469963,"@MareeConway It’s also the reason that the word “literacy” doesn’t work very well for the field (not the teachings under its umbrella). It denotes set standards of intelligence, an idea that is the inverse of futuring. I expounded on that in a different thread."
296,frankspencer,2021-11-28 20:37:19+00:00,https://twitter.com/frankspencer/status/1465057235525156870,"""Typically, societal challenges are based on extrapolations of historical trends, and thus implicitly assume that historically relevant categories remain important also in the future."" 13/x"
297,frankspencer,2021-11-28 20:35:04+00:00,https://twitter.com/frankspencer/status/1465056670934081539,"""In other words, the focus of future-oriented analysis should be learning, problem redefinition and innovative construction of new empirically relevant categories, not predictive modelling."" 12/x"
298,frankspencer,2021-11-28 20:34:16+00:00,https://twitter.com/frankspencer/status/1465056468651098112,"""Policies that are legitimized by facts are methodologically problematic. Although evidence- based policy-making may be useful in the sense that it generates a common frame for policy debates, it may be harmful because it inherently neglects innovation &amp; knowledge creation."" 11/x"
299,frankspencer,2021-11-28 20:30:10+00:00,https://twitter.com/frankspencer/status/1465055439217963017,"@steveseager My original tweet was even in response to a Dunne/Raby comparison of design fiction vs. design futures where they call the latter forecasting, and THEY definitely shouldn’t be making that mistake."
300,frankspencer,2021-11-28 20:28:18+00:00,https://twitter.com/frankspencer/status/1465054969476878344,"@steveseager In turn, foresight pros often seek to fulfill that desire, and in doing so deprive org/biz/gov of pursuing the change/models/thinking needed in an organic/transformative world."
301,frankspencer,2021-11-28 20:26:34+00:00,https://twitter.com/frankspencer/status/1465054533688700929,"@steveseager Thanks for clarifying! Interesting, in that EVERY client for 20+ yrs has asked “where are the numbers?” and need further understanding to unleash their innate futurist ability. It’s the point of Tuomi’s research I’m quoting."
302,frankspencer,2021-11-28 20:03:48+00:00,https://twitter.com/frankspencer/status/1465048803401252879,@steveseager Unsure of your meaning. Foresight often gets defined by dominant and favored public narratives of predictive forecasting. This framing deprives the field of its most powerful utility.
303,frankspencer,2021-11-28 19:53:58+00:00,https://twitter.com/frankspencer/status/1465046328195661844,"SO IMPORTANT: ""Ontological expansion means that we do not need a better model; instead, we need a different model."" 9/x"
