,0,1,2,3
657,frankspencer,2021-06-12 04:50:26+00:00,https://twitter.com/frankspencer/status/1403575398458343426,"More than crime, modern police forces in the United States emerged as a response to ""disorder."" What constitutes social and public order depends largely on who is defining those terms. Who did the defining? 7/n"
658,frankspencer,2021-06-12 04:49:21+00:00,https://twitter.com/frankspencer/status/1403575124184477701,"Mob violence, particularly violence directed at immigrants &amp; African Americans, occurred w/ some frequency. But evidence of an actual crime wave is lacking. So, if the modern American police force was not a direct response to crime, then what was it a response to? 6/n"
659,frankspencer,2021-06-12 04:47:33+00:00,https://twitter.com/frankspencer/status/1403574672164335617,Urbanization was occurring at an ever-quickening pace and old informal watch and constable system was no longer adequate to control disorder. Anecdotal accounts suggest increasing crime and vice in urban centers. 5/n
660,frankspencer,2021-06-12 04:46:41+00:00,https://twitter.com/frankspencer/status/1403574454605824003,"The key question is what was it about the United States in the 1830s that necessitated the development of local, centralized, bureaucratic police forces? One answer is that cities were growing. The United States was no longer a collection of small cities and rural hamlets. 4/n"
661,frankspencer,2021-06-12 04:45:34+00:00,https://twitter.com/frankspencer/status/1403574173398704128,"Following the Civil War, these vigilante orgs evolved in modern Southern police depts primarily as a means of controlling freed slaves who were now laborers working in an agricultural caste system, &amp; enforcing ""Jim Crow"" laws designed to deny freed slaves equal rights. 3/n"
662,frankspencer,2021-06-12 04:44:00+00:00,https://twitter.com/frankspencer/status/1403573777775087618,"Slave patrols had 3 functions (1) chase down &amp; return runaway slaves (2) provide a form of organized terror to deter slave revolts (3) maintain a form of discipline for slave-workers who were subject to summary justice, outside of the law, if they violated plantation rules. 2/n"
663,frankspencer,2021-06-12 04:41:28+00:00,https://twitter.com/frankspencer/status/1403573140517707777,"Why do we have police in the US at all? I suspect most don't know the history. The genesis of the modern police organization in the South is the ""Slave Patrol"" (Platt 1982). The first formal slave patrol was created in the Carolina colonies in 1704 (Reichel 1992). 1/n"
664,frankspencer,2021-06-12 04:22:07+00:00,https://twitter.com/frankspencer/status/1403568269144043523,@RobinWrightGunn @JasonIsbell Nice! Great experience for sure! (Waiheke off the coast of Auckland.)
665,frankspencer,2021-06-12 04:05:14+00:00,https://twitter.com/frankspencer/status/1403564020968341508,@MareeConway I’m very interested in imagining this for practical reasons.
666,frankspencer,2021-06-12 04:03:49+00:00,https://twitter.com/frankspencer/status/1403563664687386626,"In an attempt to re-normalize American life by ignoring the grossest expression of American political corruption &amp; crime ever, the @JoeBiden administration &amp; @DOJPH is going to end up as part of that corruption. Also, they’re basically inviting a 2nd wave worst than the first."
667,frankspencer,2021-06-12 03:54:45+00:00,https://twitter.com/frankspencer/status/1403561383598477312,@RobinWrightGunn @JasonIsbell I can live with it. Ever visited Waiheke Island?
668,frankspencer,2021-06-10 17:37:38+00:00,https://twitter.com/frankspencer/status/1403043691728625671,"Is foresight meant for more impactful uses than supporting the ""science"" of management theory or upholding dominant narratives? Read Part 2 of Holoptic Foresight Dynamics: An Evolutionary Model for Co-Creating the Future. https://t.co/eze80uU1Ju"
669,frankspencer,2021-06-10 01:33:58+00:00,https://twitter.com/frankspencer/status/1402801177423749120,I hate the police. Let me say it again. I hate the police. ALL POLICE!
670,frankspencer,2021-06-08 18:52:24+00:00,https://twitter.com/frankspencer/status/1402337732001681424,"@VeliVirmajoki @aamostaylor And hopefully that’s never, or we will completely ignored a better understanding of a naturally complex universe and the power that it produces, and instead surrendered to so-called “management science.” And, that’s the aim of foresight."
671,frankspencer,2021-06-08 17:39:12+00:00,https://twitter.com/frankspencer/status/1402319312254377991,"@POTUS and the @TheDemocrats are looking pretty weak right now. Or worse, they really don’t disagree with those who hate democracy."
672,frankspencer,2021-06-07 23:08:51+00:00,https://twitter.com/frankspencer/status/1402039884228050944,@JoeManchinWV is a Trumper. He hates democracy.
673,frankspencer,2021-06-07 22:27:16+00:00,https://twitter.com/frankspencer/status/1402029418005028870,"@aamostaylor I don’t equate forecasting with foresight, and scenario building in foresight should resemble world building to model complex robustness. I agree that when people say AI can replace human foresight, they are really talking about trend hunting and data analysis."
674,frankspencer,2021-06-07 22:17:23+00:00,https://twitter.com/frankspencer/status/1402026930199740417,"@aamostaylor To my earlier point, trendspotting and reductive scenarios aren’t (good) foresight."
675,frankspencer,2021-06-07 16:29:48+00:00,https://twitter.com/frankspencer/status/1401939461043273732,Who cares?
676,frankspencer,2021-06-07 14:06:51+00:00,https://twitter.com/frankspencer/status/1401903486636285957,"As a futurist, it’s my job to challenge your assumptions abt what, why, so what, where “it’s” going - not to reinforce what we already know. Foresight is for the brave &amp; bold, not purveyors of broken systems &amp; realities. #evolutionarydevelopment #anticipatoryscience #visionaries"
677,frankspencer,2021-06-07 13:59:31+00:00,https://twitter.com/frankspencer/status/1401901640169537538,"#Foresight challenges what is, &amp; questions what can be and what WANTS to be. The field of futures isn’t void of scientific rigour; rather, it acknowledges that the scientific principles that define modern organization &amp; society are fundamentally flawed. #taylorismisinhumane"
678,frankspencer,2021-06-07 11:50:03+00:00,https://twitter.com/frankspencer/status/1401869056739844100,"I would write some horrible thing about @JoeManchinWV, but he would care about that about as much as he cares about saving democracy. Probably a white supremacist, most likely power hungry, definitely a coward."
679,frankspencer,2021-06-07 02:17:14+00:00,https://twitter.com/frankspencer/status/1401724904509251585,"“What, after all, is more important: the death of democracy, or the preservation of a Senate tradition that has been leveraged for decades to protect conservative minority rule?”"
680,frankspencer,2021-06-07 01:55:29+00:00,https://twitter.com/frankspencer/status/1401719430942502915,"I know that Snopes says that the orange dictator’s pants weren’t actually on backwards, but why is there no fly in the front and the behind-the-knee creases ARE in the front?"
681,frankspencer,2021-06-05 22:51:17+00:00,https://twitter.com/frankspencer/status/1401310688337932291,@refuturing De-evolution.
682,frankspencer,2021-06-05 22:32:19+00:00,https://twitter.com/frankspencer/status/1401305911986118657,"What have we learned from the @discoveryplus show #HomemadeAstronauts? Rocket Science IS Rocket Science, and without expertise, death is imminent."
683,frankspencer,2021-06-05 21:06:16+00:00,https://twitter.com/frankspencer/status/1401284256647757828,"Today, I browsed in a bookstore for the first time in 15 months, one of my favorite things to do pre-pandemic. BTW, we’re still in a pandemic. I’m fully vaccinated, still wearing a mask."
684,frankspencer,2021-06-05 20:09:15+00:00,https://twitter.com/frankspencer/status/1401269911373205510,"I’m not saying that anyone should be excited about living in a world where collective care and global unity is increasingly unpopular, but this is the transformationalists’ time to shine!"
685,frankspencer,2021-06-05 19:34:38+00:00,https://twitter.com/frankspencer/status/1401261198084132868,"The point in my earlier tweet was that foresight fosters an embrace of complexity for transformational expression, not a way to simplify or codify the world around us. Scenarios are powerful IF they are robust worlds rather than reductive statements of possibilities. #foresight"
686,frankspencer,2021-06-05 18:09:18+00:00,https://twitter.com/frankspencer/status/1401239723658645513,"Was listening to a session from this yr’s #globalforesightsummit, &amp; still amazed that scenario building in foresight isn’t always robust worldbuilding (i.e. breadcrumbs of trends, values, implications, pattern building, clustering &amp; theming, people-centered narratives, more)."
687,frankspencer,2021-06-02 23:16:26+00:00,https://twitter.com/frankspencer/status/1400229851571892231,"The filibuster is FAKE. Destroying it doesn’t kill democracy, but keeping it will. https://t.co/2hU3HatZ5u"
688,frankspencer,2021-06-01 17:16:34+00:00,https://twitter.com/frankspencer/status/1399776899124060163,@POTUS @VP @TheDemocrats DO SOMETHING!
689,frankspencer,2021-06-01 12:51:46+00:00,https://twitter.com/frankspencer/status/1399710261389443082,"I just published Climbing the Foresight Ladder https://t.co/ya8byiEMel Foresight isn’t an add-on that supercharges our traditional methods of business or governance; by its very nature, it challenges the efficacy and existence of all that we think and do."""
690,frankspencer,2021-05-26 01:08:24+00:00,https://twitter.com/frankspencer/status/1397358924936978437,One of the most exhausting things in the world is being hyper scrutinized by white &amp; woke “allies.” They couldn’t have a non-toxic conversation with Santa Claus. Quit trying to expose everybody that you meet as a non-inclusive bastard. You sound ridiculous doing it.
691,frankspencer,2021-05-23 13:52:29+00:00,https://twitter.com/frankspencer/status/1396464051845222404,"If you want to explore myth and metaphor, there’s no better subject than the idea that white nationalism is a global scourge of epic proportions. Listen to the powerful voice of @TaNehisiCoats unmask this atrocity."
692,frankspencer,2021-05-23 13:40:40+00:00,https://twitter.com/frankspencer/status/1396461077114851329,"I’m sure I’ll get at least one response saying how dystopic Sci Fi helps us to avoid such futures, but I’m still waiting to see a tangible example of that. And, no, psychological studies do not strongly indicate any such thing."
693,frankspencer,2021-05-23 13:33:25+00:00,https://twitter.com/frankspencer/status/1396459251376263173,"Simon chickens out a bit at the end when he says that a tidal wave of Sci Fi explaining our present dilemma is ok because it’s the genre growing up. Nope, it’s a lack of imagination literacy however you slice it."
694,frankspencer,2021-05-23 13:29:45+00:00,https://twitter.com/frankspencer/status/1396458328566468613,"I’ve been screaming this for the past decade plus: Being bombarded with stories of impending doom is not only sheep-like laziness, but it betrays our lack of pursuing evolutionary consciousness and transformation."
695,frankspencer,2021-05-23 05:13:38+00:00,https://twitter.com/frankspencer/status/1396333479655268354,Get vaccinated! #TikTok https://t.co/ByMAfW8foc
696,frankspencer,2021-05-23 05:05:53+00:00,https://twitter.com/frankspencer/status/1396331527462658049,"Every morning, remind yourself that the prevailing system on which we run our businesses, organizations, governments, cities and societies is nucking futs."
697,frankspencer,2021-05-23 05:02:25+00:00,https://twitter.com/frankspencer/status/1396330655743610880,"BTW, it’s for this same reason that AI won’t replace human foresight. Foresight isn’t a better strategic planning method, and it’s not about number-crunching forecasts. Foresight is about embracing organic complexity in the face of a linear-crazed system."
698,frankspencer,2021-05-23 04:57:09+00:00,https://twitter.com/frankspencer/status/1396329329689235461,"Martin is spot on, but still misses the need to shift strategic thinking away from pre-existing logics to leveraging creative emergence by identifying organizational DNA. To be fair though, he does fire a bullet through the head of “data science” and analytical patterns."
699,frankspencer,2021-05-23 03:49:54+00:00,https://twitter.com/frankspencer/status/1396312407769817090,#novelfutures #dominantnarratives #futuresconsciousness
700,frankspencer,2021-05-17 02:52:54+00:00,https://twitter.com/frankspencer/status/1394123733376372736,@audaciouslyndn Congratulations Dr. Hunt!
701,frankspencer,2021-05-17 02:41:55+00:00,https://twitter.com/frankspencer/status/1394120969816576002,"Read this thread, and you’ll better understand why critical thinking is important in a world that was volatile, uncertain, complex &amp; ambiguous even BEFORE the pandemic. A shift was afoot, accelerated by COVID, &amp; their answer is “do the same things, hope for different results.”"
702,frankspencer,2021-05-17 02:07:06+00:00,https://twitter.com/frankspencer/status/1394112209987457026,@_dezein Tricky
703,frankspencer,2021-05-17 00:11:08+00:00,https://twitter.com/frankspencer/status/1394083023738527744,"Great example of mapping the future without understanding every facet. It’s not about exact prediction; it’s about identifying patterns, influences and emerging realities."
704,frankspencer,2021-05-16 18:46:40+00:00,https://twitter.com/frankspencer/status/1394001371326726149,"This is my favorite thread of recent, the fun starts on the second tweet. It’s also given me an idea for a great biopunk/solarpunk short scenario narrative."
705,frankspencer,2021-05-16 15:56:12+00:00,https://twitter.com/frankspencer/status/1393958470089588736,"@im_design_coach w/o weighing facts such as vast US poverty, devastating conservative health care policies, zero social safety net, shrinking abortion rates under progressive administrations, etc."
706,frankspencer,2021-05-16 15:52:20+00:00,https://twitter.com/frankspencer/status/1393957498839871494,"@im_design_coach Let’s apply this to your first response, “I guess you prefer Hamas.” This is similar to someone saying, “I guess you prefer killing babies” because I didn’t vote for Trump in our last election..."
707,frankspencer,2021-05-16 15:45:46+00:00,https://twitter.com/frankspencer/status/1393955843033509889,@im_design_coach Embracing uncertainty does not mean being agnostic or practicing “whataboutism” in the face of human suffering and atrocities.
708,frankspencer,2021-05-16 15:42:48+00:00,https://twitter.com/frankspencer/status/1393955099492458498,@im_design_coach And it did (US). But it also strengthened the voice of 2 long-standing problems here: deep racism and anti-intellectualism - the country was somewhat founded on both. We can recognize when something is rotten and anti-human while still embracing uncertainty.
709,frankspencer,2021-05-16 15:36:19+00:00,https://twitter.com/frankspencer/status/1393953468466057216,"@im_design_coach Let’s take a closer look at the article. It mentions Trump v. Clinton, &amp; notes that highly favouring one is simply political polarization. I have often said ignoring large swaths of people while Silicon Valley races toward a tech future would result in nationalistic fervour."
710,frankspencer,2021-05-16 15:29:14+00:00,https://twitter.com/frankspencer/status/1393951682078429189,@im_design_coach An example of probing this particular issue: Has Israel displaced Palestinian people? Yes. Has Hamas responded with awful terrorist activity? Yes. Is Israel practicing inhumane Apartheid? Yes.
711,frankspencer,2021-05-16 15:22:22+00:00,https://twitter.com/frankspencer/status/1393949957510635524,"@im_design_coach Thanks! As part of my extensive daily scanning, I had already read this article. In my profession, unconscious bias modelling is very important as a means to check our own assumptions and ladder of inference before mapping futures possibilities."
712,frankspencer,2021-05-15 22:00:00+00:00,https://twitter.com/frankspencer/status/1393687636406120459,@futuryst @USC @berggruenInst Looking forward to seeing your work on such an important issue my friend!
713,frankspencer,2021-05-15 20:01:47+00:00,https://twitter.com/frankspencer/status/1393657886274957314,Get vaccinated!
714,frankspencer,2021-05-15 19:04:24+00:00,https://twitter.com/frankspencer/status/1393643445210828801,"@im_design_coach Especially when we are all faced with growing issues that demand greater empathy, diplomacy and global cooperation. (Climate, population displacement, panoptic connectivity, etc.) Old, broken systems, approaches, conflicts won’t get us there. How’s that for long-sighted? ;-)"
715,frankspencer,2021-05-15 18:55:26+00:00,https://twitter.com/frankspencer/status/1393641189417627650,@im_design_coach In a time when democracy is in danger of collapsing worldwide due largely to nationalistic fervour - and Israel claims to be a democracy - we must violently question governmental actions that attempt to implement “racial purity.”
716,frankspencer,2021-05-15 18:46:08+00:00,https://twitter.com/frankspencer/status/1393638848152887301,@im_design_coach Human Rights Watch and even the Israeli human rights group B'Tselem confirm. https://t.co/x180uUfH97
717,frankspencer,2021-05-15 18:39:16+00:00,https://twitter.com/frankspencer/status/1393637121068576769,"@im_design_coach The opposite of shortsighted. When you look at the history of the Palestinian people/region, they have been systematically shrunk down from inhabiting most of what comprises Israel today to a small territory (ghettos). We have history to show us what Apartheid looks like."
718,frankspencer,2021-05-15 15:25:23+00:00,https://twitter.com/frankspencer/status/1393588326700048394,Israel is an apartheid state engaged in ethnic cleansing and genocide. #IsraeliCrimes #ApartheidIsrael #Genocide #IsraeliTerrorism
719,frankspencer,2021-05-14 21:04:44+00:00,https://twitter.com/frankspencer/status/1393311340459134979,"When Majorie Taylor Greene shoots someone, who among you will be shocked or wonder how we could have seen that coming?"
720,frankspencer,2021-05-08 17:03:58+00:00,https://twitter.com/frankspencer/status/1391076420206698496,“Whoever marries the spirit of this age will find himself a widower in the next.” William Ralph Inge
721,frankspencer,2021-05-07 03:50:41+00:00,https://twitter.com/frankspencer/status/1390514397945155587,"Such a good clip about recent updates, and the turning tide in the US. We could see an incredibly low amount of new cases and number of deaths by early Fall IF PEOPLE GET VACCINATED! https://t.co/efNfbUltup"
722,frankspencer,2021-05-06 02:25:43+00:00,https://twitter.com/frankspencer/status/1390130628784529411,"@casscoleman I LOVE your voice, and can't wait to hear more from you. Sad you were eliminated from American Idol - you were my fav - but excited to see what's next!"
723,frankspencer,2021-05-01 14:27:17+00:00,https://twitter.com/frankspencer/status/1388500276697604097,“Sheets without the hoods” @GovRonDeSantis denies the lived experience of millions of Americans when he discounts systemic racism out of hand. Then he signs a racist voter law. #noshame #exposedracist
724,frankspencer,2021-04-27 15:20:46+00:00,https://twitter.com/frankspencer/status/1387064181988462600,Had a great time speaking on the virtual stage in Berlin today with @TanjaFutureMe at the @newmittelstand Summit 2021 about our collective need for more positive images of the future. https://t.co/CuKSodx3ze
725,frankspencer,2021-04-24 18:52:15+00:00,https://twitter.com/frankspencer/status/1386030240028311555,"@TiffanyDCross calling Polk County Florida Police Chief Grady Judd “a wannabe Barney Fife” was priceless and spot on. These old white farts just want to intimidate American citizens, and that makes them the worst kind of terrorists."
726,frankspencer,2021-04-18 01:16:05+00:00,https://twitter.com/frankspencer/status/1383590122264817669,Awesome behind the scenes pic of Day 1 of the FuturesxDesign program from @learnforesight and @Futures_Design.
727,frankspencer,2021-04-17 19:10:34+00:00,https://twitter.com/frankspencer/status/1383498135352184832,"The future is experiential (as is the past and present). Change, transformation and emergence takes place inside of us before manifesting around us. We’ve tried to externally quantify it, but that’s not the future."
728,frankspencer,2021-04-17 19:06:13+00:00,https://twitter.com/frankspencer/status/1383497041091850240,Why isn’t there more talk about @PressSec Jen Psaki being an American hero? She is amazing!
729,frankspencer,2021-04-17 05:27:27+00:00,https://twitter.com/frankspencer/status/1383290991327682560,"And that means we aren’t headed into doom, but change — and we, the people, will survive. By working together to include as many people as possible in our democratic process, we can guide that transformation and hopefully do things better this time. https://t.co/7lKMfUZ4ue"
730,frankspencer,2021-04-15 16:43:06+00:00,https://twitter.com/frankspencer/status/1382736247966158851,@NurtureGirl Bad things.
731,frankspencer,2021-04-10 15:30:30+00:00,https://twitter.com/frankspencer/status/1380906039676133376,"@VictoriaFutures Similar to people becoming pandemic experts via the Internet. Doctors certainly want people to be knowledgeable about Covid and actively engaged in fighting it, but you don’t become a virologist through Google."
732,frankspencer,2021-04-10 15:05:07+00:00,https://twitter.com/frankspencer/status/1380899652321603587,"@VictoriaFutures Yes, also a good analogy. I couldn’t agree more that voice-inclusion is critical to good foresight, but that doesn’t negate deep learning. We already have dominant narratives in society, and foresight theory helps (should) to combat that. It won’t if there’s less field rigour."
733,frankspencer,2021-04-10 14:31:35+00:00,https://twitter.com/frankspencer/status/1380891211125334016,"And the field can learn/benefit from everyone pursuing healthy lifestyles (depends on it really) - that doesn’t negate the study of the brain, nervous system, diseases, effects of social contact, etc. Good health belongs to and depends on everyone."
734,frankspencer,2021-04-10 14:26:51+00:00,https://twitter.com/frankspencer/status/1380890023562727425,"Commitment to rigour and deep learning in the field of foresight through formal curriculum, certification programs, continuing education etc. is not gatekeeping. Everyone should have a future-oriented mindset just like everyone should eat healthy. 1/2"
735,frankspencer,2021-04-10 14:19:34+00:00,https://twitter.com/frankspencer/status/1380888188449865729,"An analogy: Professional foresight is like the field of medicine. There is a strong/growing knowledge base and field-supporting theory that’s necessary to effectively practice. However, the field wants everyone to own their personal well-being &amp; practice healthy lifestyles. 2/2"
736,frankspencer,2021-04-10 14:08:33+00:00,https://twitter.com/frankspencer/status/1380885417046679554,Interesting to hear a newly-minted author say in an interview yesterday that it’s important to have people dedicated full-time to practicing foresight who wrote 6 months ago that they considered such a position “gatekeeping the future.” 1/2
737,frankspencer,2021-04-06 17:27:05+00:00,https://twitter.com/frankspencer/status/1379485828410437633,It’s not economic. IT WAS NEVER ECONOMIC!
738,frankspencer,2021-04-05 01:29:08+00:00,https://twitter.com/frankspencer/status/1378882364173078532,Has anyone attended one of Biden’s rallies yet?
739,frankspencer,2021-04-04 23:09:20+00:00,https://twitter.com/frankspencer/status/1378847182128832512,"@JoyAnnReid @ReverendWarnock She and her ilk have stood by every form of disgusting and “sinful” activity, their witness to the validity of their faith is null and completely discredited."
740,frankspencer,2021-04-04 16:28:29+00:00,https://twitter.com/frankspencer/status/1378746303149137922,https://t.co/Nkbmer1XMj
741,frankspencer,2021-04-02 19:21:07+00:00,https://twitter.com/frankspencer/status/1378064971528089605,@NurtureGirl BINGO!
742,frankspencer,2021-04-01 02:07:00+00:00,https://twitter.com/frankspencer/status/1377442342278463493,Join Futurist @ymsalvatico and me at this year’s Association for Strategic Planning conference! https://t.co/eZNeGn9WnW #ASPconf2021 https://t.co/t7brABGuKx
743,frankspencer,2021-03-29 01:49:14+00:00,https://twitter.com/frankspencer/status/1376350707721383942,@Delta writes a message to us like we are children. The spin on this is unbelievable. BOYCOTT DELTA until they change their stance and support democracy. #boycottdelta #BoycottCocaColaCo #boycotthomedepot
744,frankspencer,2021-03-26 12:36:18+00:00,https://twitter.com/frankspencer/status/1375426382063411200,@Sohailfutures 😂
745,frankspencer,2021-03-26 01:33:14+00:00,https://twitter.com/frankspencer/status/1375259516359602176,"This from my friend @Sohailfutures on a post today - loved it. I’ve written before about how reductive the 2x2 method is, and we’ve quite honestly evolved past this in robust foresight practice."
746,frankspencer,2021-03-26 01:03:07+00:00,https://twitter.com/frankspencer/status/1375251935457083393,“What can seem cheap in the beginning can be costly later. I've had 100 organizations tell me they initially went w/ the 2x2 matrix... it is a dead-end. The method does not assist in developing the capabilities &amp; literacies to navigate changing waters.” Sohail Inayatullah
