,0,1,2,3
137,salimismail,2022-06-10 23:09:05+00:00,https://twitter.com/salimismail/status/1535398676591517696,Great to meet you @RhysLindmark
138,salimismail,2022-05-27 13:12:24+00:00,https://twitter.com/salimismail/status/1530175088229752833,My tweet of the day… you’re either evidence based or you’re not..
139,salimismail,2022-05-19 13:52:23+00:00,https://twitter.com/salimismail/status/1527286046160850944,Just wow.
140,salimismail,2022-05-19 05:39:08+00:00,https://twitter.com/salimismail/status/1527161916166131715,"@iancr @veecon @scabshop @Ledger Ian, I’ll unfortunately miss @veecon, but while there, try and meet @UnrealApe - he’s awesome"
141,salimismail,2022-05-17 23:01:51+00:00,https://twitter.com/salimismail/status/1526699545719193600,@durjoy @CoryBooker Beautiful
142,salimismail,2022-05-16 00:13:50+00:00,https://twitter.com/salimismail/status/1525992885023383552,"@infoarbitrage With a remote and some nachos, I can miss hey plays in both. cc @howardlindzon"
143,salimismail,2022-05-09 21:32:39+00:00,https://twitter.com/salimismail/status/1523777995072503808,"I'm really excited to be the opening speaker at the @dpi_canada  #PDW_SPP 

You can find out more and register here 
https://t.co/kqHI8wkH7O
https://t.co/v65KZemkSB https://t.co/FZDUE3HKYa"
144,salimismail,2022-05-05 12:26:27+00:00,https://twitter.com/salimismail/status/1522190988617424897,"Great thread, except this ""nobody knew in the beginning"" business is, er, completely wrong"
145,salimismail,2022-05-04 00:06:10+00:00,https://twitter.com/salimismail/status/1521642301843546113,No commentary needed..
146,salimismail,2022-05-03 07:32:36+00:00,https://twitter.com/salimismail/status/1521392264551018496,"I had the incredible honor of meeting His Highness Crown Prince of the Emirate of Abu Dhabi, Sheikh Mohamed Bin Zayed bin Sultan Al Nahyan and sharing ideas with UAE thought leaders to discuss its strategic vision for the future."
147,salimismail,2022-05-01 11:47:50+00:00,https://twitter.com/salimismail/status/1520731719522914304,@StephenMarche So totally agree with you Stephen
148,salimismail,2022-04-30 03:43:34+00:00,https://twitter.com/salimismail/status/1520247460240625665,Things are getting ugly.. but overall very small crowd in Ottawa https://t.co/mbeVcS4cdT
149,salimismail,2022-04-30 00:02:36+00:00,https://twitter.com/salimismail/status/1520191854079270914,The Ottawa protest.. live https://t.co/EdqgMuDobu
150,salimismail,2022-04-28 13:32:10+00:00,https://twitter.com/salimismail/status/1519670812764160000,Has been really great sharing this with everyone!
151,salimismail,2022-04-24 09:40:40+00:00,https://twitter.com/salimismail/status/1518163004201779203,An absolute MUST-READ by @ramez..
152,salimismail,2022-04-19 17:55:47+00:00,https://twitter.com/salimismail/status/1516475661942419460,@andysherry @MayorDaniella @FIU @AgathaCaraballo @eMergeAmericas Andrew!  Sorry to have missed you
153,salimismail,2022-04-18 00:51:52+00:00,https://twitter.com/salimismail/status/1515855598969102337,Incredibly important article.. h/t @pkedrosky..  https://t.co/dJxR3psJ8h
154,salimismail,2022-04-14 15:02:19+00:00,https://twitter.com/salimismail/status/1514620069300826118,Oh Ship! Show Presents: Building Exponential Organizations https://t.co/QwOssFq2eV
155,salimismail,2022-04-08 19:36:55+00:00,https://twitter.com/salimismail/status/1512514848025976835,Great to be part of @etherMiami's ecosystem
156,salimismail,2022-03-30 18:13:07+00:00,https://twitter.com/salimismail/status/1509232268904177672,@OpenExO @LizClaman This will be fun
157,salimismail,2022-03-25 14:12:12+00:00,https://twitter.com/salimismail/status/1507359698458193932,@drpbkim1 Thanks for mentioning. It is NOT me. Please report it. We've been trying to get it shut down.. hey @instagram salimiismailex0 is a phishing account
158,salimismail,2022-03-22 21:21:33+00:00,https://twitter.com/salimismail/status/1506380587476656130,My tweet of the day. This is wild
159,salimismail,2022-03-19 14:24:19+00:00,https://twitter.com/salimismail/status/1505188421467361283,"Hey @garyvee - looking forward to @veecon.  (oh, and I'm Charismatic Chameleon)"
160,salimismail,2022-03-09 05:01:46+00:00,https://twitter.com/salimismail/status/1501422972610961409,@innonate I've been on a flight with Cruz on it. People avoided him like the plague
161,salimismail,2022-03-07 21:31:53+00:00,https://twitter.com/salimismail/status/1500947368522526720,@TomRaftery @TwitterSupport Me too
162,salimismail,2022-03-05 20:21:25+00:00,https://twitter.com/salimismail/status/1500204858242125826,Very important threat from Jeff..
163,salimismail,2022-03-02 10:35:56+00:00,https://twitter.com/salimismail/status/1498970353187672066,My tweet of the day. Completely insane
164,salimismail,2022-02-28 19:36:21+00:00,https://twitter.com/salimismail/status/1498381578447241226,My tweet of the day.  Extraordinary times..
165,salimismail,2022-02-24 05:56:17+00:00,https://twitter.com/salimismail/status/1496725650140725248,My tweet of the day…
166,salimismail,2022-02-18 01:34:52+00:00,https://twitter.com/salimismail/status/1494485534235930636,My tweet (thread) of the day..
167,salimismail,2022-02-13 14:41:08+00:00,https://twitter.com/salimismail/status/1492871465263316992,"@TobyWalsh Totally agree with marek above.  With consciousness, we have a huge definition problem and an even bigger testing problem"
168,salimismail,2022-02-13 14:37:00+00:00,https://twitter.com/salimismail/status/1492870426552324104,I used this exact model for about 8 years
169,salimismail,2022-01-30 06:14:50+00:00,https://twitter.com/salimismail/status/1487670622910099458,Must read thread about US history
170,salimismail,2022-01-28 22:57:25+00:00,https://twitter.com/salimismail/status/1487198152423874560,My tweet of the day. Advice I certainly can use
171,salimismail,2022-01-24 04:56:11+00:00,https://twitter.com/salimismail/status/1485476503081164800,@jpalfrey @AMNH Wait what?  Teddy was your GG-GF?  That’s amazing!
172,salimismail,2022-01-20 02:18:39+00:00,https://twitter.com/salimismail/status/1483987304830193667,This is a great thread on security tokens and the huge opportunity they represent
173,salimismail,2022-01-15 16:33:07+00:00,https://twitter.com/salimismail/status/1482390401403305992,My tweet of the day
174,salimismail,2022-01-07 01:40:00+00:00,https://twitter.com/salimismail/status/1479266535491440640,My tweet of the day.. h\t @PhilipSheppard
175,salimismail,2022-01-04 22:01:28+00:00,https://twitter.com/salimismail/status/1478486764843118600,Must read thread on the emergence of security tokens..
176,salimismail,2021-12-31 05:53:48+00:00,https://twitter.com/salimismail/status/1476793691943669761,"A bit hyperbolic, but yes.. definitely worth watching.."
177,salimismail,2021-12-19 21:20:32+00:00,https://twitter.com/salimismail/status/1472678257254408193,My tweet of the day.. lmao
178,salimismail,2021-12-08 15:48:59+00:00,https://twitter.com/salimismail/status/1468608555813150720,@Kemp @planet @NYSE @Will4Planet @schingler Massive congrats guys
179,salimismail,2021-11-30 13:08:51+00:00,https://twitter.com/salimismail/status/1465669151649894413,"@Pericarus @Defi_Summit Hey Max, would love to connect.."
180,salimismail,2021-11-28 14:08:09+00:00,https://twitter.com/salimismail/status/1464959301689167883,@ArminThon You're very welcome. Currently finishing 2nd edition with something like 70% new information. Stay tuned!
181,salimismail,2021-11-18 21:09:10+00:00,https://twitter.com/salimismail/status/1461441375363346436,Dare nails it here..
182,salimismail,2021-11-10 14:41:17+00:00,https://twitter.com/salimismail/status/1458444655616475139,"Join me to Discover How To Embrace Disruption To Grow Exponentially 
@ScaleUpWithGI. The Exponential Growth Formula: How to Leverage The Fast Pace of Change So You Can Grow 10x Faster Than Your Competitors
https://t.co/r909P9SoIo https://t.co/7XO4w1HHYg"
183,salimismail,2021-11-05 12:41:35+00:00,https://twitter.com/salimismail/status/1456602595280236545,"Excited to be a part of eWMS2021, the biggest marketing event starting tomorrow. https://t.co/WqLsZmbNbg

#eWMS2021 https://t.co/hQmzQ362PX"
184,salimismail,2021-11-02 17:10:08+00:00,https://twitter.com/salimismail/status/1455583013245497351,"I’ll be speaking at #WonderlandMiami on investing the Shamanic way, 8th of November 09:30am EST https://t.co/M232JSiCQ3 https://t.co/JFJYq26mrk"
185,salimismail,2021-10-30 14:41:01+00:00,https://twitter.com/salimismail/status/1454458324100030465,Because.. freedom!
186,salimismail,2021-10-22 11:36:13+00:00,https://twitter.com/salimismail/status/1451512714443075588,"I will be discussing The Future of Entrepreneurship along with @Atortajada, @bobdorf, @SpeakerJeff, @PeterDiamandis, @robertoalvarez &amp; @plopezsela 
Join us for this exciting event!

https://t.co/mHY5lQxiuz https://t.co/jXnq8dNnfB"
187,salimismail,2021-10-12 15:10:17+00:00,https://twitter.com/salimismail/status/1447942706597085194,Can’t wait to read !!
188,salimismail,2021-10-04 20:31:52+00:00,https://twitter.com/salimismail/status/1445124532180770820,"My last six hrs while whatsapp is down.. telegram/signal/telegram/signal...  omg, a text msg...  telegram/signal/"
189,salimismail,2021-10-03 12:44:18+00:00,https://twitter.com/salimismail/status/1444644478208385025,@jamesparton Totally feel you . my lowest is 7 miles while crossing the U.S.
190,salimismail,2021-09-29 16:03:00+00:00,https://twitter.com/salimismail/status/1443244929724174339,We are bringing the world from scarcity to abundance @espn Edge
191,salimismail,2021-09-29 15:51:22+00:00,https://twitter.com/salimismail/status/1443242004411002884,In the NFT world we have just seen the tip of the iceberg in how fans can monetize their experience @erin_mcpherson. @espn Edge
192,salimismail,2021-09-29 15:48:24+00:00,https://twitter.com/salimismail/status/1443241255933186055,@MickeyMaher23 @BSchneider Discussing how NFTs are being introduced to a broader audience through sports fans. @espn Edge
193,salimismail,2021-09-29 15:31:00+00:00,https://twitter.com/salimismail/status/1443236877272862725,"The power of AI increased season ticket sales by 30% for the @MiamiHEAT, making data driven decisions is crucial to Exponential Transformation. @espn Edge"
194,salimismail,2021-09-29 15:24:25+00:00,https://twitter.com/salimismail/status/1443235219969040389,The role that technology plays in creating inclusive experiences is undoubtable @BondSarah_Bond
195,salimismail,2021-09-29 15:10:07+00:00,https://twitter.com/salimismail/status/1443231621419831308,Athletes 3.0 don't just focus on sports but also inspiring others to look externally towards the long term @blakegriffin23 @lindseyvonn. @espn Edge
196,salimismail,2021-09-29 15:02:16+00:00,https://twitter.com/salimismail/status/1443229645684584451,"@blakegriffin23  &amp; @lindseyvonn invested because they believed in the company, the product AND the person. @espn Edge"
197,salimismail,2021-09-29 14:48:37+00:00,https://twitter.com/salimismail/status/1443226212789276680,The Real time nature of 5G is going to completely change sports. Great share @brianmecum and @erin_mcpherson @ESPN Edge
198,salimismail,2021-09-29 14:42:36+00:00,https://twitter.com/salimismail/status/1443224698557550599,Could not agree more @olof_s that innovation is about people more than technology alone. @ESPN Edge
199,salimismail,2021-09-29 14:31:53+00:00,https://twitter.com/salimismail/status/1443222001523560449,Future Innovation @ESPN - We want fans to experience sport in the best way possible. ESPN Edge is about finding the best ways to do this - James Pitaro
200,salimismail,2021-09-29 14:28:12+00:00,https://twitter.com/salimismail/status/1443221076163678210,@NHL and @ESPN Deal. Streaming is at the Heart of the deal. Showing the importance of Innovation
201,salimismail,2021-09-29 14:17:35+00:00,https://twitter.com/salimismail/status/1443218402160615432,Great to hear James Pitaro speaking my language about disruption at the @ESPN Edge Launch
202,salimismail,2021-09-29 14:09:27+00:00,https://twitter.com/salimismail/status/1443216356896280583,@Accenture @Verizon and @Microsoft partnering with @ESPN ESPN Edge Innovation Center Launch https://t.co/gMUm806UOH
203,salimismail,2021-09-29 14:09:15+00:00,https://twitter.com/salimismail/status/1443216303699922961,"@itsthebaldgirl and @KevinNegandhi, Kicking off ESPN Edge Innovation Center Launch https://t.co/gMUm806UOH"
204,salimismail,2021-09-29 14:05:40+00:00,https://twitter.com/salimismail/status/1443215403702947840,It's rare for me to be mentioned alongside an Olympic gold medal winner.. :)
205,salimismail,2021-09-29 12:06:36+00:00,https://twitter.com/salimismail/status/1443185438768906242,@erickschonfeld @Touchcast @espn @lindseyvonn Looking forward to it Erick!
206,salimismail,2021-09-27 13:56:00+00:00,https://twitter.com/salimismail/status/1442488193870336002,"Reimagining the Fan Experience @itsthebaldgirl, @BSchneider, @erin_mcpherson &amp; @MickeyMaher23 ESPN Edge :https://t.co/gMUm806UOH"
207,salimismail,2021-09-26 14:48:00+00:00,https://twitter.com/salimismail/status/1442138892321308676,Catch @BondSarah_Bond on Empowering Interactivity at ESPN Edge :https://t.co/gMUm806UOH
208,salimismail,2021-09-26 14:45:00+00:00,https://twitter.com/salimismail/status/1442138137338253315,Hear how 5G is changing the game of Sports with @brianmecum at ESPN Edge :https://t.co/gMUm806UOH
209,salimismail,2021-09-26 14:42:00+00:00,https://twitter.com/salimismail/status/1442137382380261380,"1 week to the  ESPN Edge Innovation Center Launch @itsthebaldgirl and @KevinNegandhi, you prepping for game day? https://t.co/gMUm806UOH"
210,salimismail,2021-09-25 21:04:00+00:00,https://twitter.com/salimismail/status/1441871128285237250,"Athlete 3.0 is on the horizon. @KayleeHartung, @blakegriffin23, @lindseyvonn and Anthony Katz will cover this at ESPN Edge :https://t.co/gMUm80ovGf"
211,salimismail,2021-09-24 14:43:00+00:00,https://twitter.com/salimismail/status/1441412858512769031,Catch @olof_s on Unlocking Potential with New Experiences at ESPN Edge 29 Sep  https://t.co/gMUm80ovGf
212,salimismail,2021-09-15 22:51:14+00:00,https://twitter.com/salimismail/status/1438274237089918979,In two weeks I will be speaking at the launch of the ESPN Edge Innovation Center. Looking forward to it. Sign up here: https://t.co/gMUm806UOH
213,salimismail,2021-09-15 17:59:43+00:00,https://twitter.com/salimismail/status/1438200873545576450,@arrington @stablekwon omg - @stablekwon might be my favorite twitter handle of all time
214,salimismail,2021-09-12 19:07:40+00:00,https://twitter.com/salimismail/status/1437130810721718280,My tweet of the day..
215,salimismail,2021-09-04 14:15:06+00:00,https://twitter.com/salimismail/status/1434158080531603465,One of my grand aunts just passed away in india. Every time I hear about that generation.. it blows my mind what they were up to.  https://t.co/dPFX8MG0Sq
216,salimismail,2021-08-31 01:28:30+00:00,https://twitter.com/salimismail/status/1432515608940318722,"Wonderful article in ExO Insights by @PaulEpping.  Adapting evolution to today's time crises.. 

Nature’s Ingenuity https://t.co/Q1JEWFUeQd"
217,salimismail,2021-08-30 16:46:40+00:00,https://twitter.com/salimismail/status/1432384283927252998,This is my must-read thread of the year. Incredible.. by @michaelharriot
218,salimismail,2021-08-29 21:11:15+00:00,https://twitter.com/salimismail/status/1432088481405325322,This is an important point by Jeremiah. @PeterDiamandis talks about the same thing.
219,salimismail,2021-08-24 11:39:28+00:00,https://twitter.com/salimismail/status/1430132648110968840,"@zeynep Zeynep, thrilled to see this..  congrats!"
220,salimismail,2021-08-21 17:37:59+00:00,https://twitter.com/salimismail/status/1429135708921466886,Yes yes. This is the appropriate analogy..
221,salimismail,2021-08-21 16:12:39+00:00,https://twitter.com/salimismail/status/1429114231081820161,The best thread I've yet seen on the Afghan mess
222,salimismail,2021-08-17 15:37:51+00:00,https://twitter.com/salimismail/status/1427655925704368133,"I, for one, welcome the increase of Afghani food into the smorgasbord of U.S cuisine.."
223,salimismail,2021-08-17 05:25:06+00:00,https://twitter.com/salimismail/status/1427501721681637404,@ReelTalker 41.. some I'm happy not to have done
224,salimismail,2021-08-16 06:40:14+00:00,https://twitter.com/salimismail/status/1427158240106852354,This is devastating..
225,salimismail,2021-07-26 12:30:52+00:00,https://twitter.com/salimismail/status/1419636334763905026,My tweet of the day. This is pretty funny
226,salimismail,2021-07-20 19:56:00+00:00,https://twitter.com/salimismail/status/1417574029989457920,My tweet of the day..
227,salimismail,2021-07-17 17:20:34+00:00,https://twitter.com/salimismail/status/1416447750518964224,My very safe tweet of the day
228,salimismail,2021-07-16 04:49:48+00:00,https://twitter.com/salimismail/status/1415896424647114753,My tweet of the day. Mind boggling photo
229,salimismail,2021-07-13 22:31:02+00:00,https://twitter.com/salimismail/status/1415076328215388161,My tweet of the day...
230,salimismail,2021-07-12 13:55:42+00:00,https://twitter.com/salimismail/status/1414584251928961026,My tweet of the day.
231,salimismail,2021-07-11 19:12:28+00:00,https://twitter.com/salimismail/status/1414301582368206851,Omg England.. go go go!  #Euro2020Final
232,salimismail,2021-07-07 01:05:15+00:00,https://twitter.com/salimismail/status/1412578423864762369,My tweet of the day.. pretty spectacular
233,salimismail,2021-07-06 21:44:09+00:00,https://twitter.com/salimismail/status/1412527816613171200,"Voting is now open for the inaugural ExO Transformation Awards. 

Vote for your favorite ExO applicants in over 6 awesome award categories. https://t.co/briLjqCW6U

You can also register for our free interactive virtual awards event, taking pace on the 29th of July 2021."
234,salimismail,2021-07-06 11:14:57+00:00,https://twitter.com/salimismail/status/1412369471004721162,My tweet of the day..
235,salimismail,2021-07-02 13:36:02+00:00,https://twitter.com/salimismail/status/1410955427358167040,@davewiner What @zee said.. I live on workflowy..
236,salimismail,2021-06-28 15:16:04+00:00,https://twitter.com/salimismail/status/1409531048313171970,My tweet of the day.  Great stuff from @karaswisher.  And really #toyota?  Really??
237,salimismail,2021-06-25 17:10:29+00:00,https://twitter.com/salimismail/status/1408472680622432258,My tweet is the day. Typically incredible article by @zeynep
238,salimismail,2021-06-23 21:35:21+00:00,https://twitter.com/salimismail/status/1407814558845222922,"My tweet of the day. If you're American, please watch this video."
239,salimismail,2021-06-23 14:19:45+00:00,https://twitter.com/salimismail/status/1407704935249104896,My tweet of the day.. this is the very definition of immune system
240,salimismail,2021-06-20 21:45:34+00:00,https://twitter.com/salimismail/status/1406729966994268165,@rashmi @jboutelle I'd say yes. Maybe add a little extra garlic\ginger
241,salimismail,2021-06-19 16:27:04+00:00,https://twitter.com/salimismail/status/1406287425979232256,"If you're not watching this Portugal Germany game, fix that. #EURO2020"
242,salimismail,2021-06-17 17:49:45+00:00,https://twitter.com/salimismail/status/1405583459033231368,That was a great event.. congrats Kunal!
243,salimismail,2021-06-16 19:10:52+00:00,https://twitter.com/salimismail/status/1405241484241219591,@martinvars @GoggoNetwork @EmmanuelMacron Wonderful.. c'est magnifique
244,salimismail,2021-06-15 13:21:14+00:00,https://twitter.com/salimismail/status/1404791109776142338,My tweet of the day.
245,salimismail,2021-06-10 19:54:59+00:00,https://twitter.com/salimismail/status/1403078260745981955,Totally my tweet of the day
246,salimismail,2021-06-08 15:13:43+00:00,https://twitter.com/salimismail/status/1402282701244317699,@OwenC Pretty amazing. The overall feeling is quite transcendent. But the 30 seconds at a time part is frustrating. Definitely leaves you wanting more
247,salimismail,2021-06-06 20:28:31+00:00,https://twitter.com/salimismail/status/1401637148135026688,Ready for my first zero G flight. Super excited.. https://t.co/WsClqP9Meg
248,salimismail,2021-06-05 12:57:00+00:00,https://twitter.com/salimismail/status/1401161132249911296,My tweet of the day..
249,salimismail,2021-06-03 01:02:23+00:00,https://twitter.com/salimismail/status/1400256516343615493,My tweet of the day. This thread is insane
250,salimismail,2021-05-28 02:13:14+00:00,https://twitter.com/salimismail/status/1398100019148824577,Omg. Totally my tweet of the day
251,salimismail,2021-05-28 02:09:10+00:00,https://twitter.com/salimismail/status/1398098995583533058,"@Andrzej_0xa0 @OpenExO @ExOEconomy @singularityu As Bruce Willis said in Die Hard, ""welcome to the party,"" pal..  seriously, great to have you in the community!"
252,salimismail,2021-05-26 05:42:38+00:00,https://twitter.com/salimismail/status/1397427938304221185,Tweet of the day.. This thread (and the comments) are bizarrely funny
253,salimismail,2021-05-23 11:09:22+00:00,https://twitter.com/salimismail/status/1396423002884120576,My tweet of the day. Must read..
254,salimismail,2021-05-22 04:32:57+00:00,https://twitter.com/salimismail/status/1395960850968625152,"@pkedrosky By far the best technique I've ever come across is the 4-7-8 approach. Breath in for four counts, hold for seven, breathe out over eight counts. Puts me to sleep in 3 to 4 cycles. It's amazing"
255,salimismail,2021-05-19 12:04:22+00:00,https://twitter.com/salimismail/status/1394987289672101888,@peterpham My vote: a Porsche 914 or a replica beck 550 spyder
256,salimismail,2021-05-17 21:54:50+00:00,https://twitter.com/salimismail/status/1394411110028165121,"Join us for our final ExO Economy Town Hall - 18 May at 11am PDT / 8pm CEST.

It's a truly exciting time for the ExO Economy, don't miss out.

Join us on your channel of choice:
YouTube: https://t.co/16jYWqfzXQ
LinkedIn: https://t.co/z2esUMCCae
Facebook: https://t.co/InZUjEMMaz"
257,salimismail,2021-05-11 17:37:47+00:00,https://twitter.com/salimismail/status/1392172096218931205,"Super excited to be participating in the ExO Economy Town Hall live stream, starting in 20 minutes.

Join us on your channel of choice:
YouTube: https://t.co/L3lAe4ZMla
LinkedIn: https://t.co/9Se0oJpll9
Facebook: https://t.co/u7CEfUC9XF

See you there!

#ExOEconomy #ExOTownHall https://t.co/lYy2pPrG7h"
258,salimismail,2021-05-10 20:34:39+00:00,https://twitter.com/salimismail/status/1391854218961620994,"Join our ExO Economy Town Hall live stream where we discuss the impact of cryptocurrency tokens like EXOS with world leading technology specialists Anu Bhardwaj, Toby Lewis &amp; Kent Langley.

Get your calendar invite here: https://t.co/IvwoxnGL7h

See you there! https://t.co/xWZvnLHbfK"
259,salimismail,2021-05-10 19:43:16+00:00,https://twitter.com/salimismail/status/1391841286609588224,@CarlPhillips007 Note that we are moving to proof of stake block chains which takes out the electricity usage problem..  Our own EXOS token operates on that basis perfectly happily
260,salimismail,2021-05-10 17:31:31+00:00,https://twitter.com/salimismail/status/1391808130749771778,"Anyone complaining of BTC electricity usage please read the following… (also note the natural move to renewables will fix the problem, esp as we move to energy abundance)"
261,salimismail,2021-05-08 20:02:23+00:00,https://twitter.com/salimismail/status/1391121322810433537,@rasmus Me also BNR.. shame over time what happened.
262,salimismail,2021-05-08 04:40:13+00:00,https://twitter.com/salimismail/status/1390889250162450434,@rasmus My God man.. I was a co-op student on that floor in 1986
263,salimismail,2021-05-07 15:37:11+00:00,https://twitter.com/salimismail/status/1390692192000385028,@ebbandflowph We’re aiming for august/September..
264,salimismail,2021-05-07 00:19:12+00:00,https://twitter.com/salimismail/status/1390461177931702276,This is amazing. Totally my tweet or thread of the day. Staggering level of malice
265,salimismail,2021-05-06 15:18:58+00:00,https://twitter.com/salimismail/status/1390325220771340292,"Join us today for Implementing ExO Part 2! 

We are taking a best-seller and aim to make it living, practical, and applicable to our society.  https://t.co/wthv3RD9zE

We will have an ExO Economy helpdesk for live interaction on the 30-Doubling Challenge! The event is free! https://t.co/XVKuH1NdtN"
266,salimismail,2021-05-06 12:01:50+00:00,https://twitter.com/salimismail/status/1390275612569477120,"Join us today for Implementing ExO Part 2! 

Engage in multiple sessions on:
Building and ExO
Sprint and Fast Track
Broader applications of ExOs
ExO Toolbox
Implementing ExO for Big Companies / Corporations

https://t.co/2SdEmWBtYC https://t.co/aBmgKIO1MW"
267,salimismail,2021-05-05 15:35:39+00:00,https://twitter.com/salimismail/status/1389967033220091911,See how version 2 of Exponential Organizations is being updated with over 80 volunteers &amp; changemakers from the OpenExo Community who are curating portions. Check out this week's collaborative book event https://t.co/2SdEmWBtYC. It's free to participate. https://t.co/HWUo0CAMzu https://t.co/y5UPEIVDS5
268,salimismail,2021-05-05 12:11:55+00:00,https://twitter.com/salimismail/status/1389915760185729025,"Every american should read this article. I, for one, am not optimistic (and I believe the country will disintegrate)"
269,salimismail,2021-05-04 17:47:07+00:00,https://twitter.com/salimismail/status/1389637729240109060,"ExO Economy Town Hall live stream is starting in 15 minutes. 

You can join us on your channel of choice, see below link options:

YouTube: https://t.co/qOBCMYQGMJ

LinkedIn: https://t.co/9kmgFifJCp

Facebook: https://t.co/KlatVco6m2

See you there!

#ExOEconomy #ExOTownHall https://t.co/HcSsdCpPUw"
