,0,1,2,3
0,salimismail,2023-02-15 22:51:54+00:00,https://twitter.com/salimismail/status/1625991317808459777,@IgorPejic9 @reidhoffman @chrisyeh @vangeest @azeem @PeterDiamandis @steven_kotler @GeorgeSelgin This is cool - tx for including.. doubly so as we're about to release the second edition #ExO2
1,salimismail,2023-02-15 22:48:56+00:00,https://twitter.com/salimismail/status/1625990571977240581,A lamborghini NFT..  this is definitely one to watch :) https://t.co/NqNXg6cr5h
2,salimismail,2023-02-14 21:29:47+00:00,https://twitter.com/salimismail/status/1625608263948505088,"This is utterly amazing...  @jeremycole, thanks for sharing.  We are monster fans of @Kiva"
3,salimismail,2023-02-11 00:59:52+00:00,https://twitter.com/salimismail/status/1624211582614925312,@jhong Dude.. CRISPR
4,salimismail,2023-02-10 23:21:12+00:00,https://twitter.com/salimismail/status/1624186753698471938,"Unfortunately, we don't have a pat phrase for this.  Lean startup is the closest (not great) approximation we use in the ExO world..  Any suggs welcome.  /end rant"
5,salimismail,2023-02-10 23:21:12+00:00,https://twitter.com/salimismail/status/1624186752565972992,"So what's the alternative?  Don't do long passes!  Like FC Barcelona's Messi strategy, much better if you just skate with the damn puck and make short, low risk passes to team mates while you constantly evaluate the landscape."
6,salimismail,2023-02-10 23:21:12+00:00,https://twitter.com/salimismail/status/1624186751404179457,"Fourth you get there, maybe magically happen to meet the puck, and because you've been so focused on it, some huge defenseman (competitor) body checks you into the stands.  Or, you're so surprised that you actually happened to sync up that you've not thought about the next hop."
7,salimismail,2023-02-10 23:21:11+00:00,https://twitter.com/salimismail/status/1624186750233989123,"Third, you have to have incredible vector geometry to gauge what direction and speed you need to get there.  If you're wrong on any of that by a couple of percent, you'll miss it."
8,salimismail,2023-02-10 23:21:11+00:00,https://twitter.com/salimismail/status/1624186749122404358,"Second, it's going super fast and that speed accelerates in today's world.  So we have speed variability."
9,salimismail,2023-02-10 23:21:11+00:00,https://twitter.com/salimismail/status/1624186748040359937,"First, it's a super small puck.  I mean, a few centimeters on a big ice rink.  Seriously?"
10,salimismail,2023-02-10 23:21:11+00:00,https://twitter.com/salimismail/status/1624186746832297985,"Goddamn I really hate when someone says ""skate to where the puck is going""  (even though I'm Canadian).  Here's why and a better suggestion:"
11,salimismail,2023-02-10 19:29:19+00:00,https://twitter.com/salimismail/status/1624128398686552064,"@tomaspueyo I asked this during my university physics degree… response: “lightning produces very high voltage, but almost zero current (sic: amps or electrons).”  You need electrons for power generation. It’s why folks survive lighting strikes but not fingers in power sockets."
12,salimismail,2023-02-09 23:40:37+00:00,https://twitter.com/salimismail/status/1623829249462349828,Pretty much sums it up..
13,salimismail,2023-02-07 22:45:53+00:00,https://twitter.com/salimismail/status/1623090700559450114,Try to figure out which is me and which one is the hologram.  This tech is nuts: https://t.co/6yjBeSgCk6
14,salimismail,2023-02-05 15:02:40+00:00,https://twitter.com/salimismail/status/1622249352520425479,This made my day..
15,salimismail,2023-01-31 19:49:05+00:00,https://twitter.com/salimismail/status/1620509495301672966,"🔥 Don't forget to subscribe and catch up on the first 2 episodes with Gamification expert @yukaichou and Fungal Biotechnologist @OmonIsi if you haven't already! #AI #ChatGPT 
https://t.co/1xB1MT0WBf"
16,salimismail,2023-01-31 19:49:05+00:00,https://twitter.com/salimismail/status/1620509492982190080,"📈 But that's not all, we also touch on the power of combining different statistical understandings to create something truly unique and groundbreaking. This episode is a must-listen for anyone interested in the future of AI and technology."
17,salimismail,2023-01-31 19:49:04+00:00,https://twitter.com/salimismail/status/1620509490880843778,"🤖🤯 In this episode, we delve into the fascinating world of ChatGPT and its impact on the future of AI. Adam shares his insights on how #ChatGPT is changing the game by allowing us to reverse engineer AI and create more human-like interactions. #innovation"
18,salimismail,2023-01-31 19:49:04+00:00,https://twitter.com/salimismail/status/1620509487558967296,"Exciting news for all my #podcast listeners out there! The latest episode of The Salim Ismail Podcast is now live, and I had the pleasure of interviewing none other than @AdamBLevine, a true innovator in the field of AI and technology.   (a thread... &gt;) https://t.co/1xB1MT0WBf"
19,salimismail,2023-01-25 20:27:42+00:00,https://twitter.com/salimismail/status/1618344883475075072,Amazing conversation on mushrooms from one of the top scientists in the world.  My podcast episode #2: https://t.co/Ek0OElHxmv
20,salimismail,2023-01-25 00:54:36+00:00,https://twitter.com/salimismail/status/1618049664489754626,"@tystiklorius Holy shit, what a nut job. Ty, good on you for calling this out"
21,salimismail,2023-01-13 17:24:07+00:00,https://twitter.com/salimismail/status/1613950029764464664,Awesome.. almost? :))
22,salimismail,2023-01-11 13:31:52+00:00,https://twitter.com/salimismail/status/1613166807824613376,"@ArcFather I know quite a few people whose careers have been outstanding just because they did a deep dive into MM early on..  (naturally, I came across him quite late :)"
23,salimismail,2023-01-11 05:14:36+00:00,https://twitter.com/salimismail/status/1613041663974477824,"Yes, rather a bright chap"
24,salimismail,2023-01-10 05:38:44+00:00,https://twitter.com/salimismail/status/1612685351243419649,This is quite brilliant…. H/t @arrington
25,salimismail,2023-01-06 16:53:16+00:00,https://twitter.com/salimismail/status/1611405551295938580,"Wait what?  Actually like, collaborate?"
26,salimismail,2023-01-06 04:26:50+00:00,https://twitter.com/salimismail/status/1611217706916659200,"By far and away, this is my top pick as tweet of the day.. : ))"
27,salimismail,2023-01-05 02:14:11+00:00,https://twitter.com/salimismail/status/1610821935050510336,This made my day.
28,salimismail,2023-01-03 23:19:03+00:00,https://twitter.com/salimismail/status/1610415472213737480,This is a really big deal..  h/t @EMostaque
29,salimismail,2023-01-03 00:25:02+00:00,https://twitter.com/salimismail/status/1610069688717017089,"Important commentary from @PeterDiamandis.. the entire segment was bullshit from a discredited, many-times wrong pessimist.."
30,salimismail,2023-01-02 04:09:45+00:00,https://twitter.com/salimismail/status/1609763852895272963,"@ASG52 @JimHarris @chartrdaily @instagram @Spotify Anecdotally, everyone in our ExO community is playing with it… I believe these numbers.  Seeing the same with #stablediffusion"
31,salimismail,2023-01-01 15:01:36+00:00,https://twitter.com/salimismail/status/1609565508122075143,"Was waiting for @jasonsilva's take on #chatGPT, #stablediffusion etc. It does not disappoint!  Watch this."
32,salimismail,2022-12-31 18:07:50+00:00,https://twitter.com/salimismail/status/1609249991238844420,This is wonderful
33,salimismail,2022-12-30 21:26:43+00:00,https://twitter.com/salimismail/status/1608937653063553025,@goldman This made my day.. 🤣
34,salimismail,2022-12-29 15:00:38+00:00,https://twitter.com/salimismail/status/1608478103566749703,Tweet of the year?
35,salimismail,2022-12-29 15:00:08+00:00,https://twitter.com/salimismail/status/1608477975833362433,"@tomcoates My go to for decent clothes is Boggi. A bit Italian-slim, but good stuff.  I have no need for any of that in Miami..  https://t.co/YHm6LZc0SB"
36,salimismail,2022-12-29 03:47:27+00:00,https://twitter.com/salimismail/status/1608308692163641346,George Santos is challenging to be meme of the year.. it'd be funny if it wasn't so disgusting
37,salimismail,2022-12-28 20:26:35+00:00,https://twitter.com/salimismail/status/1608197743343796224,Eff me. 50%?  Winter is coming
38,salimismail,2022-12-28 20:20:35+00:00,https://twitter.com/salimismail/status/1608196234216349700,@lessig @aaronsw A really great guiding principle I've been using is WWAD
39,salimismail,2022-12-21 15:01:21+00:00,https://twitter.com/salimismail/status/1605579178748702724,The best summary I've yet seen on chat GPT by @emollick
40,salimismail,2022-12-19 14:13:59+00:00,https://twitter.com/salimismail/status/1604842484944625664,"This is bad. Very, very bad."
41,salimismail,2022-12-19 14:09:24+00:00,https://twitter.com/salimismail/status/1604841329573646338,"Because, you know, freedom.. !"
42,salimismail,2022-12-19 05:58:24+00:00,https://twitter.com/salimismail/status/1604717767361531904,Mind. Blown.
43,salimismail,2022-12-18 17:46:25+00:00,https://twitter.com/salimismail/status/1604533558089072649,Am dying. And I'm not even French or Argentinian.. #ArgentinaVsFrance  #WorldCup
44,salimismail,2022-12-18 15:01:22+00:00,https://twitter.com/salimismail/status/1604492021921902593,Omg omg omg - allez les bleues (et blanches rayures)..   #WorldCupFinal
45,salimismail,2022-12-17 15:20:17+00:00,https://twitter.com/salimismail/status/1604134393760694273,"This is incredible.. ""80% of Ukrainians had a positive attitude to Russia in 2013; by May 2022, the figure was just 2%."" https://t.co/2acU2NmcD3"
46,salimismail,2022-12-17 13:02:41+00:00,https://twitter.com/salimismail/status/1604099763728695296,My sentiment exactly (but better phrased by Mike)
47,salimismail,2022-12-13 00:50:38+00:00,https://twitter.com/salimismail/status/1602465989429542914,Will check out Post..  https://t.co/y3UcVsYMv2
48,salimismail,2022-12-11 21:41:42+00:00,https://twitter.com/salimismail/status/1602056054250082305,@casinclair Holy shit Cameron.. that is incredible. How do you even process that?
49,salimismail,2022-12-11 02:03:41+00:00,https://twitter.com/salimismail/status/1601759596410195968,It's also a great example of how goddamn hard it is and how long it takes for the 'overnight' success
50,salimismail,2022-12-10 20:16:14+00:00,https://twitter.com/salimismail/status/1601672155754041346,Am totally gripped by this game.. #WorldCup #comeonengland
51,salimismail,2022-12-09 22:21:21+00:00,https://twitter.com/salimismail/status/1601341254192664576,I'm completely fried after today's games.  Congrats #Croatia and #Argentina.  Very sad for my friends in #brazil and #holland.  #FIFAWorldCup
52,salimismail,2022-12-09 17:40:41+00:00,https://twitter.com/salimismail/status/1601270625393311745,This game is nuts…. Glad I’m not Brazilian or Croatian..  #WorldCup
53,salimismail,2022-12-09 14:46:30+00:00,https://twitter.com/salimismail/status/1601226789472256001,Seriously. I'd pick Miami every day of the week.. (and yes despite bbq being so good in Atlanta)
54,salimismail,2022-12-09 14:43:51+00:00,https://twitter.com/salimismail/status/1601226120690794496,Thanks Julian. And I don't even speak Spanish
55,salimismail,2022-12-07 00:49:30+00:00,https://twitter.com/salimismail/status/1600291373718061056,Thanks... !  It was so fun with Peter
56,salimismail,2022-12-07 00:48:52+00:00,https://twitter.com/salimismail/status/1600291216624480256,"I was in the #ArabianDesert at a place called #LiwaNights. I was staying in tents in the sand dunes and enjoy the peaceful, quiet atmosphere and the energy of the untouched land. #highlyrecommend https://t.co/OqbBwuJfbF"
57,salimismail,2022-12-04 19:30:06+00:00,https://twitter.com/salimismail/status/1599486218429157376,This game is as dull as dishwater so far ..  #ENGvsSEN
58,salimismail,2022-12-04 18:54:00+00:00,https://twitter.com/salimismail/status/1599477134992498691,Getting that normal nervous feeling watching England.  #ENGvsSEN
59,salimismail,2022-12-03 14:59:58+00:00,https://twitter.com/salimismail/status/1599055848889880576,It would be incredibly poetic if Brazil won before Pele passes.  #worldcup
60,salimismail,2022-12-02 04:18:07+00:00,https://twitter.com/salimismail/status/1598531935743213569,This is devastating.. #ftx
61,salimismail,2022-12-01 05:57:43+00:00,https://twitter.com/salimismail/status/1598194614665908226,What a powerful comment
62,salimismail,2022-11-28 05:47:40+00:00,https://twitter.com/salimismail/status/1597104920628727808,"Incredible what is happening in China, Iran etc.  You cannot beat passive resistance over time.. let's hope these stay non violent."
63,salimismail,2022-11-27 16:03:00+00:00,https://twitter.com/salimismail/status/1596897386139303937,"Wait, did Canada just score their first ever world cup goal? Omfg..  and what a great goal!  #WorldCup2022 #canada"
64,salimismail,2022-11-27 07:31:46+00:00,https://twitter.com/salimismail/status/1596768731941990400,Simple and utterly efficient
65,salimismail,2022-11-26 22:28:05+00:00,https://twitter.com/salimismail/status/1596631909563613185,Brilliant title and article - must read…. By @dianefrancis1
66,salimismail,2022-11-25 17:44:28+00:00,https://twitter.com/salimismail/status/1596198144915931141,Very thorough article from Alex here.. go read it (like twice)
67,salimismail,2022-11-25 13:41:27+00:00,https://twitter.com/salimismail/status/1596136989052444672,What a magnificent image..
68,salimismail,2022-11-24 15:24:44+00:00,https://twitter.com/salimismail/status/1595800591824875520,"@Paul08113166 @balajis The technological socialism idea is a very powerful one.  There are lots of equivalents in capitalism, btw…  many people use the same restaurant dinner plates.  And yes, @balajis stuff is very complementary with some big overlaps"
69,salimismail,2022-11-24 01:55:34+00:00,https://twitter.com/salimismail/status/1595596959821500416,Very kind of you!
70,salimismail,2022-11-23 20:10:37+00:00,https://twitter.com/salimismail/status/1595510148327698432,Go @EMostaque !
71,salimismail,2022-11-22 18:06:22+00:00,https://twitter.com/salimismail/status/1595116491535699968,This was a great conversation.. check it out
72,salimismail,2022-11-21 19:12:05+00:00,https://twitter.com/salimismail/status/1594770643303661569,This is crazy brave..  am so amazed
73,salimismail,2022-11-17 21:50:00+00:00,https://twitter.com/salimismail/status/1593360832389386240,Best use of a Venn diagram ever?  H\t @meedabyte
74,salimismail,2022-11-17 21:34:28+00:00,https://twitter.com/salimismail/status/1593356924153606144,"I think Twitter is great for 2 things. 1. Immediacy, but more important, 2. what Charles says.. ""Twitter’s always been good at getting into the corners of a topic."""
75,salimismail,2022-11-17 21:31:40+00:00,https://twitter.com/salimismail/status/1593356219590139905,This is very similar to @stewartbrand's pace layer thinking. Good stuff!
76,salimismail,2022-11-17 20:15:03+00:00,https://twitter.com/salimismail/status/1593336938093682689,Oversubscribed flight and I'm number 25 on the upgrade list. Something tells me I ain't going to make it https://t.co/E84c5SViap
77,salimismail,2022-11-16 22:15:29+00:00,https://twitter.com/salimismail/status/1593004859812634624,This is like the scoop of the decade..  #sbf #ftx https://t.co/YKfBTHw7GL
78,salimismail,2022-11-16 19:44:07+00:00,https://twitter.com/salimismail/status/1592966765679890432,Beautifully said..
79,salimismail,2022-11-16 19:31:07+00:00,https://twitter.com/salimismail/status/1592963493942415361,"Hear hear, John. Canadian entrepreneurs *should* take a ton more risk"
80,salimismail,2022-11-15 15:28:50+00:00,https://twitter.com/salimismail/status/1592540133710086146,@NinosMaron @PeterDiamandis @thenetworkstate Have already read it (and we talk about it in the podcast)… some great thinking by @balajis..
81,salimismail,2022-11-12 14:40:54+00:00,https://twitter.com/salimismail/status/1591440906171092992,"For the record, I have a blue tick, but I have NOT paid for it.  This is the real @salimismail speaking."
82,salimismail,2022-11-11 19:19:09+00:00,https://twitter.com/salimismail/status/1591148545100242945,This quote is in every presentation I give…. H/t @toddmfinch
83,salimismail,2022-11-11 14:03:42+00:00,https://twitter.com/salimismail/status/1591069158380298240,"@Nouriel @fuzheado - @Nouriel, many in the crypto world have been asking for regulation.. the SEC has been incredibly unclear.  That allows bad actors to propagate."
84,salimismail,2022-11-11 00:38:00+00:00,https://twitter.com/salimismail/status/1590866395142684674,This was really fun… thanks @PeterDiamandis !
85,salimismail,2022-11-08 15:20:14+00:00,https://twitter.com/salimismail/status/1590001254918688769,This is so awesome
86,salimismail,2022-11-04 21:41:21+00:00,https://twitter.com/salimismail/status/1588647613746024448,@bobbie Super important thread
87,salimismail,2022-11-04 03:01:25+00:00,https://twitter.com/salimismail/status/1588365773428428802,"“If you vote for someone who says they won’t accept the result if they lose, you are giving up on the United States.. “   Very important video.."
88,salimismail,2022-11-01 00:59:29+00:00,https://twitter.com/salimismail/status/1587247922915295232,This seems awfully serious
89,salimismail,2022-10-29 22:02:27+00:00,https://twitter.com/salimismail/status/1586478597241720832,V important thread re Twitter
90,salimismail,2022-10-29 14:56:54+00:00,https://twitter.com/salimismail/status/1586371504031375360,This will be very cool.. !
91,salimismail,2022-10-26 16:05:32+00:00,https://twitter.com/salimismail/status/1585301611550752769,Amazing new gig for @SonalRShah - huge congrats to be running the Texas Tribune.  https://t.co/GoN1gA3HSw
92,salimismail,2022-10-22 19:49:03+00:00,https://twitter.com/salimismail/status/1583908309840502784,"Canada should be leading the world on this. Not as an opportunity, but an obligation"
93,salimismail,2022-10-21 15:41:27+00:00,https://twitter.com/salimismail/status/1583483612883652609,This is an amazing thread..
94,salimismail,2022-10-19 01:03:09+00:00,https://twitter.com/salimismail/status/1582537806760783873,This is so good..
95,salimismail,2022-10-15 19:03:24+00:00,https://twitter.com/salimismail/status/1581360107220529153,Must watch.. climate reality bites
96,salimismail,2022-10-13 14:20:25+00:00,https://twitter.com/salimismail/status/1580564114929172481,"Many many thanks to @unrealape for a) lending us some space in #decentraland and b) filling it with amazing stuff!  Absolutely go check it out..   this is part of a community all-hands for the global 18,000-strong ExO community.."
97,salimismail,2022-10-11 17:44:48+00:00,https://twitter.com/salimismail/status/1579890776452247554,Old school! https://t.co/edhaf8yfV4
98,salimismail,2022-10-09 16:02:18+00:00,https://twitter.com/salimismail/status/1579140206816817153,Wow..
99,salimismail,2022-10-05 14:39:37+00:00,https://twitter.com/salimismail/status/1577669847051169792,This is a must-subscribe podcast..
100,salimismail,2022-10-04 17:01:13+00:00,https://twitter.com/salimismail/status/1577343091098402817,This is amazing
101,salimismail,2022-09-25 21:05:22+00:00,https://twitter.com/salimismail/status/1574143042046550018,One of the greats..
102,salimismail,2022-09-24 15:22:15+00:00,https://twitter.com/salimismail/status/1573694309571911681,"Great point, Simon. Where's the frickin heavenscape.."
103,salimismail,2022-09-21 15:37:20+00:00,https://twitter.com/salimismail/status/1572610938599247874,Holy crap. You can't get out of Russia if you're male.
104,salimismail,2022-09-21 15:33:03+00:00,https://twitter.com/salimismail/status/1572609860562452481,This is just incredible. Must watch
105,salimismail,2022-09-09 22:27:26+00:00,https://twitter.com/salimismail/status/1568365491181191175,Listening to a U.S congressman vilifying bitcoin is totally fascinating - complete fear mongering..
106,salimismail,2022-09-09 05:06:32+00:00,https://twitter.com/salimismail/status/1568103540467318785,This made my day
107,salimismail,2022-09-08 20:30:51+00:00,https://twitter.com/salimismail/status/1567973762288467969,This is one of those days where you remember what you were doing when you heard the news..  RIP Queen Elizabeth II
108,salimismail,2022-09-03 03:11:10+00:00,https://twitter.com/salimismail/status/1565900181408780289,Very sad to hear. Met Frank once.. huge highlight. The Drake equation was one of my favorite parts of my physics degree
109,salimismail,2022-08-30 03:41:13+00:00,https://twitter.com/salimismail/status/1564458190238089217,@benedictevans @Nicolas_Colin I lived on that train 1995-2000. Sometimes 4x a week. Biz class was great
110,salimismail,2022-08-27 13:35:21+00:00,https://twitter.com/salimismail/status/1563520545580204039,This is such an important point by @MargaretAtwood..  we have seen this movie before.
111,salimismail,2022-08-24 01:12:00+00:00,https://twitter.com/salimismail/status/1562246313701527552,"This is an incredible story. Moses, thanks for sharing"
112,salimismail,2022-08-13 00:57:47+00:00,https://twitter.com/salimismail/status/1558256468171833344,"My favorite response from a Trump defender.  ""Well, if he has the nuclear codes, it's because he's protecting the country from Biden - that guy is crazy"".  [Shakes head]"
113,salimismail,2022-08-12 02:43:46+00:00,https://twitter.com/salimismail/status/1557920750140641280,My tweet of the day…
114,salimismail,2022-08-10 21:06:06+00:00,https://twitter.com/salimismail/status/1557473388188270600,"You literally can't make this up.. ""(In response to the Hillary Clinton email scandal, Trump himself signed a law in 2018 that made it a felony to remove and retain classified documents.)"" https://t.co/206CdJuOVS"
115,salimismail,2022-08-10 20:56:14+00:00,https://twitter.com/salimismail/status/1557470901708673024,My tweet of the day. You just can't make this up
116,salimismail,2022-08-10 19:58:41+00:00,https://twitter.com/salimismail/status/1557456420051849216,This totally made my day. Wonderful commentary on the amazing @doctorow
117,salimismail,2022-08-10 00:19:14+00:00,https://twitter.com/salimismail/status/1557159601954512898,This blows my mind. How do you vote against birth control?
118,salimismail,2022-08-08 15:38:57+00:00,https://twitter.com/salimismail/status/1556666281356660739,This is a great observation.. h/t @doctorow
119,salimismail,2022-08-06 10:20:28+00:00,https://twitter.com/salimismail/status/1555861355487531009,"@durjoy Jesus, what a mess"
120,salimismail,2022-08-05 00:54:51+00:00,https://twitter.com/salimismail/status/1555356624956674048,Congrats to @carole_baskin for finally getting this legislation passed… what an ordeal: https://t.co/Tgk7lRJOgr
121,salimismail,2022-08-03 15:49:06+00:00,https://twitter.com/salimismail/status/1554856897429360641,"Good and bad news in the U.S yesterday.  Kansas convincingly voted for abortion rights, and this poor fellow, who operated with integrity and character, got completely taken out..   https://t.co/R4Rpc8eAIw"
122,salimismail,2022-08-02 14:42:13+00:00,https://twitter.com/salimismail/status/1554477674407550976,Must read..
123,salimismail,2022-07-24 16:04:01+00:00,https://twitter.com/salimismail/status/1551236772012576769,"Saw this flying at 30,000 feet over Yosemite last night. The world is literally on fire https://t.co/Mr9kiOH5BF"
124,salimismail,2022-07-22 12:46:45+00:00,https://twitter.com/salimismail/status/1550462352654573569,This is my tweet of the day {from last night’s hearing.}
125,salimismail,2022-07-22 05:21:16+00:00,https://twitter.com/salimismail/status/1550350243199344640,Stumbled on a wonderful analysis of Groundhog Day (one of the best movies ever made)..  https://t.co/92XFbsm8PX
126,salimismail,2022-07-20 15:48:49+00:00,https://twitter.com/salimismail/status/1549783395852509184,"@howardlindzon yes, me too…"
127,salimismail,2022-07-19 20:41:53+00:00,https://twitter.com/salimismail/status/1549494761052069891,@leashless New York City hospitals are testing incoming patients and apparently finding a 30% covid infection rate. It's bad
128,salimismail,2022-07-19 13:59:41+00:00,https://twitter.com/salimismail/status/1549393540991619079,@jeffjarvis Slow summer?
129,salimismail,2022-07-18 23:52:24+00:00,https://twitter.com/salimismail/status/1549180314710417408,@WetaWorkshop One of my favorite films ever.. this is wonderful. I still remember visiting Weta in NZ a few years ago
130,salimismail,2022-07-18 16:11:15+00:00,https://twitter.com/salimismail/status/1549064264714952704,My tweet of the day..
131,salimismail,2022-07-17 16:21:24+00:00,https://twitter.com/salimismail/status/1548704432124305410,Some wonderful phrasing in this article (“pray to play”) !!   But more important is the scathing indictment of this Supreme Court decision which clearly violated the facts on the ground: https://t.co/xACaLBvy5k
132,salimismail,2022-07-09 21:21:28+00:00,https://twitter.com/salimismail/status/1545880842551132160,"How violence is protected by law.. ""In 2021, Iowa Republicans passed a bill that effectively eliminated civil liability for drivers who hit protesters in the street, and increased various penalties for protesters""

 https://t.co/J5SlrGAwco"
133,salimismail,2022-07-08 04:21:43+00:00,https://twitter.com/salimismail/status/1545261826434285569,My tweet of the day.. brilliant
134,salimismail,2022-06-30 20:43:10+00:00,https://twitter.com/salimismail/status/1542609714256699395,"Great comment by @ezraklein: ""The problem is that, without [the principle of precedence], the Supreme Court itself makes even less sense. It is just nine costumed political appointees looking for the votes they need to get the outcomes they want https://t.co/wi5kLKjlWJ"
135,salimismail,2022-06-15 17:24:38+00:00,https://twitter.com/salimismail/status/1537123930229579784,"Kevin, you are a counter example your own theory :))"
136,salimismail,2022-06-15 03:20:13+00:00,https://twitter.com/salimismail/status/1536911429021929477,@tystiklorius @PeterDiamandis Hey ty.. ramez nails it.. https://t.co/F31i2Muc2N
