,0,1,2,3
527,@BBC_Future,2022-05-01 18:02:47+00:00,https://twitter.com/BBC_Future/status/1520826078775824386,People living with HIV are some of society’s most vulnerable to Covid-19. https://t.co/WftLmhZ0vU
528,@BBC_Future,2022-05-01 13:03:48+00:00,https://twitter.com/BBC_Future/status/1520750836246216704,Is there an optimum number of meals to be eating? https://t.co/oBJUo5lOG4
529,@BBC_Future,2022-04-30 18:02:45+00:00,https://twitter.com/BBC_Future/status/1520463683167473669,"Micronations aren’t recognised as legitimate nations, but these places can take on lives of their own. https://t.co/R6wVo7zxay"
530,@BBC_Future,2022-04-30 13:03:32+00:00,https://twitter.com/BBC_Future/status/1520388381871460354,"The misguided belief that an intact hymen proves virginity can be found in many parts of the world, and there’s a whole industry based on testing and even reconstructing them. https://t.co/errFHl2cPz"
531,@BBC_Future,2022-04-30 06:02:47+00:00,https://twitter.com/BBC_Future/status/1520282496100757504,"Small, isolated island communities are leading the charge in zero-emission living. https://t.co/apS21ZBKsu"
532,@BBC_Future,2022-04-29 19:55:47+00:00,https://twitter.com/BBC_Future/status/1520129740991909888,"Pristine lawns have been a status symbol for centuries. But with the huge amounts of land they take up, and the water and chemicals needed to keep them looking perfect, some people are turning their backs on them. https://t.co/TB9M3RULXY"
533,@BBC_Future,2022-04-29 16:02:23+00:00,https://twitter.com/BBC_Future/status/1520071003547742213,"African forest elephants – which are critically endangered – are vital for the ecosystem of the central African rainforest, and its ability to suck carbon from the atmosphere. https://t.co/p4cbFiHSFv"
534,@BBC_Future,2022-04-29 12:55:47+00:00,https://twitter.com/BBC_Future/status/1520024042765389824,"An estimated 23% of the entire urban land area on Earth is covered by lawns. But with greater scrutiny of the water and chemicals needed to keep them pristine, and the space devoted to them, are we seeing a rebellion against the verdant green carpet? https://t.co/TB9M3RULXY"
535,@BBC_Future,2022-04-29 09:02:28+00:00,https://twitter.com/BBC_Future/status/1519965330210050048,"One in five reptiles is threatened with extinction, according to a comprehensive study, with urgent conservation action needed for crocodiles and turtles in particular. https://t.co/KCxVWmkRag"
536,@BBC_Future,2022-04-28 20:14:44+00:00,https://twitter.com/BBC_Future/status/1519772120431034368,"After a chance encounter at the dentist, archaeologists went on to discover dozens of shipwrecks from the world-changing Battle of the Aegates. https://t.co/VUZ429qGUg"
537,@BBC_Future,2022-04-28 16:02:18+00:00,https://twitter.com/BBC_Future/status/1519708595104874501,"Climate change, biodiversity loss, worsening pests and diseases all impact our food supplies. That, coupled with a growing global population, means there needs to be a leap in agricultural productivity to keep people fed and healthy. https://t.co/SKVB5LarJR"
538,@BBC_Future,2022-04-28 13:14:46+00:00,https://twitter.com/BBC_Future/status/1519666433705201664,A chance discovery in a dentist’s office opened up the archaeological world of the Battle of the Aegates. https://t.co/VUZ429qGUg
539,@BBC_Future,2022-04-28 09:07:36+00:00,https://twitter.com/BBC_Future/status/1519604233225392129,"“Since the diagnosis I've been slowly reframing six decades of relationships, actions and behaviour through this new and alternative lens.” https://t.co/v6f0FkPX9V"
540,@BBC_Future,2022-04-27 20:09:31+00:00,https://twitter.com/BBC_Future/status/1519408421098852352,"How can the pale, briny oyster become such a velvety, deep brown sauce? https://t.co/BdubXCWBdt"
541,@BBC_Future,2022-04-27 16:06:58+00:00,https://twitter.com/BBC_Future/status/1519347381715709952,"People judged as ""boring"" are considered less competent and warm than the average person, and are unfairly shunned in social interactions – before they have even opened their mouths. https://t.co/W4CEzWeouv"
542,@BBC_Future,2022-04-27 13:09:31+00:00,https://twitter.com/BBC_Future/status/1519302725141340160,"Oyster sauce is a staple in many Chinese dishes, with it’s salty-sweet, ginger and umami flavours. https://t.co/BdubXCWBdt"
543,@BBC_Future,2022-04-27 09:03:41+00:00,https://twitter.com/BBC_Future/status/1519240857521508352,"Eating lab-grown meat or ground-up insects could lead to big savings in carbon emissions and water, as well as freeing up land for nature. https://t.co/MOI8MehLX6"
544,@BBC_Future,2022-04-26 20:03:40+00:00,https://twitter.com/BBC_Future/status/1519044561237995520,"Chagas disease, known as the 'silent illness', affects seven million people annually and is fiendishly difficult to combat at every step. https://t.co/DJ1okio5fO"
545,@BBC_Future,2022-04-26 16:03:04+00:00,https://twitter.com/BBC_Future/status/1518984011640500224,"There has been a surge in interest in adapting homes to be more energy efficient and eco-friendly, and some are now looking at how these changes can be done on a massive scale.  https://t.co/X6MSZuMOvw"
546,@BBC_Future,2022-04-26 13:03:40+00:00,https://twitter.com/BBC_Future/status/1518938865280569345,"Chagas disease has been called the most neglected tropical disease, causing about 10,000 deaths a year and affecting seven million people worldwide, but few will ever receive treatment. https://t.co/cqNLMe11tG"
547,@BBC_Future,2022-04-26 09:09:50+00:00,https://twitter.com/BBC_Future/status/1518880018385965056,"The goal of independent, uninterrupted baby sleep is not shared around the world. https://t.co/tL1CbfSdo4"
548,@BBC_Future,2022-04-25 20:02:25+00:00,https://twitter.com/BBC_Future/status/1518681859646840833,"The African spiny mouse can overcome devastating injuries to its skin, heart, kidneys and spinal cord. Could their biology help humans with major injuries and diseases? https://t.co/ATnnW5Bv2F"
549,@BBC_Future,2022-04-25 16:08:19+00:00,https://twitter.com/BBC_Future/status/1518622945358188544,"If humans want to set up communities on the Moon or planets, what will they eat? https://t.co/VQGjGwkW5b"
550,@BBC_Future,2022-04-25 13:33:24+00:00,https://twitter.com/BBC_Future/status/1518583960514662401,"Mammals, from tiny rodents to humans, never usually recover from serious spinal cord or other central nervous system injuries. Except, it seems, for the African spiny mouse. https://t.co/ATnnW5Bv2F"
551,@BBC_Future,2022-04-25 09:12:35+00:00,https://twitter.com/BBC_Future/status/1518518323100585984,"Engaging in “scary play”, like watching horror movies or taking part in murder mysteries, makes you engage with fake threats in a safe setting. https://t.co/RfeDTYNftE"
552,@BBC_Future,2022-04-24 18:11:35+00:00,https://twitter.com/BBC_Future/status/1518291578153889792,"Awareness of tongue-tie, and the impact it can have on children, is growing around the world. https://t.co/dahQdwD8tN"
553,@BBC_Future,2022-04-24 13:10:33+00:00,https://twitter.com/BBC_Future/status/1518215822547636224,"Growing a tiny bit every year, Everest’s peak is still on the rise. https://t.co/3o8kRy7Ocb"
554,@BBC_Future,2022-04-23 18:09:36+00:00,https://twitter.com/BBC_Future/status/1517928689865924608,"Training dogs helps them to live happier, lower-stress lives. https://t.co/HC5UlRaqhN"
555,@BBC_Future,2022-04-23 13:08:28+00:00,https://twitter.com/BBC_Future/status/1517852909676900352,Mining has an enormous environmental impact. What if we just… stopped? https://t.co/KxKzdvD1kv
556,@BBC_Future,2022-04-23 06:05:00+00:00,https://twitter.com/BBC_Future/status/1517746341601890304,"Bioluminescent bacteria is being trialled as an alternative to traditional streetlights. Could it be a greener, more pleasant solution to harsh outdoor light? https://t.co/U7698T1fjq"
557,@BBC_Future,2022-04-22 16:06:55+00:00,https://twitter.com/BBC_Future/status/1517535430605819906,"Forest elephants are critically endangered, and if they became extinct their disappearance would result in a loss of carbon stores in the central African rainforest equivalent to emissions from more than 2 billion petrol cars over a year. #EarthDay https://t.co/p4cbFiHSFv"
558,@BBC_Future,2022-04-22 13:07:20+00:00,https://twitter.com/BBC_Future/status/1517490234224627712,A chronic fear of environmental doom is increasingly common among children and young people. How can it be fixed? https://t.co/xKb8qrRCa5
559,@BBC_Future,2022-04-22 09:05:52+00:00,https://twitter.com/BBC_Future/status/1517429467890601984,"Ever been tempted by a brie at bedtime, a double Gloucester under the duvet or a parmesan in your PJs? 🧀 https://t.co/PeuC9txrK6"
560,@BBC_Future,2022-04-21 19:55:33+00:00,https://twitter.com/BBC_Future/status/1517230580328321025,"Those living with HIV have considerably compromised immune systems, but were widely left out of initial clinical trials for Covid-19 vaccines. https://t.co/7B7N2APFDF"
561,@BBC_Future,2022-04-21 16:05:11+00:00,https://twitter.com/BBC_Future/status/1517172605887074305,"Eliminating childhood bullying will help alleviate individual psychological suffering, and may bring long-term benefits to population health. https://t.co/fXC0r8QMhm"
562,@BBC_Future,2022-04-21 13:03:44+00:00,https://twitter.com/BBC_Future/status/1517126943799341057,"People living with HIV are some of the most vulnerable to Covid-19, but were left out of initial clinical trials for vaccines. 

@sandyong_yx and @EmmaSAanne look into why they were left out, and what that means for them and other immunocompromised groups. https://t.co/7B7N2APFDF"
563,@BBC_Future,2022-04-21 09:09:47+00:00,https://twitter.com/BBC_Future/status/1517068067053789184,"In one study on a farm in Italy, animals began to change their behaviour up to 20 hours before an earthquake. https://t.co/9T7Zudvuqo"
564,@BBC_Future,2022-04-20 20:09:09+00:00,https://twitter.com/BBC_Future/status/1516871614574432256,"The misguided belief that an intact hymen proves virginity can be found in many parts of the world, and there’s a whole industry based on testing and even reconstructing them. https://t.co/errFHl2cPz"
565,@BBC_Future,2022-04-20 16:09:09+00:00,https://twitter.com/BBC_Future/status/1516811216169013250,"There are three ways to calculate age in South Korea – which is leading to ""persistent confusion"" and ""unnecessary social and economic costs"". https://t.co/9Bn0JgElFy"
566,@BBC_Future,2022-04-20 13:09:09+00:00,https://twitter.com/BBC_Future/status/1516765918356942851,"The “hymen myth”: the idea that an intact hymen equates to virginity, has no scientific basis, but continues to be believed around the world, in a wide range of cultures and communities, writes @sophiasgaler. https://t.co/errFHl2cPz"
567,@BBC_Future,2022-04-20 09:14:18+00:00,https://twitter.com/BBC_Future/status/1516706817216196613,"A new trial has found that psilocybin ""reintegrates"" a depressed brain, making it more fluid, flexible and connected. The BBC has spoken to someone who was on that trial. https://t.co/5NggadRWS2"
568,@BBC_Future,2022-04-19 20:02:52+00:00,https://twitter.com/BBC_Future/status/1516507646374731779,"Micronations aren’t recognised as legitimate nations, but these places can take on lives of their own. https://t.co/R6wVo7zxay"
569,@BBC_Future,2022-04-19 16:13:34+00:00,https://twitter.com/BBC_Future/status/1516449938023993349,"Forest elephants are critically endangered, and if they became extinct their disappearance would result in a 7% loss of carbon stores in the central African rainforest, equivalent to emissions from more than 2 billion petrol cars over the course of a year. https://t.co/p4cbFiHSFv"
570,@BBC_Future,2022-04-19 13:02:53+00:00,https://twitter.com/BBC_Future/status/1516401951629406208,There are more than a dozen micronations in Australia. https://t.co/R6wVo7zxay
571,@BBC_Future,2022-04-19 09:01:19+00:00,https://twitter.com/BBC_Future/status/1516341160578469892,Our intuition is an essential part of our decision-making toolkit – but is it everything? https://t.co/frUGrVrC0a
572,@BBC_Future,2022-04-18 17:59:25+00:00,https://twitter.com/BBC_Future/status/1516114189579788290,Thousands of community health workers in Liberia are on constant lookout for infectious disease in the nation’s furthest remote reaches. https://t.co/dGe4Ae9W7u
573,@BBC_Future,2022-04-18 12:58:10+00:00,https://twitter.com/BBC_Future/status/1516038375597240321,Modern life revolves around mealtimes. Is that the healthiest way to live and eat? https://t.co/oBJUo5lOG4
574,@BBC_Future,2022-04-17 12:55:25+00:00,https://twitter.com/BBC_Future/status/1515675296229330947,"""This new understanding of life is a huge gift. I wish I'd got a diagnosis earlier."" https://t.co/v6f0FkPX9V"
575,@BBC_Future,2022-04-16 17:54:14+00:00,https://twitter.com/BBC_Future/status/1515388109390692354,"With a hotchpotch of neighbourhoods focused on innovative architecture, sustainability and social enrichment, can Almere give us a glimpse of what living in cities could be like in years to come? https://t.co/pxAye2tO0h"
576,@BBC_Future,2022-04-16 12:53:03+00:00,https://twitter.com/BBC_Future/status/1515312313292664840,"Countries as we know them were once all connected, on a supercontinent called Pangea. As they slowly move and change shape, what will the next one look like? https://t.co/cAKuYEJCAJ"
577,@BBC_Future,2022-04-15 17:51:23+00:00,https://twitter.com/BBC_Future/status/1515025005247025156,Are homemade or solid shampoos the future of environmentally-friendly bathing? https://t.co/UQJz67mAnD
578,@BBC_Future,2022-04-15 12:50:13+00:00,https://twitter.com/BBC_Future/status/1514949214232473601,How can you create “canine good citizens”? https://t.co/HC5UlRaqhN
579,@BBC_Future,2022-04-15 08:48:52+00:00,https://twitter.com/BBC_Future/status/1514888476033921024,"Epstein-Barr virus (EBV) is so common that nearly all of us can expect to catch it during our lives. Now, scientists have published “very, very strong evidence that this virus is likely to be the cause of multiple sclerosis"". https://t.co/no3H3WQd5v"
580,@BBC_Future,2022-04-14 20:06:55+00:00,https://twitter.com/BBC_Future/status/1514696722911432714,"Mount Everest grows about 4mm (0.16in) per year. In millions of years, just how big could it get? https://t.co/3o8kRy7Ocb"
581,@BBC_Future,2022-04-14 15:56:45+00:00,https://twitter.com/BBC_Future/status/1514633766005735426,"The extraction of minerals, metals and fuels from the ground is one of humankind's oldest industries. And our appetite for it is growing. What would happen if we just… stopped? https://t.co/KxKzdvD1kv"
582,@BBC_Future,2022-04-14 13:06:55+00:00,https://twitter.com/BBC_Future/status/1514591027763429378,"Mount Everest grows a tiny bit taller every year. In the far-flung future, just how big could it get? 🏔 https://t.co/3o8kRy7Ocb"
583,@BBC_Future,2022-04-14 09:10:36+00:00,https://twitter.com/BBC_Future/status/1514531558937354243,"The use of facial recognition technology in wars isn’t new, but it's being used in an unprecedented range of applications in the Russia-Ukraine conflict. https://t.co/8wXydFN5Qw"
584,@BBC_Future,2022-04-13 20:02:55+00:00,https://twitter.com/BBC_Future/status/1514333331822833666,"Awareness of tongue-tie, and the impact it can have on children is growing around the world. https://t.co/dahQdwD8tN"
585,@BBC_Future,2022-04-13 16:16:03+00:00,https://twitter.com/BBC_Future/status/1514276236519886853,"Mammals usually have roughly the same number of mutations by the time they die of old age, a discovery that helps to explain why we age. https://t.co/j72YS00ig3"
586,@BBC_Future,2022-04-13 13:03:26+00:00,https://twitter.com/BBC_Future/status/1514227764114583558,"Children with tongue-tie may struggle with feeding, eating, breathing, sleeping and speaking. https://t.co/dahQdwD8tN"
587,@BBC_Future,2022-04-13 09:02:16+00:00,https://twitter.com/BBC_Future/status/1514167073894633474,"The UK is home to dwindling patches of temperate rainforest, a rare and ancient ecosystem that is found in isolated fragments along the country's western coastlines. https://t.co/m4bdqyTt0j"
588,@BBC_Future,2022-04-12 16:01:36+00:00,https://twitter.com/BBC_Future/status/1513910211496488962,"Psilocybin, a drug found in magic mushrooms, appears to free up the brains of people with severe depression in a way that other antidepressants do not, a study has found. https://t.co/oIa5nLU3N0"
589,@BBC_Future,2022-04-12 13:12:02+00:00,https://twitter.com/BBC_Future/status/1513867538299428865,"Murder mysteries follow a surprisingly intricate set of psychological rules, allowing us to learn and practice important mental and emotional skills, and can even teach us not to overlook important evidence. https://t.co/RfeDTYNftE"
590,@BBC_Future,2022-04-12 09:11:13+00:00,https://twitter.com/BBC_Future/status/1513806935362924544,Is there a formula for lasting success when it comes to teaching children to read? https://t.co/5fS4GYejbV
591,@BBC_Future,2022-04-11 20:01:18+00:00,https://twitter.com/BBC_Future/status/1513608147516026886,"Bioluminescent bacteria is being trialled as an alternative to traditional streetlights. Could it be a greener, more pleasant solution to harsh outdoor light? https://t.co/U7698T1fjq"
592,@BBC_Future,2022-04-11 16:09:44+00:00,https://twitter.com/BBC_Future/status/1513549870035988482,We rarely hear about the ozone hole these days – what happened? https://t.co/b3YgptkXc3
593,@BBC_Future,2022-04-11 13:01:17+00:00,https://twitter.com/BBC_Future/status/1513502448396034048,The French town of Rambouillet is using bioluminescent bacteria to light some streets. Could the technology change the way we illuminate towns and cities? https://t.co/U7698T1fjq
594,@BBC_Future,2022-04-11 09:07:50+00:00,https://twitter.com/BBC_Future/status/1513443697806901255,"In 1994, a pristine Caribbean mangrove was decimated by a tourism project. Now, it’s thriving again. https://t.co/6YFpo2sAgj"
595,@BBC_Future,2022-04-10 18:06:50+00:00,https://twitter.com/BBC_Future/status/1513216951664840704,We often think of seed banks as vaults only to be used in emergencies – but there’s so much more to these incredible homes of billions of seeds. https://t.co/BuXgjZSFfc
596,@BBC_Future,2022-04-09 18:04:01+00:00,https://twitter.com/BBC_Future/status/1512853855406493699,"It’s highly unlikely that you’ll become a fossil, but there are ways of improving your odds. https://t.co/ijmKPrTXKm"
597,@BBC_Future,2022-04-09 13:02:59+00:00,https://twitter.com/BBC_Future/status/1512778098311266307,"""Sleep training"" is seen by some as the key to a good night's rest. Others argue that it's distressing for babies. What’s the science? https://t.co/yLm44lQFk3"
598,@BBC_Future,2022-04-09 09:01:42+00:00,https://twitter.com/BBC_Future/status/1512717377837838343,"Abandoned oil rigs provide the ideal skeletons for coral reefs, making them some of the most bountiful human-made marine habitats in the world. https://t.co/MFVjQYqROn"
599,@BBC_Future,2022-04-08 20:02:35+00:00,https://twitter.com/BBC_Future/status/1512521307581083651,"What impact do the ingredients in our shampoos have on the planet, and can we change that?  https://t.co/UQJz67mAnD"
600,@BBC_Future,2022-04-08 16:01:04+00:00,https://twitter.com/BBC_Future/status/1512460526437109761,"Enormous gardens created by the wealthy have lasted for hundreds of years, even if they’re long forgotten by the living. https://t.co/xKEZqs1DZq"
601,@BBC_Future,2022-04-08 13:17:35+00:00,https://twitter.com/BBC_Future/status/1512419387352920069,Would making your own shampoo help reduce your shower emissions? https://t.co/UQJz67mAnD
602,@BBC_Future,2022-04-08 09:01:43+00:00,https://twitter.com/BBC_Future/status/1512354996125200384,Capturing and reusing the methane released from food waste and sewage could put a major dent in the reliance on natural gas. https://t.co/Yw9ebFDeCs
603,@BBC_Future,2022-04-07 20:11:26+00:00,https://twitter.com/BBC_Future/status/1512161145909510158,"By paying and training healthcare providers in rural populations, Liberia has created an excellent system of disease monitoring and healthcare in hard-to-reach rural areas. https://t.co/dGe4Ae9W7u"
604,@BBC_Future,2022-04-07 16:27:36+00:00,https://twitter.com/BBC_Future/status/1512104816201244672,Scientists have found fossilised remains of a dinosaur they think were killed and entombed on the actual day a giant asteroid struck Earth. https://t.co/087ypxEhLf
605,@BBC_Future,2022-04-07 13:11:25+00:00,https://twitter.com/BBC_Future/status/1512055446567198727,"Liberia is finding remarkable success in fighting infectious diseases by training members of rural communities to act as the first line of defence, and to spot warning signs before they get out of control. https://t.co/dGe4Ae9W7u"
606,@BBC_Future,2022-04-07 09:12:59+00:00,https://twitter.com/BBC_Future/status/1511995442266984448,"The world’s first mass-produced electric car was launched by General Motors back in 1996, and was capable of 0-60 in eight seconds. What happened? https://t.co/EijC3y2byR"
607,@BBC_Future,2022-04-06 20:02:33+00:00,https://twitter.com/BBC_Future/status/1511796521842339844,"Being diagnosed with autism at 60 made journalist Sue Nelson “reframe six decades of relationships, actions and behaviour through this new and alternative lens”. https://t.co/v6f0FkPX9V"
608,@BBC_Future,2022-04-06 16:29:55+00:00,https://twitter.com/BBC_Future/status/1511743009812987904,A concoction of seven different fungi could help to thin Delhi’s smog. https://t.co/q98v5ygolD
609,@BBC_Future,2022-04-06 13:03:36+00:00,https://twitter.com/BBC_Future/status/1511691089219973125,"“I am that woman with no volume control who probably interrupted your conversation because a thought exploded from her head and immediately out of her mouth,” writes @ScienceNelson. “The one who got overly excited about space stamps or wildflowers"" https://t.co/v6f0FkPX9V"
610,@BBC_Future,2022-04-06 09:02:33+00:00,https://twitter.com/BBC_Future/status/1511630428502822913,"Valmeyer is “a textbook example of how a town can recover, start over and thrive after devastation”. https://t.co/OGXFQmhhcG"
611,@BBC_Future,2022-04-05 20:17:49+00:00,https://twitter.com/BBC_Future/status/1511437974801551370,"Almere – a Dutch city that has grown from the sea – is focused on innovative architecture, sustainability and social enrichment.  https://t.co/pxAye2tO0h"
612,@BBC_Future,2022-04-05 16:02:23+00:00,https://twitter.com/BBC_Future/status/1511373693456293891,"Restless legs syndrome affects around 10% of the global population, and can be incredibly debilitating. https://t.co/x4eZVkT0XV"
613,@BBC_Future,2022-04-05 13:17:49+00:00,https://twitter.com/BBC_Future/status/1511332279360008197,Almere – the newest city in the Netherlands – has grown from non-existence to the country's eighth largest. https://t.co/pxAye2tO0h
614,@BBC_Future,2022-04-05 08:49:47+00:00,https://twitter.com/BBC_Future/status/1511264827078963200,Is trusting your gut always the right thing to do? https://t.co/frUGrVrC0a
615,@BBC_Future,2022-04-04 20:02:54+00:00,https://twitter.com/BBC_Future/status/1511071835143647234,How will the landmasses we know rearrange in the future? https://t.co/cAKuYEJCAJ
616,@BBC_Future,2022-04-04 20:02:33+00:00,https://twitter.com/BBC_Future/status/1511071746580832258,Supercontinents disperse and assemble in cycles; what might lie in Earth's future? https://t.co/cAKuYEJCAJ
617,@BBC_Future,2022-04-04 09:11:46+00:00,https://twitter.com/BBC_Future/status/1510907970426613762,Turning food scraps into methane could be the key to reducing reliance on natural gas. https://t.co/Yw9ebFDeCs
618,@BBC_Future,2022-04-03 13:08:00+00:00,https://twitter.com/BBC_Future/status/1510605035318616066,It turns out we’ve been laughing at the same things for thousands of years. https://t.co/s5MFiWjadV
619,@BBC_Future,2022-04-02 18:07:00+00:00,https://twitter.com/BBC_Future/status/1510317892574744582,Is hydrogen the future of “clean” aviation?  https://t.co/EsCPjmgnxt
620,@BBC_Future,2022-04-02 13:04:57+00:00,https://twitter.com/BBC_Future/status/1510241877169082370,"More than 30 years on from its discovery, we don’t hear much about the ozone hole anymore. What happened? https://t.co/b3YgptkXc3"
621,@BBC_Future,2022-04-01 19:59:32+00:00,https://twitter.com/BBC_Future/status/1509983822389006336,"If you want to know the evolutionary history of the chili pepper, or how to breed a climate change-proof chickpea, seed banks provide an intriguing dataset to draw on. https://t.co/BuXgjZSFfc"
622,@BBC_Future,2022-04-01 17:04:16+00:00,https://twitter.com/BBC_Future/status/1509939716900020224,The most common barrier to acts of kindness is fear of being misinterpreted. https://t.co/R4HlRu8uoy
623,@BBC_Future,2022-04-01 12:59:31+00:00,https://twitter.com/BBC_Future/status/1509878124422389768,"Seed banks are primarily to help plant breeders looking to create better, hardier, or tastier crops. https://t.co/BuXgjZSFfc"
624,@BBC_Future,2022-04-01 09:09:15+00:00,https://twitter.com/BBC_Future/status/1509820176874631169,"To harvest wind energy from the heights where it blows fastest, the key may be to fly a kite. https://t.co/UggFCpIQTh"
625,@BBC_Future,2022-03-31 20:07:41+00:00,https://twitter.com/BBC_Future/status/1509623486318198806,Brands know that consumers want to buy things that are good for the planet – and sometimes use misleading and unverifiable claims to make them more appealing.  https://t.co/Ka9fe3p9dq
626,@BBC_Future,2022-03-31 16:08:40+00:00,https://twitter.com/BBC_Future/status/1509563336010059792,"Coffee, chocolate and spices used to be luxuries, but have become everyday items for many. Now, rising temperatures and higher rainfall could change that. https://t.co/rgsT2dFGzp"
