,0,1,2,3
0,@BBC_Future,2023-02-16 18:30:01+00:00,https://twitter.com/BBC_Future/status/1626287802555174912,Should unborn generations get a say in how we act on climate change today? https://t.co/UGrS5KeX1n
1,@BBC_Future,2023-02-16 13:43:36+00:00,https://twitter.com/BBC_Future/status/1626215720681086976,"Many of the world’s crops are grown using pesticides, but these chemicals may be harming our health and senses. https://t.co/h81qfTnFgr"
2,@BBC_Future,2023-02-15 17:59:20+00:00,https://twitter.com/BBC_Future/status/1625917693361799168,Diseases often leave traces in our bones. Now scientists have found tell-tale signs of everything from arthritis to cancer in dinosaur fossils. https://t.co/hmK6JfXAEW
3,@BBC_Future,2023-02-14 12:02:27+00:00,https://twitter.com/BBC_Future/status/1625465492248072195,"New technology is helping geologists spot subtle signals that could be used to predict when and where large earthquakes might strike, but how close are they to being able to do it for real? https://t.co/HRVEFI4wpM"
4,@BBC_Future,2023-02-14 09:56:25+00:00,https://twitter.com/BBC_Future/status/1625433774615072768,"This year the first full genome of a single human, sequenced from end to end without any gaps, will be published.  https://t.co/fvmJaYWrJz"
5,@BBC_Future,2023-02-13 22:00:05+00:00,https://twitter.com/BBC_Future/status/1625253502804197378,High-altitude balloons face freezing temperatures miles above commercial airliners. Just how high and far can they travel? https://t.co/lSqG1FIbAf
6,@BBC_Future,2023-02-10 12:30:02+00:00,https://twitter.com/BBC_Future/status/1624022883189293056,"Every year, large and remarkable species new to science are discovered in the oceans. With so many unknown fish, jellyfish, whales and octopuses in the sea, scientists are devising new ways to seek them out. https://t.co/vJ1FB0KRi1"
7,@BBC_Future,2023-02-09 22:51:43+00:00,https://twitter.com/BBC_Future/status/1623816943391342592,"In libraries around the world, there could be hidden messages and doodles hiding in plain sight https://t.co/iBj5gZ8NuO"
8,@BBC_Future,2023-02-08 16:01:48+00:00,https://twitter.com/BBC_Future/status/1623351399282270210,Architects are developing ways to build new structures designed for disassembly from the get-go. https://t.co/qUBWOgBMCx
9,@BBC_Future,2023-02-08 16:00:25+00:00,https://twitter.com/BBC_Future/status/1623351049431171072,"Philip II of Spain was obsessed with his garden fish, and imported several invasive species from abroad.  https://t.co/uBmfMw2wmS"
10,@BBC_Future,2023-02-07 14:03:43+00:00,https://twitter.com/BBC_Future/status/1622959294139465728,"How do you detect “organic cotton” that isn’t organic, or “recycled polyester” that’s not recycled? New technologies can help us determine whether the clothes in our wardrobes really are what they claim to be. https://t.co/AfELrgBqRL"
11,@BBC_Future,2023-02-03 14:00:02+00:00,https://twitter.com/BBC_Future/status/1621508814871891972,Hidden within North America is an ancient continent once inhabited by dinosaurs – but it's been almost entirely forgotten. https://t.co/zKtNzSheSq
12,@BBC_Future,2023-02-02 16:10:45+00:00,https://twitter.com/BBC_Future/status/1621179322097889284,Undersea cables carry electricity and data vital to keep our modern societies running. But could they be doing harm to life underneath the waves? https://t.co/hjEvijDqd6
13,@BBC_Future,2023-02-02 14:00:02+00:00,https://twitter.com/BBC_Future/status/1621146426226151426,"As heat pumps gain momentum as a source of clean heating, how will they adapt to warm high rises? https://t.co/gUwnGK9u1O"
14,@BBC_Future,2023-02-01 14:03:01+00:00,https://twitter.com/BBC_Future/status/1620784792525471758,"There are at least 60,000 schools around the world using the Montessori method, but its benefits remain a matter of scientific debate. https://t.co/FWp7tDbREy"
15,@BBC_Future,2023-01-31 15:51:56+00:00,https://twitter.com/BBC_Future/status/1620449813455314944,A respiratory infection doesn't necessarily mean you have to stop singing to protect your voice. But there are some easy ways to take care of it. https://t.co/lxPo9GFBOZ
16,@BBC_Future,2023-01-30 14:00:02+00:00,https://twitter.com/BBC_Future/status/1620059263443046401,"For women with ""complicated UTIs"", the struggle to have urinary tract infection symptoms taken seriously can last years.  https://t.co/GoCmqiBizy"
17,@BBC_Future,2023-01-26 14:50:26+00:00,https://twitter.com/BBC_Future/status/1618622395748855809,"You might not recognise words like nonnapaura, chuco헐sol, or preuphoreau – but these new terms help to capture life in the 21st Century. https://t.co/Ik48yPec3C"
18,@BBC_Future,2023-01-25 18:00:01+00:00,https://twitter.com/BBC_Future/status/1618307719324368896,"As the snowy season shortens and winter slopes turn green, climate change is turning skiing into an endangered pastime. How are resorts adapting in a warming world? https://t.co/ksnnmS5SFG"
19,@BBC_Future,2023-01-25 14:00:02+00:00,https://twitter.com/BBC_Future/status/1618247325629005829,"Leprosy still infects as many as 200,000 people a year. But how it spreads is still puzzling scientists. https://t.co/dCpoPhg8Of"
20,@BBC_Future,2023-01-24 13:28:29+00:00,https://twitter.com/BBC_Future/status/1617876995639234565,What would happen in a terrifying world where water boatmen and weasels were as big as elephants? https://t.co/ASMMQQW9Yn
21,@BBC_Future,2023-01-24 12:13:16+00:00,https://twitter.com/BBC_Future/status/1617858066950782977,The microbes living in your gut can have a surprising influence on the way you think. https://t.co/vIvDrk34dO
22,@BBC_Future,2023-01-20 14:00:02+00:00,https://twitter.com/BBC_Future/status/1616435383985909763,Two pioneering dinosaur bone-hunters in the US made prodigious discoveries that shaped our view of these prehistoric creatures for 150 years – and they hated each other's guts. https://t.co/3Wdg2u0P7S
23,@BBC_Future,2023-01-19 16:50:21+00:00,https://twitter.com/BBC_Future/status/1616115858660786176,Fresh fruit and veg are some of the most wasted foods – but an array of emerging technologies is contending to stop produce going bad before it reaches our plates. https://t.co/vhws7DGrBd
24,@BBC_Future,2023-01-19 14:25:14+00:00,https://twitter.com/BBC_Future/status/1616079339531165699,"Though China rolled out its one-child policy in 1980, its population has only just started going down. https://t.co/dUgVXoxec7"
25,@BBC_Future,2023-01-18 15:11:02+00:00,https://twitter.com/BBC_Future/status/1615728479592648710,"One volcanic eruption in Indonesia could trigger global chaos in trade, travel and financial markets. https://t.co/p8i31tzqEr"
26,@BBC_Future,2023-01-18 13:15:03+00:00,https://twitter.com/BBC_Future/status/1615699291166904320,"Italy's treasured olive trees, many of them hundreds of years old, are dying from a fast-spreading disease. Could a highly trained squad of super-sniffer dogs stop the spread? https://t.co/NJRz4az1Dt"
27,@BBC_Future,2023-01-17 14:02:01+00:00,https://twitter.com/BBC_Future/status/1615348722589913092,Donkeys are more than just humble beasts of burden – they may have helped humans adapt and flourish in a changing world. https://t.co/zRey2oR84I
28,@BBC_Future,2023-01-16 16:15:34+00:00,https://twitter.com/BBC_Future/status/1615019940922413058,Advances in gene editing are making the prospect of resurrecting long-lost species a possibility.  https://t.co/Sx2ksjreut
29,@BBC_Future,2023-01-15 13:33:27+00:00,https://twitter.com/BBC_Future/status/1614616756865339392,"The symmetry of our bodies makes it easy to distinguish front from back, but not left from right. https://t.co/jNATfDOntV"
30,@BBC_Future,2023-01-12 18:05:28+00:00,https://twitter.com/BBC_Future/status/1613598049129082885,"They can turn entire watercourses and lakes a vivid green, but an increase in algal blooms is posing a threat to the environment and human health. https://t.co/djdvU9WmzP"
31,@BBC_Future,2023-01-12 14:00:06+00:00,https://twitter.com/BBC_Future/status/1613536297544716323,"Vertical farms are spreading rapidly, but where is the limit of what we can actually grow in them? https://t.co/ejfrGGoZ8V"
32,@BBC_Future,2023-01-11 14:05:02+00:00,https://twitter.com/BBC_Future/status/1613175152094875655,"While the daily death toll has gone down compared to the peak of the pandemic, Covid-19 is still claiming a surprisingly high number of lives.  https://t.co/uAoUhf6R6h"
33,@BBC_Future,2023-01-10 14:30:02+00:00,https://twitter.com/BBC_Future/status/1612819055400091650,"Do some parents obsess too much about so-called milestones? Doctors say tracking development is important, but there are right and wrong ways of doing it. https://t.co/4YpvKES9mD"
34,@BBC_Future,2023-01-09 18:09:29+00:00,https://twitter.com/BBC_Future/status/1612511896036610048,"This remote set of laboratories and aircraft hangers were ""as important as Bletchley Park"" in Britain's war effort during World War Two. https://t.co/JPKpBVT4xy"
35,@BBC_Future,2023-01-05 17:01:31+00:00,https://twitter.com/BBC_Future/status/1611045238482817024,Unusually high numbers of dolphins and porpoises have been washing up dead on the shores of the Black Sea. Scientists say they may be casualties of the war in Ukraine. https://t.co/zLICFX2aX2
36,@BBC_Future,2023-01-04 18:30:01+00:00,https://twitter.com/BBC_Future/status/1610705124820938753,Lignin from trees could help batteries in electric vehicles charge in super fast time – in as little as eight minutes according to some claims. https://t.co/boqtrIDSLY
37,@BBC_Future,2023-01-04 15:53:04+00:00,https://twitter.com/BBC_Future/status/1610665626607185920,Microscopic fragments of plastic are absorbed from the soil by plant roots. What does this mean for the food we eat? https://t.co/VrOtKlrRK4
38,@BBC_Future,2023-01-03 14:44:09+00:00,https://twitter.com/BBC_Future/status/1610285892173959170,"In some countries, it’s not 2023 right now. https://t.co/ZaWdoxaO4b"
39,@BBC_Future,2023-01-01 12:02:02+00:00,https://twitter.com/BBC_Future/status/1609520321199214592,Can changing the timings of your meals be better for your health? https://t.co/dJfrgOti69
40,@BBC_Future,2022-12-30 12:07:07+00:00,https://twitter.com/BBC_Future/status/1608796822499373056,Jurassic Park got it wrong – dinosaurs probably didn't roar but the noises they made were arguably even more terrifying. https://t.co/vzBd2d3amr
41,@BBC_Future,2022-12-22 13:28:14+00:00,https://twitter.com/BBC_Future/status/1605918133327638529,"From cooking turkey sous vide-style to microwaving Brussels sprouts, try these hacks to make your Christmas dinner a little more sustainable.   https://t.co/QiZTURyIcv"
42,@BBC_Future,2022-12-21 19:30:02+00:00,https://twitter.com/BBC_Future/status/1605646798428983296,Medieval 'fight masters' left manuals with details of their complex martial arts – but interpreting them is fraught with confusion and guesswork.   https://t.co/yFXXXqbmL0
43,@BBC_Future,2022-12-21 14:00:03+00:00,https://twitter.com/BBC_Future/status/1605563753172717570,"Naked mole-rats are immune to ageing and pain, remarkably long-lived and able to survive in low oxygen environments underground. What can we learn from these extraordinary, if a little ugly, creatures? https://t.co/TJRxm9rG4b"
44,@BBC_Future,2022-12-20 16:35:38+00:00,https://twitter.com/BBC_Future/status/1605240521781555201,"Fleather, a vegan leather made from the flower waste from India's temples, is part of wider move towards plant- and fungi-based leather alternatives  https://t.co/BLW6WPOoB5"
45,@BBC_Future,2022-12-19 15:57:40+00:00,https://twitter.com/BBC_Future/status/1604868575248154625,Most space agencies aim for the Moon – the UAE’s aimed for Mars. https://t.co/4wUkoVbRQZ
46,@BBC_Future,2022-12-16 13:07:25+00:00,https://twitter.com/BBC_Future/status/1603738568962473985,"What does a protein-rich, low-carbon diet really look like? Just how bad for the climate are meat and dairy? Is it better to cut out cheese or chicken? BBC Future digs into the data to find the answers. https://t.co/WCx1iBbfid"
47,@BBC_Future,2022-12-15 15:27:23+00:00,https://twitter.com/BBC_Future/status/1603411402966069250,Were you ever on Santa's naughty list? Dan John explores the ethical dilemma around a beloved Christmas tradition. https://t.co/oFCxgTnH1a
48,@BBC_Future,2022-12-14 15:32:31+00:00,https://twitter.com/BBC_Future/status/1603050308607049731,Could dinosaur calls have been more like birds than fearsome movie monsters? https://t.co/5xE7DzZmNo
49,@BBC_Future,2022-12-13 14:00:03+00:00,https://twitter.com/BBC_Future/status/1602664649618751490,"Amid a rising tide of nationalism, walls and fortified fences are proliferating around the world, blocking wildlife migrations and threatening millions of species. https://t.co/ChraOc1lqn"
50,@BBC_Future,2022-12-13 09:57:38+00:00,https://twitter.com/BBC_Future/status/1602603644444368896,"Why do some infections, such as strep A, seem to be suddenly becoming more common? https://t.co/2lXWQTgmDg"
51,@BBC_Future,2022-12-09 14:49:16+00:00,https://twitter.com/BBC_Future/status/1601227485047582723,"Animals like hyenas and vultures prevent diseases. Should we take better care of them?
  https://t.co/i6QNXeTgrC"
52,@BBC_Future,2022-12-08 12:26:24+00:00,https://twitter.com/BBC_Future/status/1600829144346267650,Cola and lemonade are merely the tip of the iceberg: the vast landscape of soda flavours contains some very eccentric examples. https://t.co/EkujTjS3Nr
53,@BBC_Future,2022-12-07 15:00:02+00:00,https://twitter.com/BBC_Future/status/1600505419549782016,"What would it take to really make the World Cup, and other sports mega-events, a genuine part of a low-carbon world? #BBCWorldCup https://t.co/txrVHnkorU"
54,@BBC_Future,2022-12-07 12:00:02+00:00,https://twitter.com/BBC_Future/status/1600460120705896449,"When author Ben Fergusson and his husband adopted their son, they were told about the challenges many adopted children face – such as the impact of early trauma. Here's what science says about how to help them heal and flourish.    https://t.co/9OGtB4G0JH"
55,@BBC_Future,2022-12-06 17:34:52+00:00,https://twitter.com/BBC_Future/status/1600181996340535296,"There may be benefits in embracing the vastness of our Universe.
  https://t.co/1xhQRBz6Ym"
56,@BBC_Future,2022-12-05 15:08:18+00:00,https://twitter.com/BBC_Future/status/1599782722108805120,"Under polar ice sheets, life thrives in intense cold. https://t.co/8XpKSm8sA9"
57,@BBC_Future,2022-12-02 18:05:33+00:00,https://twitter.com/BBC_Future/status/1598740166927343616,"Dolphins, porpoises and whales are losing their ability to navigate, communicate, and detect danger due to noise and chemical pollution of the oceans.  https://t.co/O9o4Gl79AG"
58,@BBC_Future,2022-12-01 12:31:16+00:00,https://twitter.com/BBC_Future/status/1598293653445038080,Dinosaurs may have once roamed the frozen Arctic. https://t.co/TObnYf5fS6
59,@BBC_Future,2022-12-01 09:37:38+00:00,https://twitter.com/BBC_Future/status/1598249956321931265,Journalist Sue Nelson was diagnosed with autism late in life – and the discovery shed a new light on many of her childhood habits. https://t.co/4wz2hB7zUR
60,@BBC_Future,2022-11-30 11:17:28+00:00,https://twitter.com/BBC_Future/status/1597912691934638080,Small hydropower plants have long sustained remote communities in the Alps – but there is a growing debate over their environmental impact. https://t.co/Kb9xJOOlQw
61,@BBC_Future,2022-11-28 14:00:01+00:00,https://twitter.com/BBC_Future/status/1597228826521931776,"AI art may not be particularly sophisticated yet, but the same could be said of photography and filmmaking in their early days https://t.co/iY3Mxa5lS0"
62,@BBC_Future,2022-11-26 14:00:02+00:00,https://twitter.com/BBC_Future/status/1596504051310809093,Lost memories may be more like searching for information in a maze rather than something that crumbles away over time. https://t.co/y0h9AkSMSi
63,@BBC_Future,2022-11-25 11:40:44+00:00,https://twitter.com/BBC_Future/status/1596106607293005827,You might not have to be ruthless to get ahead after all. https://t.co/G4lSoiu07s
64,@BBC_Future,2022-11-24 14:00:02+00:00,https://twitter.com/BBC_Future/status/1595779278582734848,Can parenting ever be “green”? https://t.co/hWjfsrJ7cR
65,@BBC_Future,2022-11-23 15:12:11+00:00,https://twitter.com/BBC_Future/status/1595435044935700480,Would cutting air miles schemes help to bring down aviation emissions? https://t.co/FPEnD1ePZJ
66,@BBC_Future,2022-11-23 15:07:28+00:00,https://twitter.com/BBC_Future/status/1595433858618753024,We shouldn’t worry about momentary lapses in memory – they can actually be good for us. https://t.co/rTh5D7d1LG
67,@BBC_Future,2022-11-22 14:48:07+00:00,https://twitter.com/BBC_Future/status/1595066603942875136,Should restaurants show carbon emissions on their menus? https://t.co/qTEVc3bYF9 https://t.co/qTEVc3bYF9
68,@BBC_Future,2022-11-17 14:03:37+00:00,https://twitter.com/BBC_Future/status/1593243463851872258,A transition away from fossil fuel extraction in Colombia would require several major transformations. https://t.co/4nD1xnfbHV
69,@BBC_Future,2022-11-16 14:22:46+00:00,https://twitter.com/BBC_Future/status/1592885895098945537,Artemis I is paving the way for humanity’s return to the Moon. https://t.co/R88Mqnfetm
70,@BBC_Future,2022-11-15 14:14:57+00:00,https://twitter.com/BBC_Future/status/1592521538317737986,"Humanity has domesticated a surprising number of insects, turning them into tiny livestock. https://t.co/3WnbM0x7Tq"
71,@BBC_Future,2022-11-14 16:57:30+00:00,https://twitter.com/BBC_Future/status/1592200060435337219,How can farmers adapt to the threats facing our food chain? Watch more: https://t.co/Vyjua7S8JO https://t.co/PRO4nvuyz7
72,@BBC_Future,2022-11-14 14:12:18+00:00,https://twitter.com/BBC_Future/status/1592158484216565761,The majority of studies concerning people with psychopathy have been conducted on criminal offenders. https://t.co/yZ8NVjwuyV
73,@BBC_Future,2022-11-10 13:55:58+00:00,https://twitter.com/BBC_Future/status/1590704825477783553,"Water insecurity is a key threat to farmers living and working in Egypt, where climate talks are currently being held. https://t.co/mbDjRYnbxD"
74,@BBC_Future,2022-11-09 16:15:44+00:00,https://twitter.com/BBC_Future/status/1590377608424099841,"“Blue” spaces, where people can be close to water, can have a powerful effect on mental health. https://t.co/kVk9WNRp6P"
75,@BBC_Future,2022-11-09 14:06:55+00:00,https://twitter.com/BBC_Future/status/1590345190170320897,Teaching children “decision-making competence” can help them throughout their lives. https://t.co/7S0LCw3lq2
76,@BBC_Future,2022-11-08 14:22:24+00:00,https://twitter.com/BBC_Future/status/1589986701484883974,Low temperatures can affect bodily functions. https://t.co/OVyUjc5ecl
77,@BBC_Future,2022-11-07 14:11:16+00:00,https://twitter.com/BBC_Future/status/1589621512499519488,Multiple psychological factors contribute to astonishing feats of creativity and insight. https://t.co/LdPEdnTYUU
78,@BBC_Future,2022-11-04 14:00:38+00:00,https://twitter.com/BBC_Future/status/1588531672857071618,Language can have a fascinating effect on the way we think about time and space. https://t.co/1BsPMsI3gO
79,@BBC_Future,2022-11-03 14:33:47+00:00,https://twitter.com/BBC_Future/status/1588177624127672320,What can an individual do about injustice? https://t.co/ycV6GTk0gn
80,@BBC_Future,2022-11-01 14:14:25+00:00,https://twitter.com/BBC_Future/status/1587447977098248197,Tucson has harnessed rainwater to help boost water supplies to the city. https://t.co/bME6zpB1oe
81,@BBC_Future,2022-10-31 14:10:34+00:00,https://twitter.com/BBC_Future/status/1587084619727634433,"Self-contained habitats with all essential infrastructure, including energy, food production, waste management and water, have long been present in science fiction. Could they become reality? https://t.co/MILo7KQLZM"
82,@BBC_Future,2022-10-28 12:56:33+00:00,https://twitter.com/BBC_Future/status/1585978826819276800,"Auto-Brewery Syndrome is a rare condition, and scientists are searching for what causes it. https://t.co/U9PLEDbh29"
83,@BBC_Future,2022-10-27 13:01:23+00:00,https://twitter.com/BBC_Future/status/1585617655486369793,Talking to strangers – under the right conditions – can be good for us. https://t.co/TEulnrw6Ox
84,@BBC_Future,2022-10-26 13:02:55+00:00,https://twitter.com/BBC_Future/status/1585255654880866304,Why were T. rex's arms so small? https://t.co/TNJDoCr9lq
85,@BBC_Future,2022-10-25 12:56:01+00:00,https://twitter.com/BBC_Future/status/1584891531223519232,"While the factors that increase the risks of sudden infant death syndrome (SIDS) are well known, scientists still don’t fully understand the underlying cause. https://t.co/Y95mvTPjTW"
86,@BBC_Future,2022-10-24 13:57:08+00:00,https://twitter.com/BBC_Future/status/1584544522092314625,"A growing number of organisations are calling for more TV and film scripts to feature climate-related storylines, characters and reference points, even when climate change isn't the main focus. https://t.co/H7JNAZKqe4"
87,@BBC_Future,2022-10-21 12:56:40+00:00,https://twitter.com/BBC_Future/status/1583442143645159429,"In World War Two, the Soviet Union devised a tank that could fly into battle. https://t.co/W7OrsqTsRh"
88,@BBC_Future,2022-10-20 16:20:50+00:00,https://twitter.com/BBC_Future/status/1583131135747698688,"In areas at high risk of wildfire – such as Paradise, California – public officials are exploring potential protective solutions to keep the town safe. https://t.co/dbzgRimed9"
89,@BBC_Future,2022-10-20 13:03:10+00:00,https://twitter.com/BBC_Future/status/1583081390173999104,A simple strategy devised by statisticians allowed them to double or triple the advantage of a competent card counter. https://t.co/1kVBH7tiWP
90,@BBC_Future,2022-10-19 13:10:46+00:00,https://twitter.com/BBC_Future/status/1582720917053984768,It is common for many people to avoid or suppress their everyday worries. But what if they could be turned to our advantage? https://t.co/Zgyy4Su0zu
91,@BBC_Future,2022-10-18 13:06:29+00:00,https://twitter.com/BBC_Future/status/1582357451940462592,The evolution of roots transformed life on Earth – and understanding them could help us to grow more resilient plants. https://t.co/IxW3l6cESM
92,@BBC_Future,2022-10-17 13:06:44+00:00,https://twitter.com/BBC_Future/status/1581995125018095621,Our best means of predicting what will happen if a colossal object smashes into us involves studying past events. https://t.co/fjZHBZPjxw
93,@BBC_Future,2022-10-13 12:54:01+00:00,https://twitter.com/BBC_Future/status/1580542373721174016,"A “eucatastrophe” is a “good catastrophe”, which happens at the darkest moment, when all seems lost. https://t.co/SoUGfc0TNl"
94,@BBC_Future,2022-10-12 13:12:01+00:00,https://twitter.com/BBC_Future/status/1580184514177142785,Cosmic rays have been identified as the possible culprits behind numerous extraordinary cases of computer failure. https://t.co/JJDIevL1re
95,@BBC_Future,2022-10-11 14:18:13+00:00,https://twitter.com/BBC_Future/status/1579838786917527553,Playing outdoors has a myriad of benefits for children. https://t.co/6nKpivCBMp
96,@BBC_Future,2022-10-10 12:59:29+00:00,https://twitter.com/BBC_Future/status/1579456585273053185,The world is creating more and more data. How can we store it all? https://t.co/apPqQ8MfYw
97,@BBC_Future,2022-10-07 13:01:01+00:00,https://twitter.com/BBC_Future/status/1578369807397056512,Removing Japanese knotweed is extremely difficult. https://t.co/43s1R04Zsr
98,@BBC_Future,2022-10-06 19:55:03+00:00,https://twitter.com/BBC_Future/status/1578111615538720768,Hallucinations are helping to reveal new insights about how our minds work. https://t.co/oovl55wNMA
99,@BBC_Future,2022-10-04 10:53:02+00:00,https://twitter.com/BBC_Future/status/1577250435811119104,The amount of plastic in our oceans is increasing by 1.5-2% every year.  https://t.co/BKrSMPMzJR
100,@BBC_Future,2022-09-29 14:22:55+00:00,https://twitter.com/BBC_Future/status/1575491315504414725,"Sepsis is more common in newborns than any other age group, causing up to 24% of deaths among babies around the world. https://t.co/MqFuQptHpA"
101,@BBC_Future,2022-09-28 13:56:42+00:00,https://twitter.com/BBC_Future/status/1575122330996469760,"By 2100, Venice could see nearly 6ft (180cm) sea level rise, submerging much of the iconic city for good.  https://t.co/FMNnOvcoSD"
102,@BBC_Future,2022-09-28 09:30:01+00:00,https://twitter.com/BBC_Future/status/1575055217363931136,"Agricultural grafting originated thousands of years ago in India, and eventually inspired the earliest skin grafts in humans.  https://t.co/4GVcsyoQVD"
103,@BBC_Future,2022-09-27 16:31:33+00:00,https://twitter.com/BBC_Future/status/1574798911294046208,"As more objects are fired into space, the chances of someone or something being struck by debris falling back to Earth are increasing. https://t.co/ekbSqwDXwB"
104,@BBC_Future,2022-09-27 12:28:47+00:00,https://twitter.com/BBC_Future/status/1574737815988211713,"""Sleep training"" is seen by some as the key to a good night's rest. Others argue that it's distressing for babies. What’s the science? https://t.co/oeRlMcpI52"
105,@BBC_Future,2022-09-20 16:26:36+00:00,https://twitter.com/BBC_Future/status/1572260951990341633,"As gardeners turn their backs on peat, companies are experimenting with alternative products to improve their compost – from wood chips to sphagnum moss grown in a greenhouse.  https://t.co/iqQhe1HcVh"
106,@BBC_Future,2022-09-07 15:27:23+00:00,https://twitter.com/BBC_Future/status/1567535005659967491,"The global human population is set to keep growing until 2100. How large could it get, and will the planet be able to support it? https://t.co/MWA6McpZu0"
107,@BBC_Future,2022-09-07 13:02:05+00:00,https://twitter.com/BBC_Future/status/1567498439264731137,Scientists are starting to decode the mysteries of the teenage brain – and their insights could help young people maximise their potential. https://t.co/uhIvWcxvpN
