,0,1,2,3
0,francescoeam,2021-04-13 09:27:11+00:00,https://twitter.com/francescoeam/status/1381901771229044738,Microsoft Researchers Claim Entire Universe Is a Machine-Learning Algorithm https://t.co/T2aBKedmeN https://t.co/QpMYqspY29
1,francescoeam,2021-04-12 16:30:39+00:00,https://twitter.com/francescoeam/status/1381645951392174084,A new era of innovation: Moore’s Law is not dead and AI is ready to explode - SiliconANGLE https://t.co/OgYId2A264 https://t.co/XS6918uEyT
2,francescoeam,2021-04-12 15:50:05+00:00,https://twitter.com/francescoeam/status/1381635744041738248,5 Amazing Real-World Applications of Artificial Intelligence and Data Science https://t.co/zJDR9qcggU https://t.co/cEAj41ujZz
3,francescoeam,2021-04-09 11:30:13+00:00,https://twitter.com/francescoeam/status/1380483180780720128,"Embrace the unexpected: To teach AI how to handle new situations, change the rules of the game https://t.co/VghulgbCKT https://t.co/oMKpHSNEB6"
4,francescoeam,2021-04-08 13:10:03+00:00,https://twitter.com/francescoeam/status/1380145918125674500,A wireless brain-computer interface has been successfully tested on humans for the first time https://t.co/pM3AYnKpTV https://t.co/ltyzMkTZ8I
5,francescoeam,2021-04-08 12:30:27+00:00,https://twitter.com/francescoeam/status/1380135953197596675,An artificial intelligence tool that can help detect melanoma https://t.co/XY0EGQkomP https://t.co/bxo3dWyo9c
6,francescoeam,2021-04-08 11:30:13+00:00,https://twitter.com/francescoeam/status/1380120793787596803,Tim Cook's 5-Word Response to Facebook Is Brutal and Brilliant at the Same Time https://t.co/yX7vWuyakc https://t.co/88D2PWRTxa
7,francescoeam,2021-04-06 13:50:02+00:00,https://twitter.com/francescoeam/status/1379431204248641536,Eight Post-Covid Tech Trends Expected To Grow Exponentially https://t.co/7cAalNvRuc https://t.co/TnIn7OXDFg
8,francescoeam,2021-04-06 13:10:03+00:00,https://twitter.com/francescoeam/status/1379421141530517511,What actually happened with Facebook’s massive 533M record leak https://t.co/wvfLsgqBaI https://t.co/JliU6IhwJb
9,francescoeam,2021-04-06 12:30:02+00:00,https://twitter.com/francescoeam/status/1379411073896419332,A.I. Can’t Detect Our Emotions https://t.co/wuvGpJLHqD #ai #emotions https://t.co/hqZcLnDmjY
10,francescoeam,2021-04-05 12:30:20+00:00,https://twitter.com/francescoeam/status/1379048759045328898,Facebook Is Betting On Brain-Control Technology. Will It Pay Off? https://t.co/g8AZUYI5vx https://t.co/t69epwphSZ
11,francescoeam,2021-04-05 11:01:38+00:00,https://twitter.com/francescoeam/status/1379026436573560834,How to check if your account was part of Facebook’s 533M record leak https://t.co/IbJDeTh4vb https://t.co/VdM6qsxJnt
12,francescoeam,2021-04-03 11:30:17+00:00,https://twitter.com/francescoeam/status/1378308872167907330,AI datasets are filled with errors. It's warping what we know about AI https://t.co/u7FbxWxLoE https://t.co/PcyMmUnKMf
13,francescoeam,2021-04-01 13:50:03+00:00,https://twitter.com/francescoeam/status/1377619268771151876,Low-code app development: How Microsoft's Power Fx language is evolving https://t.co/HltUF6DXTo https://t.co/JGJgw2JpvF
14,francescoeam,2021-04-01 13:10:03+00:00,https://twitter.com/francescoeam/status/1377609201539764226,5 Product #SEO Strategies to Get Your Products to Rank in the SERPs https://t.co/3anoYzqkaC https://t.co/juNQWNzcyC
15,francescoeam,2021-04-01 12:30:03+00:00,https://twitter.com/francescoeam/status/1377599138712465409,5 machine learning essentials non-technical leaders need to understand https://t.co/8rBoduZDR0 #learning #ai https://t.co/u1oGFzhyur
16,francescoeam,2021-04-01 11:30:34+00:00,https://twitter.com/francescoeam/status/1377584168905900032,"Stop Calling Everything AI, Machine-Learning Pioneer Says https://t.co/rUjrnNUKLc https://t.co/S7gnzmN0AC"
17,francescoeam,2021-03-31 13:50:04+00:00,https://twitter.com/francescoeam/status/1377256886018379777,Worldwide quantum web may be possible with help from graphs https://t.co/dYHbUob56b https://t.co/lGV5Ty9zFb
18,francescoeam,2021-03-29 11:29:30+00:00,https://twitter.com/francescoeam/status/1376496736248664068,The power of gamification in marketing for businesses https://t.co/dtDqwEp4IX
19,francescoeam,2021-03-26 14:10:04+00:00,https://twitter.com/francescoeam/status/1375449981910450176,3 Ways To Beat The LinkedIn Algorithm https://t.co/TU7ARieCMz https://t.co/y8Drk8x1VY https://t.co/Yj8VxcUG53
20,francescoeam,2021-03-26 13:30:35+00:00,https://twitter.com/francescoeam/status/1375440044350189573,Microsoft Azure: This new developer kit helps to bust the myth that AI is hard https://t.co/bBktaBPYgM by @TechRepublic https://t.co/bYOY70HXK0
21,francescoeam,2021-03-26 12:30:16+00:00,https://twitter.com/francescoeam/status/1375424865264668672,3 Main Reasons Why Big Technology Projects Fail – &amp; Why Many Companies Should Just Never Do Them https://t.co/btJYOFOwQW
22,francescoeam,2021-01-23 18:30:16+00:00,https://twitter.com/francescoeam/status/1353047414647648262,Why Microsoft’s self-driving car strategy will work https://t.co/wCsJnFNBPj by @venturebeat https://t.co/gdeuZxrgNB
23,francescoeam,2021-01-23 17:30:03+00:00,https://twitter.com/francescoeam/status/1353032259104858112,How technology can drive a sustainable economic recovery https://t.co/6oqZYOGeWH https://t.co/KYBaxjHmET
24,francescoeam,2021-01-23 17:24:30+00:00,https://twitter.com/francescoeam/status/1353030861260730368,How Predictive Algorithms Are Transforming Data into Decisions https://t.co/iixY33aV01 https://t.co/qsA99lVZbI
