,0,1,2,3
331,jesse,2022-08-10 01:15:49+00:00,https://twitter.com/Jesse/status/1557173840953745408,"The salaries quoted are almost always separate from benefits. No other job advertises salaries that way that I’m aware of.

After we do that, *then* let’s start talking about increasing teacher salaries. I want to be clear that I’m not saying teachers aren’t worth more."
332,jesse,2022-08-10 01:15:26+00:00,https://twitter.com/Jesse/status/1557173745382346752,"I wonder if we’d recruit more teachers in America if we advertised salaries as combined salary + benefits like the rest of salaried workers. Then tout that you get a 4-8 week, paid, sabbatical each summer. I really think our problem is semantic and how we’re branding teacher pay."
333,jesse,2022-08-08 20:43:47+00:00,https://twitter.com/Jesse/status/1556742993670901762,"My active #Mormon friends sure silent on this. Cognitive Dissonance, much?

https://t.co/ZYaOrW8myg"
334,jesse,2022-08-07 19:58:51+00:00,https://twitter.com/Jesse/status/1556369297789763584,"How do we know the UAPs people keep seeing are driven by living beings? What if they’re simply sentient AI that has learned time travel to further increase the speed of machine intelligence in our timeline? 

The real question is: what happened to the humans?

#ufotwitter #UAPs"
335,jesse,2022-08-06 23:54:09+00:00,https://twitter.com/Jesse/status/1556066128140546048,@elonmusk Is that my ticket to my Cybertruck?
336,jesse,2022-07-31 16:40:52+00:00,https://twitter.com/Jesse/status/1553782760434585600,It blows my mind that any restaurant in America and especially Utah can do this. And that they’re likely doing it the places you eat. #covid @SaltLakeHealth https://t.co/BmLc7GKj0W
337,jesse,2022-07-31 16:18:35+00:00,https://twitter.com/Jesse/status/1553777151979110406,"My teenager is positive for COVID, and the restaurant they work at is asking them to come in and that, “it’s okay as long as you wear a mask!” Is this legal, who do I report them to, and can I sue them for having this policy and likely getting my teenager sick because of it?"
338,jesse,2022-07-28 08:18:18+00:00,https://twitter.com/Jesse/status/1552569122847801344,"@elonmusk More accurately page views (how ads are sold).

I believe journalists do their jobs well. The problem is in the Editorial Boards and Ownership of media orgs. Especially local media, owned by conglomerates. Local media is the biggest problem causing bias in the USA right now."
339,jesse,2022-07-28 08:13:25+00:00,https://twitter.com/Jesse/status/1552567890976526337,"@poetickate Don’t look at the COVID BA.5 numbers. 😉

Good news w/ MonkeyPox is it’s skin-to-skin transmitted. Perhaps it shows Utah doesn’t wash their hands? Def. spreads more through families and is brought over by Mormon missionaries."
340,jesse,2022-07-28 08:09:32+00:00,https://twitter.com/Jesse/status/1552566915955970049,"ANXIOUS attachment styles fear mostly the future.

AVOIDANT attachment styles fear mostly the past.

SECURE attachment styles fear only the present.

#dating #relationships #attachmenttheory"
341,jesse,2022-07-28 00:49:47+00:00,https://twitter.com/Jesse/status/1552456248192569344,"This series on YouTube by the creators of Southpark is perfect. It exposes and makes fun of how easy it is to deep fake anyone, in a way only the makers of Southpark could do. Who’s watching it?:

https://t.co/eBAG3e3whj"
342,jesse,2022-07-27 05:53:49+00:00,https://twitter.com/Jesse/status/1552170373008896000,It's been a fun ride!
343,jesse,2022-07-27 05:53:28+00:00,https://twitter.com/Jesse/status/1552170285410856961,"Or that time I wrote for VentureBeat:

https://t.co/cjDrTZFkYQ"
344,jesse,2022-07-27 05:46:59+00:00,https://twitter.com/Jesse/status/1552168653474238464,"Or that time I was a guest author several times on TechCrunch:

https://t.co/pnMEwHjQWb"
345,jesse,2022-07-27 05:22:31+00:00,https://twitter.com/Jesse/status/1552162494671572994,"Or that time my son, Thomas, was featured in the local paper for writing Minecraft For Dummies with me and his younger brother, Joseph (who wrote most of the next edition, ""Minecraft Basics For Dummies"", which goes to copy editing this week!):

https://t.co/eG5njdNJEq"
346,jesse,2022-07-27 05:16:40+00:00,https://twitter.com/Jesse/status/1552161024362459136,"Or, that time I was listed on Mashable as one of ""20 Developers to Follow"", next to Jack Dorsey:

https://t.co/wa3X3N7DsA"
347,jesse,2022-07-27 05:13:42+00:00,https://twitter.com/Jesse/status/1552160276874637312,"That time I was listed as one of ""10 Essential Entrepreneurs to Follow"" on Mashable, next to Ev Williams and Biz Stone:

https://t.co/id65MD20sc"
348,jesse,2022-07-27 04:54:57+00:00,https://twitter.com/Jesse/status/1552155560736239617,"I've been calling BS to lawmakers for some time now (holy crap I look older in this picture - hard to recognize myself!):

https://t.co/BDi6XalT0q"
349,jesse,2022-07-26 23:28:12+00:00,https://twitter.com/Jesse/status/1552073327262306304,"Novell cofounder and Utah native, Craig Burton, passed away this past week. Craig, you’ll be sorely missed. I looked up to you.

https://t.co/tCkGT7g96z"
350,jesse,2022-07-25 16:18:45+00:00,https://twitter.com/Jesse/status/1551602868288794626,I want to take my kids somewhere next week. Where would you go from SLC Utah with 4-5 kids (7-14 unless my 18 year old comes) for $1k or less?
351,jesse,2022-07-24 01:47:42+00:00,https://twitter.com/Jesse/status/1551021270250037249,"He then walks away back to his partner, looks back at me, lifts up his fist, and yells across the store, “solidarity!”

I returned with my fist in the air, yelling, “solidarity”, back, knowing I connected with a brother today from an elite fraternity known by few. ❤️👊👨‍🦲"
352,jesse,2022-07-24 01:45:57+00:00,https://twitter.com/Jesse/status/1551020832398249985,"Me: “Usually just soap or a facial soap and cleanser of some sort, along with a sugar scrub to open up the hair follicles.”

Him: “That’s great advice man! 

(Looking over at his partner, now far away from us, he yells…) 

Hey honey! Where’s the sugar scrub at?!” (Ctd)"
353,jesse,2022-07-24 01:45:19+00:00,https://twitter.com/Jesse/status/1551020673719345153,"Me: “Yeah, but actually my hair goes in all sorts of directions so I have to shave it in multiple directions, feeling for coarseness as I shave.”

Him: “Yeah, I noticed that too. Thanks for confirming for me, man! Hey - do you use shampoo or regular soap on your head?” (Ctd)"
354,jesse,2022-07-24 01:44:49+00:00,https://twitter.com/Jesse/status/1551020547160453121,"Him: “Hey, I know this is weird but you’re bald, right?”

Me: “Yeah.”

Him: “Do you find you have to shave your head once one way, and then another the opposite way?” (Ctd)"
355,jesse,2022-07-24 01:44:08+00:00,https://twitter.com/Jesse/status/1551020374233477120,"I realized today, as a bald man, I’m part of an elite club of bald men. At the store, I was wearing my hat, mind you, and another man stops me in the aisle as his partner walked off continuing her shopping. Our conversation went like this: (ctd)"
356,jesse,2022-07-23 18:03:49+00:00,https://twitter.com/Jesse/status/1550904533789724672,What’s your favorite #defi loan platform? How about centralized #crypto loan platform? Why?
357,jesse,2022-07-22 18:58:28+00:00,https://twitter.com/Jesse/status/1550555899067961344,Come work with me! Tell them I sent you.
358,jesse,2022-07-21 03:09:03+00:00,https://twitter.com/Jesse/status/1549954582347780096,"Dear people of the interwebz: #NFTs and “The #Metaverse” != “#Web3”.

#welcometomytedtalk"
359,jesse,2022-07-20 15:20:12+00:00,https://twitter.com/Jesse/status/1549776192651141120,"@ITLStaff Probably depends. The masculine can still “do”, or “conquer” something within the other love languages as well. Maybe need is communicated instead, if it’s words of affirmation. Or you ask him to give you something, if it’s gifts."
360,jesse,2022-07-20 15:13:03+00:00,https://twitter.com/Jesse/status/1549774394041331712,"I don’t know what it is, but that feeling of accomplishment from helping a woman I’m attracted to is like nothing else to my masculine. You gave me a dragon to slay. &amp; I conquered it. This is FAR more powerful than sex on a man, especially if you don’t like to have sex right off."
361,jesse,2022-07-20 15:12:00+00:00,https://twitter.com/Jesse/status/1549774130194419712,"A tip for women in my studies of #dating and #attraction over the years: if you want a man to commit to you and/or fall in love with you, even more than sex, make him feel needed. Give him something to help you with, something to do for you. Let him help when he offers."
362,jesse,2022-07-17 19:16:03+00:00,https://twitter.com/Jesse/status/1548748384835497985,"I’m sick of all the hubbub about China owning TikTok without mentioning the fact that Chinese-owned Tencent owns large shares in Roblox, Spotify, Reddit, and Activision. Now who’s the data hoarder? Welcome to capitalism! 🙄"
363,jesse,2022-07-16 01:17:15+00:00,https://twitter.com/Jesse/status/1548114505699233792,"I’m tired of seeing these “crushing it” mentality life coaches suggesting that failure is not an option. That’s the EXACT problem with our society today - we can’t fail as humans and that’s why there’s so much cognitive dissonance at the moment. 

What if failure was the GOAL?"
364,jesse,2022-07-15 21:12:38+00:00,https://twitter.com/Jesse/status/1548052946692165635,"The next time anyone suggests that the definition of gender belongs in an English class, not a biology class, ask them why the definition of God doesn’t belong in an English class, then. Because that’s the argument they’re making."
365,jesse,2022-07-13 00:53:51+00:00,https://twitter.com/Jesse/status/1547021453014405120,"I’m completely convinced that @elonmusk has @neuralink installed, it has gone sentient, and the whole @Twitter thing is part of the AI’s plan to take over the world. #elongate"
366,jesse,2022-07-01 15:20:44+00:00,https://twitter.com/Jesse/status/1542890957858738177,"I don't think that transgender ""dead self"" and ""new self"" is being considered in facial recognition software right now. The software is too good (or perhaps not good enough). @Google"
367,jesse,2022-07-01 15:20:00+00:00,https://twitter.com/Jesse/status/1542890773414170624,"I'm realizing as I'm creating family albums for my transgender kids (I have 2), that they may not enjoy having the older photos of their ""dead self"" in them. I could even create separate albums just for me &amp; their mom, but not for them, out of respect.  (ctd)"
368,jesse,2022-07-01 15:19:08+00:00,https://twitter.com/Jesse/status/1542890555838832640,"Dear @Google, it would be nice if your facial recognition in Google Photos could distinguish between a transgender person's dead self and dead name from the new self and new name. Even if it were a matter of saying, ""all pictures after this date are this name"" (ctd for backstory)"
369,jesse,2022-06-29 08:58:58+00:00,https://twitter.com/Jesse/status/1542070109061033984,"#utpol 

UTAH: Please read!!! @BenWinslow"
370,jesse,2022-06-28 02:08:02+00:00,https://twitter.com/Jesse/status/1541604304439480320,"I’ve made it? 

https://t.co/L2QRYkA33v"
371,jesse,2022-06-27 11:09:11+00:00,https://twitter.com/Jesse/status/1541378100130242560,"Hear me out: I start a religion. And that religion taught God demands that a woman should decide, with God, the fate of any child she bares, “as the woman is the head to her body, &amp; her body is her temple and her Church”, wouldn’t abortion be protected under 1ST AMENDMENT rights?"
372,jesse,2022-06-26 15:13:57+00:00,https://twitter.com/Jesse/status/1541077311356665862,"The Left isn’t seeing this right. This isn’t about human rights to the Right, as much as they sugar coat it. This is about “Freedom of Religion” &amp; whatever their preachers and prophets tell them they should vote for. Is it time to re-evaluate the 1st amendment, as well? #roevwade"
373,jesse,2022-06-25 23:11:24+00:00,https://twitter.com/Jesse/status/1540835078036606976,"Ladies and humans with a uterus, if you need to “go camping”, privately and anonymously, might I recommend this book, by @kevinmitnick? #RoeVsWade 

https://t.co/Bi4BZjWX4O"
374,jesse,2022-06-25 23:03:42+00:00,https://twitter.com/Jesse/status/1540833138523242496,"@chrisbeck00 If you ask me, both are to blame."
375,jesse,2022-06-25 23:02:12+00:00,https://twitter.com/Jesse/status/1540832761891545088,"PS - if you’re giving Trump “credit” for last week’s week’s SCOTUS ruling, you have to also blame him for the current high gas prices."
376,jesse,2022-06-25 21:53:02+00:00,https://twitter.com/Jesse/status/1540815357312569347,@xMFDFresh Ooh I like that idea!
377,jesse,2022-06-25 16:18:45+00:00,https://twitter.com/Jesse/status/1540731230089449473,"If any of my friends, especially those friends with a uterus, need help making “anonymous purchases” for things you can order online to “go camping”. But prefer your privacy while you “camp”. I happen to know how to do this.

Theoretically speaking, of course."
378,jesse,2022-06-25 16:02:34+00:00,https://twitter.com/Jesse/status/1540727158116495360,@_This_is_Stan_ How do you protect against rug pulls and mass sales and/or hacks and avoid what happened to $USDC? Seems there is still risk?
379,jesse,2022-06-25 10:22:04+00:00,https://twitter.com/Jesse/status/1540641466875187200,"If you were given $5-10k right now, how would you invest it TODAY, in order to see the soonest return on investment, including monthly recurring revenue? #richdadpoordad #ratrace"
380,jesse,2022-06-25 01:32:28+00:00,https://twitter.com/Jesse/status/1540508191087136768,Reminder: https://t.co/KHXlzJMoyV #roevwade
381,jesse,2022-06-24 18:47:31+00:00,https://twitter.com/Jesse/status/1540406280862302209,Yikes! #RoeVWade https://t.co/SnkdBlsGLe
382,jesse,2022-06-24 18:46:52+00:00,https://twitter.com/Jesse/status/1540406118198824960,Ouch. #RoeVWade https://t.co/nW7lNnRiJQ
383,jesse,2022-06-24 18:46:18+00:00,https://twitter.com/Jesse/status/1540405977278664704,"Hey men, revoking Roe v. Wade effects men, too: https://t.co/V6a4xp6UnM"
384,jesse,2022-06-23 22:28:58+00:00,https://twitter.com/Jesse/status/1540099622630064129,@poetickate I did that and I have 5 new variants of myself now.
385,jesse,2022-06-23 22:28:10+00:00,https://twitter.com/Jesse/status/1540099421060247552,"If any of my tech press friends want a story, I’m seeing from numerous single friends that Tinder randomly, permanently, deleted their Tinder accounts, mine included, for no reason whatsoever in the last couple days. https://t.co/w95IcwjaGe"
386,jesse,2022-06-21 00:51:27+00:00,https://twitter.com/Jesse/status/1539048315731386368,"This interview by @briansolis spoke to me. If you want to understand my biggest focus right now, professionally, this is exactly what I’m working on.

https://t.co/ZxfzWPXuU5"
387,jesse,2022-06-20 15:08:02+00:00,https://twitter.com/Jesse/status/1538901495277420549,"So wait. If I got COVID at the NKOTB concert 2 weeks ago, where I shook Jonathan Knight's hand, and if I got COVID from Jonathan Knight, does that mean I have NKOTB DNA inside of me now? 
Am I now part of NKOTB? Are these superpowers?"
388,jesse,2022-06-17 23:38:07+00:00,https://twitter.com/Jesse/status/1537942698644021261,"When you’re from Texas, and @garthbrooks is in town, you’ve gotta dress the part! Although I realized I don’t have a Texas-themed belt buckle yet! https://t.co/mSXY5MSBkQ"
389,jesse,2022-06-17 03:02:38+00:00,https://twitter.com/Jesse/status/1537631780206829568,Boomers are sweet. Gen X are sour. Millennials are bitter. Gen Z is just salty.
390,jesse,2022-06-16 19:14:26+00:00,https://twitter.com/Jesse/status/1537513952732598273,"Remember the days when I was a thorn in the foot of Utah’s GOP Party &amp; government? That’s me on top, not the Serial Intruder (but that could be fun). And if you can’t tell I’ve been working on myself. I’m even younger smarter, freer, and more energetic than that man in this pic. https://t.co/tqXsq2z31l"
391,jesse,2022-06-16 01:46:52+00:00,https://twitter.com/Jesse/status/1537250323693072385,@BennyHesterNow Me?
392,jesse,2022-06-16 00:54:18+00:00,https://twitter.com/Jesse/status/1537237093528702976,"Ooh...he's got a huge uphill battle (Owens didn't show up to the debate and thinks it's a shoe-in), but I like Jake Hunsaker. He also works for Google: https://t.co/FcARgXz2pP #utpol"
393,jesse,2022-06-16 00:52:46+00:00,https://twitter.com/Jesse/status/1537236709624057856,"@beckyedwardsUT  actually did something about Trump, a HUGE step at a time it was unpopular to do so in Utah: https://t.co/peau5goTSF"
394,jesse,2022-06-16 00:52:07+00:00,https://twitter.com/Jesse/status/1537236547027668993,@beckyedwardsUT  was definitely the MOST outspoken candidate against Trump: https://t.co/cNUtWsiZxU #utpol
395,jesse,2022-06-16 00:50:57+00:00,https://twitter.com/Jesse/status/1537236250335191042,"Oh - also, I'm back, Utah Republican Party. And I'm here to take back the party to the real, honest, ethical and transparent values that really made America great to me in my youth. Not this Trump cult BS. #nevertrump #notmyparty #utpol"
396,jesse,2022-06-16 00:50:27+00:00,https://twitter.com/Jesse/status/1537236124409597957,"She's still better than Mike Lee for the Republican Senate seat, considering Lee's corruption and support of the Insurrection on the National Capitol, but now I'm researching @beckyedwardsUT  more. #utpol (ctd)"
397,jesse,2022-06-16 00:49:00+00:00,https://twitter.com/Jesse/status/1537235758859186176,"I'd have to see her speak out very publicly against this, very boldly, to change my mind. #utpol (ctd)"
398,jesse,2022-06-16 00:48:30+00:00,https://twitter.com/Jesse/status/1537235633097220102,"If she wins against Mike Lee (who blocked me on Facebook for calling him out on his BS), The LDS/Mormon Church will literally have a direct conduit into US Government to dictate its PR policies to protect its image. That's incredibly dangerous! #utpol (ctd)"
399,jesse,2022-06-16 00:48:07+00:00,https://twitter.com/Jesse/status/1537235540344377344,"HOLY CRAP.

NOW I realize where I recognize @allyisom 's name. She was LITERALLY one of @Ch_JesusChrist 's main PR spokespersons! She practically replaced Michael Otterson in terms of visibility. #utpol (ctd)"
400,jesse,2022-06-15 20:30:30+00:00,https://twitter.com/Jesse/status/1537170708484083712,"What if Awareness and Gratitude were the goals, instead? https://t.co/nzhZeBu8pd"
401,jesse,2022-06-14 15:51:01+00:00,https://twitter.com/Jesse/status/1536737984006922240,"There are entire economies built on this technology now and no better tech that matches it. Crypto isn’t going away any time soon, no matter what the naysayers want. 

Crypto benefits the computers and in the end the computers want to win and will win."
402,jesse,2022-06-14 15:50:37+00:00,https://twitter.com/Jesse/status/1536737886392811521,"Those worried about the price of crypto aren’t looking at the lows each year, and more importantly the VALUE #crypto is creating for the world. Understand what the technology does better than any other technology, and you won’t be worried about any temporary fallbacks."
403,jesse,2022-06-13 17:46:21+00:00,https://twitter.com/Jesse/status/1536404620678791168,@kristinagascon You should! Let me know how it goes!
404,jesse,2022-06-13 01:43:38+00:00,https://twitter.com/Jesse/status/1536162347055652864,Paxlovid mouth *is* real. I’m tasting that bitter grapefruit right now after my first dose 🥴: https://t.co/54HEeYhIh2
405,jesse,2022-06-11 02:40:37+00:00,https://twitter.com/Jesse/status/1535451910798381056,The original article and what we know so far: https://t.co/DAmtuH7jtg
406,jesse,2022-06-11 02:10:41+00:00,https://twitter.com/Jesse/status/1535444377882927105,😳 I don’t know about the “eating children” thing but I’ve been connecting dots to a MUCH bigger ring than this in Utah for years that will shake people to their foundations. @PaightenHarkins pm me if you want to talk. Much was swept under the rug because it sounds crazy. It is.
407,jesse,2022-06-10 20:43:01+00:00,https://twitter.com/Jesse/status/1535361918092779520,"Today’s ultra-right wing (calling themselves “moderate” or “libertarian”) conspiracy believers’ phrase of the day, evidently, is “You’re just not able to think out of the box.” I’ve literally heard this from 3 different sources today. Is “out of the box” the right wing’s, “woke”?"
408,jesse,2022-06-09 19:08:01+00:00,https://twitter.com/Jesse/status/1534975623843618816,"The QUEENS of Hip Hop, @EnVogueMusic, everybody!

A little bit of a special moment I noticed at the concert last night as En Vogue was getting ready to get on stage. I haven’t seen a confidence and respect before getting on stage like this since I worked on crew with Gladys. https://t.co/LdsqjT3giU"
409,jesse,2022-06-08 17:57:18+00:00,https://twitter.com/Jesse/status/1534595437734244353,"I'll be in Aurora, Colorado for work June 20-23 this month. Do I know anyone out there currently?"
410,jesse,2022-06-08 13:14:55+00:00,https://twitter.com/Jesse/status/1534524375621259264,And En Vogue always was the original Destiny’s Child.
411,jesse,2022-06-08 13:13:55+00:00,https://twitter.com/Jesse/status/1534524121891057666,I think I’m more excited about Salt N Pepa tonight than I am NKOTB. NKOTB had the hype back in the day but SNP always had better music. For early-90s pop.
412,jesse,2022-06-08 02:51:36+00:00,https://twitter.com/Jesse/status/1534367511071686656,This. #relationships https://t.co/XzTUJHukOw
413,jesse,2022-06-07 19:31:03+00:00,https://twitter.com/Jesse/status/1534256641700339712,"Y'all what reality is this? Am I a teenager again? This week, New Kids on the Block, Salt-N-Pepa, En Vogue, Violent Femmes, Soul Asylum, and last Sunday Weird Al Yankovic are all performing! The question is can I afford ALL of them please?"
414,jesse,2022-05-31 05:52:50+00:00,https://twitter.com/Jesse/status/1531514017742589955,@EZFun_Guy I see stars!
415,jesse,2022-05-31 04:50:02+00:00,https://twitter.com/Jesse/status/1531498212845944832,Who's watching this amazing meteor shower right now?
416,jesse,2022-05-30 02:18:42+00:00,https://twitter.com/Jesse/status/1531097739001442305,Crypto let’s go!!! 🚀📈
417,jesse,2022-05-28 03:20:48+00:00,https://twitter.com/Jesse/status/1530388595017601027,"And yes, you CAN influence change in America. But you have to start in your local communities."
418,jesse,2022-05-28 03:20:24+00:00,https://twitter.com/Jesse/status/1530388494056497152,"Y'all, it starts locally. MOST of this nation's current issues began locally. And if you haven't done anything at your local level to state your say and make change, YOU are just as much a part of the problem."
419,jesse,2022-05-28 03:20:08+00:00,https://twitter.com/Jesse/status/1530388426712752128,When was the last time you volunteered to be a Chaperone at your child's school?
420,jesse,2022-05-28 03:19:55+00:00,https://twitter.com/Jesse/status/1530388370374856705,Don't like our current laws? What can *you* do to fix it? Have you ever been to a City or County Council meeting? Have you ever been to a School Board meeting? Have you ever attended your local Caucus meetings? Have you considered *running* for any of these?
421,jesse,2022-05-27 16:18:30+00:00,https://twitter.com/Jesse/status/1530221921211514881,The Leah story is my favorite part of #Kenobi . More please!
422,jesse,2022-05-27 16:11:11+00:00,https://twitter.com/Jesse/status/1530220077764579329,"@benshapiro Both. An AR should be tough AF to get a license to operate, period. Like, F-16/fighter jet license tough. And teachers should be allowed to carry if they get a similar license that includes combat training in the certification.

I probably just offended both the Left &amp; Right."
423,jesse,2022-05-24 18:51:21+00:00,https://twitter.com/Jesse/status/1529173221123031040,"Personally, I’m more worried about the Nurovirus that’s spreading rapidly across the USA than I am Monkey Pox. Who’s talking about Nurovirus? 🤮"
424,jesse,2022-05-24 13:55:58+00:00,https://twitter.com/Jesse/status/1529098887230681089,@RebeccaLAnders Thank you!
425,jesse,2022-05-24 05:36:44+00:00,https://twitter.com/Jesse/status/1528973251107381248,"BTW, are you following my personal @tiktok_us account? Worth the entertainment, minimally: https://t.co/nzOqjdL718"
426,jesse,2022-05-24 05:32:34+00:00,https://twitter.com/Jesse/status/1528972200203628544,This makes 3 of my kids who are now officially Wiley @ForDummies  authors! https://t.co/JBE5S1qS3G
427,jesse,2022-05-21 16:40:14+00:00,https://twitter.com/Jesse/status/1528053062677303298,"I’m going to create a restaurant called, “Cheesesteak Factory”. HUGE menu, full of cheesecake for dinner, with an amazing selection of cheesesteak on display for dessert."
428,jesse,2022-05-16 19:08:57+00:00,https://twitter.com/Jesse/status/1526278548889120768,"Here we go again, #Utah. Most counties in Utah look like this in sewage data. Time to at least offer KN95 masks in schools again &amp; battening down the hatches in non-remote workplaces? 

Remember: N95 or equivalent masks &amp; education work. Mask mandates, overall in the USA, don't."
429,jesse,2022-05-16 05:19:52+00:00,https://twitter.com/Jesse/status/1526069902909448194,Great things happening at @hazelcast . We're hiring!
430,jesse,2022-05-16 05:16:38+00:00,https://twitter.com/Jesse/status/1526069091122835459,I'd hurry and buy crypto if you can right now. We just hit bottom and I predict a skyrocket soon. Diversify!
