,0,1,2,3
0,jesse,2023-02-16 05:41:47+00:00,https://twitter.com/Jesse/status/1626094469715226624,"Started intermittent fasting this week. I eat from 1pm-9pm. I highly recommend it! Takes some getting used to and being okay with being hungry but as my body has adjusted, my energy is actually up and I’m losing the final fat I was wanting to, thus far.

https://t.co/ffdF6LbfAo"
1,jesse,2023-02-16 05:31:04+00:00,https://twitter.com/Jesse/status/1626091773675155456,All products I review are in my bio. These were given to me for free without expectation. Hey is it time to verify me? With and #consumerelectronics #gadgetreviews #techreviews https://t.co/2cf1G6pY4F
2,jesse,2023-02-16 01:35:09+00:00,https://twitter.com/Jesse/status/1626032400202403843,Lion King wins. Hands down. #sorrymatrix #movierankings #marchmadness https://t.co/dhkhffZw9Q
3,jesse,2023-02-15 23:52:57+00:00,https://twitter.com/Jesse/status/1626006680587878400,"I think it's time I start doing reviews on Fox 13 again. I mostly ended the segments due to COVID &amp; lockdowns. I'm going to start reaching out to tech and consumer electronics companies for review again, and once I have a few, look forward to me making TV appearances again!"
4,jesse,2023-02-15 20:51:46+00:00,https://twitter.com/Jesse/status/1625961087827935245,I’m sorry I’m going to hell for laughing at this. 😂😂😂 #superbowl #rihanna https://t.co/pX34qI2bjW
5,jesse,2023-02-15 20:38:52+00:00,https://twitter.com/Jesse/status/1625957838521774080,@VegasMrr0ng @JoeBiden Except the tech workers had nothing to do with it. You can’t punish tech workers for the stupid decisions of their employers.
6,jesse,2023-02-15 19:34:44+00:00,https://twitter.com/Jesse/status/1625941698869334017,"Someone pointed out to me that records show the plane that landed in front of my house yesterday is owned by Cody Veibell, SVP of Sales for @VivintHome. Was he the pilot? Gotta say that’s service if they make house calls by plane now! @youtah @thedailybeast"
7,jesse,2023-02-15 18:33:43+00:00,https://twitter.com/Jesse/status/1625926343786463232,"if God exists, it will benefit believers to turn to science as they are headed to determined ways to reproduce such miracles in the future. I see no scientific studies on this man. To me we deserve a knowledge why he was healed and how we can reproduce this, guaranteed, every https://t.co/r1kck6kZmr"
8,jesse,2023-02-15 18:31:38+00:00,https://twitter.com/Jesse/status/1625925819557351424,"@JoeBiden Now, can you do something for all those being laid off in Tech right now?"
9,jesse,2023-02-15 17:21:27+00:00,https://twitter.com/Jesse/status/1625908156495802389,"Caption this. Here’s mine: “Hey honey, let’s grab some flowers at Costco while we’re out!” #valentinesdate #costcofinds #ufo Security footage by https://t.co/SNdCZJQNfQ"
10,jesse,2023-02-15 14:44:53+00:00,https://twitter.com/Jesse/status/1625868755703300096,@garyvee My license plate says WEB 3 https://t.co/8R12OmSIsb
11,jesse,2023-02-15 14:42:31+00:00,https://twitter.com/Jesse/status/1625868160640634881,"Can we have a day now where people are jealous of people who are single? Because being single is pretty great, too. And I guarantee my relationship with myself is far better than many of the relationships I see others bragging about on social media…"
12,jesse,2023-02-15 04:03:19+00:00,https://twitter.com/Jesse/status/1625707301075324928,"I've been featured for multiple reasons in a lot of press over my lifetime, but this might be the first time I was quoted on @thedailybeast:

https://t.co/gKV8DgiwAf"
13,jesse,2023-02-15 02:06:22+00:00,https://twitter.com/Jesse/status/1625677870298435584,"News copters finally made it. Swirling overhead. My footage is better, @KSL5TV ;-P"
14,jesse,2023-02-15 01:40:34+00:00,https://twitter.com/Jesse/status/1625671377427787777,Just posted my video streams on Twitter.
15,jesse,2023-02-15 01:39:38+00:00,https://twitter.com/Jesse/status/1625671140550246400,@armano A plane did an emergency landing in front of my house. Does that count?
16,jesse,2023-02-15 01:35:34+00:00,https://twitter.com/Jesse/status/1625670120474570752,Here’s the plane right after landing from my security cameras: https://t.co/69T9wyzPer
17,jesse,2023-02-15 01:34:20+00:00,https://twitter.com/Jesse/status/1625669807818567682,"Here you can see the plane better. Small plane, Bangerter Highway at 106th S:

https://t.co/QjZWwpBOip"
18,jesse,2023-02-15 01:32:32+00:00,https://twitter.com/Jesse/status/1625669354678538241,"I think a plane just crash landed in front of my house:

https://t.co/kqN4FtYrnJ"
19,jesse,2023-02-13 17:34:05+00:00,https://twitter.com/Jesse/status/1625186561523609600,"Is it just me, or does anything with caffeine, including Excedrin, have a much worse effect on me as I get older? Having ADHD, it used to relieve anxiety. Now it causes anxiety and I don’t tolerate it like I used to."
20,jesse,2023-02-12 19:25:09+00:00,https://twitter.com/Jesse/status/1624852126307328002,"oddly, my good friend that was my contact there just took a social media hiatus… #skinwalkerranch #ufos #uaps #balloons https://t.co/9xJzV566lS"
21,jesse,2023-02-11 01:30:13+00:00,https://twitter.com/Jesse/status/1624219221692411906,I’ve had enough TikTok for today. #Horrify https://t.co/AOTfcj92fq
22,jesse,2023-02-09 05:27:18+00:00,https://twitter.com/Jesse/status/1623554110002978819,you’re welcome. #tiktoktips #tiktokfordummies https://t.co/vOWMZjvFWo
23,jesse,2023-02-09 00:31:16+00:00,https://twitter.com/Jesse/status/1623479611408498689,be cautious of these men! #dating #relationships #singledadlife #boundaries https://t.co/g4XgRqSK0J
24,jesse,2023-02-08 23:17:33+00:00,https://twitter.com/Jesse/status/1623461058080907266,This is a major reason guys feel so lonely. We’re only willing to be nice to people we’re attracted to. And our own peers end up neglected as a result. #dobetter #attraction #singledadlife #dating https://t.co/stFUertp88
25,jesse,2023-02-08 02:35:06+00:00,https://twitter.com/Jesse/status/1623148383891521537,"Friends, if you have collections companies coming after you for any type of debt, contact me. They’re scams. I think I’ve figured out the secrets to getting them to leave you alone forever, how to drop any lawsuits they file against you, and even sometimes how to sue THEM."
26,jesse,2023-02-07 20:21:22+00:00,https://twitter.com/Jesse/status/1623054330990403584,#greenfuneral I love this so much! My daughter asked me awhile ago what I wanted them to do when I pass away (I feel old). This right here. And plant all the cool trees and perennials and fungi and sustainable ecosystems with what you get from me!!! #permaculture #theproblemis https://t.co/A7Nwe8442P
27,jesse,2023-02-06 21:29:58+00:00,https://twitter.com/Jesse/status/1622709210390691841,"This story is an important one to get right, because it’s the sad state of many men out there. made a beautiful metaphor out of this song that people keep getting wrong. #lgbtq #ally #menshealth https://t.co/wi6FKWIssQ"
28,jesse,2023-02-05 20:29:01+00:00,https://twitter.com/Jesse/status/1622331481497411585,That moment you realize you’re raising them right… #parenting #singledadlife #brunchthoughts https://t.co/r3Qx1GtsAT
29,jesse,2023-02-05 07:18:50+00:00,https://twitter.com/Jesse/status/1622132627343048704,@elonmusk @teslaownersSV Like a real life Knight Rider??? https://t.co/UeT5ggHunu
30,jesse,2023-02-05 07:17:45+00:00,https://twitter.com/Jesse/status/1622132354461609984,"@Jason Not gonna hook up tonight man, sorry. 😉"
31,jesse,2023-02-05 07:16:33+00:00,https://twitter.com/Jesse/status/1622132053318991873,How many Utah state politicians and legislators are divorced parents? How about at the federal level? I’m unaware of any but I’m trying to assess if this is actually the case. #utpol
32,jesse,2023-02-05 03:30:47+00:00,https://twitter.com/Jesse/status/1622075234110083079,"we need to do something about your boyfriend. Also, did you know he has his own TikTok effect? #singledadlife #singleinutah #dating https://t.co/jMb79VAmjp"
33,jesse,2023-02-05 02:30:07+00:00,https://twitter.com/Jesse/status/1622059966436876288,"Now that I’m officially @TwitterBlue , here’s my theory about the @Tesla CyberTruck:

I think it’s radar proof."
34,jesse,2023-02-04 15:56:03+00:00,https://twitter.com/Jesse/status/1621900400755642368,Now this. 👌 https://t.co/yOyhRMA7Sv
35,jesse,2023-02-04 15:54:30+00:00,https://twitter.com/Jesse/status/1621900009674518529,"Gotta admit, this was funny, too."
36,jesse,2023-02-04 15:46:14+00:00,https://twitter.com/Jesse/status/1621897930251853824,You win.
37,jesse,2023-02-03 19:00:54+00:00,https://twitter.com/Jesse/status/1621584530825175041,Huge!
38,jesse,2023-02-03 17:18:31+00:00,https://twitter.com/Jesse/status/1621558766566084608,"feels like a US disinformation campaign, to me. #politics https://t.co/UmOXEr43lY"
39,jesse,2023-02-02 17:20:38+00:00,https://twitter.com/Jesse/status/1621196912442458115,WAIT…I mean that I’ve witnessed. Although I’ll try anything once so maybe I’m NOT mansplaining?… #onenightinbangkok #youneverknow #comedy https://t.co/ti97QF6yg2
40,jesse,2023-02-01 18:24:08+00:00,https://twitter.com/Jesse/status/1620850501842620417,Reason #1 that TikTok should verify me. Should I do more? Selfie responsibly. #selfiestick #pizzahut #comedy #cameos https://t.co/C1eoRnrXMp
41,jesse,2023-01-31 08:02:14+00:00,https://twitter.com/Jesse/status/1620331609135136768,"""Remember that you are the creator of your own destiny. Believe in yourself and never let anyone or anything stand in the way of your dreams!"" #empowerment #believe #motivation"
42,jesse,2023-01-30 21:23:47+00:00,https://twitter.com/Jesse/status/1620170936464056322,we need answers! https://t.co/bLBvu5MjOQ
43,jesse,2023-01-30 10:08:24+00:00,https://twitter.com/Jesse/status/1620000972830543873,@Cobratate The responses give me hope for humanity. 👌
44,jesse,2023-01-30 08:02:31+00:00,https://twitter.com/Jesse/status/1619969291977121794,"""Life is 10% what happens to you, and 90% how you respond. Choose wisely."" #perspective #empowerment #inspiration"
45,jesse,2023-01-30 05:22:48+00:00,https://twitter.com/Jesse/status/1619929097429196803,I don’t get it. #jesseruinseverything https://t.co/YIppRM8ZPV
46,jesse,2023-01-30 02:20:11+00:00,https://twitter.com/Jesse/status/1619883143191793665,Jesse ruins everything. #magichowtos https://t.co/DdXTeTWhdv
47,jesse,2023-01-29 08:01:23+00:00,https://twitter.com/Jesse/status/1619606620127875075,"""When faced with a challenge, take a deep breath, focus on the positives and remember that you have the power to succeed. #StayStrong #AchieversNeverGiveUp"""
48,jesse,2023-01-28 08:01:38+00:00,https://twitter.com/Jesse/status/1619244293960486914,"""Knowledge is the key to unlocking a brighter future. Work hard, dream big and never give up on your goals 💪 #StayMotivated #DreamBig #LearnSomethingNew"
49,jesse,2023-01-27 08:02:18+00:00,https://twitter.com/Jesse/status/1618882075293093888,"""Choose courage over comfort. That's how progress is made. #inspiration #motivation #courage"
50,jesse,2023-01-26 12:28:08+00:00,https://twitter.com/Jesse/status/1618586586094112774,"@SpencerJCox Now do that survey again and use the term, “Mormon”, and see how that changes. Then separate those that actually know one from those that don’t. We have that data. The current church threw it all away after I left employment."
51,jesse,2023-01-26 08:02:09+00:00,https://twitter.com/Jesse/status/1618519647078211584,"""Never be afraid to turn the page, for a new and exciting chapter of your life awaits you!"" #Inspiration #MondayMotivation"
52,jesse,2023-01-25 08:02:33+00:00,https://twitter.com/Jesse/status/1618157359469035520,"Creativity isn't just about making something new, it's about finding new ways to make the world a better place. #Inspiration #Creativity #Positivity"
53,jesse,2023-01-25 05:17:27+00:00,https://twitter.com/Jesse/status/1618115814082891776,"If they hired you, but didn’t need you in the first place, isn’t that a management problem? Seems way more money could be saved by firing management. https://t.co/A8mnLdkI5b"
54,jesse,2023-01-24 19:15:11+00:00,https://twitter.com/Jesse/status/1617964245676703744,I see nothing new here. #uselessinventions #comedy https://t.co/KWhJvCZGSG
55,jesse,2023-01-24 08:02:02+00:00,https://twitter.com/Jesse/status/1617794843878490112,"""No matter how hard life may seem, never give up on your dreams. There is always a way to make them come true; don’t let anyone tell you otherwise!"" #Motivation #Inspiration #Dreams #Believe"
56,jesse,2023-01-24 07:17:00+00:00,https://twitter.com/Jesse/status/1617783509028044804,"This has been fun. My Facebook Page. Just the last week. I’ll share what I did later. All of my social engagement is through the roof now.

I’ve still got it. When I want it. https://t.co/3Yphmw2llC"
57,jesse,2023-01-23 08:02:24+00:00,https://twitter.com/Jesse/status/1617432546794422272,"""Each day offers a chance to be our best selves and make the world a better place. #positivethinking #inspiration"""
58,jesse,2023-01-23 05:43:37+00:00,https://twitter.com/Jesse/status/1617397622142271493,"For 1.2k followers, my views and engagement on Pinterest aren’t too shabby. When working w/ influencers, are you looking for followers, or engagement?

Looking for influencers that truly engage &amp; convert, or influencers looking for more engagement? I can help! Been in both shoes. https://t.co/ToKDFFOgro"
59,jesse,2023-01-22 08:01:21+00:00,https://twitter.com/Jesse/status/1617069897502056449,Change starts with a single thought. Embrace the power of dialogue and use it to spark meaningful progress. #SmartThoughts #ChangeStartsNow
60,jesse,2023-01-21 08:01:10+00:00,https://twitter.com/Jesse/status/1616707463608147969,"""When you believe in yourself, anything is possible. Take a leap of faith and trust in your own abilities to make it happen."" #inspirationalquotes #believeinyourself"
61,jesse,2023-01-20 08:02:17+00:00,https://twitter.com/Jesse/status/1616345355695656963,"""A great life is created by a mindset of resilience, optimism and growth. #MindsetMatters #BeInspired"
62,jesse,2023-01-19 16:41:57+00:00,https://twitter.com/Jesse/status/1616113747445297152,I just used a similar technique on my current employer's website (I lead Web Marketing for the company) that I used to thwart chat spammers on https://t.co/Slq9iXaOY6 back in the day. It's usually pretty effective - let me know if your company needs help thwarting lead spam!
63,jesse,2023-01-19 08:02:09+00:00,https://twitter.com/Jesse/status/1615982933772304384,"""Setting lofty goals can be intimidating, but remember that they are there to challenge and motivate you to reach your full potential. #DreamBig #Inspiration"""
64,jesse,2023-01-18 13:05:21+00:00,https://twitter.com/Jesse/status/1615696846579707904,"The worst part of freedom is the insane number of people trying to take it back from you, once you have it."
65,jesse,2023-01-18 08:01:56+00:00,https://twitter.com/Jesse/status/1615620492664225792,"Remember, you are the only one who has the power to make your dreams come true. #BelieveInYourself #StayMotivated #YouveGotThis"
66,jesse,2023-01-17 08:02:28+00:00,https://twitter.com/Jesse/status/1615258236164182018,You have the power to create the life you want. Believe in yourself and make it happen! #inspiration #motivation
67,jesse,2023-01-17 05:01:47+00:00,https://twitter.com/Jesse/status/1615212768906608641,@KUTV2News Alert @yunggravy
68,jesse,2023-01-16 08:02:08+00:00,https://twitter.com/Jesse/status/1614895764165038081,"""If you want to make it to the top, dream big and never give up. Success is waiting around the corner!"" #motivation #success #inspiration"
69,jesse,2023-01-16 05:56:07+00:00,https://twitter.com/Jesse/status/1614864053733822474,"FYI, I’m taking small profits off my crypto right now. All indicators show we’re in a temp pump, where everyone who was shorting @ the previous lows is being liquidated. Hard to say when, but we may remain stagnant &amp; then go down, or go down again tomorrow. #notafinancialadvisor"
70,jesse,2023-01-15 15:27:06+00:00,https://twitter.com/Jesse/status/1614645357492961282,"“Pain is not tragic. Pain is magic. Suffering is tragic. Suffering is what happens when we avoid pain and consequently miss our becoming.”

—Glennon Doyle, Untamed"
71,jesse,2023-01-15 08:00:57+00:00,https://twitter.com/Jesse/status/1614533080630394883,"""No goal is too big if you make the effort to reach it. Take the steps today to achieve success tomorrow!"" #NeverGiveUp #Inspiration #Goals"
72,jesse,2023-01-14 08:01:28+00:00,https://twitter.com/Jesse/status/1614170821785788416,"""Push yourself to be the best you can be- life is a journey, not a race. #inspiration #motivation"""
73,jesse,2023-01-13 21:05:25+00:00,https://twitter.com/Jesse/status/1614005721338900482,@ThatMumboJumbo My kids showed me that you reacted to an old book in the For Dummies series! DM me and we can work on creating an updated one!
74,jesse,2023-01-13 08:02:16+00:00,https://twitter.com/Jesse/status/1613808635200536576,"""There isn't a single challenge you can't face with courage, resilience, and perseverance. Believe in yourself, and you can achieve anything!"" #motivation #inspiration"
75,jesse,2023-01-12 08:00:59+00:00,https://twitter.com/Jesse/status/1613445926676299777,"""Life is short so never give up. Work hard, set goals, and celebrate your successes - no matter how small they are!"" #motivation #success"
76,jesse,2023-01-11 08:01:08+00:00,https://twitter.com/Jesse/status/1613083576215412736,"If you want to reach your potential, don't focus on what you can't do - focus on what you can do to make your dreams a reality. #DreamBig #Inspiration #motivation"
77,jesse,2023-01-10 08:01:53+00:00,https://twitter.com/Jesse/status/1612721376078462980,The best way to make yourself look smart is to fill your life with learning and knowledge. #inspiration #neverstopgrowing
78,jesse,2023-01-09 08:02:08+00:00,https://twitter.com/Jesse/status/1612359050762637312,Everything worth having in life is worth working hard for. #StayMotivated #StayDetermined #TheGrind
79,jesse,2023-01-08 08:01:03+00:00,https://twitter.com/Jesse/status/1611996388555997185,The best way to success is to always keep learning and never give up. #inspiration #motivation #success
80,jesse,2023-01-07 08:00:58+00:00,https://twitter.com/Jesse/status/1611633980129902592,"""The only limits to success are the ones we place on ourselves- so break through and reach for the stars!"" #motivation #inspiration #success"
81,jesse,2023-01-07 00:15:42+00:00,https://twitter.com/Jesse/status/1611516893780930560,"I think I need a shower. Just found a chip in my beard. 

It was delicious. #foodstorage"
82,jesse,2023-01-06 19:06:18+00:00,https://twitter.com/Jesse/status/1611439031426109441,"Hey @UtahGov and @SpencerJCox, the ORS website design sucks, functionally. Have you run it for color blindness or other disabilities before? You're prone to lawsuit by not fixing this. PM me and I'm happy to consult: https://t.co/TFyzcIpAZU"
83,jesse,2023-01-06 08:02:25+00:00,https://twitter.com/Jesse/status/1611271957902757890,"""The path to success is never smooth, but courage and resilience will carry you through each challenge. #StayStrong #Inspiration"""
84,jesse,2023-01-05 17:43:00+00:00,https://twitter.com/Jesse/status/1611055679669927938,"The dating market is so bad right now that not only is it full of Avoidants, even the Anxious are Avoidant!

#attachmenttheoryhumor"
85,jesse,2023-01-05 08:02:28+00:00,https://twitter.com/Jesse/status/1610909582338949120,"The only way to success is to keep pushing through the challenges, no matter how hard it may seem. #DreamBig #StayMotivated #BeInspired"
86,jesse,2023-01-04 08:02:26+00:00,https://twitter.com/Jesse/status/1610547188211367937,"""You have the power to create your own future. Believe in yourself and never let go of your dreams. #motivation #inspiration #believeinyourself"
87,jesse,2023-01-03 08:01:52+00:00,https://twitter.com/Jesse/status/1610184654635651072,"""The only way to reach your goals is to take action &amp; never give up. Believe in yourself &amp; pursue your dreams - You can achieve anything!"" #GoForIt #NeverGiveUp #BelieveInYourself"
88,jesse,2023-01-02 08:01:46+00:00,https://twitter.com/Jesse/status/1609822243831353345,"""It's easy to get lost in the daily grind, but remember – greatness lies in every moment and opportunity. #StayInspired #Grow #Achieve"""
89,jesse,2023-01-01 08:01:50+00:00,https://twitter.com/Jesse/status/1609459871312642049,"""Every successful journey begins with a single step. Take the first step, and the opportunities will start pouring in. #motivation #entrepreneurship"""
90,jesse,2022-12-31 08:01:26+00:00,https://twitter.com/Jesse/status/1609097382230167552,"Success is a journey, not a destination. Embrace the process and cultivate a growth mindset to ensure you reach your fullest potential. #Inspiration #MindsetMatter"
91,jesse,2022-12-30 08:12:51+00:00,https://twitter.com/Jesse/status/1608737868691959810,"For my single friends, work on yourselves! This is the secret to succeeding on dating apps.

TLDR; “In other words, a person who is happy outside their relationship is far more likely to be happy inside their relationship, as well.”

https://t.co/XyYeLCpULg"
92,jesse,2022-12-30 08:01:48+00:00,https://twitter.com/Jesse/status/1608735087914369026,"""The key to success is to take action and never give up - nothing is impossible if you have the courage to dream it!"" #BeInspired #SuccessMindset"
93,jesse,2022-12-30 01:54:50+00:00,https://twitter.com/Jesse/status/1608642737309634560,@poetickate Eat his cheesecake!
94,jesse,2022-12-29 08:02:11+00:00,https://twitter.com/Jesse/status/1608372797025165313,"No matter what challenges you face, never lose sight of your goals. With hard work, dedication, and perseverance, anything is possible! #inspiration #motivation"
95,jesse,2022-12-28 08:02:17+00:00,https://twitter.com/Jesse/status/1608010435722084352,"No matter how difficult the challenge, stay focused and keep going. You can achieve great things if you put your mind to it! #LifeLessons #BeInspired"
96,jesse,2022-12-28 07:31:01+00:00,https://twitter.com/Jesse/status/1608002564116877312,I should mention that my first Facebook apps were apps for Mormons and other religious people…
97,jesse,2022-12-28 07:28:48+00:00,https://twitter.com/Jesse/status/1608002009428525056,"Hmm…interesting. I’ve been wanting to play w/ making TikTok effects for awhile now but haven’t had time. Those long timers know that I became known in my career for building FB apps in the early days of FB. I think I might have some fun with this… 🤔

https://t.co/SZYFALSfXC"
98,jesse,2022-12-27 08:01:42+00:00,https://twitter.com/Jesse/status/1607647898623217666,"""The key to success is to never give up - if you work hard and stay focused, you can achieve anything!"" #StayDetermined #NeverGiveUp #Motivation"
99,jesse,2022-12-26 08:00:56+00:00,https://twitter.com/Jesse/status/1607285319073677312,"""Success is not just about achieving your goals, it's about creating a path to those goals that makes you become the person you need to be along the way."" #motivation #Inspiration #Success"
100,jesse,2022-12-26 06:11:30+00:00,https://twitter.com/Jesse/status/1607257777159929856,"Ahh…December 26th and 27th, when the entire population of #Utah single moms suddenly become kid free, while the single dads are suddenly needing babysitters to rectify this issue… @SpencerJCox 

#utahnewstheydonttellyou #weneeddefault50percentcustody"
101,jesse,2022-12-25 17:08:25+00:00,https://twitter.com/Jesse/status/1607060709929816065,"@BartEhrman sums up precisely why I, as a former Christian-turned Atheist, still choose to celebrate Christmas: https://t.co/9JJvMDEVAb"
102,jesse,2022-12-25 08:44:50+00:00,https://twitter.com/Jesse/status/1606933978027790336,@JenaiHuff @innoutburger 🙏
103,jesse,2022-12-25 08:44:07+00:00,https://twitter.com/Jesse/status/1606933798935212032,@jono_photo @official2XIST I wish I was that young
104,jesse,2022-12-25 08:43:06+00:00,https://twitter.com/Jesse/status/1606933544101871617,@BleedsBlueNGold Thank you. I have 7 and 4 still at home when with me.
105,jesse,2022-12-25 08:00:35+00:00,https://twitter.com/Jesse/status/1606922843958263812,"""The key to success is not to give up, no matter the odds. Believe in yourself and never lose sight of your goal. #StayFocused #FindYourPath"""
106,jesse,2022-12-25 04:35:25+00:00,https://twitter.com/Jesse/status/1606871209647673344,"7 (last). So if this inspires you, go do the same at your favorite drive through this Christmas. Let’s all keep the chain going and may it never stop! I’ll post video on the clock app, @jessestay there.

Merry Christmas and Happy Holidays to all! I hope this brightens your day ♥️"
107,jesse,2022-12-25 04:33:14+00:00,https://twitter.com/Jesse/status/1606870659631837185,"6. As the truck in front of me picked up their food, he waved back out of his window, and I waved back yelling, “Merry Christmas!” It was at that point I noticed the military stickers on their truck. 

Their continuing the chain made them the true hero tonight.

Ctd…"
108,jesse,2022-12-25 04:30:42+00:00,https://twitter.com/Jesse/status/1606870024354156544,"5. I got up to the payment window and the person said, “Guess what? You’ve started a chain! They all decided to pay for the cars behind you and we’re hoping that chain continues.”

Evidently it made those working on Christmas Eve‘s night as well. Mission accomplished.

ctd…"
109,jesse,2022-12-25 04:27:51+00:00,https://twitter.com/Jesse/status/1606869305588862976,"4. As the veteran in front of me got to the window I noticed he paid for something and I was suddenly worried that he refused. Or hopefully he wasn’t paying for mine!

Ctd…"
