,0,1,2,3
453,@bethnoveck,2021-07-05 15:21:35+00:00,https://twitter.com/bethnoveck/status/1412069153574371328,"@carlmalamud ""Good-bad cake"" aka the kind they sell in supermarkets...so delicious."
454,@bethnoveck,2021-07-04 22:22:55+00:00,https://twitter.com/bethnoveck/status/1411812794815688707,"Davos is dead, and the coronavirus killed it https://t.co/nMnHROJX98 via @financialtimes @Feleaks"
455,@bethnoveck,2021-07-02 23:38:06+00:00,https://twitter.com/bethnoveck/status/1411106940931948552,Woo hoo
456,@bethnoveck,2021-07-02 22:20:35+00:00,https://twitter.com/bethnoveck/status/1411087432276193280,"Jeff Bezos is bringing an aviation legend with him to space—and she's been waiting for this moment for 60 years, @marinakoren writes. ""Taking Funk on this ride may be a great PR stunt, but at its core, it’s a real gift, to a real person."" https://t.co/6OpChbFSaI"
457,@bethnoveck,2021-07-02 15:46:01+00:00,https://twitter.com/bethnoveck/status/1410988136155566080,Why Understanding Virtual World Economies Is So Important. https://t.co/qkVLdKHQV3 @slhamlet @jackbalkin #stateofplay #blastfromthepast
458,@bethnoveck,2021-07-01 16:17:35+00:00,https://twitter.com/bethnoveck/status/1410633693845245959,Join me on July 22 at 5 pm EST for a @TheGovLab @nyu_ipk Future of Democracy conversation with @BrookingsInst Paul Light about the future of government reform. RSVP here. https://t.co/5KT68PrIQS @DavidSchoenbrod @CommonGood @PhilipKHoward
459,@bethnoveck,2021-07-01 11:44:47+00:00,https://twitter.com/bethnoveck/status/1410565041129201664,🚨🚨🚨 Job Opportunity: @MetroLabNetwork is seeking an Executive Director to lead the organization. Great opportunity to drive progress in cities and communities. Learn more about the role https://t.co/SYIGjr8K7r
460,@bethnoveck,2021-06-24 19:20:34+00:00,https://twitter.com/bethnoveck/status/1408143027076534275,7 skills you need if you want to solve public problems (a quick excerpt from my newest book) https://t.co/Uatejh1XaS @FastCompany
461,@bethnoveck,2021-06-18 00:16:48+00:00,https://twitter.com/bethnoveck/status/1405680862558105601,States and Localities Should Strengthen Data Analytics Capacity Using Rescue Plan Funds https://t.co/Iqd4sU1fu6 @APHSA1
462,@bethnoveck,2021-06-17 20:50:38+00:00,https://twitter.com/bethnoveck/status/1405628978736545801,"Exciting news in higher ed! @MillsCollege partners with @Northeastern ""Our goal is to combine our two institutions so that, together, we can expand Mills’ core strengths, including advancing student access, women’s leadership, equity, and social justice."""
463,@bethnoveck,2021-06-09 21:29:23+00:00,https://twitter.com/bethnoveck/status/1402739628172615690,Here's one of several interactive worksheets for identifying the root causes of the problem you are trying to tackle: https://t.co/KuttMKCwVv @nprnews
464,@bethnoveck,2021-06-09 21:27:18+00:00,https://twitter.com/bethnoveck/status/1402739101342867461,"The @VP is focusing on the root causes of migration in order to solve the problem ""upstream."" Learning how to identify root causes and know which ones to tackle and how is one of the key skills a public problem solver needs to learn. We teach how at: https://t.co/yjOfHAGjxW"
465,@bethnoveck,2021-06-09 20:37:16+00:00,https://twitter.com/bethnoveck/status/1402726512600682499,"Spot on review in @ScienceMagazine of Solving Public Problems: A Practical Guide to Fix Our Government and Change Our World ""She emphasizes participatory elements...and she encourages training in quantitative and qualitative scientific techniques."" https://t.co/9VJe3J4zct"
466,@bethnoveck,2021-06-09 20:33:59+00:00,https://twitter.com/bethnoveck/status/1402725687404937219,"Very exciting! My new book Solving Public Problems
A Practical Guide to Fix Our Government and Change Our World is now out on Kindle from @yalepress ! https://t.co/wr59aqsSqy"
467,@bethnoveck,2021-06-08 23:14:54+00:00,https://twitter.com/bethnoveck/status/1402403792990126085,"@icehockeymike37 @icehockeystick No, it is correct. This student was likely an African-American member of this group not an Israeli: https://t.co/Rplwd3R4sK. Thus, the hate crime here was rooted in both race and anti-Semitism."
468,@bethnoveck,2021-06-08 23:10:07+00:00,https://twitter.com/bethnoveck/status/1402402589212393473,Props to @dudurudh for finding this image! Now you'll NEVER forget the point.
469,@bethnoveck,2021-06-08 22:57:40+00:00,https://twitter.com/bethnoveck/status/1402399457405190150,"Where is there, you ask? #Kidpundit, of course.  https://t.co/vg5qXGUGaX"
470,@bethnoveck,2021-06-05 23:25:55+00:00,https://twitter.com/bethnoveck/status/1401319404042850304,"APPLY! @RussellSageFdn BehavioralEconomics seeks to broaden understanding of social, economic and political consequences of behavioral interventions. Contact me if wanting to conduct applied research with @NJInnovation @NJGov  https://t.co/Lv75Ijc4OJ"
471,@bethnoveck,2021-06-05 17:35:54+00:00,https://twitter.com/bethnoveck/status/1401231318810337280,"Federal Unemployment  Is Now a Political Lightning Rod ""Employers tend to take a negative view of people who have been out of work for an extended period"" https://t.co/sotYjCHYR6  @heldrichcenter"
472,@bethnoveck,2021-06-04 12:56:51+00:00,https://twitter.com/bethnoveck/status/1400798703020040197,“We Need to Reimagine the Modern Think Tank” Nicely captures why @thegovlab we have always been a participatory “do tank” not a think tank https://t.co/fMkZwdEUel via @SSIReview
473,@bethnoveck,2021-06-04 01:25:23+00:00,https://twitter.com/bethnoveck/status/1400624690268409866,"This is good news as this algorithm caused doctors to push women of color toward c-sections thereby perpetuating disparities. ""Black women are three to four times more likely to die from pregnancy-related causes than white women."""
474,@bethnoveck,2021-06-03 22:24:38+00:00,https://twitter.com/bethnoveck/status/1400579203528118274,The @CityofAthens @synathina project is a prime example of citizen engagement for solving urban challenges that works and outlasts changes in political administrations. Find out why!
475,@bethnoveck,2021-06-03 22:04:57+00:00,https://twitter.com/bethnoveck/status/1400574250315100163,"Wonderful news, @lrainie. @pewinternet goes #opendata. Let's hope others follow suit."
476,@bethnoveck,2021-06-03 15:25:18+00:00,https://twitter.com/bethnoveck/status/1400473676659691525,Interesting UX. This is the 10-90 rule. ⁦@USPS default package⁩ shipping options: day old poultry or cremated remains??! https://t.co/j1bP1FsYpe
477,@bethnoveck,2021-05-30 21:41:04+00:00,https://twitter.com/bethnoveck/status/1399118687597105154,Awww. Rats!
478,@bethnoveck,2021-05-30 02:52:10+00:00,https://twitter.com/bethnoveck/status/1398834592791072771,"Videos Show the Violent, and Deadly, Ways Colombian Police Quell Protests https://t.co/vwyXibr7pb"
479,@bethnoveck,2021-05-29 21:14:02+00:00,https://twitter.com/bethnoveck/status/1398749499066044417,"“Demonstrations that began two weeks ago as anger over pandemic-related tax reforms have intensified and spread, turning into a collective howl of outrage over abuses by the national police force.” Colombia’s Police Force, Built for War, Finds a New One https://t.co/960aJh0CSQ"
480,@bethnoveck,2021-05-27 12:31:29+00:00,https://twitter.com/bethnoveck/status/1397893218776358918,"POSTDOC IN CHILE @AdolfoIbanez Ethical standards in the design and procurement of automated decision making systems  https://t.co/0ubiejkq37 Applications are open until June 30th, 2021. @AINowInstitute @medialab @usamaf @NuLawLab @_VictoriaAlsina"
481,@bethnoveck,2021-05-26 22:41:56+00:00,https://twitter.com/bethnoveck/status/1397684453431037956,BREAKING NEWS! @TheGovLab Senior Fellow @_VictoriaAlsina named Minister of Foreign Affairs and Transparency of Catalonia. Congratulations!
482,@bethnoveck,2021-05-26 22:38:35+00:00,https://twitter.com/bethnoveck/status/1397683614230458369,Awaiting anxiously! #kidpunditfanclubpresident
483,@bethnoveck,2021-05-26 22:37:51+00:00,https://twitter.com/bethnoveck/status/1397683425750835200,"""There’s no going around parents. Teachers must work with them and through them, or children will fall further behind with every passing day. The bad news? Most teachers and parents are ill-prepared to collaborate."" https://t.co/sB1fdurWxG @The74 @AleGibesDeGac"
484,@bethnoveck,2021-05-23 14:17:04+00:00,https://twitter.com/bethnoveck/status/1396470236195459073,Fandom as a tool for social change @reallovepunk  https://t.co/aGzBNLZaU1 #solvingpublicproblems
485,@bethnoveck,2021-05-23 14:11:51+00:00,https://twitter.com/bethnoveck/status/1396468926352142338,Congratulations!!!! Wonderful news.
486,@bethnoveck,2021-05-21 13:08:48+00:00,https://twitter.com/bethnoveck/status/1395728282436444165,APPLY! @NJGov Future of Work Accelerator seeking innovators from everywhere to pilot innovations that improve lives of workers and conditions of work in NJ. https://t.co/ZmA74E6omH @AFLCIO @SEIU @ilo @WorkingFamilies @MauriceWFP @medialab @SolveMIT @Changemakers @ShuttleworthFdn
487,@bethnoveck,2021-05-21 12:41:38+00:00,https://twitter.com/bethnoveck/status/1395721444710133763,"Check out @inCitu_AR pilot project with Manhattan Community Board 5, using AR/VR to engage the public in the MSG Relocation Proposal https://t.co/Lrw9zyfHMH"
488,@bethnoveck,2021-05-20 17:08:04+00:00,https://twitter.com/bethnoveck/status/1395426107839721475,READ! Federal data is key to optimal governance and business — open it with public input https://t.co/h1ePhKyvZi @JoelGurin #opendata
489,@bethnoveck,2021-05-20 15:39:33+00:00,https://twitter.com/bethnoveck/status/1395403832822222848,"CONFERENCE: Value of Science: Data, Products &amp; Use
June 23-24,2021 https://t.co/yGcMToG6Ya"
490,@bethnoveck,2021-05-19 00:03:32+00:00,https://twitter.com/bethnoveck/status/1394805885705273349,"Sign up to be part of the @NJGov @theRSAorg @theworkerslab Future of Work Accelerator. Come from anywhere, pilot in NJ https://t.co/3ckeDkGS19"
491,@bethnoveck,2021-05-18 20:37:35+00:00,https://twitter.com/bethnoveck/status/1394754056833359873,Help #newjersey unemployed workers get back to work by contributing to the New Start Career Network. #donate today at: https://t.co/pZBGPNpcOM @heldrichcenter
492,@bethnoveck,2021-05-10 19:18:29+00:00,https://twitter.com/bethnoveck/status/1391835050577207311,"APPLY! Got an innovation app, method, curriculum, process, service to improve the lives of workers? https://t.co/O6VaYriuNM"
493,@bethnoveck,2021-05-08 17:23:41+00:00,https://twitter.com/bethnoveck/status/1391081381875302403,The definitive taxonomy of academic publications!
494,@bethnoveck,2021-05-06 00:06:18+00:00,https://twitter.com/bethnoveck/status/1390095543003648000,.@GovMurphy Announces Inaugural Future of Work Accelerator to Spur Innovations that Improve Worker Economic Security and Well-Being - Insider NJ - https://t.co/31U2toAnYP
495,@bethnoveck,2021-05-05 22:58:15+00:00,https://twitter.com/bethnoveck/status/1390078416620335111,🧑‍💼🧑‍⚕️👨‍🌾👨‍🏭 JOB! Future of Work Fellow @NJGov Office of Innovation. Want to work on implementing lifelong learning and innovative policies and platforms to promote meaningful work? https://t.co/y8ZSvDse7k @MILR_Cornell @princetonalumni  @rutgersalumni @montclairstateu @ILO_NewYork
496,@bethnoveck,2021-05-05 21:12:11+00:00,https://twitter.com/bethnoveck/status/1390051723700547586,Lucky @VanderbiltU! Congrats.
497,@bethnoveck,2021-05-04 21:17:10+00:00,https://twitter.com/bethnoveck/status/1389690589554348034,"Hey entrepreneurs! Got an app/venture/innovation that improves job quality and economic security for working families?

Apply to Future of Work Accelerator to take it to the next level! Applications open Spring 2021. Visit: https://t.co/X5Qk3lKOW6"
498,@bethnoveck,2021-05-04 21:14:43+00:00,https://twitter.com/bethnoveck/status/1389689975118180352,APPLY! Join the inaugural @NJGov Future of Work Accelerator to take your idea for improving the lives of workers to the next level (you don't have to be from New Jersey)  https://t.co/9dDrtOX9Vw @theRSAorg @RSAMatthew @ILO_NewYork @ilo @AFLCIO @RWDSU @CNTR4growth @LuminaFound
499,@bethnoveck,2021-04-30 19:35:29+00:00,https://twitter.com/bethnoveck/status/1388215448928456710,JOB: @MarconiSociety seeking  a Program Manager https://t.co/d0TquLe1Rm
500,@bethnoveck,2021-04-29 19:01:25+00:00,https://twitter.com/bethnoveck/status/1387844487062376448,"Forget Citizen Kane, now YOU can make the greatest video of all time....about getting vaccinated! @GovMurphy   Announces the “Your Voice, Your Shot” Video Contest - https://t.co/FcxnovI2Ss"
501,@bethnoveck,2021-04-28 18:57:53+00:00,https://twitter.com/bethnoveck/status/1387481209027055617,JUST OUT! From @BKCHarvard @ugasser German Digital Council (Digitalrat): An ‘Inside-Out’ Case Study https://t.co/aKGnnkpBbQ @DIEZEIT @BehoerdenNews @dwnews @TheGovLab
502,@bethnoveck,2021-04-27 21:14:13+00:00,https://twitter.com/bethnoveck/status/1387153131373580289,"For parents and caregivers who want to exercise your voice and share what you think are the most important changes schools need, please weigh in at https://t.co/bPCnSxxRWs"
503,@bethnoveck,2021-04-27 20:46:42+00:00,https://twitter.com/bethnoveck/status/1387146206435028994,"During COVID-19, parents have gotten a first hand view of their children's education and they are demanding more. Read @AJC617 @newprofit piece on parent power and systems change in education."
504,@bethnoveck,2021-04-27 16:29:35+00:00,https://twitter.com/bethnoveck/status/1387081502572400642,"Tech tools help deepen citizen input in drafting laws abroad and in U.S. states https://t.co/slGoJUAdWw
Congress’ embrace of technology is slow, hampered by tradition
https://t.co/VYbiaLOi5s #crowdlaw @TheGovLab"
505,@bethnoveck,2021-04-27 16:20:57+00:00,https://twitter.com/bethnoveck/status/1387079331504082949,RSVP! Please join me and @NYUWagner @BrookingsInst @BrookingsGov expert Paul Light talking about the future of government reform next Thursday 5/6 at 5pm @TheGovLab @nyu_ipk Future of Democracy series. @digiphile @PhilipKHoward @CommonGood @xavbriggs @DavidSchoenbrod
506,@bethnoveck,2021-04-26 21:45:27+00:00,https://twitter.com/bethnoveck/status/1386798605198000129,"Important piece on why we must also invest in civic and social infrastructure to strengthen civil society, social cohesion and democratic culture ⁦@EricKlinenberg⁩ ⁦@nytopinion⁩  https://t.co/PfiKIYVemP"
507,@bethnoveck,2021-04-22 15:26:07+00:00,https://twitter.com/bethnoveck/status/1385253592668454913,APPLY! Job opening @TheGovLab is hiring a #CrowdLaw Fellow to deepen and expand our work on tech-enabled citizen engagement in lawmaking https://t.co/XvUqauJVmX
508,@bethnoveck,2021-04-21 19:56:57+00:00,https://twitter.com/bethnoveck/status/1384959359629897732,"JOB OPPORTUNITY! Future of Work Policy and Engagement Fellow at the NJ Office of Innovation. Come join us to work on lifelong learning and innovation for worker rights, worker safety and worker voice. https://t.co/mVjVZLXz4w"
509,@bethnoveck,2021-04-20 17:08:16+00:00,https://twitter.com/bethnoveck/status/1384554523839062018,Check out this first part in a two-part series on how foreign and state legislatures are using new technologies to bring more citizen participation into lawmaking.  Read about exciting work in @NJGov @NJDOE @v_taiwan @ITSriodejaneiro https://t.co/Z27BfMkNsP
510,@bethnoveck,2021-04-20 17:06:43+00:00,https://twitter.com/bethnoveck/status/1384554130690252803,Tech tools help deepen citizen input in drafting laws abroad and in states https://t.co/wiu2abCPha #crowdlaw @rollcall @TheGovLab
511,@bethnoveck,2021-04-10 18:04:41+00:00,https://twitter.com/bethnoveck/status/1380944840402296832,"In response to ""As a student, which is more important for the schools in your community?.....Your top response: ""Schools should make sure students have social and emotional skills, like self-awareness, empathy, and relationship-building."" https://t.co/c8sBmbdBCG"
512,@bethnoveck,2021-04-10 17:39:02+00:00,https://twitter.com/bethnoveck/status/1380938385116762118,Eager to make a dent in the universe? Consider applying to  @stanfordimpact. Open positions: https://t.co/ujl31EX4y5
513,@bethnoveck,2021-04-09 23:26:18+00:00,https://twitter.com/bethnoveck/status/1380663391803604993,https://t.co/h0ACV87ZhV
514,@bethnoveck,2021-04-06 17:08:02+00:00,https://twitter.com/bethnoveck/status/1379481031959572482,@geoffmulgan Yikes. Which vaccine did you get? And did you have both doses already? Feel better!!!
515,@bethnoveck,2021-04-05 14:58:40+00:00,https://twitter.com/bethnoveck/status/1379086091244994568,Home for spring break? Take a moment to help @TheGovLab tell federal and state policymakers what schools need to fix most urgently. See what others are saying. Participate! https://t.co/bPCnSxxRWs @bridgitmendler @anya1anya @npr_ed @DanaGoldstein @caitlinzaloom
516,@bethnoveck,2021-04-02 19:18:58+00:00,https://twitter.com/bethnoveck/status/1378064430957727749,"Take 2 minutes. Help us tell federal, state and local policymakers and philanthropy your priorities for fixing schools. Participate at https://t.co/uJC7cB5aCI"
517,@bethnoveck,2021-03-31 21:43:48+00:00,https://twitter.com/bethnoveck/status/1377376106404192261,From 100 Days to 100 Ways says @MitchWei. The @POTUS will eventually need to shift from competency government to possibility government and innovate more. Ask your questions of @MitchWei here and we'll answer them live https://t.co/U7XwAIw4wR
518,@bethnoveck,2021-03-31 21:36:16+00:00,https://twitter.com/bethnoveck/status/1377374208372531200,"Across @nyutandon, we are #engineering a better 🌎. See how our advancing world-changing research helped us leap 30 spots in 10 years in @usnewseducation https://t.co/TAMLaIMx1U #30in10 #NYUTandonMade"
519,@bethnoveck,2021-03-31 21:31:20+00:00,https://twitter.com/bethnoveck/status/1377372967802433539,If you have a question for @MitchWei please tweet at me @bethnoveck
520,@bethnoveck,2021-03-31 21:19:23+00:00,https://twitter.com/bethnoveck/status/1377369961279090689,"Run, don’t walk, to buy @MitchWei We the Possibility: https://t.co/IYpfxUY2fN"
521,@bethnoveck,2021-03-31 21:07:45+00:00,https://twitter.com/bethnoveck/status/1377367033994567685,Come join us now to hear @MitchWei talking about We the Possibility at the Future of Democracy Lecture Series- https://t.co/x73gXekBkH @TheGovLab @nyu_ipk
522,@bethnoveck,2021-03-31 16:49:14+00:00,https://twitter.com/bethnoveck/status/1377301976686399499,Here’s why @citizenlabco is going open source https://t.co/fMlT9T1dKN
523,@bethnoveck,2021-03-29 16:55:04+00:00,https://twitter.com/bethnoveck/status/1376578667099340806,"""We need to fortify our democracy against the prospect that an assassin’s bullet, an encounter with microbes or even a natural death could flip control of our government."" A death in office could flip control of government. It doesn’t have to https://t.co/ZOcLfW6MxY"
524,@bethnoveck,2021-03-25 20:24:59+00:00,https://twitter.com/bethnoveck/status/1375181943562768386,@econeditor It is NEVER socks and sandals weather....EVER
525,@bethnoveck,2021-03-25 16:01:13+00:00,https://twitter.com/bethnoveck/status/1375115563798773768,"Today's @ModernizeCmte Listening Session chaired by @RepDerekKilmer is itself an example of the kind of innovative #crowdlaw practices that Congress should do more of. Instead of a few witnesses, we have 23 reformers sharing their expertise."
526,@bethnoveck,2021-03-25 15:15:59+00:00,https://twitter.com/bethnoveck/status/1375104180759756804,"We're not The Squad, we're The Cohort....the Fix Congress Cohort meeting today with @ModernizeCmte
to recommend topics for the year ahead. Watch https://t.co/KH44C8ukuW @marcidale @loreleikelly @MichaelNeblo @congressfdn @danielschuman"
527,@bethnoveck,2021-03-22 20:13:22+00:00,https://twitter.com/bethnoveck/status/1374091856393367554,"📢📣Help us get out the word to students, caregivers and educators to participate in Your Education, Your Voice  to share public priorities around COVID with policymakers, philanthropy and education leaders https://t.co/bPCnSxggxS @HalPlotkin @stevemidgley @rec54 @JIMSEDU 📣📢"
528,@bethnoveck,2021-03-22 19:43:58+00:00,https://twitter.com/bethnoveck/status/1374084459230814209,Are you a student in the United States? Parent of a student? Teacher of a student? Take 2 minutes and visit https://t.co/uJC7cB5aCI and make your voice heard. #YourEducationYourVoice
529,@bethnoveck,2021-03-19 12:37:58+00:00,https://twitter.com/bethnoveck/status/1372890086241677312,The #WhoCongressPays report released by @payourinterns found over 75% of paid interns were white; Black and Latino paid interns made up less than 15%. Here are their recommendations https://t.co/hOgXIcdR1M
530,@bethnoveck,2021-03-17 17:35:23+00:00,https://twitter.com/bethnoveck/status/1372240160750977027,"We are running a national-level engagement to listen to students, caregivers and educators about the education system and need your help spreading the word on Monday. For more information, we are doing a quick webinar today. https://t.co/uJC7cB5aCI"
531,@bethnoveck,2021-03-16 17:29:25+00:00,https://twitter.com/bethnoveck/status/1371876268115955718,"On March 25th, @EnergyCommerce will hold a hearing with @jack @sundarpichai @finkd to scrutinize how @facebook @Twitter @Google are addressing misinformation and disinformation. Help write the questions Members will ask. https://t.co/xjMh6sHg3Q @FAScientists @scipolnetwork"
532,@bethnoveck,2021-03-13 16:16:44+00:00,https://twitter.com/bethnoveck/status/1370770814027640836,Singapore will require 1.2 million digitally skilled workers by 2025: AWS survey https://t.co/6im47kZYmN # via @Ettelecom
533,@bethnoveck,2021-03-12 20:02:28+00:00,https://twitter.com/bethnoveck/status/1370465233714606086,"What happens when you join-up data with lived experiences to inform action? @aucklandcouncil @TSIforSthAkl answers in its new guide ""Towards better social sector decision making and practice"" that we've added as a resource on #SolvingPublicProblems https://t.co/A0THDVgFZF"
534,@bethnoveck,2021-03-12 19:00:07+00:00,https://twitter.com/bethnoveck/status/1370449543230320650,"Today was 2nd #smartercrowdsourcing experiential learning dialogue. @TheGovLab @Northeastern and three dozen practitioners addressed access to experiential learning, diversity and inclusion, and advancing social justice. @PTECHNETWORK @UnityTechnology @design4america @riipen"
535,@bethnoveck,2021-03-12 18:48:44+00:00,https://twitter.com/bethnoveck/status/1370446677463728133,"For more on how #CivicBridge @sfgov coordinate engagement at scale between city governments and volunteer technologists, listen to @deebrar and then read more https://t.co/QsVdC3HI8z"
536,@bethnoveck,2021-03-11 22:53:15+00:00,https://twitter.com/bethnoveck/status/1370145825372971010,"@CollegeBoard I will DM you, thanks"
537,@bethnoveck,2021-03-11 16:49:30+00:00,https://twitter.com/bethnoveck/status/1370054285300531202,"After 45+ minutes on hold with @CollegeBoard trying to find out our new testing location, we were disconnected AGAIN. As if kids aren't under enough stress already thanks to #COVID19 and online learning, this treatment (not the first time) is truly unkind."
538,@bethnoveck,2021-03-10 14:57:32+00:00,https://twitter.com/bethnoveck/status/1369663721312837632,Nominate an NYC public servant for the Sloan Public Service Awards recognizing six outstanding civil servants whose work performance and commitment to the public goes above and beyond the ordinary https://t.co/r0Jx0b3GyR
539,@bethnoveck,2021-03-10 13:14:26+00:00,https://twitter.com/bethnoveck/status/1369637775268601861,Die gesamte Liste: https://t.co/ldVz8P6Yir
540,@bethnoveck,2021-03-10 00:38:34+00:00,https://twitter.com/bethnoveck/status/1369447551456473088,As @billmaher explains (hilariously) https://t.co/pc5DC1tMgm raising awareness isn't enough and it doesn't produce the change we need. This is why @TheGovLab offers a free online coaching program to help go from demanding change to making it: https://t.co/SrV3kPUIYs
541,@bethnoveck,2021-03-10 00:24:20+00:00,https://twitter.com/bethnoveck/status/1369443973522223107,"@vonderwippel @Tagesspiegel Absolut! Ich freue mich. DM, bitte."
542,@bethnoveck,2021-03-09 16:57:52+00:00,https://twitter.com/bethnoveck/status/1369331614753431556,"Apropos of using collective intelligence to solve problems that I wrote about in @Tagesspiegel https://t.co/8Cod1Fwva2, SIGN UP for #UpdateDeutschland Challenge"
543,@bethnoveck,2021-03-03 00:23:58+00:00,https://twitter.com/bethnoveck/status/1366907165626294272,Former Obama Labor Department official @MrSethHarris  is joining the @WhiteHouse as a top adviser to @POTUS  on labor issues https://t.co/UDymHmc9xH via @bpolitics
544,@bethnoveck,2021-03-02 22:07:07+00:00,https://twitter.com/bethnoveck/status/1366872725587910667,Now!!! Not to late. Drop on in. Watch live on Twitter or join us on Zoom.
545,@bethnoveck,2021-03-02 15:25:00+00:00,https://twitter.com/bethnoveck/status/1366771527371411459,"JOIN US! Tonight at 5pm, I'll be speaking with @dkroy about @cortico's ""Local Voices Network"" and uses of machine learning and applied AI to strengthen #citizenengagement #deliberation. 

RSVP for the Future of #Democracy @nyu_ipk @thegovlab: https://t.co/VJxP9Tv4r7  @medialab"
546,@bethnoveck,2021-03-02 14:00:07+00:00,https://twitter.com/bethnoveck/status/1366750166078873607,Today I published this piece @Tagesspiegel @TspBackgroundDi about how the smartest cities are those working with residents to solve problems. https://t.co/GV0XDbhSkm #collectiveintelligence #multicitychallenge @TheGovLab @nesta_uk @LakewoodColo @UNDPtech @PeterBaeck @yalepress
547,@bethnoveck,2021-02-25 23:29:10+00:00,https://twitter.com/bethnoveck/status/1365081435565158400,Whoa
