,0,1,2,3
0,@bethnoveck,2023-03-14 22:41:39+00:00,https://twitter.com/bethnoveck/status/1635773209596272645,This is not dissimilar to what I once termed “notice and spam” and what interest groups do to get supporters to churn out identical comments in the context of regulatory rulemaking. So the arms race continues!
1,@bethnoveck,2023-03-14 21:58:58+00:00,https://twitter.com/bethnoveck/status/1635762471586635780,"This is an exciting development when used to good ends and @OpenAI's #GPT4 will transform the practice of law. But, obviously, this also has the potential to clog up the courts and the workings of government in unanticipated and malicious ways."
2,@bethnoveck,2023-03-14 21:31:45+00:00,https://twitter.com/bethnoveck/status/1635755618874056704,Looking forward to this conversation!
3,@bethnoveck,2023-03-14 15:32:22+00:00,https://twitter.com/bethnoveck/status/1635665180431470593,Very nice surprise to still find Smart Citizens ⁦@Harvard_Press⁩ among the new and noteworthy ⁦@Waterstones⁩ https://t.co/ERpTcRosCD
4,@bethnoveck,2023-03-10 20:34:45+00:00,https://twitter.com/bethnoveck/status/1634291726255808518,Oyez! Oyez! Justice Blob presiding. Check out @thekidpundit and friends  @nuvustudio making the law more entertaining and accessible @icivics @oyez @SCOTUSblog @tribelaw @united4sc @uscourts
5,@bethnoveck,2023-03-10 13:51:08+00:00,https://twitter.com/bethnoveck/status/1634190152233885702,We are so lucky to have someone of @BonnieMcGilpin talent and experience. Welcome home!!! @MrSethHarris @JillAbramson @laura4lano @sboschg @anitamcgahan  @JonathanMetzl @NeilKleiman
6,@bethnoveck,2023-03-09 13:23:06+00:00,https://twitter.com/bethnoveck/status/1633820706730385408,"CHECK IT OUT! ⁦@thekidpundit⁩ strikes again. New video about dangers to public health, environ., economy and kids’ wellbeing of car-centric urban design @StrongTowns⁩ ⁦@CityLab⁩ @thegovlab ⁦⁦@notjustbikes⁩ ⁦⁦⁦@dudurudh⁩  https://t.co/j2XOBjRfKk"
7,@bethnoveck,2023-03-03 17:59:51+00:00,https://twitter.com/bethnoveck/status/1631716028890722305,"On the whole, there's a great deal of optimism about the power of generative AI to foster engagement by more diverse audiences and to help rule writers manage the participation process better."
8,@bethnoveck,2023-03-03 17:43:04+00:00,https://twitter.com/bethnoveck/status/1631711802986831873,Excited to be online with 400+ participants talking about #ChatGPT and the future of citizen engagement in regulatory rulemaking. Important conversation about the future of democracy and lawmaking. @ABAesq @BurnesCenter @TheGovLab @NUSL https://t.co/aVEqMsNdoJ
9,@bethnoveck,2023-03-02 00:38:52+00:00,https://twitter.com/bethnoveck/status/1631091666764398594,Hey ⁦@UberEats⁩ ordered SUSHI on Feb 27. It arrived now on March 1! NOW will you believe me when I ask for a refund? https://t.co/kOt0LDgNDT
10,@bethnoveck,2023-02-28 14:56:04+00:00,https://twitter.com/bethnoveck/status/1630582612094775300,📚 TODAY! Hybrid book talk with @lexpaulson talking about Philosophy and Power and his new book Cicero and the People's Will  1930 CET https://t.co/vwv18LTUP5
11,@bethnoveck,2023-02-24 14:45:13+00:00,https://twitter.com/bethnoveck/status/1629130330467708930,". @stuartbuck1""Publications and citations aren’t the best measures...short-term study of the average rate of publications and citations will probably miss that impact entirely."" Fund the person not the project. #socialchange @burnescenter https://t.co/2Xj0QcyQpp"
12,@bethnoveck,2023-02-24 14:09:25+00:00,https://twitter.com/bethnoveck/status/1629121322990043140,Looking forward to tuning in!
13,@bethnoveck,2023-02-24 11:26:53+00:00,https://twitter.com/bethnoveck/status/1629080420212940804,Such an exciting development! #wikigovernment coming to fruition
14,@bethnoveck,2023-02-23 17:52:06+00:00,https://twitter.com/bethnoveck/status/1628814974947655681,Congratulations to @decidim_org @citizenlabco @Loomio @CitizensFNDN for earning top marks for their platforms for robust resident engagement   https://t.co/BSgE3gFClw
15,@bethnoveck,2023-02-23 17:21:04+00:00,https://twitter.com/bethnoveck/status/1628807166663487488,Excited to see that @PeoplePowrd new ratings evaluate transparency and accessibility as well as features and cost. Very helpful contribution to the field of engagement and participatory democracy. @TheGovLab  https://t.co/BSgE3gFClw
16,@bethnoveck,2023-02-23 16:31:02+00:00,https://twitter.com/bethnoveck/status/1628794573995507715,"Wow! Well deserved. @gabowd won @sigchi ‘Lifetime Research Award’ for his impactful work in ubiquitous computing, software engineering, and technologies for autism https://t.co/ELt4SrSqfX @BurnesCenter @TheOfficialACM @NUGlobalNews"
17,@bethnoveck,2023-02-20 15:59:13+00:00,https://twitter.com/bethnoveck/status/1627699401509548032,"JOB! @TechTalentProj is hiring a State Partnerships Director to help state governments’ recruit, retain, and empower tech leaders. Finding passionate people and matching them to opportunities to improve how we solve problems for residents is vital. https://t.co/RGZMz7tfE6"
18,@bethnoveck,2023-02-20 01:18:48+00:00,https://twitter.com/bethnoveck/status/1627477838482886657,"Sigh. At eight points along the Green Line, it would be faster to run than take the T.  In at least one spot, it would probably be faster to walk.
  https://t.co/716DQ6nioU via @BostonGlobe"
19,@bethnoveck,2023-02-18 19:05:22+00:00,https://twitter.com/bethnoveck/status/1627021473440309249,How to Really Run a City podcast from @thephilacitizen Episode 3: fighting gun violence @Michael_Nutter @KasimReed talking with @DavidMuhammad  about how @Oakland cut gun violence in half. https://t.co/BMVQdPj02K  cc @platt_larry @thegovlab @BurnesCenter
20,@bethnoveck,2023-02-18 12:56:16+00:00,https://twitter.com/bethnoveck/status/1626928586887143425,".@politico Google Translate forging Europe’s  unity towards Ukraine. ""Ordinary Europeans can understand one another, instantly and accurately.""  Worth adding that patent #OpenData  (same app mult langs) helped to perfect Neural Machine Trans. #opengov  https://t.co/hZjodbHexz"
21,@bethnoveck,2023-02-17 15:22:38+00:00,https://twitter.com/bethnoveck/status/1626603034397605897,FTC Launches New Office of Technology to Bolster Agency’s Work to strengthen the FTC’s ability to keep pace with technological challenges in the digital marketplace by supporting the agency’s law enforcement and policy work. https://t.co/qL1v3MPBek
22,@bethnoveck,2023-02-13 20:43:13+00:00,https://twitter.com/bethnoveck/status/1625234157667495936,Had a provocative conversation @antonyjfunnell @RadioNational  talking about how unis have imparted a top-down culture of managerialism that has left public professionals untrained in how to engage with residents. https://t.co/BVwEB9vA5s
23,@bethnoveck,2023-02-13 20:20:37+00:00,https://twitter.com/bethnoveck/status/1625228471881592832,Congratulations @RMIT they are so lucky to have you!! Can't wait to collaborate more! @BurnesCenter @TheGovLab
24,@bethnoveck,2023-02-12 19:49:20+00:00,https://twitter.com/bethnoveck/status/1624858211093295104,Excited that ⁦@thekidpundit⁩ is speaking at today’s @writopialab Youth Essay Conference. Wonderful opportunity for an exchange of ideas among young thinkers.  https://t.co/5upeRZloaZ
25,@bethnoveck,2023-02-12 19:24:55+00:00,https://twitter.com/bethnoveck/status/1624852067205451776,Looking for someone interested in exchanging a place to stay in Boston this summer for care and cuddles from a friendly cat. Grad student at summer school? Sabbatical writing retreat? DM if interested.
26,@bethnoveck,2023-02-10 22:59:48+00:00,https://twitter.com/bethnoveck/status/1624181366098214913,"NYC Subway Banned Dogs Unless They Fit in a Bag, So Residents Got Creative ⁦@IKEAUSA⁩  https://t.co/bARRmgBV2G"
27,@bethnoveck,2023-02-10 20:41:15+00:00,https://twitter.com/bethnoveck/status/1624146499272683520,"Cost is just one obstacle many workers face when trying to engage in upskilling opportunities. The program will cover training costs and wrap-around services like childcare, transportation, and more. @noamschreiber @greenhousenyt @LuceFoundation @FordFoundation @kristindakota"
28,@bethnoveck,2023-02-10 20:41:14+00:00,https://twitter.com/bethnoveck/status/1624146498001768465,"Uniquely, this program will give participants full autonomy while providing access to coaching and information to help them make informed decisions https://t.co/Mt7HlXKru8 @FamiliesWorkers"
29,@bethnoveck,2023-02-10 20:41:14+00:00,https://twitter.com/bethnoveck/status/1624146496156274695,"Exciting news! @NJGOV launching a first-of-its-kind $10 million Lifelong Learning Account pilot to help  1,000 low income and no credential participants access #upskilling and support. We are seeking organizations to help administer and provide coaching. https://t.co/83KOndSOeP"
30,@bethnoveck,2023-02-09 22:12:52+00:00,https://twitter.com/bethnoveck/status/1623807170184609792,"Top economists to Netanyahu: ‘Undermining judiciary detrimental to prosperity and growth’ Fifty-six world-renowned economists, including 11 Nobel laureates, have signed an open letter protesting Netanyah plan to weaken Israel’s democracy  https://t.co/H72kN1adGm"
31,@bethnoveck,2023-02-06 20:11:03+00:00,https://twitter.com/bethnoveck/status/1622689347924332551,How many states have an official state microbe?  @NJGov State Microbe - Streptomyces griseus. Who knew?! https://t.co/NYq8PSVjsQ. https://t.co/IPKhx5aYKx
32,@bethnoveck,2023-02-06 19:35:09+00:00,https://twitter.com/bethnoveck/status/1622680314442092548,Excellent piece @saiphcita about how generative #AI can assist worker organizing and #collectiveaction #collectiveintelligence. @MrSethHarris @ilo  @nesta_uk @AFLCIO @KhouryCollege
33,@bethnoveck,2023-02-03 22:28:54+00:00,https://twitter.com/bethnoveck/status/1621636876036620295,Data junkies - JOB OPPORTUNITY -Research Director  @heldrichcenter working with the incomparable Carl van Horn and getting to dig into @NJGOV P20W state administrative longitudinal data system #NJEEDS https://t.co/uqJQ3uASj3 @chris_bail @msalganik @shapiro_stuart @Coleridge4Data
34,@bethnoveck,2023-02-03 03:51:33+00:00,https://twitter.com/bethnoveck/status/1621355684733263872,Boston might be bracing for -10 but Melbourne is facing a Sheep Grazier Warning. Not something we see here everyday. https://t.co/b0gthUAsXI
35,@bethnoveck,2023-02-02 13:34:14+00:00,https://twitter.com/bethnoveck/status/1621139933439352835,"Just dropped! @thekidpundit on ""Capitalism and Self-care"" discussing the right to rest and the right to organize @PowerAtWorkBlog"
36,@bethnoveck,2023-02-01 20:53:12+00:00,https://twitter.com/bethnoveck/status/1620888016318533632,Sick of Silicon Valley? Tech Congress Fellowship deadline extended.
37,@bethnoveck,2023-02-01 18:28:57+00:00,https://twitter.com/bethnoveck/status/1620851714143420430,"Are you interested in contributing to positive change in the world? 🌏Learn more about
@MITSolve’s 2023 Global Challenges and how you can be part of the solution.
https://t.co/12js4cxVcD #SolveChallenges2023 @BurnesCenter @TheGovLab"
38,@bethnoveck,2023-02-01 17:34:27+00:00,https://twitter.com/bethnoveck/status/1620837998198915079,.@BurnesCenter Distinguished Professor @JillAbramson had some salty words about the World Economic Forum — and other stand-out moments from Davos https://t.co/QwqVxkQuG7 via @BostonGlobe
39,@bethnoveck,2023-01-29 17:14:40+00:00,https://twitter.com/bethnoveck/status/1619745856265289731,"JOB! Looking for a passionate individual to manage office and coordinate events in #Boston and online for @BurnesCenter (writing for social change workshops, coaching for social innovators, future of democracy lectures etc). Join our growing team. https://t.co/A54plSEomH"
40,@bethnoveck,2023-01-27 17:10:56+00:00,https://twitter.com/bethnoveck/status/1619020142029189121,Great interview @thekidpundit demonstrating power of youth democracy and why we need to create more ways to take advantage of power and passion of young people to save our planet and tackle public problems @WaltonFamilyFdn @TheGovLab @BurnesCenter @elipariser @Fridays4future
41,@bethnoveck,2023-01-24 18:58:13+00:00,https://twitter.com/bethnoveck/status/1617959975997046784,Robust conversation with state workforce leaders as part of our three-part #innovateus @TheGovLab @BurnesCenter Innovation and Public Problem Solving Course with @NASWAORG https://t.co/7w1cpRYx4Q https://t.co/EWKkBNRXiM
42,@bethnoveck,2023-01-22 14:34:43+00:00,https://twitter.com/bethnoveck/status/1617168889665802242,David Pozen @ColumbiaLaw trenchant piece on growing irrelevance of constitutional theory — and the legal academy — in the fight against Trumpism. Balkinization: A Constitutional Blog in Constitutional Time: https://t.co/ii8TDgDMDZ
43,@bethnoveck,2023-01-20 19:36:03+00:00,https://twitter.com/bethnoveck/status/1616519946942513153,Feat. @BurnesCenter @MrSethHarris @PoweratWorkblog
44,@bethnoveck,2023-01-18 23:06:45+00:00,https://twitter.com/bethnoveck/status/1615848193987575809,APPLY! Are you a changemaker in #boston? Want to do well by doing good? Sign up for this after-work health equity program and advance social change in your community. Please forward! cc @kdlucas @GayleCaleb @anitamcgahan @JillAbramson @NUBouve @
45,@bethnoveck,2023-01-18 15:34:44+00:00,https://twitter.com/bethnoveck/status/1615734440382140417,Tune in tomorrow for this important discussion @BurnesCenter about developments in unionization in the United States. @AFLCIO @SEIU @MachinistsUnion @AFGENational @uniglobalunion @AFTunion @noamschreiber
46,@bethnoveck,2023-01-13 22:56:44+00:00,https://twitter.com/bethnoveck/status/1614033737116786688,@theasnow This recent piece by @anthony_barrows makes this point eloquently https://t.co/bbd9RMUhmm
47,@bethnoveck,2023-01-13 20:56:17+00:00,https://twitter.com/bethnoveck/status/1614003423074045958,Proud of my home state!
48,@bethnoveck,2023-01-13 20:53:20+00:00,https://twitter.com/bethnoveck/status/1614002679940022274,"@theasnow It irks me so much I've written a book about this false dichotomy (Smart Citizens, Smarter State). But here's a short version of the rant: https://t.co/abBSF4m9vg"
49,@bethnoveck,2023-01-13 17:26:17+00:00,https://twitter.com/bethnoveck/status/1613950575732822032,Amazing job opportunity! Apply to follow in the very big footsteps of the one and only @lrainie Research Director Internet and Technology @pewresearch https://t.co/o7aFD6BMaq
50,@bethnoveck,2023-01-13 01:38:19+00:00,https://twitter.com/bethnoveck/status/1613712012567269376,"Address climate change? Reduce gun violence? Provide for the poor? Nah, let's bar the use of the term “Latinx” in official state documents. Excellent use of time and taxpayer dollars. https://t.co/Ye74tAqkIV"
51,@bethnoveck,2023-01-11 19:27:58+00:00,https://twitter.com/bethnoveck/status/1613256421050814464,The answer is @NJGov!
52,@bethnoveck,2023-01-11 19:25:42+00:00,https://twitter.com/bethnoveck/status/1613255853087268887,"Public servants under assault again! Rather than investing in and upskilling public servants, new congressional rules package reinstates a 1876 rule permitting Members to reduce salaries or fire federal workers with whom they disagree. 
@thegovlab @publicservice @PowerAtWorkNU"
53,@bethnoveck,2023-01-11 19:18:33+00:00,https://twitter.com/bethnoveck/status/1613254050933346304,"Public servants under assault again! Rather than investing in and upskilling public servants, the new congressional rules package reinstates an 1876 that permits Members to reduce salaries or fire federal workers with whom they disagree. #innovateus @thegovlab @publicservice"
54,@bethnoveck,2023-01-11 19:13:37+00:00,https://twitter.com/bethnoveck/status/1613252809490571278,"Some key flags: the new rules ironically but not surprisingly eliminate the Select Committee on the Modernization of Congress, which made great strides making Congress work better."
55,@bethnoveck,2023-01-06 14:06:43+00:00,https://twitter.com/bethnoveck/status/1611363637838462976,"Op-Ed by ⁦@TheGovLab⁩ advisor and former Member Brian Baird. Ask not “Who will be the speaker?” but rather, “What should the proper role of the speaker of the House be and how do we select the best person for that job?”@seattletimes⁩  https://t.co/Kow6AncHyQ"
56,@bethnoveck,2022-12-18 19:39:06+00:00,https://twitter.com/bethnoveck/status/1604561912980807681,Practice radical compassion and humility rather than finger pointing.
57,@bethnoveck,2022-12-18 19:28:14+00:00,https://twitter.com/bethnoveck/status/1604559179217534976,Unionization can mitigate glass house tendencies and foster deliberative workplace democracy and foster leadership advancement and learning. #poweratwork @MauriceWFP @WorkingFamilies @BurnesCenter
58,@bethnoveck,2022-12-18 19:04:53+00:00,https://twitter.com/bethnoveck/status/1604553304138211328,"Corruption of power has gone unexamined for too long. Healthy skepticism is important. However, reflexive anti-leadership neglects the fact that social change work requires rigor, experience and study. @BurnesCenter #workerpower"
59,@bethnoveck,2022-12-18 19:04:52+00:00,https://twitter.com/bethnoveck/status/1604553301583953923,"Belonging to a marginalized identity is “in and of itself insufficient information” to “mandate that their position be adopted,” Struggle, debate and disagreement are crucial for realizing collective power, says @MauriceWFP in Building Resilient Orgs.
https://t.co/uymHCHiJC5"
60,@bethnoveck,2022-12-17 15:26:43+00:00,https://twitter.com/bethnoveck/status/1604136014481539072,"What Happens When Jobs Are Guaranteed? “using a randomized controlled trial… on a broad range of dimensions—symptoms of anxiety…a sense of social inclusion, social status, financial security…the improvements…are statistically significant.” https://t.co/0KADfDO0OC"
61,@bethnoveck,2022-12-14 11:39:42+00:00,https://twitter.com/bethnoveck/status/1602991720320450564,“VR should not be seen as a standalone technique; planners can gain more… feedback by incorporating VR…alongside other traditional approaches.” Congrats Prince Amin ⁦@transgovgh⁩ on finishing Masters thesis on #VR and public engagement.   https://t.co/V6DI6ZjFqg
62,@bethnoveck,2022-12-09 15:28:03+00:00,https://twitter.com/bethnoveck/status/1601237245339398144,"At last a sensible assessment of the pros and limits of citizen assemblies, which are democracy theatre if not connected to decision making. See this new piece by @Smith1966G @Rikki_Dean @Boswell_JC on assemblies and climate https://t.co/zPpfdtGCA1"
63,@bethnoveck,2022-12-08 14:30:48+00:00,https://twitter.com/bethnoveck/status/1600860449796399105,Important development in #evidencebacked governing is today’s launch of a new dashboard for non fatal opioid overdoses. But there doesn’t seem to be an option to download the data as #opendata? And the government is asserting ownership over the data. Huh? https://t.co/bKfmEjLpHN
64,@bethnoveck,2022-12-07 20:39:28+00:00,https://twitter.com/bethnoveck/status/1600590838358282240,Learnings on the Importance of Youth Engagement ⁦@TheGovLab⁩ ⁦@BurnesCenter⁩ ⁦@NUCSSH⁩  https://t.co/D4tqxgH5pa
65,@bethnoveck,2022-12-05 23:37:37+00:00,https://twitter.com/bethnoveck/status/1599910896654028800,Not too late to join us https://t.co/RmHENxDrNm
66,@bethnoveck,2022-12-05 23:28:05+00:00,https://twitter.com/bethnoveck/status/1599908498942226432,Tonight ⁦@NU_CAMD⁩ ⁦@doctorow⁩ is talking with ⁦@MrSethHarris⁩ ⁦@GayleCaleb⁩ ⁦@jkaufman617⁩ ⁦@lexlanham⁩ about #chokepoint capitalism and ability of monopsonist media companies to use copyright to strangle artists. ⁦@BurnesCenter⁩ https://t.co/cHcI0Fc0iS
67,@bethnoveck,2022-12-04 18:03:51+00:00,https://twitter.com/bethnoveck/status/1599464513518325760,@jamesburton_mus @TheBostonPops @BostonSymphony @the_halle @hallechoir @EditionPetersUS Will it be on Idagio soon? Or where can we rewatch it? Was wonderful and the highlight of the performance.
68,@bethnoveck,2022-12-03 16:50:35+00:00,https://twitter.com/bethnoveck/status/1599083688553480192,"""Feds make DOT nix funny safety signs on N.J. highways."" Government should be more, not less, accessible, engaging and approachable. Research shows that humor boosts compliance.
 https://t.co/vky2lD7aOo"
69,@bethnoveck,2022-12-03 00:21:46+00:00,https://twitter.com/bethnoveck/status/1598834843487416320,Apropos of our conversation @teamguilded @Estebantitos @LuceFoundation
70,@bethnoveck,2022-12-02 16:59:47+00:00,https://twitter.com/bethnoveck/status/1598723614152458240,Critical Ignoring as a Core Competence for Digital Citizens “digital information literacy must include the competence of critical ignoring—choosing what to ignore and where to invest one’s limited attentional capacities.”- https://t.co/00yDejmofX @TheGovLab
71,@bethnoveck,2022-12-02 16:29:04+00:00,https://twitter.com/bethnoveck/status/1598715887246348289,"The @BurnesCenter @TheGovLab are looking for a super-passionate, hyper-organized individual to manage events, people and initiatives https://t.co/k2BZQD6kkV @JillAbramson @MrSethHarris @NeilKleiman @GayleCaleb"
72,@bethnoveck,2022-12-02 16:16:03+00:00,https://twitter.com/bethnoveck/status/1598712610106376194,Here’s the original posting https://t.co/dG3LZKcOkK. Direct questions to me via DM.
73,@bethnoveck,2022-12-02 16:11:55+00:00,https://twitter.com/bethnoveck/status/1598711570011283456,JOIN US! @BurnesCenter @TheGovLab @Northeastern seeks Professor of the Practice with a significant track record for social impact. https://t.co/xqyw099jaU
74,@bethnoveck,2022-12-01 12:48:25+00:00,https://twitter.com/bethnoveck/status/1598297967571746816,The idea that the military industrial complex has ticketmastered Teddy Roosevelt’s public parks should shock our consciences. How Booz Allen ticketmasters our national parks by ⁦@doctorow⁩  https://t.co/ojsgtsrV9Y
75,@bethnoveck,2022-11-28 17:44:32+00:00,https://twitter.com/bethnoveck/status/1597285325004759042,"To promote public sector upskilling and build community, the @DigAkademie @cio_bund do in-person learning with senior leaders to expose them to digital innovations across multiple agencies and locations."
76,@bethnoveck,2022-11-28 14:01:04+00:00,https://twitter.com/bethnoveck/status/1597229090842742785,Don’t miss the livestream of Cory @Doctorow discussing his book #ChokepointCapitalism with @lexlanham @gaylecaleb @JKaufman617 &amp; @MrSethHarris on 12/5 at 6ET. Register: https://t.co/RmHENxDZCU. Sponsored by @Northeastern’s @BurnesCenter and @NU_CAMD.  @NUGlobalNews @Northeastern
77,@bethnoveck,2022-11-23 16:48:36+00:00,https://twitter.com/bethnoveck/status/1595459310649319426,JOIN US! ⁦@BurnesCenter⁩ ⁦@Northeastern⁩ seeks Professor of the Practice with a track record of and passion for real-world impact.  https://t.co/dMByP50pII
78,@bethnoveck,2022-11-23 14:16:55+00:00,https://twitter.com/bethnoveck/status/1595421137411899394,"“What we didn’t expect to find was that in some cases, political ideology and a highly polarized nation meant that the people who were in charge of disbursing funds to residents were also actively opposed to providing that help.”"
79,@bethnoveck,2022-11-18 17:15:11+00:00,https://twitter.com/bethnoveck/status/1593654060669812736,"NEW! 

In an op-ed for the @chicagotribune, @Results4America’s @michelejolin and Lisa Morrison Butler share how “boring” won in this year’s midterm elections and why that’s good news for the future of governing in America.

https://t.co/HSXrDbZ0Q5"
80,@bethnoveck,2022-11-18 16:21:17+00:00,https://twitter.com/bethnoveck/status/1593640495267434497,The @TheWebbyAwards deadline for nominations is coming up soon! https://t.co/WtgRW4TV8h
81,@bethnoveck,2022-11-15 19:16:07+00:00,https://twitter.com/bethnoveck/status/1592597332692172800,JOB! Join us @BurnesCenter - We are seeking a passionate professional eager to join and support our team of changemakers and help us grow our programming and events. https://t.co/A54plSEomH
82,@bethnoveck,2022-11-15 18:17:16+00:00,https://twitter.com/bethnoveck/status/1592582522172764160,"This looks great and very timely: Institutions, Experts &amp; the Loss of Trust #daedalus @americanacad https://t.co/jWS72CWjEK"
83,@bethnoveck,2022-11-14 15:23:54+00:00,https://twitter.com/bethnoveck/status/1592176503709745152,Way to go @DannyWerfel Biden Taps Federal Management Guru to Lead IRS https://t.co/lCV9lG0cnJ via @GovExec
84,@bethnoveck,2022-11-14 15:08:39+00:00,https://twitter.com/bethnoveck/status/1592172668022919173,New in November from @G_Gutenberg  my book Solving Public Problems is now Resolver problemas públicos!! https://t.co/i0x6JMdIUX @BurnesCenter @TheGovLab @Northeastern https://t.co/iYbVne0n5f
85,@bethnoveck,2022-11-14 14:54:50+00:00,https://twitter.com/bethnoveck/status/1592169189787467776,ARTICLE @asahi on #collectiveintelligence by @shinoken9 https://t.co/Q1rzvHXvIL cc @TheGovLab @BurnesCenter @Northeastern
86,@bethnoveck,2022-11-14 14:28:32+00:00,https://twitter.com/bethnoveck/status/1592162571464876032,FELLOWSHIP: Global social media governance scholars’ fellowship @yaleisp https://t.co/TS2l1MsTlf
87,@bethnoveck,2022-11-10 08:36:24+00:00,https://twitter.com/bethnoveck/status/1590624402923978752,At ⁦@RockefellerFdn⁩ with ⁦@GayleCaleb⁩ ⁦@BurnesCenter⁩ and education innovators from fourteen countries talking about how to tell your story clearly and without jargon. https://t.co/KCvgKtNwLr
88,@bethnoveck,2022-11-09 09:12:56+00:00,https://twitter.com/bethnoveck/status/1590271210188935168,JOB OPPORTUNITY! Come join our growing team ⁦@BurnesCenter⁩ ⁦@Northeastern⁩.  We are seeking an Executive Assistant and Events lead to work with our passionate community of change agents and mission-driven leaders.  https://t.co/A54plSDQx9
