,0,1,2,3
163,@futurist_Ahines ,2022-03-17 13:36:16+00:00,https://twitter.com/futurist_Ahines/status/1504451554165895175,We still have spots open for our next Foresight seminar starting April 6th and meets for 5 consecutive Wednesday mornings for 9am-12:30pm with group homework in between each class meeting.https://t.co/YjFSBm4b04
164,@futurist_Ahines ,2022-03-09 14:07:06+00:00,https://twitter.com/futurist_Ahines/status/1501560211609460740,"Futurist Calls to Action ... Is it best to recommend changes that are palatable and hope they can be scaled up in time. Or is there a point where it is best to present the shocking bad news?
https://t.co/d5VoVgX52U"
165,@futurist_Ahines ,2022-03-03 15:02:12+00:00,https://twitter.com/futurist_Ahines/status/1499399748461096964,So you wanna be a futurist? Here are ten books to get you started! https://t.co/ZwDHOCD8n1
166,@futurist_Ahines ,2022-02-24 14:38:21+00:00,https://twitter.com/futurist_Ahines/status/1496857030929547265,Futurists and their thirsty horses https://t.co/C1n7kAenaI
167,@futurist_Ahines ,2022-02-17 14:36:26+00:00,https://twitter.com/futurist_Ahines/status/1494319836318425094,"Post-work: Can We and Should We? Here’s my blog-sized case for “yes and yes.” What do you think?
https://t.co/odwRV9Nq5l https://t.co/iGS4Vvtfu4"
168,@futurist_Ahines ,2022-02-12 15:33:29+00:00,https://twitter.com/futurist_Ahines/status/1492522254932000768,"Why Is the Left Missing in U.S. Politics? https://t.co/XQxdfs03Qp Nice piece. I have a driver in ""After Capitalism"" called the ""ineffective left."" It is a real big problem!"
169,@futurist_Ahines ,2022-02-10 14:19:40+00:00,https://twitter.com/futurist_Ahines/status/1491778899734323207,Top Ten Drivers of the Future? What would you add or subtract? https://t.co/4IZ5aA87P9 https://t.co/XMHcOGYYKs
170,@futurist_Ahines ,2022-02-01 14:29:42+00:00,https://twitter.com/futurist_Ahines/status/1488519935814942722,"My favorite time of year -- acknowledging good futures work ... the 2021 APF Most Significant Futures Works winners
https://t.co/nVt1rg3EhJ 
https://t.co/nVt1rg3EhJ https://t.co/n1gy1f4XRr"
171,@futurist_Ahines ,2022-01-12 14:33:00+00:00,https://twitter.com/futurist_Ahines/status/1481273006253305856,Looking forward rather than backward ... tendency of the mean green meme to look backwards instead of forwards https://t.co/tWMJK80K7u https://t.co/CfU42UAolO
172,@futurist_Ahines ,2022-01-04 14:00:31+00:00,https://twitter.com/futurist_Ahines/status/1478365730223570948,"State of Foresight in the US Government ... not the best, but it's improving https://t.co/fiBSIGyGkd https://t.co/LMb0ruOZVr"
173,@futurist_Ahines ,2021-12-15 15:49:23+00:00,https://twitter.com/futurist_Ahines/status/1471145372143783949,"Futurists, get in the box! Having a wide variety of methods is surely a good thing, right? Lots of tools in the tool kit. OTOH. hand, it may suggest that we futurists don’t agree on how to do our work, particularly to those new to the field. https://t.co/27IoD2F2Ms https://t.co/ZXlLeTo632"
174,@futurist_Ahines ,2021-12-09 14:06:47+00:00,https://twitter.com/futurist_Ahines/status/1468945223997100034,"Purposes of Foresight work and Time Horizons ... Rather than an exclusive focus on one purpose or another, perhaps our project work engages multiple purposes across the three horizons??? https://t.co/zQ2rRaAEp9 https://t.co/2OonJ3QiGv"
175,@futurist_Ahines ,2021-11-25 14:26:57+00:00,https://twitter.com/futurist_Ahines/status/1463876869040881666,"Futurists and naming the field 2021 May I may offer up a “why"" it matters ... think ""the public"" who doesn't know us yet! https://t.co/5Fp6PSEGTf https://t.co/KPni5DI8Zy"
176,@futurist_Ahines ,2021-11-16 14:15:56+00:00,https://twitter.com/futurist_Ahines/status/1460612604036993029,What’s your Foresight Sauce? Our work has much more in common than differences. The differences are our “special sauce.” https://t.co/2QmiNhvYrw https://t.co/ihHGplJG6B
177,@futurist_Ahines ,2021-11-10 14:10:55+00:00,https://twitter.com/futurist_Ahines/status/1458437014202748933,Change: Confusing movement with progress ... change is slower than we think! https://t.co/hCnRQUPS5Q https://t.co/cQ4IUrz9Wv
178,@futurist_Ahines ,2021-11-08 13:53:35+00:00,https://twitter.com/futurist_Ahines/status/1457707876428955651,"Really nice analysis on increasing integration of global value chains ... questions who benefits
World Development under Monopoly Capitalism https://t.co/lfEfFIBRUB"
179,@futurist_Ahines ,2021-11-03 13:08:13+00:00,https://twitter.com/futurist_Ahines/status/1455884519807102987,Foresight Slides for a Desert Island ... You are exiled to a desert island and you were give permission to print out three slides to take with you. What would you take? https://t.co/BLWw5p1u8H https://t.co/yCTHK2UHZi
180,@futurist_Ahines ,2021-10-19 13:26:20+00:00,https://twitter.com/futurist_Ahines/status/1450453260763082765,"The Houston Foresight Vision ... what it's about, the big vision for the field, and the program vision  https://t.co/zP84CGaXC8 https://t.co/ffeEAw1Aee"
181,@futurist_Ahines ,2021-10-14 13:06:51+00:00,https://twitter.com/futurist_Ahines/status/1448636421435232259,Recent After Capitalism Scanning Ain't Pretty. coverage is shifting from reforming capitalism to getting rid of it (still more reform ideas overall) https://t.co/sA79umg9Vg https://t.co/DtoWobjmhH
182,@futurist_Ahines ,2021-10-05 13:38:43+00:00,https://twitter.com/futurist_Ahines/status/1445382946861506570,"Polak’s Image Criteria and After Capitalism ... Polak’s The Image of the Future, was a key reason for me getting interested and involved in foresight and is the key inspiration for the After Capitalism work. https://t.co/dl5uxHZraO https://t.co/lOXrPS1TzK"
183,@futurist_Ahines ,2021-09-29 13:09:17+00:00,https://twitter.com/futurist_Ahines/status/1443201212900380678,"Foresight Emotions: Hmmms, Oooos, Dangs, and No-ways.... We futurists must pay strict attention to emotional reactions from our clients (and ourselves) to insights about the future. https://t.co/MzWkEqsRy5 https://t.co/APBWVxF0xT"
184,@futurist_Ahines ,2021-09-21 13:20:40+00:00,https://twitter.com/futurist_Ahines/status/1440304976195063822,Monitoring ... The Time Has Come! Provides some practical guidance is available on how to set up a monitoring capability https://t.co/XHvb3Omsp6 https://t.co/7YesRo5S9c
185,@futurist_Ahines ,2021-09-14 13:26:44+00:00,https://twitter.com/futurist_Ahines/status/1437769789011685378,"Tribalism as a Lubricant for Collapse ...Complicating matters is that the divides are along so many different dimensions, from party to religion to race to ethnicity to gender to class and so on. Compromise is increasingly viewed as weakness. https://t.co/8Gku7zkqLR https://t.co/xIU0nxh8o0"
186,@futurist_Ahines ,2021-09-08 13:17:37+00:00,https://twitter.com/futurist_Ahines/status/1435593165591953408,"The unbreakable rule: Know your audience ... n foresight, rules are made to be broken. Futurists are rule-breakers by nature. But one rule cannot be broken: https://t.co/QWS7ioK3Gt https://t.co/kcgLQLMfLL"
187,@futurist_Ahines ,2021-09-05 17:53:25+00:00,https://twitter.com/futurist_Ahines/status/1434575408612130816,Solarpunk Is Not About Pretty Aesthetics. It's About the End of Capitalism [Interesting!!!] https://t.co/6Sp7p4abij via @vice
188,@futurist_Ahines ,2021-08-31 13:05:59+00:00,https://twitter.com/futurist_Ahines/status/1432691136469114885,"Scenarios start now. We typically describe the pathway to the scenarios, but perhaps we create impression that the pathway is not part of the scenario, but a bridge to the scenario. Let’s correct that. https://t.co/dbWPZecvJr https://t.co/dCtsHAUGhP"
189,@futurist_Ahines ,2021-08-24 13:19:03+00:00,https://twitter.com/futurist_Ahines/status/1430157708725006341,"How foresight strengthens strategic planning. We designed Framework Foresight to strategy (or innovation, policy, design, etc.)  https://t.co/C0jHJuOUfH https://t.co/nb9H12rgrM"
190,@futurist_Ahines ,2021-08-18 12:50:06+00:00,https://twitter.com/futurist_Ahines/status/1427976096813834254,The curse of the futurist ...  https://t.co/MGmBMCj00t https://t.co/j57CH24eaM
191,@futurist_Ahines ,2021-08-13 21:21:39+00:00,https://twitter.com/futurist_Ahines/status/1426292891899637760,It's so hot in Dubai that the government is artificially creating rainstorms https://t.co/DgaFfpZePD via @CBSNews Nothing could go wrong with this...right?
192,@futurist_Ahines ,2021-08-11 13:01:35+00:00,https://twitter.com/futurist_Ahines/status/1425442270917152775,"Most Significant Futures Works Nominations Are In. Fifteen works in three categories of methods/practice, issues, and literary/artistic work. Its been great to see the number of worthy nominations steadily increasing over the years https://t.co/nuCQcXopQa https://t.co/oqkiIfbUiE"
193,@futurist_Ahines ,2021-08-05 13:13:54+00:00,https://twitter.com/futurist_Ahines/status/1423271044660539399,"A Tribute to Futurist Richard Slaughter: Every field needs has its chroniclers, critics, innovators, and champions. It is unusual, however, for these roles being incorporated in one person. Richard Slaughter continues to play these roles for Foresight. https://t.co/XLSAlBHON3 https://t.co/DWwK53qem5"
194,@futurist_Ahines ,2021-07-31 04:08:47+00:00,https://twitter.com/futurist_Ahines/status/1421321921254277123,Opinion | Generation labels mean nothing. It’s time to retire them.  Thank goodness!!!! https://t.co/YIa68F3kSm
195,@futurist_Ahines ,2021-07-27 20:30:05+00:00,https://twitter.com/futurist_Ahines/status/1420119320307408900,Check out this report: https://t.co/WGWnFq9lsR This is so on-point -- really useful in moving the conversation from fear and anxiety to practical things that can actually be done within a handy framework. Well done!
196,@futurist_Ahines ,2021-07-27 13:36:00+00:00,https://twitter.com/futurist_Ahines/status/1420015113730510856,Tip of the HAT: Houston Archetype Technique: Exploring how domains flow through the Three Horizons. https://t.co/6tDuVKRdBS https://t.co/EAJXufzsXp
197,@futurist_Ahines ,2021-07-21 13:12:34+00:00,https://twitter.com/futurist_Ahines/status/1417834889844600832,"Sustainable Commons or Circular Commons? Is the modifier ""sustainable"" showing its age? Is circular more future-fit? What do you think? https://t.co/9KbcxV1iXU https://t.co/FZnUX4CE4e"
198,@futurist_Ahines ,2021-07-13 13:14:36+00:00,https://twitter.com/futurist_Ahines/status/1414936298096414725,"Imperatives of Capitalism ... capitalism is constantly on the prowl for new ways to grow and new things to enclose, monetize, and sell. https://t.co/u8O7X5Yf9n https://t.co/Yn2ut3dJh7"
199,@futurist_Ahines ,2021-07-07 13:25:07+00:00,https://twitter.com/futurist_Ahines/status/1412764617470791682,Defining foresight: what's your definition? https://t.co/fgsOK4auHE https://t.co/JpgqrHvuo1
200,@futurist_Ahines ,2021-07-03 01:07:34+00:00,https://twitter.com/futurist_Ahines/status/1411129456534732800,"The ""mean green meme"" goes after Walden Pond; probably not what Henry David Thoreau had in mind (at least there is a backlash) https://t.co/MLxPV2hZpv"
201,@futurist_Ahines ,2021-06-29 13:37:38+00:00,https://twitter.com/futurist_Ahines/status/1409868663243554827,APF Most Significant Futures Works 2021 is launching. This is our opportunity to recognize the great work our fellow futurists are doing https://t.co/Odtr5bqe9D https://t.co/SBan1lIhgf
202,@futurist_Ahines ,2021-06-22 13:24:48+00:00,https://twitter.com/futurist_Ahines/status/1407328721783099400,How many varieties of capitalism? They keep springing up ... why? https://t.co/4McMnRxGBm https://t.co/aq2Z3UUd1C
203,@futurist_Ahines ,2021-06-16 13:32:22+00:00,https://twitter.com/futurist_Ahines/status/1405156295565529090,"A Futurist Wildcard Policy. , our coverage includes domain-specific wildcards https://t.co/4F8Da7dSlh https://t.co/AxbHa51TjB"
204,@futurist_Ahines ,2021-06-09 13:18:31+00:00,https://twitter.com/futurist_Ahines/status/1402616097237606409,Values Shifts the Key to After Capitalism? https://t.co/C2MZ6BfwaV https://t.co/kTzyVm731M
205,@futurist_Ahines ,2021-06-03 13:02:53+00:00,https://twitter.com/futurist_Ahines/status/1400437835702865922,Analyzing After Capitalism Images ... describes the categories I used to analyze the Horizon 3 images of the After Capitalism futures  https://t.co/6nxro4GmBN https://t.co/KZHMjwH2Wl
206,@futurist_Ahines ,2021-05-26 13:15:21+00:00,https://twitter.com/futurist_Ahines/status/1397541871782711300,The STEEP Cheat: Build your Trend Inventory. Scanning for STEEP in a project  https://t.co/8Ey6aS2mfx https://t.co/OqtawMB6oj
207,@futurist_Ahines ,2021-05-12 12:26:37+00:00,https://twitter.com/futurist_Ahines/status/1392456173794861056,Who is the futurist's work for? Too many times we and our clients are leaving the implementation responsibility with someone else.https://t.co/ZPNY2CpiON https://t.co/Bs5TEfytXp
208,@futurist_Ahines ,2021-05-05 13:06:55+00:00,https://twitter.com/futurist_Ahines/status/1389929601632178179,Design Pizazz for the Framework Foresight cone https://t.co/gsBbNkYmuw https://t.co/wsizMoOyeg
209,@futurist_Ahines ,2021-05-02 14:42:14+00:00,https://twitter.com/futurist_Ahines/status/1388866424349896709,"@ForesightAlianz Ha, I remember this...indeed!"
210,@futurist_Ahines ,2021-04-28 13:11:06+00:00,https://twitter.com/futurist_Ahines/status/1387393941750833160,"Investing that aligns with the emerging future. New book ""Foresight Investing"" applies foresight principles to investing https://t.co/bxc1Hozy6c https://t.co/rmmcCE4b3M"
211,@futurist_Ahines ,2021-04-20 13:48:28+00:00,https://twitter.com/futurist_Ahines/status/1384504240895238148,"Challenges to ""Humanity Separate from Nature."" Nature, in the modern worldview, is something to be mastered or conquered using the tools of science and technology. Stefano Boeri's work is an example of reintegrating with nature. https://t.co/hRcVFeq2hd https://t.co/YQKwbf8NEU"
212,@futurist_Ahines ,2021-04-13 14:18:55+00:00,https://twitter.com/futurist_Ahines/status/1381975189991329797,"Five challenges to ""jobs are required"" In today’s world, yes, you need a job. But the support for this assumption is weakening and will continued to do so as we move into the future https://t.co/NBAHwCPTfO https://t.co/5m2o4ztlyp"
213,@futurist_Ahines ,2021-04-06 13:51:49+00:00,https://twitter.com/futurist_Ahines/status/1379431652884013056,"Three challenges to ""economic growth is required"" https://t.co/lB4g9y7aQl https://t.co/z7tj80IcPn"
214,@futurist_Ahines ,2021-03-31 02:54:24+00:00,https://twitter.com/futurist_Ahines/status/1377091882107428864,@Radmiddle all of it!
215,@futurist_Ahines ,2021-03-30 20:44:39+00:00,https://twitter.com/futurist_Ahines/status/1376998832295268359,"not just Twitter, but all social media"
216,@futurist_Ahines ,2021-03-30 20:44:09+00:00,https://twitter.com/futurist_Ahines/status/1376998705337835521,Is it weird to ask my Twitter friends how likely an unplugging scenario is? It's looking really plausible when one looks ahead.
217,@futurist_Ahines ,2021-03-30 13:25:24+00:00,https://twitter.com/futurist_Ahines/status/1376888292134825992,Technology and After Capitalism ... Longer-than-typical post as I briefly summarize the impact of accelerating technology change on After Capitalism. https://t.co/25u55gPt7t https://t.co/3F2C3TnlTm
218,@futurist_Ahines ,2021-03-20 14:12:47+00:00,https://twitter.com/futurist_Ahines/status/1373276337444651008,"If nothing else, writing a book forces you to get your own thinking straight, which may help you in other ways. I need to summarize technology acceleration in two pages. Are you kidding me? How can you do that? Yep, ""it really forces you to clarify your thinking!"""
219,@futurist_Ahines ,2021-03-16 13:46:33+00:00,https://twitter.com/futurist_Ahines/status/1371820185074724864,"A Futures Magic Wand... if you had one, what would you fix? I would.... https://t.co/fa8M7WYp0T https://t.co/7cRH7D9RHR"
220,@futurist_Ahines ,2021-03-14 14:15:18+00:00,https://twitter.com/futurist_Ahines/status/1371102641749655554,oooof &gt; How Britain Became the Dumbest Society in the World by @umairh https://t.co/PpH2prb4xh
221,@futurist_Ahines ,2021-03-13 17:34:23+00:00,https://twitter.com/futurist_Ahines/status/1370790355654828038,"@james_overstand @KateRaworth @pauldegregorio ha ha, well thank you for that. nice thing to see on a Saturday morning hard at work...."
222,@futurist_Ahines ,2021-03-09 14:26:23+00:00,https://twitter.com/futurist_Ahines/status/1369293491046645767,“Final” After Capitalism Concepts...the research phase closes and the writing phase kicks in.  https://t.co/BD2hQXG5xP https://t.co/Wx8hDO2N2K
223,@futurist_Ahines ,2021-03-05 14:04:37+00:00,https://twitter.com/futurist_Ahines/status/1367838464801202180,"Alter-Worlds, a vision of “de-commodified and autonomous territories,"" emerging from the margins or outside the system that will enable post-capitalist politics. https://t.co/h9f76NI6RM https://t.co/ppimWxsJBK"
224,@futurist_Ahines ,2021-02-23 14:18:02+00:00,https://twitter.com/futurist_Ahines/status/1364217960294797318,Visions of the future over time...change is slow. What's next? https://t.co/Eda110bpsS https://t.co/k0phJLV3dA
225,@futurist_Ahines ,2021-02-17 14:10:14+00:00,https://twitter.com/futurist_Ahines/status/1362041670469001219,Directory of After Capitalism Blog Posts....links to 73 posts over the last several years https://t.co/gMtvWmK6cY via @futurist_Ahines https://t.co/tayf62MdSj
226,@futurist_Ahines ,2021-02-10 13:58:27+00:00,https://twitter.com/futurist_Ahines/status/1359501990825500673,Personas in foresight .. is it just me or has the use of personas gone quiet in foresight? https://t.co/CrjhTvWHPc via @futurist_Ahines https://t.co/e4mVcHbVBQ
227,@futurist_Ahines ,2021-02-03 14:09:35+00:00,https://twitter.com/futurist_Ahines/status/1356968078534393861,Economic growth and the future: make your choice https://t.co/ue0mffXyXc via @futurist_Ahines https://t.co/opwrdsVesg
228,@futurist_Ahines ,2021-01-27 14:07:15+00:00,https://twitter.com/futurist_Ahines/status/1354430776683749379,Doughnut Economics: Light and Tasty https://t.co/4Y62ZmGAeT via @futurist_Ahines https://t.co/9DxXIHyHFE
229,@futurist_Ahines ,2021-01-19 14:49:53+00:00,https://twitter.com/futurist_Ahines/status/1351542401135947778,After Capitalism Drivers:  eight drivers that emerged from the research and scanning as most important to the future after capitalism -- which one doesn't belong?. https://t.co/32EFeqXLOH via @futurist_Ahines https://t.co/6Rba7wqzuo
230,@futurist_Ahines ,2021-01-12 14:05:53+00:00,https://twitter.com/futurist_Ahines/status/1348994612569006088,Scenario Based Strategy...comparing Shell's approach with our Framework Foresight https://t.co/aXHTSSQFzy via @futurist_Ahines https://t.co/8tF4FFs7U9
231,@futurist_Ahines ,2021-01-05 13:58:26+00:00,https://twitter.com/futurist_Ahines/status/1346456021863190528,Outlines research approach for studying how the future of a domain/topic evolves over the three horizons over time. https://t.co/aeXoVMM5K0 https://t.co/MQT42Lm04G
