,0,1,2,3
0,@Benioff,2023-02-14 22:33:23+00:00,https://twitter.com/Benioff/status/1625624270360711168,Happy Valentines Day! ❤️ https://t.co/6PvczFpVf6
1,@Benioff,2023-02-13 16:58:07+00:00,https://twitter.com/Benioff/status/1625177508881776641,Thich Nhat Hahn's question changed everything: Success or Happiness? How does this impact the future of Salesforce and our Ohana &amp; stakeholder capitalism vision? Pulitzer-Prize winning journalist @DavidStreitfeld investigates. ❤️ https://t.co/1XQUeSNtWO
2,@Benioff,2023-02-13 16:53:19+00:00,https://twitter.com/Benioff/status/1625176302646104064,Thich Nhat Hahn's question sparked a revolution in me: Success or Happiness? How does this shape the future of Salesforce and our mission of Ohana &amp; stakeholder capitalism? ⁦@DavidStreitfeld⁩ delves into this thought-provoking topic. ❤️ https://t.co/1XQUeSNtWO
3,@Benioff,2023-02-08 17:31:31+00:00,https://twitter.com/Benioff/status/1623373977765953537,¡Presentando Salesforce EinsteinGPT! El CRM que conoce a tus clientes mejor que tú y hasta puede predecir su próximo movimiento. ¡Hablemos de juego de poder! #EinsteinGPT #tdx 🔮💪😎 https://t.co/QWhhjctkz0
4,@Benioff,2023-02-08 17:30:55+00:00,https://twitter.com/Benioff/status/1623373827655995394,Présentation de Salesforce EinsteinGPT : le CRM qui connaît vos clients mieux que vous et peut même prédire leur prochaine move. Parlons de stratégie ! #EinsteinGPT #TDX23 🔮💪😎 https://t.co/xZQS2hCnGZ
5,@Benioff,2023-02-08 17:29:06+00:00,https://twitter.com/Benioff/status/1623373369285685248,"Salesforce EinsteinGPT登場！顧客を知りすぎて、彼らの次の一手を予想できるCRM。これはパワープレーです！ #EinsteinGPT #TDX23
 🔮💪😎 https://t.co/LrWPGJjLtt"
6,@Benioff,2023-02-08 17:27:45+00:00,https://twitter.com/Benioff/status/1623373028431380481,"CRM just got a whole lot smarter with the new Salesforce EinsteinGPT! No more boring reports, now it'll write them for you with jokes included. #EinsteinGPT #tdx23 🤖💻😂 https://t.co/Y14FCWkdCw"
7,@Benioff,2023-02-08 17:27:09+00:00,https://twitter.com/Benioff/status/1623372878854107136,"Get ready to be wowed by Salesforce EinsteinGPT! It generates leads, closes deals, and even makes coffee (just kidding, but wouldn't that be amazing?) #EinsteinGPT #TDX23 💼☕️😎 https://t.co/8W9cKq8mci"
8,@Benioff,2023-02-08 16:44:39+00:00,https://twitter.com/Benioff/status/1623362183798358016,@jachristian Native San Franciscans need Flonase and Allegra today.  It’s our only hope. ❤️
9,@Benioff,2023-02-06 19:50:02+00:00,https://twitter.com/Benioff/status/1622684060190670848,"Im so sad for all my friends &amp; family in Turkey. Its a heartbreaking situation. I received this message this morning: “The roads are closed; many people are left homeless, and sadly, there are thousands of people waiting to get rescued still. I'm very sorry for my country.” ❤️🇹🇷"
10,@Benioff,2023-02-06 18:31:01+00:00,https://twitter.com/Benioff/status/1622664175477751808,"🌲s teach us to stand tall, grow deep roots, &amp; never lose our sense of wonder. 🌲s combat climate change by converting CO2 to O2 &amp; sequestering carbon. Join us to conserve, restore, &amp; grow 1 trillion 🌲s by 2030. https://t.co/JEYRRKvFFD! #1t #trilliontrees #naturepositive"
11,@Benioff,2023-02-06 02:49:21+00:00,https://twitter.com/Benioff/status/1622427196450295808,@APompliano Sandman. 🤘
12,@Benioff,2023-02-04 06:53:18+00:00,https://twitter.com/Benioff/status/1621763813258444800,@techforecastis @MeighanSF @C_Estevez3 @adam17amo @danieljpeter @hectorperezjr @JarrettTaylorVO Beautiful. ❤️
13,@Benioff,2023-02-03 22:33:11+00:00,https://twitter.com/Benioff/status/1621637952593088512,"I’m so very sorry to hear the passing of @MeighanSF.  Meighan is a cornerstone of our community, &amp; we will all deeply miss her kindness, intelligence, fight for equality, deep support of others, &amp; continually positive attitude. May the One who brings Peace bring Peace to all. ❤️ https://t.co/gIvkPK61XY"
14,@Benioff,2023-02-03 22:32:35+00:00,https://twitter.com/Benioff/status/1621637804223782917,"I’m so very sorry to hear the passing of @MeighanSF.  Meighan is a cornerstone of our community, &amp; we will all deeply miss her kindness, intelligence, fight for equality, deep support of others, &amp; continually positive attitude.  May the One who brings Peace bring Peace to all. ❤️ https://t.co/WnhMGSwp0R"
15,@Benioff,2023-01-28 04:12:06+00:00,https://twitter.com/Benioff/status/1619186529326473217,"“You can be victim of your success, but you can not be a victim of your happiness.”‘ - ⁦⁦@thichnhathanh⁩ https://t.co/5UFSxUXg3X"
16,@Benioff,2023-01-28 02:14:53+00:00,https://twitter.com/Benioff/status/1619157029930831873,Chat Gpt: Text is the new GUI. 🤖
17,@Benioff,2023-01-27 22:05:48+00:00,https://twitter.com/Benioff/status/1619094346208509954,"Welcoming 3 amazing new board members today! Arnold Donald, Sachin Mehra, &amp; Mason Morfit are joining our Ohana.  We are also sending our immense gratitude to 2 Salesforce BOD who are retiring today: Sandy Robertson &amp; Alan Hassenfeld.  Mahalo for your Kokua of salesforce! ❤️ https://t.co/Oe2F5EVH8i"
18,@Benioff,2023-01-26 05:06:59+00:00,https://twitter.com/Benioff/status/1618475566725795840,Amazing week in Switzerland with https://t.co/U6nrVBCgaA.  Will’s work in the nation’s toughest public schools reminds us that nothing is more important than our children’s education. Will inspired $125M in grants to our SF &amp; Oakland public schools from Salesforce Foundation. ❤️ https://t.co/iUPau40nco
19,@Benioff,2023-01-26 04:40:20+00:00,https://twitter.com/Benioff/status/1618468858947588102,@gauravkheterpal @salesforce @justguilda @LangstonJessica @malloryranahan @LeahBMH @lexpisani @jenntothechen @emceeamalia @diminom @kavindrapatel We are Ohana. ❤️ https://t.co/rB9GGjxoUu
20,@Benioff,2023-01-20 10:22:55+00:00,https://twitter.com/Benioff/status/1616380744997240832,"I’m grateful to Insead Society for Progress for this wonderful recognition.  A wonderful surprise today, and unexpected.  Thank you Subramanian Rangen for your leadership and making business the greatest platform for change.  ❤️ https://t.co/XQAVze2fon"
21,@Benioff,2023-01-19 13:14:59+00:00,https://twitter.com/Benioff/status/1616061659629637632,"In times of crisis, we can always count on the selfless dedication of Chef Jose Andreas. His unwavering compassion ensures no one goes hungry and every person is fed. Forever grateful for his kindness. #hero #compassion #gratitude ❤️👨‍🍳 https://t.co/xkQOU28hkN"
22,@Benioff,2023-01-19 08:48:59+00:00,https://twitter.com/Benioff/status/1615994719154368513,"Deforestation is the 3rd largest emitter in the world, but we can change that by protecting, restoring, &amp; planting 1 trillion trees. Join us in delivering 200GT of carbon sequestration. #SaveTrees #ClimateAction @1t_org ❤️🌲 https://t.co/RxofOMfo9k"
23,@Benioff,2023-01-19 07:02:14+00:00,https://twitter.com/Benioff/status/1615967855933100034,"Look at the data! We're on the brink of catastrophe with food, energy, health &amp; nature crises threatening our way of life. Visionary leadership &amp; systems thinking is needed NOW for transformative solutions &amp; global collaboration. We need to wake up! https://t.co/7x2NCJGQ3u"
24,@Benioff,2023-01-19 07:01:17+00:00,https://twitter.com/Benioff/status/1615967617142951936,"Look at the data! We're on the brink of catastrophe with food, energy, health &amp; nature crises threatening our way of life. Visionary leadership &amp; systems thinking is needed NOW for transformative solutions &amp; global collaboration. We need to wake up. https://t.co/7x2NCJGQ3u"
25,@Benioff,2023-01-18 15:03:54+00:00,https://twitter.com/Benioff/status/1615726682551517184,"Ecopreneurs, let's make the earth green with envy restoring 1 Trillion Trees &amp; investing in nature to sequester 200GT of carbon. Together, we can drive new innovative tech &amp; solutions for a brighter future. Let's lead the way to a greener future. ❤️🌲#NetZeroCapitalism @1t_org"
26,@Benioff,2023-01-18 09:39:51+00:00,https://twitter.com/Benioff/status/1615645133331959810,Want to close deals and work flexibly? Look no further than Salesforce and a trusty guide dog! Check out this article to see how they lead to success: https://t.co/2zoAfEIvFd #GuideDogsofSalesforce #FlexibleWorking #DataDrivenDecisions
27,@Benioff,2023-01-18 09:32:12+00:00,https://twitter.com/Benioff/status/1615643206456164352,"Looks like Salesforce Marketing Cloud is the real MVP when it comes to ROI! A recent study showed a 299% return on investment over 3 years. That's like winning the Super Bowl, World Series, and World Cup all at once! #Salesforce #Marketing #ROI #Winning  https://t.co/sdAMDtSiW2"
28,@Benioff,2023-01-18 09:29:32+00:00,https://twitter.com/Benioff/status/1615642536797782016,"Formula 1 teams up with Salesforce to speed past the competition in personalized fan experiences. Finally, a pit stop for our new Genie Customer Data Cloud that's worth the wait! #F1 #Salesforce #Personalization #Racing https://t.co/qmuCYcUyQj"
29,@Benioff,2023-01-17 11:23:57+00:00,https://twitter.com/Benioff/status/1615308943793741824,"We're growing like a tree! 🌳Since 2020, https://t.co/vMJ0FdlVqA has planted 125 billion trees &amp; counting! 🌲 875 billion to go! Join our movement &amp; let's make the earth a little more lush. 🎄1 Trillion Trees sequestering 200GT of CO2. #PlantATree #JoinTheMovement @1t_org ❤️🌴"
30,@Benioff,2023-01-17 10:49:47+00:00,https://twitter.com/Benioff/status/1615300344627728384,"Treedom! So proud of the success &amp; progress of https://t.co/vMJ0Fdmtg8! Since its founding in 2020, 1T has conserved, restored, &amp; grown 125 billion trees from pledges by more than 130 organizations across 65 countries. Join us. #PlantATree! 🌳 #JoinTheMovement @1t_org https://t.co/Fp64NDt0nG"
31,@Benioff,2023-01-17 04:50:04+00:00,https://twitter.com/Benioff/status/1615209817878020097,Leaders like @angeliquekidjo and @iamwill are my spirit animals. They're out there making the world a better place while I'm just trying to make it to the fridge without tripping. #goals #inspiration #snacktime ❤️🌎 https://t.co/6gCskpMPGO
32,@Benioff,2023-01-17 04:43:39+00:00,https://twitter.com/Benioff/status/1615208202051940352,Who inspires me?  These incredible global female leaders who are committed to improving the state of the world.  Their individual activism to constantly bring people together.  Only through a multi stakeholder conversation amplified by trust can we move the world forward.  ❤️🌎 https://t.co/XKXXxojc7S
33,@Benioff,2023-01-16 13:41:50+00:00,https://twitter.com/Benioff/status/1614981255623495686,"Faith is taking the first step even when you don’t see the whole staircase.  Martin Luther King, Jr. https://t.co/pio9Ve8WUH"
34,@Benioff,2023-01-16 11:36:18+00:00,https://twitter.com/Benioff/status/1614949660992446465,"Let's aim for 1 Trillion Trees sequestering 200GT of CO2, but let's focus on protecting land for natural recovery &amp; sustainable practices like agroforestry &amp; permaculture. Together, we can make nature the economically viable option. #trilliontrees #sustainability @1t_org ❤️🌲"
35,@Benioff,2023-01-16 11:31:36+00:00,https://twitter.com/Benioff/status/1614948478538420225,"Join us to protect &amp; restore Earth with 1 Trillion Trees @1T_org &amp; sequester 200GT of CO2. It's not just about planting, but protecting land for natural recovery &amp; working with local communities for solutions like agroforestry, silviculture &amp; permaculture. @1t_org ❤️🌲#teamearth"
36,@Benioff,2023-01-14 21:41:48+00:00,https://twitter.com/Benioff/status/1614377267739910144,Exciting week at #CES with @Qualcomm showing off new #Salesforce &amp; #Tableau innovations for Auto Cloud. Direct data to determine the perfect time for an upsell &amp; insights on subscription conversion. Check it out: https://t.co/pakpI7uIrY #innovation #automotive
37,@Benioff,2023-01-14 21:31:07+00:00,https://twitter.com/Benioff/status/1614374575856562176,"2023 is looking bright for #Tableau! @Ajenstat shares the company's commitment to innovation, community and expanding opportunities for all to access data. Excited for what's to come! #DataFam Learn more: https://t.co/1Ch2CXEBVb"
38,@Benioff,2023-01-14 21:26:52+00:00,https://twitter.com/Benioff/status/1614373508456546306,5 years in a row and still going strong! So proud that #Salesforce has once again been named one of America's Most JUST Companies by @JustCapital and @CNBC. #corporateresponsibility #justbusiness  https://t.co/Ti2S2glv3H
39,@Benioff,2023-01-14 21:23:04+00:00,https://twitter.com/Benioff/status/1614372552025178114,Just promoted #ChatGPT to the management team at salesforce. It's been a real asset - never seen such efficient decision making &amp; hilarious meeting participation! #AI #futureofwork ❤️🤖
40,@Benioff,2023-01-10 20:05:16+00:00,https://twitter.com/Benioff/status/1612903419421020162,Grateful that Salesforce has been named one of America's Most JUST Companies for the 5th year in a row by Just Capital &amp; CNBC.  ❤️ https://t.co/Ti2S2glv3H
41,@Benioff,2023-01-08 21:07:34+00:00,https://twitter.com/Benioff/status/1612194321587113984,@calloni @tableau DM me
42,@Benioff,2023-01-08 21:04:54+00:00,https://twitter.com/Benioff/status/1612193651844845568,"Exciting week at CES with @Qualcomm showing off our new salesforce Tableau innovations for Auto Cloud. Our first viz shows a direct to Genie data &amp; determines when to offer a ""parking assist"" upsell. The second viz shows subscription conversion insights.
https://t.co/2WmRtBR5XG"
43,@Benioff,2023-01-08 20:58:54+00:00,https://twitter.com/Benioff/status/1612192143233404928,@calloni Let’s chat
44,@Benioff,2023-01-08 03:42:37+00:00,https://twitter.com/Benioff/status/1611931351984541698,"@ZachBowders @ZenDollData @_gringuinho_ @matthewmmiller @pdrmnvd @tableau Thank you for saying that Zach. Yes, Salesforce is deeply committed to Tableau &amp; the DataFam &amp; we love the passion for the product &amp; the community.  We can’t wait until Tableau Conference to show off the innovation &amp; get back together."
45,@Benioff,2023-01-08 03:41:37+00:00,https://twitter.com/Benioff/status/1611931101316149248,"@_gringuinho_ @matthewmmiller @pdrmnvd Thank you for your love of Tableau Will. I love it too.  And, Yes, Salesforce is deeply committed to Tableau &amp; the DataFam &amp; we love the passion for the product &amp; the community.  We can’t wait until Tableau Conference to show off the innovation &amp; get back together."
46,@Benioff,2023-01-08 03:39:32+00:00,https://twitter.com/Benioff/status/1611930577879592960,"@ZenDollData @_gringuinho_ @matthewmmiller @pdrmnvd @tableau Thank you for asking Lindsay. Yes, Salesforce is deeply committed to Tableau &amp; the DataFam &amp; we love the passion for the product &amp; the community.  We can’t wait until Tableau Conference to show off the innovation &amp; get back together."
47,@Benioff,2023-01-06 19:48:00+00:00,https://twitter.com/Benioff/status/1611449524610039810,"A gorgeous day in San Francisco &amp; serendipitously ran in to Workday ceo Aneel Bushri on my morning walk. Thank you Aneel for being such a great friend &amp; an incredible partner in building the cloud computing industry. You are truly a wonderful person, and a amazing leader.  ❤️🌉 https://t.co/FGHLRdOUyz"
48,@Benioff,2023-01-04 10:18:23+00:00,https://twitter.com/Benioff/status/1610581399505096705,@MiniRacker Congrats!
49,@Benioff,2022-12-15 23:28:33+00:00,https://twitter.com/Benioff/status/1603532492769746944,"The @salesforce learning event of the year is coming!  Join us at TrailblazerDX March 7–8 in San Francisco: 

👩🏽‍💻200+ technical sessions
🤠400+ Salesforce product experts
🎓1k Certification opportunities

Join us and register at ➡️ https://t.co/VewXqx69bO"
50,@Benioff,2022-12-14 17:25:15+00:00,https://twitter.com/Benioff/status/1603078678962790400,Thank you President Fritch @EdouardFritch for your support of a deep sea mining moratorium. Urgent action is needed before AI-based robots are at the bottom of our Ocean digging nodules with consequences from the release of toxic metals &amp; mining waste.❤️🐟 https://t.co/QSL6c1ApAB
51,@Benioff,2022-12-13 07:11:09+00:00,https://twitter.com/Benioff/status/1602561747520364545,Who was employee 13 at salesforce in 1999? Answer: Our COO Brian Millham.”Execution is something that we can control. Lean in on the things that you can control. You are not going to change the economy. Go fix the things that you can in your organization.“ https://t.co/Txtw9CwtZ5
52,@Benioff,2022-12-13 05:04:03+00:00,https://twitter.com/Benioff/status/1602529761040904192,Our new salesforce Data Cloud is a breakthrough for our customers delivering a data warehouse--a lake house architecture directly into our salesforce platform for the 1st time. Today customers stand up unintegrated data warehouses outside of our platform. https://t.co/P9ynxKY47d
53,@Benioff,2022-12-11 22:49:16+00:00,https://twitter.com/Benioff/status/1602073057085923328,"So much fun being with Jim Cramer &amp; Mayor Adams at the salesforce world tour New York.  Over 10,000 registered to come to see the Salesforce Data Cloud powered by Tableau.  The energy was just amazing, &amp; so grateful to be back in New York City. ❤️ https://t.co/kitCh9zOKd"
54,@Benioff,2022-12-11 20:50:02+00:00,https://twitter.com/Benioff/status/1602043048858615814,@brandicarlile Brandi amazing performance on SNL &amp; you always bring it! ❤️ https://t.co/jYyDpKW1pD
55,@Benioff,2022-12-09 16:19:13+00:00,https://twitter.com/Benioff/status/1601250123795017729,"Incredible week in DC &amp; NYC with Salesforce customers &amp; our Ohana. The highlight was our introduction of the Salesforce Genie Data Cloud powered by Tableau. I could not be more proud of our team, or more excited for trailblazers! #1 CRM: Apps. Verticals. Platform. Data. ❤️"
56,@Benioff,2022-12-09 16:06:56+00:00,https://twitter.com/Benioff/status/1601247031796072453,"Incredible week in DC &amp; NYC with Salesforce customers &amp; our Ohana. The highlight was our introduction of the Salesforce Genie Data Cloud powered by Tableau. I could not be more proud of our team, or more excited for trailblazers! #1 CRM: Apps. Verticals. Platform. Data. ❤️ https://t.co/Y07nKYnczR"
57,@Benioff,2022-12-08 19:49:17+00:00,https://twitter.com/Benioff/status/1600940599343218688,"So much fun being with Jim Cramer &amp; Mayor Adams at the salesforce world tour New York.  Over 10,000 registered to come to see the Salesforce Data Cloud powered by Tableau.  The energy is just amazing, and so grateful to be back in New York City. ❤️ https://t.co/weUWEv4zKd"
58,@Benioff,2022-12-08 15:49:32+00:00,https://twitter.com/Benioff/status/1600880264154353664,It’s a huge day in NYC with the Salesforce World Tour about to start with 10000 registered attendees at Javits Center!  Very excited to show off the new Salesforce Data Cloud powered by Tableau. Steve Fisher blowing  some minds with our new salesforce lake house architecture.  ❤️ https://t.co/5dqDOcuJ7T
59,@Benioff,2022-12-08 15:46:23+00:00,https://twitter.com/Benioff/status/1600879471044747266,It’s a huge day in NYC with the Salesforce World Tour about to start with 10000 registered attendees at Javits Center!  Very excited to show off the new Salesforce Data Cloud powered by Tableau. 😀🤯 ❤️ https://t.co/MeRB84Cgaw
60,@Benioff,2022-12-08 15:10:48+00:00,https://twitter.com/Benioff/status/1600870516885098496,It’s a huge day in NYC with the Salesforce World Tour about to start with 10000 registered attendees at Javits Center!  Very excited to show off the new Salesforce Data Cloud powered by Tableau. Ready to blow some minds with our new salesforce lake house architecture.  😀🤯 ❤️ https://t.co/Mz2aleXGPt
61,@Benioff,2022-12-08 15:07:55+00:00,https://twitter.com/Benioff/status/1600869792809947139,It’s a huge day in NYC with the Salesforce World Tour about to start with 10000 registered attendees at Javits Center!  Very excited to show off the new Salesforce Data Cloud powered by Tableau. Ready to blow some minds with our new salesforce lake house architecture.  😀🤯 ❤️ https://t.co/QusbsNAnwG
62,@Benioff,2022-12-07 18:47:59+00:00,https://twitter.com/Benioff/status/1600562782704762880,"Who inspires me?  My friends salesforce Ohana &amp; Newell Brands CEO Ravi Saligram &amp; my friend artist Brandi Carlile.  Leaders who are kind, compassionate, &amp; spiritually uplifting.  Brandi, break a leg on SNL! ❤️ https://t.co/tmzGlWolSw"
63,@Benioff,2022-12-06 12:59:01+00:00,https://twitter.com/Benioff/status/1600112574774751232,"So much fun to be with my great friends at The Business Roundtable talking about how business is the greatest platform for change, &amp; how the true purpose of a corporation is to serve all stakeholders. Especially wonderful to see Thasunda Duckett, Manny Maceda, and Ynon Kreiz. ❤️ https://t.co/XzevUV8365"
64,@Benioff,2022-12-05 20:34:50+00:00,https://twitter.com/Benioff/status/1599864897335984128,"Congratulations Lidiane on your promotion to the CEO of Slack! Thank you Stewart for the amazing product you have created, and how you and Tamar have changed the world with your incredible team, platform &amp; community. ❤️ https://t.co/dmm1FVJLWg"
65,@Benioff,2022-12-03 03:46:03+00:00,https://twitter.com/Benioff/status/1598886255760412674,❤️@YoYo_Ma  https://t.co/cEG6BmIxGx
66,@Benioff,2022-11-30 21:18:57+00:00,https://twitter.com/Benioff/status/1598064059949395969,"Salesforce Growth:

2023 $31B (guidance)
2022 $26.5B 
2021 $21.25B
2020 $17.1B 
2019 $13.2B
2018 $10.5B
2017 $8.4B
2016 $6.7B
2015 $5.4B
2014 $4.1B

Thank you Ohana!  ❤️
(Love you forever BT!)"
67,@Benioff,2022-11-29 08:12:25+00:00,https://twitter.com/Benioff/status/1597503734224863232,I couldn’t be happier to see Salesforce World Tour happening right now in Tokyo!  ❤️🇯🇵. Featuring salesforce co-founder Parker Harris. https://t.co/tCJCbXRUYd
68,@Benioff,2022-11-27 01:21:26+00:00,https://twitter.com/Benioff/status/1596675534897180672,"Watching real time holiday data coming in! Its now clear our customers broke every record Black Friday, sending 8.87 Billion outbound messages from Salesforce @MarketingCloud (up 20%) &amp; Salesforce @CommerceCloud sales growth of 14% compared over last year.  Happy holidays! ❤️ https://t.co/6c7pSfP2Xk"
69,@Benioff,2022-11-27 01:03:43+00:00,https://twitter.com/Benioff/status/1596671076410744832,"Watching real time holiday data coming in! Its now clear our customers broke every record Black Friday, sending 8.87 Billion outbound messages from Salesforce @MarketingCloud (up 20%) &amp; Salesforce @CommerceCloud sales growth of 14% compared over last year.  Happy holidays! ❤️ https://t.co/woipZ750AY"
70,@Benioff,2022-11-24 20:41:12+00:00,https://twitter.com/Benioff/status/1595880232413560832,An inside look at Sydney’s tallest office building: Salesforce Tower Sydney. Congrats @pipms! https://t.co/VobZbMcwEP
71,@Benioff,2022-11-24 20:23:01+00:00,https://twitter.com/Benioff/status/1595875659842486272,Happy Thanksgiving. ❤️🦃 https://t.co/26l9PM7EFK
72,@Benioff,2022-11-23 22:29:45+00:00,https://twitter.com/Benioff/status/1595545161693507584,"TIME 100 PHOTOS OF 2022.
https://t.co/SztSnjk342"
73,@Benioff,2022-11-23 16:55:27+00:00,https://twitter.com/Benioff/status/1595461035028193291,"An exclusive Twitter preview of “The March”, with the TV debut tomorrow on Thanksgiving day during the Patriots v. Vikings game! Mahalo @McConaughey for your amazing creative vision, unending drive, &amp; desire to improve the state of the world. Happy Thanksgiving Everyone!
❤️🦃 https://t.co/nrgD2bgAT3"
74,@Benioff,2022-11-22 08:20:24+00:00,https://twitter.com/Benioff/status/1594969031723085825,@Jason I use salesforce sales cloud that is integrated salesforce call coaching.  we have been able to scale our company across all geographies.  let me know if I can help you @jason.  https://t.co/1qkYQIENcN
75,@Benioff,2022-11-22 00:02:49+00:00,https://twitter.com/Benioff/status/1594843809657270272,Salesforce is once again a great place to work in one of my all time favorite countries: Singapore.  91% of our Ohana say this is a great place to work.  Salesforce is the #1 CRM.  Join us.  @salesforcejobs https://t.co/eVIyKxpZA9 ❤️🇸🇬 @GPTW_Singapore https://t.co/fRyHT6fgmx
76,@Benioff,2022-11-21 19:50:53+00:00,https://twitter.com/Benioff/status/1594780409069379584,@davidgura https://t.co/lAyMeBvel3
77,@Benioff,2022-11-21 18:15:31+00:00,https://twitter.com/Benioff/status/1594756406582079488,@davidgura We have an internship available for her at Salesforce when she is ready. 😇
78,@Benioff,2022-11-20 01:42:28+00:00,https://twitter.com/Benioff/status/1594144109505413120,Lets Go Trojans! Beat the Bruins! ✌️ https://t.co/B4PMYDzVJy
79,@Benioff,2022-11-19 22:00:46+00:00,https://twitter.com/Benioff/status/1594088317611814917,@ValaAfshar I worked for another one in 1984. https://t.co/B0YZzmF8ZZ
80,@Benioff,2022-11-18 20:09:03+00:00,https://twitter.com/Benioff/status/1593697817285259264,Don’t underestimate @elonmusk. https://t.co/AlTe71g8zQ
81,@Benioff,2022-11-17 18:15:29+00:00,https://twitter.com/Benioff/status/1593306849654099969,"“Healthy nature is not just a tool in the fight against climate change. It is a reason that we want to address it in the first place, because it is the essence of life on Earth.” ❤️🌲⁦@TWCrowther⁩ ⁦@1t_org⁩  https://t.co/Zv5geRMC2D"
