,0,1,2,3
0,@future,2022-10-05 15:55:11+00:00,https://twitter.com/future/status/1577688860993196032,"Machine learning when paired with biological data has the potential to forever change the way we face diseases including cancer, says @cjimmylin of @Freenome. 

But there will be challenges along the way as Lin outlines in this Q&amp;A. 👇 https://t.co/i1QMiLoZPD"
1,@future,2022-09-27 14:51:25+00:00,https://twitter.com/future/status/1574773712175435777,"Instead of companies stuffing themselves on SaaS, @AndrejSafundzic argues for a new kind of software diet.

One that changes the priorities of IT, security, and procurement from fixing problems to helping them create infrastructure that empowers employees. https://t.co/w8r1QK8P0X"
2,@future,2022-09-13 15:58:37+00:00,https://twitter.com/future/status/1569717192563871750,"Cities have been called ""the largest technology we make."" 🌃

We should be asking these questions, then, before building them, says @zachcaceres.

""Is it expensive to run?""
""Does it scale?""
And especially: ""How good are its APIs?"" https://t.co/GMiwunnJf4"
3,@future,2022-09-09 17:29:13+00:00,https://twitter.com/future/status/1568290443573751809,"37signals (Basecamp/HEY) CEO @jasonfried advocates ""short-term thinking"" when running a company. 

No long-term plans. No to-do lists. You make decisions in the moment and the maximum amount of time devoted to any project is 6 weeks. 

He explains why 👇 https://t.co/T21hjknVa9"
4,@future,2022-09-02 15:05:25+00:00,https://twitter.com/future/status/1565717539027427328,"In the same way e-commerce has decimated many physical stores, @chris_herd believes virtual companies will crush office-based companies. 

Read more: https://t.co/ZevnENO4H7"
5,@future,2022-09-02 15:05:24+00:00,https://twitter.com/future/status/1565717534736756738,"For companies that have gone or are planning to go to a hybrid-remote model, @chris_herd explains why ""hybrid"" needs to mean the same thing to management and employees, because it often doesn't. https://t.co/uAn6EckOQe"
6,@future,2022-09-01 15:00:22+00:00,https://twitter.com/future/status/1565353878325174274,"Far too many products fail because there’s simply no demand for them. How does that happen? By overlooking user research. 

@Sprig founder @ryanglasgow provides a blueprint for investment in research to fuel the right decisions at every stage of growth. https://t.co/9Wq7J7H5Sa"
7,@future,2022-08-31 19:14:06+00:00,https://twitter.com/future/status/1565055345046605824,"When your startup is on the line, SuperGoals create focus, says @anchor founder @mignano.

SuperGoals have an urgent timeframe, an open-ended method of achievement, and a single measure of success. https://t.co/waKGxhjlYY"
8,@future,2022-08-30 15:30:25+00:00,https://twitter.com/future/status/1564636665368436740,"New models for synthetic embryos have recently emerged, but bioengineers aren’t growing humans now.

The immediate goals, explains @Cambridge &amp; @Caltech scientist @ZernickaGoetz, are to understand how life is created and teach us how to rejuvenate tissues. https://t.co/zI4qqzZybJ"
9,@future,2022-08-29 18:00:08+00:00,https://twitter.com/future/status/1564311958064492544,"How to break the cycle of technology panics:

Instead of being reactive, science should be proactive. If researchers need 5 years to begin understanding something, the process shouldn’t start while everyone’s hyped up and politicians are demanding answers. https://t.co/P52nJni3f0"
10,@future,2022-08-29 18:00:07+00:00,https://twitter.com/future/status/1564311953928888320,"The Sisyphean cycle of technology panics (and how to break it).

In his new book, @heyfeifer writes about @OrbenAmy’s four-step theory for what keeps happening when a new technology takes hold, especially with young people. https://t.co/OM1VoEgCkK"
11,@future,2022-08-29 15:42:47+00:00,https://twitter.com/future/status/1564277392276963328,"No long-term planning. No politics. No Zoom. No 10-12 hour days. No project managers. Fully remote.

@jasonfried shares his unconventional approach to running agile companies. https://t.co/T21hjknnkB"
12,@future,2022-08-29 15:00:31+00:00,https://twitter.com/future/status/1564266753441599488,"Founder &amp; CEO of @Firstbase, @chris_herd, explains why he believes remote startups will win the war for top talent: https://t.co/ZevnEO5G5H https://t.co/XHjnhItsoJ"
13,@future,2022-08-28 15:25:02+00:00,https://twitter.com/future/status/1563910536281989121,"For specific metrics investors want to see for marketplaces, social apps, subscriptions, and e-commerce startups, and answers to some frequently asked questions, read more from @venturetwins ⬇️ https://t.co/spni1qTNVT"
14,@future,2022-08-28 15:25:01+00:00,https://twitter.com/future/status/1563910532507152384,"Data Room Red Flags 🚩 🚩 🚩

Your data room doesn't need to be perfect, but here are a few things that will give investors pause. https://t.co/q8zPfmvAnO"
15,@future,2022-08-28 15:24:58+00:00,https://twitter.com/future/status/1563910521266401280,"What shouldn’t you include in your data room?

Five things often seen in data rooms that @venturetwins wouldn’t recommend including, unless an investor specifically asks for them. https://t.co/VAVOWGSaSp"
16,@future,2022-08-28 15:24:57+00:00,https://twitter.com/future/status/1563910513016262656,"Lifetime value / Customer acquisition cost: are you making money on the average customer, after accounting for the costs of acquiring and serving them?

Payback period: a measure of how long it takes for the profit generated by the customer to “pay back” the cost of acquisition. https://t.co/ItiNoqvaxc"
17,@future,2022-08-28 15:24:52+00:00,https://twitter.com/future/status/1563910492732551169,"Usage data — this will vary based on type of company, but in general you’ll want to include:

✅ How your user base is scaling over time
✅ Where you are acquiring users and cost
✅ How often and long users are engaging with the product
✅ How users are retaining over time https://t.co/RlCZ1aLlrx"
18,@future,2022-08-28 15:24:44+00:00,https://twitter.com/future/status/1563910460004413441,"Historical P&amp;L and burn:

The path from gross revenue through net income (loss) through cash outflow on a monthly basis. Break out different types of revenue (if applicable) and major costs. Add your cash balance if you’re not including a balance sheet and cash flow statement. https://t.co/CsoBVRIW9C"
19,@future,2022-08-28 15:24:41+00:00,https://twitter.com/future/status/1563910446788120576,"Cap table:

This should show the current investors in your company, how much they’ve invested, and how much ownership they have. 

@cartainc has some great free templates. https://t.co/xvVVBjjU9E"
20,@future,2022-08-28 15:24:40+00:00,https://twitter.com/future/status/1563910444254781440,"Pitch deck:

At a minimum, this should include your company’s thesis, product vision, competitive landscape, traction, and team, as well as a rough road map or plan for how you will use the funds."
21,@future,2022-08-28 15:24:39+00:00,https://twitter.com/future/status/1563910441486524416,"These are the top 5 things @venturetwins recommends including in your data room:

1️⃣ Pitch deck
2️⃣ Cap table
3️⃣ Historical P&amp;L and burn
4️⃣ Usage data (growth, acquisition channels, engagement, retention)
5️⃣ LTV/CAC and payback period"
22,@future,2022-08-28 15:24:39+00:00,https://twitter.com/future/status/1563910438810660864,"What is a data room?

In the 1900s, companies used to print physical documents and present them to investors in secure rooms. 

Today, data rooms are virtual — but they’re still an important part of the diligence process. https://t.co/spni1qTNVT"
23,@future,2022-08-28 15:24:38+00:00,https://twitter.com/future/status/1563910436159754240,"A startup’s data room is key for raising venture capital. But many founders waste time compiling data investors don’t want or need.

From @venturetwins, a 🧵 on what founders need to know, including specific data investors want to see, info to leave out, and traps to avoid.👇"
24,@future,2022-08-27 15:04:07+00:00,https://twitter.com/future/status/1563542882601971712,"Companies that don’t adapt will bleed talent to their competition, and companies that embrace remote work will replace the ones that don’t.

Read more from @chris_herd ⬇️ https://t.co/YgZwyFOeNJ"
25,@future,2022-08-27 15:04:06+00:00,https://twitter.com/future/status/1563542879934369792,"The office has also grown to become a distraction factory of epic proportions. The open office has become the enemy of deep, focused work.

A slew of research has found that the open office leads to higher stress and less productivity. https://t.co/31jFyITVf3"
26,@future,2022-08-27 15:04:05+00:00,https://twitter.com/future/status/1563542877463932928,"One reason:

On average, US workers commute nearly 30 minutes each way, stealing time from hobbies and relationships outside of work."
27,@future,2022-08-27 15:04:04+00:00,https://twitter.com/future/status/1563542873752055810,"“We have a special culture and we need the social connection of the office.”

A Gartner survey of 5,000 workers found that remote and hybrid employees actually reported higher culture satisfaction than on-site employees. https://t.co/TTJ0eRiXBD https://t.co/A2RlTQssm2"
28,@future,2022-08-27 15:04:02+00:00,https://twitter.com/future/status/1563542863064866820,"“We do our best work around the water cooler.”

A 2019 study found just 10% of all communications occurred between employees whose desks were more than 500 meters apart. Collaborative value disappears once companies span floors, buildings, or campuses. https://t.co/cuBPuSSAtI"
29,@future,2022-08-27 15:04:01+00:00,https://twitter.com/future/status/1563542860233748480,"When employees have the freedom and flexibility to organize work around living, rather than living around work, a new paradigm emerges.

And the arguments for returning to the office don’t hold up."
30,@future,2022-08-27 15:04:01+00:00,https://twitter.com/future/status/1563542857503215621,"Jeff Bezos famously said, “Your margin is my opportunity.”

Now, your office is your competitor’s opportunity, writes @chris_herd. Any company that’s less remote than its competitors risks losing its most talented people.

Why remote startups will win the war for top talent 🧵👇"
31,@future,2022-08-26 19:30:06+00:00,https://twitter.com/future/status/1563247431839494145,"Insights from our Web3 Water Cooler — a Slack chat about a trending topic in crypto moderated by editor @jbensonwrites. 

This week @chaserchapman, @austin_hurwitz &amp; @nuzayraesq discuss the intellectual property frameworks surrounding NFTs.

Read more: https://t.co/7dAo0fYvIr https://t.co/wt2SLLqdWH"
32,@future,2022-08-26 15:44:25+00:00,https://twitter.com/future/status/1563190637524307968,"Over Slack @chaserchapman @austin_hurwitz @nuzayraesq &amp; @jbensonwrites chat about IP frameworks for NFTs.

They tackle the current legal landscape, commercial rights confusion, creative control &amp; more. Plus, examples of innovation &amp; takeaways for builders. https://t.co/xCnKJ9iVDa"
33,@future,2022-08-25 14:25:00+00:00,https://twitter.com/future/status/1562808265347858434,"It’s time to raise. 

You make a deck, practice your pitch, and reach out to investors. 

A meeting ends with a request to share your ""data room."" But what is a data room, and what should be included in it?

@venturetwins with what startups need to know 👇 https://t.co/spni1qCKTT"
34,@future,2022-08-24 18:33:14+00:00,https://twitter.com/future/status/1562508346048950274,"The Merge is almost here. @ethereum's transition to proof of stake is expected to trigger between September 10-20.

What's this mean and what comes next? EF lead coordinator @dannyryan answers all of our questions.

Part 1: https://t.co/XrXXyAECcb
Part 2: https://t.co/qTXDeaJCMg"
35,@future,2022-08-23 15:58:59+00:00,https://twitter.com/future/status/1562107140218802176,"Around 40% of workers are considering quitting their jobs. 

The Great Resignation (cc: quiet quitting) isn’t happening because workers don’t want to work, writes @chris_herd. 

Rather, top talent is leaving companies that don't trust them to work remote. https://t.co/ZevnEO5G5H"
36,@future,2022-08-18 16:35:24+00:00,https://twitter.com/future/status/1560304363712782338,"Unlike DALL-E for images or GPT-3 for text, there are no generative AI models trained on the vast body of scientific research. If there were, writes @joshmnicholson, plain-language answers to scientific questions would be would be among the first benefits. https://t.co/1peQH5X78l"
37,@future,2022-08-17 15:00:14+00:00,https://twitter.com/future/status/1559918028799635456,"In his new book, @heyfeifer explores why new technologies often elicit panic, and argues that to truly understand the effect of new tech, the process shouldn’t start when people are hyped up and demanding answers, it should start before anyone cares. https://t.co/P52nJni3f0"
38,@future,2022-08-17 15:00:13+00:00,https://twitter.com/future/status/1559918025309966341,"The concern about social media’s effect on teens might seem like a uniquely modern debate, but this has happened before.

A 1941 report from The Journal of Pediatrics concluded that many children had become addicted to the latest technology: radio. https://t.co/7f7yg7vDWR"
39,@future,2022-08-12 16:22:54+00:00,https://twitter.com/future/status/1558126893945217025,"New technologies and the desire to compartmentalize identity, curate how we’re perceived online, and play with different personas has led to a decentralization of our digital identities.

@jradoff explains how this evolution can benefit users and creators. https://t.co/Mw4VA8T0hY"
40,@future,2022-08-12 15:57:23+00:00,https://twitter.com/future/status/1558120472721739777,"Ben Stokes (@tinyprojectsdev) gives his take on the recent rise of developer side projects, and why they’ve become much more than just a side hustle. https://t.co/pqJdSe5NDv"
41,@future,2022-08-12 15:57:23+00:00,https://twitter.com/future/status/1558120471027191809,Devs &amp; creators: what drives you to build a side project?
42,@future,2022-08-11 14:40:14+00:00,https://twitter.com/future/status/1557738668537696258,"Headless commerce — where you separate the experience layers in a shopping application — is the future of online retail. 

@dirkhoerig answers all of our questions about what it is, how it works, and why it’s good for both consumers and developers. https://t.co/q4lRYNj0DX"
43,@future,2022-08-09 18:31:50+00:00,https://twitter.com/future/status/1557072178004127744,"Whether it’s the desire to create, learn, or get rich, there’s a fundamental change happening with how developers view their projects. 

You used to put side projects on a CV to land a career in tech. Now, side projects can be your career in tech. https://t.co/pqJdSenov3"
44,@future,2022-08-09 18:31:50+00:00,https://twitter.com/future/status/1557072174476697600,"The tiny project mindset is summed up by @dvassallo, who runs an online community teaching people how to create a portfolio of small bets. https://t.co/XaQ9IYIIwq"
45,@future,2022-08-09 18:31:47+00:00,https://twitter.com/future/status/1557072163596775424,"Click around on #buildinpublic and you’ll find devs with dozens of links in their bios to the tiny businesses they’ve created. You can join them on a rollercoaster journey of launching a product, gaining users, and even exiting.

Then, a few months later, they’ll do it all again."
46,@future,2022-08-09 18:31:46+00:00,https://twitter.com/future/status/1557072160274780160,"Side projects have also let developers tap into the creator economy. 

@benawad has 1.3 million followers watching his project videos across YouTube, TikTok, and Twitter. https://t.co/GT7zMLqAIq"
47,@future,2022-08-09 18:31:44+00:00,https://twitter.com/future/status/1557072150384689152,"The effort put into an internet project is often detached from its results. Embracing this randomness in practice simply means launching more projects.

A site like @ProductHunt allows you to get an idea on Monday and launch it to thousands of people by Friday."
48,@future,2022-08-09 18:31:43+00:00,https://twitter.com/future/status/1557072147742306306,"Building internet projects is like gambling because the excitement before you launch your next idea is addictive; you just don’t know what will happen.

With no-code resources and tools like Stripe, it’s easier than ever to write and deploy a project. https://t.co/pqJdSenov3"
49,@future,2022-08-09 18:31:42+00:00,https://twitter.com/future/status/1557072144353202177,"A random game about flying a small yellow bird between Super Mario pipes exploded into Flappy Bird, netting $50K a day. A dev built Wordle for his GF, it sold to the NY Times for over $1M. How did this happen?

@tinyprojectsdev calls it gambling at the side-project casino 🎰 https://t.co/u3oGRUlsta"
50,@future,2022-08-08 17:09:18+00:00,https://twitter.com/future/status/1556689016673644544,"One area of copywriting where AI is already having a significant impact is search results. 

@ctwtn explains how AI-generated copy is being used to produce SEO-driven content at scale ⬇️ https://t.co/VPHyngMwfN"
51,@future,2022-08-08 17:09:17+00:00,https://twitter.com/future/status/1556689013758574592,"Used properly, AI copywriting tools can be a valuable asset in any writer’s back pocket.

Here are 5 tools that writers and editors can use to train and curate AI-generated content. Some are better at grammar and spelling, while others can help with research and conceptualizing. https://t.co/XtBMalt6AX"
52,@future,2022-08-06 14:30:09+00:00,https://twitter.com/future/status/1555924192775639041,"To fully understand what neuroAI is, how it might start to evolve and impact our lives, how it complements other innovations and technologies, and what is needed to push it forward, read @patrickmineault’s piece ⬇️ https://t.co/A0pu7HTs6t"
53,@future,2022-08-06 14:30:09+00:00,https://twitter.com/future/status/1555924189793513472,"In the realm of accessibility, neuroAI could help the estimated 10% of the global population affected with dyslexia by designing fonts that are both aesthetically pleasing and easier to read. 

With the right data, fonts could be personalized to a specific individual."
54,@future,2022-08-06 14:30:08+00:00,https://twitter.com/future/status/1555924186857558016,"The applications of neuroAI go beyond the visual. 

By building machines that can hear like humans, we could democratize music production, giving anyone the ability to communicate the right emotion during a chorus, create an earworm, or make a piece irresistibly danceable."
55,@future,2022-08-06 14:30:07+00:00,https://twitter.com/future/status/1555924183074279424,"One of the core tools of neuroAI is using artificial neural nets to create computer models of specific brain functions. 

Using this recipe and repeating iterative testing across brain processes, scientists are building a patchwork of computer models for the brain. https://t.co/kR2UXmVi92"
56,@future,2022-08-06 14:30:05+00:00,https://twitter.com/future/status/1555924174161338371,"Netflix famously knows which thumbnails work best. Google tested 50 shades of blue for hyperlinks in 2009, leading to a $200M increase in revenue.

But pretty soon AI will be able to predict the best thumbnail or color without any A/B tests. How? An emerging tech called neuroAI. https://t.co/VfYOZtZhVr"
57,@future,2022-08-04 16:31:17+00:00,https://twitter.com/future/status/1555229900411371524,"While generative AI models like DALL-E can produce creative art and media, they can’t tell you if that media will communicate a message to the intended audience — but neuroAI could.

@patrickmineault explains what that is and how it could impact our lives. https://t.co/A0pu7Ib3v3"
58,@future,2022-08-03 16:00:36+00:00,https://twitter.com/future/status/1554859789838073857,"How do AI copywriters stack up against humans? How is the increased use of AI writing tools impacting SEO and search results? And how can companies and creators intelligently use this AI copywriting revolution to their advantage? 

@ctwtn explains 👇 https://t.co/wMpbzXg1Pd"
59,@future,2022-08-02 15:25:01+00:00,https://twitter.com/future/status/1554488446684741635,"One common misconception is the idea that “community” and “customers” are synonymous terms. They aren’t. Understanding how they differ is critical. 

Looking to kickstart a community? Begin with @AmberAtherton's quadrant method: https://t.co/CNeavEGSD7 https://t.co/QUZ8mYk1ms"
60,@future,2022-08-02 15:00:17+00:00,https://twitter.com/future/status/1554482222454947840,"CEO of @PlanetScaledata, @isamlambert talks with Future about what good serverless looks like, who should run Kubernetes, and the emergence of “cloud-prem”. 

Plus, how to become a non-founder CEO, and advice for moving from engineering to management. https://t.co/JvCe3V64bF"
61,@future,2022-07-27 17:56:26+00:00,https://twitter.com/future/status/1552352226982649857,"Here’s what you should know about The Merge — Ethereum’s upcoming transition to proof-of-stake.

Future talks with @dannyryan about 👇

What The Merge means for Ethereum: https://t.co/XrXXyAn1kD 

And how The Merge will impact future Ethereum upgrades: https://t.co/qTXDeb1eaQ https://t.co/tm8UYIUP3s"
62,@future,2022-07-26 16:51:21+00:00,https://twitter.com/future/status/1551973458673913858,"Co-founder &amp; CTO of @Isovalent &amp; @ciliumproject creator @tgraf__ on the growing cloud-native networking ecosystem, trends around Kubernetes adoption and evolution, where infrastructure still needs to improve, and how standardization is driving innovation. https://t.co/toXH8Mz07K"
63,@future,2022-07-24 15:00:12+00:00,https://twitter.com/future/status/1551220709552263169,"Why right now is such an exciting time to build in aerospace and defense.

A conversation with @HadrianSpace CEO @2112Power, @KTmBoyle, @pmarca &amp; @packyM: https://t.co/u70Ge4ozS2 https://t.co/eyWilkZQfC"
64,@future,2022-07-23 18:00:10+00:00,https://twitter.com/future/status/1550903613161103361,"The problem, now so drastically different from a decade ago, is not what to read/buy/eat/watch/etc, but figuring out the best thing to read/buy/eat/watch/etc with your limited time and attention.

@sariazout on why the future of search engines is boutique: https://t.co/tCZCsbsvYR https://t.co/yYV4AwgCH2"
65,@future,2022-07-23 15:30:03+00:00,https://twitter.com/future/status/1550865834125426689,"Get your productivity back: @jlowin explains ""negative engineering"" and how it can help dev teams find simple fixes and avoid cascading failures. https://t.co/UiUHAHj5Lm"
66,@future,2022-07-21 14:23:31+00:00,https://twitter.com/future/status/1550124315579805697,"First it was non-PhDs building deep learning models, now prompt-engineering for DALL-E is its own skill. @jeremyphoward of @fastdotai on the rise of domain experts in AI. https://t.co/WesAhuDfaS"
67,@future,2022-07-18 15:05:02+00:00,https://twitter.com/future/status/1549047600644386817,"Expansion can supercharge growth, but only when executed correctly. 

@venturetwins &amp; @JohnKoelliker talked to marketplace operators from companies like Instacart, Airbnb, and Depop to learn when, where, and how to expand into new regions and verticals. https://t.co/5YoiwnglUo"
68,@future,2022-07-15 16:08:35+00:00,https://twitter.com/future/status/1547976430541099008,"MIT's @youngricka, @JorgeCondeBio &amp; @omnivorousread discuss what's been learned about the 98% of the genome once thought as junk — from hiding the evidence of ancient viral infections to making every face unique, and the discovery of a gene on/off switch. https://t.co/hjMOuDzIwi"
69,@future,2022-07-13 17:41:07+00:00,https://twitter.com/future/status/1547274942047207425,"Nitin Natarajan, @CISAgov deputy director, explains how the agency looks at identifying, mitigating — and sometimes accepting — cybersecurity risks in everything from small-town school districts to internet-connected smart refrigerators. https://t.co/vJCGt1jtKM"
70,@future,2022-07-12 15:31:58+00:00,https://twitter.com/future/status/1546880051706208258,"A successful sales enablement strategy:

-Designs skilling &amp; readiness programs
-Ensures selling on strategy
-Translates analytics into actions
-Simplifies &amp; automates sellers’ journey

@TziokasV on how to build sales enablement that elevates your GTM 👇 https://t.co/BY7JBnWXvc"
71,@future,2022-07-10 15:05:32+00:00,https://twitter.com/future/status/1546148624874225665,"Some of the big ideas, movements, and research areas in crypto and web3 over the last few months.

Here are seven pieces that describe the possibilities of a decentralized future and what is needed to build it. https://t.co/uDLkDyyY4V"
72,@future,2022-07-08 15:53:30+00:00,https://twitter.com/future/status/1545435917351018500,"Future’s web3 x science coverage from this year so far, plus some of the major writings and events across the community. 

The DeSci movement is still young, so we include some coverage of web3 and decentralization that provide useful lessons and insights. https://t.co/OT8O0Sek95"
73,@future,2022-07-07 14:43:38+00:00,https://twitter.com/future/status/1545055947071950849,"What will happen as CRISPR matures? What does a biologically engineered future look like, and do scientists have to ensure these tools are used responsibly? 

Nobel Prize winner Jennifer Doudna (@doudna_lab) &amp; @vijaypande tackle these questions and more. https://t.co/6dYxtakcnW"
