,0,1,2,3
156,@future,2022-04-23 21:23:24+00:00,https://twitter.com/future/status/1517977464651231232,None of the above should be taken as investment advice; please see https://t.co/qGl8n68t72 for more information.
157,@future,2022-04-23 21:15:02+00:00,https://twitter.com/future/status/1517975355595886592,"Collectibles saw a massive boom during covid, that also appears to be lasting. @Whatnot saw the largest one-year gain in the rankings in Marketplace 100 history, and for the second straight year, is the fastest-growing M100 company. ⬇️
https://t.co/9AJOX7eMlL https://t.co/lBrzd8buEk"
158,@future,2022-04-22 19:03:23+00:00,https://twitter.com/future/status/1517579838151815168,None of the above should be taken as investment advice; please see https://t.co/qGl8n68t72 for more information.
159,@future,2022-04-22 19:03:00+00:00,https://twitter.com/future/status/1517579742559494154,"Unprecedented turnover shows that early stage marketplaces are as relevant as ever. There were 37 “freshmen,” 48% more than last year, and 19 companies “graduated” due to five IPOs, three SPACs, and 11 acquisitions. ⬇️
https://t.co/9AJOX7eMlL https://t.co/sPzKj5lW0Z"
160,@future,2022-04-22 15:19:41+00:00,https://twitter.com/future/status/1517523543042535425,"Economist John List (@Econ_4_Everyone) talks with Future about his new book The Voltage Effect, which argues that scaling is a science, not an art, and looks at the principles we should understand about ideas that scale and ideas that don’t scale. https://t.co/NCG2ITncrh"
161,@future,2022-04-21 15:54:34+00:00,https://twitter.com/future/status/1517169932995334145,How are biotech companies leveraging decentralization? And how can founders use it to their advantage? @JocelynnPearl draws on her experience working at biotech startups and DAOs to cover what’s happening in the field today and where it could go tomorrow. https://t.co/xk5IJ0MlbA
162,@future,2022-04-18 15:34:00+00:00,https://twitter.com/future/status/1516077594252398592,"Work-life integration &gt; Work-life balance

@okta EVC &amp; COO @fkerrest argues that bringing more of his life into his work, while still setting clear boundaries, has been key to maintaining his mental health as a successful co-founder. https://t.co/nWs4FrLKBe"
163,@future,2022-04-14 14:59:01+00:00,https://twitter.com/future/status/1514619240761810947,None of the above should be taken as investment advice; please see https://t.co/qGl8n68t72 for more information.
164,@future,2022-04-14 14:59:01+00:00,https://twitter.com/future/status/1514619239285489677,"A big thank you to our data partners @second_measure, @Similarweb, and @Apptopia."
165,@future,2022-04-14 14:59:01+00:00,https://twitter.com/future/status/1514619237523808262,Congratulations to all the marketplaces (and the builders behind them) on this year’s list. Read a detailed analysis here: https://t.co/9AJOX7wndj
166,@future,2022-04-14 14:59:00+00:00,https://twitter.com/future/status/1514619235212808199,"And of course NFT marketplaces took center stage the past year. While not officially on the list, the sheer volume and cross-category appeal of these five startups can’t be ignored:

@opensea
@AxieInfinity  
@nbatopshot   
@MagicEden
@SolanartNFT https://t.co/cTPXBfoTQE"
167,@future,2022-04-14 14:58:59+00:00,https://twitter.com/future/status/1514619230078967818,"5 marketplace made huge jumps up the rankings from last year:

🤖 Collectibles shopping app @Whatnot 
🧗 Outdoor gear dealer @curated
💆 Travel and wellness marketplace @ResortPass
🎟️ Last-minute ticketing app @Gametime
🚤 Boating adventure marketplace @boatsetter https://t.co/m12Ml0SKUb"
168,@future,2022-04-14 14:58:58+00:00,https://twitter.com/future/status/1514619225389772806,"Categories like Games and Collectibles grew rapidly during lockdown, including @valvesoftware, @EpicGames, and @Whatnot. https://t.co/JnZ5jBFys8"
169,@future,2022-04-14 13:53:27+00:00,https://twitter.com/future/status/1514602739367440395,"Ticketing, Food &amp; Beverage, and Education had the most new entrants — a trend that correlates in part with vaccine rollout — like @peek, @EatStreet, and @studypool. https://t.co/elaaaPo4S3"
170,@future,2022-04-14 13:53:26+00:00,https://twitter.com/future/status/1514602733986189317,"This year’s freshman class was BIG with 37 marketplaces new to the list (that’s 48% more than last year). 

Impressively, 19 companies graduated via IPO, SPAC, or acquisition. https://t.co/gn3gFwpTOF"
171,@future,2022-04-14 13:53:25+00:00,https://twitter.com/future/status/1514602728370020367,"This year’s top 10 marketplaces include brands we’ve seen on the list before like @Instacart, @valvesoftware, and @stockx as well as new entrants including @Zola and @StyleSeat.

Educational marketplace @TpT_Official took #8 in their first year on the list. https://t.co/PIlE66sh6r"
172,@future,2022-04-14 13:22:22+00:00,https://twitter.com/future/status/1514594915124060160,"This year’s Marketplace 100 is out — a ranking of the largest consumer-facing marketplace startups and private companies. 

See who comes out on top and learn about emerging marketplace trends in this report by @omooretweets and @brandonlbarros."
173,@future,2022-04-13 21:27:26+00:00,https://twitter.com/future/status/1514354597795610631,"Marketplace 100 comes out tomorrow, our ranking of the largest consumer-facing marketplace startups and private companies. 

Who do you expect to make this year’s list? https://t.co/P2oqDZtmQ8"
174,@future,2022-04-12 14:29:31+00:00,https://twitter.com/future/status/1513887038285791243,"In the world of bottom-up adoption and product-led growth, a go-to-community plan is equally as important as go-to-market. 

Here's a step by step guide on how to align community building with real business outcomes from @patrickjwoods. https://t.co/du7ibmlVn6"
175,@future,2022-04-08 21:23:07+00:00,https://twitter.com/future/status/1512541574571479043,"Chinese brands have ditched the “1 to many” format of email marketing in favor of 1 to 1, direct conversations with customers. And as @conniechan explains, it’s working.
https://t.co/ZRZmnodcty"
176,@future,2022-04-07 18:50:01+00:00,https://twitter.com/future/status/1512140657518948366,".@a16z crypto's @milesjennings shares specific models and principles of decentralization to guide web3 builders — as well as for those seeking to understand the frameworks and components — tackling what decentralization means in practice.
https://t.co/6XWGMUn6SH"
177,@future,2022-04-05 00:40:00+00:00,https://twitter.com/future/status/1511141570661203975,"Does widespread web3 adoption hinge on simplifying the onboarding process? Web3 builders @jennywang01 and @mlchiang believe there’s another way to get the crypto curious in the door.
https://t.co/1KH2wVfoAn"
178,@future,2022-03-23 16:25:59+00:00,https://twitter.com/future/status/1506668591067844610,"In their updated guide to emerging architectures for modern data infrastructure, @BornsteinMatt, @JenniferHli &amp; @martin_casado explore the idea that platforms are beginning to emerge in the data ecosystem. https://t.co/ioNyhK81jR"
179,@future,2022-03-23 14:23:10+00:00,https://twitter.com/future/status/1506637683182948362,Data50 — The world's top data startups: https://t.co/CdFCZzbFEz https://t.co/7wR4JPFzSp
180,@future,2022-03-23 13:22:16+00:00,https://twitter.com/future/status/1506622356894240771,"We believe the next 10 years will be the decade of data, encompassing infrastructure, applications, and everything in between. 

Congratulations to all the companies in the first Data50 class! https://t.co/CdFCZzbFEz"
181,@future,2022-03-23 13:22:15+00:00,https://twitter.com/future/status/1506622354746748931,"Investment dollars are growing in every category in the Data50, but the most notable trend is again in AI/ML, where companies are picking up more investor interest than ever, mostly concentrated in the early stage. https://t.co/kE74erJ5CZ"
182,@future,2022-03-23 13:22:14+00:00,https://twitter.com/future/status/1506622350837563396,"To dive deeper into the Data50 categories and how they have changed over the last year, check out @BornsteinMatt, @JenniferHli &amp; @martin_casado's updated guide to architectures for modern data infrastructure. https://t.co/ioNyhK81jR"
183,@future,2022-03-23 13:22:14+00:00,https://twitter.com/future/status/1506622349025624074,"Artificial Intelligence &amp; Machine Learning is the biggest category by the number of companies in the Data50, largely because the space is still evolving and requires a new separate set of tools to train, measure, and productionize models. https://t.co/oKJT2WDIeK"
184,@future,2022-03-23 13:22:13+00:00,https://twitter.com/future/status/1506622344747524108,"Query and Processing companies have raised the lion’s share of capital. The category only accounts for one-fifth of the companies in the Data50, but almost 50% of all funding. https://t.co/TROUom02jH"
185,@future,2022-03-23 13:22:12+00:00,https://twitter.com/future/status/1506622339848577025,"We’ve broken down the Data50 into seven subcategories. 

Even though the main market tailwind driving adoption is the increasing volume and usage of data, the underlying drivers differ for each category. https://t.co/BANDGO3HOS"
186,@future,2022-03-23 13:22:11+00:00,https://twitter.com/future/status/1506622336144924676,"How we got the Data50 ranking: 

✅ Founded after 2008. 
✅ Raised new funding in the last 2 years. 
📊 Ranking based on recent valuation + company size + employee growth + years in operation + current revenue. 
🚫 Does not include transactional database companies."
187,@future,2022-03-23 13:22:10+00:00,https://twitter.com/future/status/1506622334123319298,"The Data50 ranks the bellwether companies across the most exciting categories in data. 

In aggregate, they are valued at more than $100B and have raised approximately $14.5B. 20 reached unicorn status by 2021. https://t.co/RVJL97xLMi"
188,@future,2022-03-23 13:22:09+00:00,https://twitter.com/future/status/1506622329404764164,"Introducing the Data50: 2022. 

After a record-breaking 2021 in which data companies received tens of billions in VC investment — and an already strong 2022 — these are the next generation of category-defining data companies. https://t.co/CdFCZzbFEz"
189,@future,2022-03-18 15:33:02+00:00,https://twitter.com/future/status/1504843329015623685,"Anachronistic practices and policies for data rights at the DoD are keeping innovative companies from working on software-defined capabilities for national security, writes @anduriltech general counsel Babak Siavoshy. https://t.co/pDLlSQwGJs"
190,@future,2022-03-17 15:27:08+00:00,https://twitter.com/future/status/1504479453132427269,"Too often, B2B startups and their enterprise customers don't understand how to work with each other. 

@GaryHoberman shares lessons for maximizing that relationship — based on his experience managing massive IT budgets on Wall Street and as CEO of @unqork. https://t.co/q4CXOW8U6e"
191,@future,2022-03-12 16:00:18+00:00,https://twitter.com/future/status/1502675860696203272,"Spend a couple days with @ModernFertility co-founder @aftonvechery in our latest Info Diet. 

Get a look into her personally curated feeds and media habits to find out what she reads, follows, listens to, and watches in order to stay ahead of what’s next: https://t.co/XVdrsBg8xH https://t.co/VIgRDDVrAp"
192,@future,2022-03-11 20:58:09+00:00,https://twitter.com/future/status/1502388430541574149,"Info Diet offers a peek into the personally curated feeds and media habits of the people shaping the future. 

This time: @ModernFertility co-founder @aftonvechery on what she reads, follows, listens to, and watches in order to stay ahead of what’s next. https://t.co/XVdrsBfAI9"
193,@future,2022-03-08 16:12:34+00:00,https://twitter.com/future/status/1501229395578662918,"In part 2 of @nikogrupen’s explainer on augmented intelligence, he explores new processes for interacting with foundational machine learning models to make them more effective for startups and organizations with limited resources. https://t.co/cOsm2YmKqQ"
194,@future,2022-03-07 18:36:47+00:00,https://twitter.com/future/status/1500903304561369088,"Breakthroughs and new models in machine learning can help reimagine and redesign existing workflows, rather than replace them, argues @nikogrupen. Ushering in a new class of AI-native experiences for search, scientific research, game design, and more. https://t.co/l9iD9y4aUy"
195,@future,2022-03-02 16:34:38+00:00,https://twitter.com/future/status/1499060624369795077,"Artificial intelligence and machine learning have made huge leaps in the past decade, and @RichardSocher has been there for it all.

In this Q&amp;A, he discusses how things have changed for AI startups over the last 10 years, new ML techniques, and lots more. https://t.co/F6Eo21i1EE"
196,@future,2022-02-24 22:00:15+00:00,https://twitter.com/future/status/1496968240651808778,"Will the metaverse replace the physical office? 

We asked 6 tech builders who are all working on the future of, well… work. 

Here’s what @rajivayyangar, @MelissaDaimler, @lg, @RenjiBijoy, @copernicussw, @reshmasaujani, and Tasha Liniger had to say: https://t.co/TUq0C1q8F4"
197,@future,2022-02-18 17:00:26+00:00,https://twitter.com/future/status/1494718463977340933,"Web3 products can’t expect users to immediately make the leap from familiar centralized experiences into the deep end of decentralization in one step, argues @mvellank. 

The future of mass-market crypto might actually start with web2 primitives. https://t.co/GyEqx54zIP"
198,@future,2022-02-17 22:06:22+00:00,https://twitter.com/future/status/1494433064675598339,"A company that serves in the low millions of user requests per day doesn’t need to optimize its systems to the degree of a Netflix or a Google. 

Read @jeanqasaur on building for the 99% Developers: https://t.co/7yO9ZmTTv3 https://t.co/GmuTReG0NT"
199,@future,2022-02-17 18:44:15+00:00,https://twitter.com/future/status/1494382202385321989,"SQL is already everywhere, but it could be so much more. 

In this Q&amp;A, @fivetran CEO @frasergeorgew discusses why SQL needs more libraries — and how another popular data tool could help distribute them. https://t.co/10nZ5GQbtx"
200,@future,2022-02-15 18:30:23+00:00,https://twitter.com/future/status/1493653934145216512,"Take a peek into the curated feeds and media habits of @replit CEO @amasad. 

Over the course of two days, here’s what Amjad reads, listens to, and watches, and who he follows in order to stay ahead of what’s next. https://t.co/drTkRE0zVm"
201,@future,2022-02-11 19:17:00+00:00,https://twitter.com/future/status/1492216116990644231,"Machine learning on a budget?

From pre-training, to cloud APIs and dataset alignment, @eturner303 explains the opportunities, risks and limitations of foundation ML models, and how startups with limited resources can use them strategically. https://t.co/I2Zr8a8Q2D"
202,@future,2022-02-10 19:46:24+00:00,https://twitter.com/future/status/1491861124702162955,"DeSci combines the scientific community's efforts to change how research is funded and knowledge is shared, and the web3 movement to shift ownership and value away from industry intermediaries. 

@Shamburgularara on what exactly DeSci entails: https://t.co/b3INxdPSoz"
203,@future,2022-02-04 21:30:22+00:00,https://twitter.com/future/status/1489712963514740746,"""Go-to-market"" in web3 means something completely different from the customer acquisition funnel models we're used to.

@meigga gives you the new frameworks, the new metrics, and what it means for builders in the emerging economy. https://t.co/dM1gz1bFMZ"
204,@future,2022-01-24 15:37:00+00:00,https://twitter.com/future/status/1485637768147611649,"From his Hardcore Software @substack: @stevesi shares the behind-the-scenes story of Office 2000’s hard pivot to enterprise, and why the EA is a significant part of @Steven_Ballmer’s legacy: https://t.co/gUXpsy3Q1U https://t.co/YypqAlU0qI"
205,@future,2022-01-22 16:20:12+00:00,https://twitter.com/future/status/1484923865293856768,"The inside story of how Microsoft pivoted Office 2000 to enterprise without losing the end-user.

@stevesi on development cycles, the highs and lows of enterprise agreements and avoiding the messy middle of trying to build for both enterprise and consumer. https://t.co/gUXpsy3Q1U"
206,@future,2022-01-15 17:03:20+00:00,https://twitter.com/future/status/1482398004091006979,"If software can stave off stagnation in most industries, can it fix government? And will it just be another iteration of ""gov-tech"" or far more sweeping? 

@KTmBoyle on the opportunity for technologists to build solutions to serious American problems 👇 https://t.co/xAIhbaHxIR"
207,@future,2022-01-13 18:34:18+00:00,https://twitter.com/future/status/1481696120061501441,"Government can seize private financial data, without warrants or probable cause, through bank records and third parties. 

So what happens when tech innovation removes the middleman? 

Eugene Volokh (@VolokhC) lays out the issues for coders and customers👇 https://t.co/vyqAQP5JZF"
208,@future,2022-01-11 16:22:09+00:00,https://twitter.com/future/status/1480938089489084417,"Software has democratized the design process, enabled real-time collaboration, and changed the role of designers. Now, designers also need to be system architects, product managers, and user advocates.

@carlyayres on what the future of design looks like👇 https://t.co/xtFlLVc8dF"
209,@future,2021-12-21 18:34:43+00:00,https://twitter.com/future/status/1473361306967318535,"Fast Grants was launched at the onset of COVID-19 to address the sluggish institutional process for science funding and advancement. Over $50 million and 260 grants later, here’s what @patrickc, @pdhsu &amp; @tylercowen learned:  https://t.co/lCR4dA6bEJ https://t.co/NrqyH4DzyI"
210,@future,2021-12-21 18:34:42+00:00,https://twitter.com/future/status/1473361300960985091,"As more people arrive to web3, there needs to be even more diverse ways to participate. @VirtualElena provides the roadmap for minimum viable participation in crypto by looking at games, costs, and accessibility. https://t.co/Bjs28vybrK https://t.co/4M0qSkf3gn"
211,@future,2021-12-21 18:34:41+00:00,https://twitter.com/future/status/1473361295671975937,"We asked 21 experts how expertise is being redefined in the modern era, novelist @eliotpeper sees the power of storytelling as a path towards unlocking knowledge: https://t.co/mWpdMjU1Gn https://t.co/aOPZeYCQHb"
212,@future,2021-12-21 18:34:40+00:00,https://twitter.com/future/status/1473361290424901637,"Product designer for @Figma, @mollyfmielke explains why software companies that embrace style over “branding” are winning with users right now: https://t.co/t34GuLTf6c https://t.co/VBv99aC9Wp"
213,@future,2021-12-21 18:34:38+00:00,https://twitter.com/future/status/1473361284305506304,"The music industry is built on artists, but shuns creators, argues @itsDaveEdwards. Here’s what they need to change: https://t.co/XLEUMwTsXh https://t.co/N16EqTlYcz"
214,@future,2021-12-21 18:34:37+00:00,https://twitter.com/future/status/1473361278458605574,"Gaming industry veteran @ibjade makes a compelling argument that fans, not professional developers, will drive the hit IPs of the future: https://t.co/HIH6RWD45B https://t.co/x33Ss3gxPQ"
215,@future,2021-12-21 18:34:35+00:00,https://twitter.com/future/status/1473361272414552073,"We are still very much in the skeuomorphic era of web3, writes @cdixon, but we are starting to see a new wave of native applications that have no prior analogue and simply couldn’t have existed before: https://t.co/NFb1ibyL0u https://t.co/EFt57yZw3C"
216,@future,2021-12-21 18:34:34+00:00,https://twitter.com/future/status/1473361267368808451,"What’s the brazen strategy behind China tech’s growth? A willingness to aggressively experiment with their core products, writes @ruima: https://t.co/oLYEFDXagZ https://t.co/YY2rvYpA6p"
217,@future,2021-12-21 18:34:33+00:00,https://twitter.com/future/status/1473361261966630916,"Now one of the leading voices in how to clean up global supply chains, @Flexport CEO @typesfast went beyond the meme with a deep dive into the Ever Given and the history of containerization: https://t.co/C5JAo7xt0p https://t.co/dAwKodVUCt"
218,@future,2021-12-21 18:34:31+00:00,https://twitter.com/future/status/1473361256061063175,"In one of our most popular pieces of the year, @jeanqasaur makes the compelling case for an increased focus on ‘developer experience’: https://t.co/qgxyFPbavq https://t.co/PlsqNXkTyC"
219,@future,2021-12-21 18:34:30+00:00,https://twitter.com/future/status/1473361250637725696,"✍️ Future’s Quotes of the Year 💡

A 🧵 of insight and wisdom from Future writers that we haven’t been able to stop thinking about 👇"
220,@future,2021-12-17 17:25:53+00:00,https://twitter.com/future/status/1471894430193967109,"It used to be just “work-to-earn,” but the future of income is “x-to-earn” — play to earn, learn to earn, create to learn, and work to earn. 

@benschecter on how DAOs can coordinate this new activity outside the context of corporate systems. 👇 https://t.co/FHQ4BZE8bO"
221,@future,2021-12-16 16:10:35+00:00,https://twitter.com/future/status/1471513093100355587,"As a new wave of retail capital flows into the private markets in the coming years, the growing need for liquidity will lead to a new generation of private market exchanges, writes @dhaber — and they will begin as investor relations software. https://t.co/a9i6vftNMg"
222,@future,2021-12-15 17:24:05+00:00,https://twitter.com/future/status/1471169201826054151,"Fast Grants was launched in March 2020 to address the lethargic institutional response to COVID-19 science funding. After raising over $50 million and distributing over 260 grants, this is what @patrickc, @pdhsu and @tylercowen learned: https://t.co/lCR4dA6bEJ"
223,@future,2021-12-14 17:15:03+00:00,https://twitter.com/future/status/1470804540329197569,"As bio platforms are becoming more productive than ever, it's causing a conundrum for bio startups — to partner or not? — looking for 'platform-disease fit'. 
 
In this guide, @JayRughani and @JorgeConde share how to shape, craft, and value a deal: https://t.co/wjrOhvahXR"
224,@future,2021-12-13 17:06:37+00:00,https://twitter.com/future/status/1470440029445103626,"Employees getting paid in stock need to proactively consider risk, diversification, and taxes. @mediumsizecats on what workers need to know about equity compensation, and the infrastructure and tools that need to get built to help them: https://t.co/ITilXPmqKe https://t.co/dHbCsBOsva"
225,@future,2021-12-09 23:54:22+00:00,https://twitter.com/future/status/1469093095048417292,"How can you get users to stay involved and attract others before network effects have kicked in? By providing financial utility via tokens. 

@cdixon explains the new opportunity for bootstrapping networks made possible by web3. 👇 https://t.co/R4b4xrnM2d"
226,@future,2021-12-09 16:33:03+00:00,https://twitter.com/future/status/1468982031921074186,"There are now many paths to public markets for tech companies. Now that we’ve seen a total of 6 direct listings (in their current form), @skupor dives into what we’ve learned on whether / how they’re working so far. https://t.co/L2CqcRelpg"
227,@future,2021-12-08 16:30:04+00:00,https://twitter.com/future/status/1468618892813688834,"Equity compensation has changed the incentives around choosing a job, but the financial infrastructure for employees is nearly nonexistent. 

In this guide, @mediumsizecats lays out strategies for managing this wealth, and how companies can evolve to help. https://t.co/ITilXPmqKe"
228,@future,2021-12-07 16:31:02+00:00,https://twitter.com/future/status/1468256749631201289,"Take a deep, data-driven dive into the critical questions surrounding the summer's wildfires in California with @ArtirKel. How bad are they really (relative to the past), what causes them, what makes them worse, and what can we do about it? https://t.co/wGz584gPz8"
229,@future,2021-12-06 16:30:05+00:00,https://twitter.com/future/status/1467894120769327106,"In the complex world of bio, there are 4 major groups: 
 •life sciences
 •providers
 •payors
 •patients

For @vintweeta, the most exciting businesses are those going full-stack and competing in a group or creating novel connections between two or more. https://t.co/86N6iKblfO"
230,@future,2021-12-03 17:30:08+00:00,https://twitter.com/future/status/1466822070373920772,"For esports teams, winning titles isn’t a business strategy, it’s just a bonus, according to @Lazerchickenzzz. The best teams are monetizing their young, cord-cutting, and hyper-online fans much differently than traditional sports. https://t.co/s8D9vLRaEX"
231,@future,2021-12-03 02:00:06+00:00,https://twitter.com/future/status/1466588018148532227,"Remember FarmVille? Bejeweled? In the '00s, those browser-based Flash games were incredibly accessible—&amp; incredibly viral. 
 
Now there's a resurgence of instant games, writes @Tocelot, melding the ease of Flash with the quality of app-native titles. https://t.co/zo48Wqaedx"
232,@future,2021-12-01 16:30:14+00:00,https://twitter.com/future/status/1466082220079300610,"""If we don’t seriously consider reevaluating how we measure — and therefore better target fixes to — our productivity problem, we won’t have a productivity problem to think about."" 

@nicolefv proposes an update to how we measure developer productivity: https://t.co/HZoH1zsbe9"
