,0,1,2,3
74,@future,2022-07-06 17:00:13+00:00,https://twitter.com/future/status/1544727933385842689,"Revisit our artificial intelligence and machine learning coverage in Future over the first half of this year. 

The world of AI/ML moves very fast, so we'll catch you up on some — but certainly not all — of the recent major industry developments. https://t.co/1RbX1iPZGp"
75,@future,2022-07-05 18:04:32+00:00,https://twitter.com/future/status/1544381728814518273,"The size and sophistication of modern algorithmic ranking models makes it impossible to fully understand how they make predictions, writes @turtlesoupy, who built Instagram’s first content ranking system, but social platforms can still be more transparent. https://t.co/FSOqtcG2CI"
76,@future,2022-06-23 16:24:11+00:00,https://twitter.com/future/status/1540007823354073089,"Game creators, building on game tech and using game production processes, will be the key to unlocking the potential of the metaverse, writes @gwertz. He outlines a vision for the changes coming to games and the innovation needed to kickstart this new era. https://t.co/C3lOCuJxIB"
77,@future,2022-06-22 22:33:32+00:00,https://twitter.com/future/status/1539738384905674754,"Founder &amp; CEO of @insitro, @DaphneKoller joins Future's @DrNikkino for a Q&amp;A on: 

-Building a company culture that fosters collaboration
-The challenges of creating accurate ML models from bio data
-Why data availability is behind the success of AlphaFold
https://t.co/O7hh06a9DO"
78,@future,2022-06-20 15:10:03+00:00,https://twitter.com/future/status/1538902003966935041,"Do you have a passion for tech and innovation?

Do you work in social?

Want to run this account???

We’re hiring! Learn more &amp; apply 👇  https://t.co/Z13qwDOQbN"
79,@future,2022-06-17 21:40:57+00:00,https://twitter.com/future/status/1537913213961900032,"In addition to our editorial and social roles, Future is looking for an experienced graphic designer to help conceptualize, design, and otherwise manage all art for all our content across mediums—on web to audio to video and more.

Learn more &amp; apply here: https://t.co/XeJZO3JHMG"
80,@future,2022-06-17 16:59:12+00:00,https://twitter.com/future/status/1537842306929369089,"14/ And we’re just getting started.
We're hiring editors, production, marketing &amp; more. Find a few roles here with more coming. And we’re always looking for contributors with an idea to share.

Editor https://t.co/xxkVFC3klJ
Social https://t.co/Z13qwDOQbN

https://t.co/BbXIkiBGPt"
81,@future,2022-06-17 16:59:11+00:00,https://twitter.com/future/status/1537842305327144966,"13/ There’s a growing team behind Future that is working to bring you the best ideas and expertise from the front lines of the future every day, including: 

@ASalyers3 @laurenmurrow @derrickharris @jbensonwrites @DrNikkino @stephsmithio @jareditor @charlienorwood"
82,@future,2022-06-17 16:59:11+00:00,https://twitter.com/future/status/1537842303930454016,"12/ We launched Future to be the go-to place for anyone building, advancing, or curious about technology, the most powerful force shaping the future.

Future is written for builders, by builders — and we believe there’s no better time than now to be building the future with tech."
83,@future,2022-06-17 16:59:11+00:00,https://twitter.com/future/status/1537842302185512960,"11/ From @Shamburgularara, a thorough look at the decentralized science movement and the scientists and entrepreneurs who are leveraging blockchain tools, including smart contracts and tokens, in an attempt to improve modern science.. https://t.co/R0DpnMtlVf"
84,@future,2022-06-17 16:59:10+00:00,https://twitter.com/future/status/1537842300415516672,"10/ “Learn to code” is a tired response to people who don’t see a place for themselves in the future of work. But, as @itunpredictable writes, there’s always going to be a need for those who achieve technical literacy. https://t.co/4FmfK8HNL1"
85,@future,2022-06-17 16:59:10+00:00,https://twitter.com/future/status/1537842298452692993,"8/ Flexport founder @typesfast has been one of the most sought after voices when it comes to understanding global supply chains. For Future, he explains the interplay between software and the real world and the effect on shipping infrastructure. https://t.co/R8gFu9Rga1"
86,@future,2022-06-17 16:59:09+00:00,https://twitter.com/future/status/1537842294136655872,"7/ Designer and editor @mollyfmielke looks back at the history of creative software to understand why so much digital design looks the same right now, and why the future doesn’t have to: https://t.co/gVILCdQdSA https://t.co/NVkFELYcbj"
87,@future,2022-06-17 16:59:07+00:00,https://twitter.com/future/status/1537842288369491969,"6/ Understand the future of AI and deep learning with @nikogrupen’s two-part series on augmented intelligence.

Part 1: https://t.co/a4gtnO4Q2J 
Part 2: https://t.co/qY0kdsJ9Fj"
88,@future,2022-06-17 16:59:06+00:00,https://twitter.com/future/status/1537842284145823745,"5/ One of our favorite creator economy writers, @runciedan, explains how companies that group all “creators” together could miss out on the next phase of opportunities: specific tools that help breakout stars grow their business.

There are levels to this: https://t.co/UAPotVeMBm https://t.co/CuQVUWtMJn"
89,@future,2022-06-17 16:59:05+00:00,https://twitter.com/future/status/1537842278047395848,"4/ A leading voice in the developer experience space, @jeanqasaur breaks down the disconnect between buzzy tech tools and the daily reality of developers working outside of the hip companies and frameworks. https://t.co/m4H7DPy2ej"
90,@future,2022-06-17 16:59:04+00:00,https://twitter.com/future/status/1537842274956193792,"3/ The future of work is not corporate — it’s DAOs and crypto networks. From @benschecter, who writes about how people will earn income in non-traditional ways by taking actions such as playing games, learning new skills, creating art, or curating content: https://t.co/fwEnNCqRE2 https://t.co/G6Qw5tIq6l"
91,@future,2022-06-17 16:59:03+00:00,https://twitter.com/future/status/1537842267796512775,"2/ From our first drop, @lennysan’s essential framework for choosing better north star metrics.

It continues to be one of the most-read pieces on Future. https://t.co/sp8PBNRpWj"
92,@future,2022-06-17 16:59:02+00:00,https://twitter.com/future/status/1537842265342853120,"1/ A year ago, we launched https://t.co/eQcOAkaJb4. Thank you to everyone who has contributed pieces and ideas, as well as shared and read what we’ve published. 

To celebrate this milestone, we’re sharing some of our favorite and most-read articles. 🧵👇"
93,@future,2022-06-16 16:56:27+00:00,https://twitter.com/future/status/1537479229436313605,"NFT memberships, where fans hold a specific NFT to join a private community and get IRL perks, are on the rise as a viable alternative to subscription and ad-based revenue. 

For creators getting into web3, @petergyang's guide is a great place to start. https://t.co/SgK9vk73PG"
94,@future,2022-06-15 17:56:50+00:00,https://twitter.com/future/status/1537132036506505216,"How to successfully pull off the acquihire.

Advice and strategies for:
✅ Defining your priorities.
✅ Conducting due diligence.
✅ Deal structure considerations.
✅ Properly integrating the new hires into your existing organization.
https://t.co/Eeiwgt7pM7"
95,@future,2022-06-14 16:12:13+00:00,https://twitter.com/future/status/1536743319686070272,"The idea of a secure software supply chain — how software goes from a developer writing code all the way to the end, and the weaknesses along every link and stage in that pipeline, explained by @kimsterv: https://t.co/O7o1cF7Zfz https://t.co/Jj4qy27DZL"
96,@future,2022-06-10 19:03:45+00:00,https://twitter.com/future/status/1535336934503026688,"Provectus Algae CEO &amp; founder @NusqeSpanton explains how synthetic biology is being used in the manufacturing space, what makes algae so interesting (and challenging) as a vehicle, and how to avoid the pitfalls that led to a false start for algal synbio. https://t.co/q2CZz6HLzU"
97,@future,2022-06-10 17:46:37+00:00,https://twitter.com/future/status/1535317524111319043,"After a series of high-profile exploits, secure software supply chains are all the rage right now. @kimsterv explains what this means and why open source is a double-edged security sword. https://t.co/oL8cVcghd3"
98,@future,2022-06-06 22:45:48+00:00,https://twitter.com/future/status/1533943267355762697,"Startups building emerging tech struggle to work with the Defense Department, argues Jeff Decker, of @Hacking4Defense. 

These companies would do well to spend the summer reading comic books — Iron Man, specifically — and absorbing some of the lessons. https://t.co/PI8bmurkQQ"
99,@future,2022-06-03 15:43:18+00:00,https://twitter.com/future/status/1532749777703780353,"A peek into the personally curated feeds and media habits of @shellkennedylon, founder and CEO of @Peanut, an online community to connect women throughout all stages of womanhood. https://t.co/lGi7U3dZ6M"
100,@future,2022-06-03 15:26:29+00:00,https://twitter.com/future/status/1532745544162062338,"Defense GTM strategies are unique to companies and their products. Applying these Iron Man lessons will inform the defense pathways a company takes, yielding increased revenue, greater defense capabilities, and a stronger economy.

Read more ⬇️ https://t.co/PI8bmurkQQ"
101,@future,2022-06-03 15:26:29+00:00,https://twitter.com/future/status/1532745542643621889,Dual-use companies that don’t want to apply for awards and can’t make an unmodified commercial sale must do the hard work of talking to potential defense end-users to assess their needs and validate that the company’s solution is capable of meeting those needs.
102,@future,2022-06-03 15:26:28+00:00,https://twitter.com/future/status/1532745540613685248,Companies without billionaire founders can also replicate the Iron Man model by selling their commercial product to the Pentagon without making any — or at least any significant — modifications. https://t.co/hmI4BJLTr1
103,@future,2022-06-03 15:26:27+00:00,https://twitter.com/future/status/1532745535928602627,"What about startups without billionaire founders? 

The Defense Department has established a host of organizations, programs, and opportunities to improve how it works with companies. https://t.co/7UKk9Yy8bG"
104,@future,2022-06-03 15:26:26+00:00,https://twitter.com/future/status/1532745530903773184,"The ingredients to the Iron Man recipe:  

1️⃣ civilian entrepreneurs 
2️⃣ using their own $ to develop high-risk capabilities in unproven technology sectors 
3️⃣ outside of government organizations and requirements 
4️⃣ to fill a government use-case"
105,@future,2022-06-03 15:26:25+00:00,https://twitter.com/future/status/1532745529066659840,"The Iron Man model: giving the Pentagon what it needs, not what it wants. 

From Jeff Decker, program director at Stanford University’s @Hacking4Defense Project. 🧵👇 https://t.co/PI8bmurkQQ"
106,@future,2022-05-24 16:07:05+00:00,https://twitter.com/future/status/1529131883749068800,"One fundamental error hiring managers make is being so focused on candidates’ skills they forget the importance of building trust early in the process.

Jeff Stump, who leads a16z's talent network, shares his framework for establishing trustworthiness. https://t.co/Wpmn4idRi2"
107,@future,2022-05-23 22:27:50+00:00,https://twitter.com/future/status/1528865315161276416,What is negative engineering? @PrefectIO founder @jlowin explains: https://t.co/1eBHrzbgB6 https://t.co/Ng00QK0dnF
108,@future,2022-05-23 22:27:49+00:00,https://twitter.com/future/status/1528865308928507904,Why on-prem software is still big business — an interview with @MongoDB CTO @MarkLovesTech: https://t.co/6EoD6w5bK1 https://t.co/PP24Zdog3a
109,@future,2022-05-23 22:27:48+00:00,https://twitter.com/future/status/1528865304436441088,"Founder &amp; CEO of @Hopper, @fredlalonde, on super-app ambitions and becoming an everything startup: https://t.co/9JBksbhb58 https://t.co/3UxnpanNYd"
110,@future,2022-05-23 22:27:47+00:00,https://twitter.com/future/status/1528865299906580480,"How to make talent scouts work for you, by @tylercowen &amp; @danielgross: https://t.co/AsOreiKNZp https://t.co/Y9BcUuLAm3"
111,@future,2022-05-23 22:27:45+00:00,https://twitter.com/future/status/1528865294499778560,"A framework for navigating down markets, from @DavidGeorge83 &amp; @justin_kahl: https://t.co/hhDNmQlu8Y https://t.co/zX5CkkW0OX"
112,@future,2022-05-23 22:23:58+00:00,https://twitter.com/future/status/1528864341826621440,"📨 In the latest Future newsletter: how startups can navigate down markets.

Plus: making talent scouts work for you, building travel super-apps, the thawing relationship of on cloud vs. on-prem, and the value of “negative engineering”.

Subscribe here 👇"
113,@future,2022-05-20 18:35:00+00:00,https://twitter.com/future/status/1527719556898344961,"When major shifts happen, either externally or internally at your organization, that’s a sign to ReCulture. https://t.co/UEZJ2eQ0kY"
114,@future,2022-05-20 18:28:02+00:00,https://twitter.com/future/status/1527717804908093440,"One of the mistakes many growing companies make is keeping the same processes and practices they used when they had 20 employees, even though they may now have thousands. 

@MelissaDaimler's advice for leaders on ""ReCulturing"" as your company evolves 👇 https://t.co/xjsITyANUB"
115,@future,2022-05-19 17:18:07+00:00,https://twitter.com/future/status/1527337821702217739,"For software engineers, small issues can cascade into major problems. 

@PrefectIO  founder @jlowin explains how negative engineering works to insure against the worst outcomes. https://t.co/1eBHrzsjD6"
116,@future,2022-05-18 16:28:57+00:00,https://twitter.com/future/status/1526963058521825280,"When done right, college ambassador programs are a low cost way to acquire users, generate buzz, and kickstart network effects. 

Here’s a beginner’s guide from @westphal_jacob that covers the what and why, the best time to launch, and metrics for success. https://t.co/QHBRUooi0j"
117,@future,2022-05-16 18:09:58+00:00,https://twitter.com/future/status/1526263703427072002,Our interview with @Hopper CEO @fredlalonde where he unpacks the future of travel commerce ⬇️ https://t.co/9JBksbgDfA
118,@future,2022-05-16 18:09:57+00:00,https://twitter.com/future/status/1526263701568995329,"Gamification of travel isn’t a new idea. It’s been a predicted trend since 2011, at least, based on old forecasting reports. What’s different about the way you’re using gamification? https://t.co/zV2F1hQwKk"
119,@future,2022-05-16 18:09:56+00:00,https://twitter.com/future/status/1526263697731031040,"In 2010, BlackBerry founder Mike Lazaridis defined a super-app as a “closed ecosystem of many apps that people would use every day because they offer such a seamless, integrated, contextualized and efficient experience.” Do you think that definition still applies? https://t.co/IdblyX4WLy"
120,@future,2022-05-16 18:09:55+00:00,https://twitter.com/future/status/1526263693293629441,"You’ve described Hopper as on its way to becoming the first travel super-app in North America. As you see it, what’s required for Hopper, or any travel app, to become a bonafide super-app? https://t.co/RggZrwIat8"
121,@future,2022-05-16 18:09:54+00:00,https://twitter.com/future/status/1526263689447358464,"70% of Hopper’s revenue comes from selling what you call “fintech products,” which are non-refundable, a la carte booking add-ons. A customer can pay to freeze the price of a flight, cancel, or switch hotels. How does Hopper offer these without cooperation from the companies? https://t.co/2Gb5BZIugh"
122,@future,2022-05-16 18:09:53+00:00,https://twitter.com/future/status/1526263684837871616,Millennials and Gen Z make up 75% of @Hopper’s customer base. Have you noticed different behavior patterns between the two generations? https://t.co/2pQpVXTmTn
123,@future,2022-05-16 18:09:52+00:00,https://twitter.com/future/status/1526263679175598085,"By the time Hopper formally launched, it was a mobile-only product. Did that seem like a risky choice at the time? https://t.co/FEbQl9v9JA"
124,@future,2022-05-16 18:09:51+00:00,https://twitter.com/future/status/1526263674838601728,Hopper launched in 2015. You’ve described its initial purpose as helping travelers figure out the best time to book a flight to get the best deal. How did you decide on that goal? https://t.co/Lt7TMqvsDE
125,@future,2022-05-16 18:09:50+00:00,https://twitter.com/future/status/1526263670350696450,"We talked with @Hopper CEO @fredlalonde about his super-app ambitions, understanding the geographical and generational differences in mobile buying behavior, canceling out travel anxiety, and loving ‘Shopee Shake’. 🧵👇 https://t.co/CtvtGvNHB4"
126,@future,2022-05-15 15:31:13+00:00,https://twitter.com/future/status/1525861367965794304,"Burn and valuation multiples tell you how efficiently and how much you need to grow. But when the fundraising environment changes and getting capital becomes more uncertain, you need to plan for your best, base, and worst case scenarios.
 
Read more ⬇️ https://t.co/hhDNmQD5xy"
127,@future,2022-05-15 15:31:13+00:00,https://twitter.com/future/status/1525861366317436932,"If your burn multiple isn’t where you need it to be, there are many ways to improve to grow more efficiently, including right sizing different functions, improving margins, or lowering CAC. https://t.co/s8OFq4jp0s"
128,@future,2022-05-15 15:31:13+00:00,https://twitter.com/future/status/1525861364610355201,"If a company burns $40M to add $10M of ARR, it would have a burn multiple of $40M/$10M, or 4.
 
Burn multiples are a metric you can evaluate every quarter, and tracking it closely can ensure you stay on plan. https://t.co/ICiPsAnqCs"
129,@future,2022-05-15 15:31:12+00:00,https://twitter.com/future/status/1525861361099710467,"Now that you have a target ARR, how do you evaluate if your business is growing efficiently to reach it?
 
Burn multiples are the best efficiency metrics for recalibrating when market conditions change because they are all-encompassing of your business activities."
130,@future,2022-05-15 15:31:11+00:00,https://twitter.com/future/status/1525861359849771010,"For a primer on startup metrics, go here: https://t.co/ElVgPrNi3q"
131,@future,2022-05-15 15:31:11+00:00,https://twitter.com/future/status/1525861358578896901,"A $20M ARR business which last raised at $2B see public companies in their space trading at 10x revenue, not 100x.

Adjusting for growth, 15x ARR could be a reasonable valuation for next round.

Goal should be to reach $133M of ARR, $2B divided by 15x — with 12 months of runway."
132,@future,2022-05-15 15:31:11+00:00,https://twitter.com/future/status/1525861357249343489,"How do you recalibrate your goals for this new lower valuation environment?
 
Figure out what ARR you need to reach to get back to your last round valuation by using estimated change in valuation multiples from public companies + a small premium for faster growth.

An example 👇"
133,@future,2022-05-15 15:31:10+00:00,https://twitter.com/future/status/1525861354791481345,"A year ago, it was common to see funding valuations for late stage private companies that were 100x of ARR.
 
If you did your last round at $20M ARR, growing 3x, you may have raised at a $2B valuation.
 
But things look very different now. https://t.co/9L2rRgy3d7"
134,@future,2022-05-15 15:31:09+00:00,https://twitter.com/future/status/1525861351129759746,"For a deeper dive into understanding how valuation multiples work, see this article from @aleximm and @DavidGeorge83. https://t.co/tJ4zkJy8xQ"
135,@future,2022-05-15 15:31:09+00:00,https://twitter.com/future/status/1525861349791830017,"Public markets provide the best basis for recalibrating private growth valuations because they tend to see the effects of decreased valuations first.
 
Currently, median public company software valuations have dropped from 12x forward revenue to 5x or less, almost a 60% decline."
136,@future,2022-05-15 15:31:09+00:00,https://twitter.com/future/status/1525861348487356421,"When the market dips, and valuation multiples are on the decline, founders crave advice that can help quantify the magnitude of the change in valuations and what it means for their next round.
 
@DavidGeorge83 &amp; @justin_kahl provide the diagnostic framework @a16z uses 🧵👇"
137,@future,2022-05-13 15:07:55+00:00,https://twitter.com/future/status/1525130725900668928,"When the market dips, founders crave advice that helps quantify the magnitude of change in their valuation, what it means for their next round, and how to chart their future course. 

@DavidGeorge83 &amp; @justin_kahl provide the diagnostic framework needed. https://t.co/hhDNmQD5xy"
138,@future,2022-05-12 22:41:11+00:00,https://twitter.com/future/status/1524882405793878017,Get @rajivayyangar's Info Diet ⬇️ https://t.co/qPrUvyb2XP
139,@future,2022-05-12 22:41:10+00:00,https://twitter.com/future/status/1524882404070023179,"⌚️ 9:00 p.m.

Watch a video from @ycombinator's YouTube channel where @daltonc talks all about pivoting. https://t.co/hCl5zojV6b"
140,@future,2022-05-12 22:41:10+00:00,https://twitter.com/future/status/1524882402509742112,"📅 Monday, May 9 
⌚️ 8:40 a.m.

Read This Week in Hybrid — which is @Tandem’s newsletter, a weekly digest for return-to-office news, policies, and trends. https://t.co/kC6Zpmby1O"
141,@future,2022-05-12 22:41:10+00:00,https://twitter.com/future/status/1524882401159266310,"⌚️ 9:30 p.m. 

Open @tonicapp, a live-practice audio app, and listen to some classical musicians playing in virtual studios."
142,@future,2022-05-12 22:41:09+00:00,https://twitter.com/future/status/1524882399460483078,"📅 Saturday, May 7 
⌚️ 8:30 a.m.

☕️ and a chapter of Mac creator Jef Raskin’s classic book, The Humane Interface: New Directions for Designing Interactive Systems, which elegantly lays out a first-principles approach to usability. https://t.co/HnonZcFmEm"
143,@future,2022-05-12 22:41:08+00:00,https://twitter.com/future/status/1524882395945656332,"Here’s @rajivayyangar's Info Diet: What the cofounder and CEO of the virtual office app @Tandem is reading, listening to, and watching over the course of a few days 👇 https://t.co/wymsQUI7tf"
144,@future,2022-05-11 15:17:17+00:00,https://twitter.com/future/status/1524408309750579201,"The future likely will make talent search more like pro gaming, argues @tylercowen &amp; @danielgross. With the very best gamers, there's no scout visiting high schools measuring reaction speed or stamina, the gaming process itself measures how good they are. https://t.co/AsOreiKg9R"
145,@future,2022-05-10 16:01:07+00:00,https://twitter.com/future/status/1524056953089142784,"MongoDB CTO @MarkLovesTech shares his views on the thawing relationship between software vendors and cloud providers, and why there’s still a big business in selling installed software. https://t.co/6EoD6w4DUt"
146,@future,2022-05-06 20:00:29+00:00,https://twitter.com/future/status/1522667639772008451,"To move toward a truly open metaverse — one that is transparent and permissionless — @liz_harkavy, @eddylazzarin and @AriannaSimpson share 7 key factors. 
https://t.co/Zytf96Kk35"
147,@future,2022-05-05 17:48:15+00:00,https://twitter.com/future/status/1522271973891616769,"Google is great for questions with an objective answer, like “# of billionaires in the world.” It’s pretty bad at answering questions requiring judgment and context like “What do NFT collectors think about NFTs?” 

@sariazout on how to fix search 👇 https://t.co/oVDRknwWQk"
148,@future,2022-05-04 20:39:17+00:00,https://twitter.com/future/status/1521952625989767169,"Before allocating resources to a dedicated community team, founders need to understand how community differs from other groups who interact with their product, and what makes a community compelling to prospective members. https://t.co/31KQ4Mu2fz"
149,@future,2022-05-04 15:15:43+00:00,https://twitter.com/future/status/1521871197063028736,"What’s needed to rebuild America’s manufacturing workforce? 

@HadrianSpace CEO @2112Power looks at the next 5, 10, 50 years of company building in this conversation with @KTmBoyle, @pmarca, and @packyM. https://t.co/QunukdCBwi"
150,@future,2022-05-03 18:07:39+00:00,https://twitter.com/future/status/1521552078744834051,🧢👀
151,@future,2022-05-03 16:35:54+00:00,https://twitter.com/future/status/1521528990598668288,"Head of Strategic Communities for @discord, @AmberAtherton explains what early-stage founders should know about building and growing a community before allocating resources and hiring a dedicated team. https://t.co/31KQ4Mu2fz"
152,@future,2022-04-29 16:17:20+00:00,https://twitter.com/future/status/1520074764160692224,None of the above should be taken as investment advice; please see https://t.co/qGl8n68t72 for more.
153,@future,2022-04-29 16:17:19+00:00,https://twitter.com/future/status/1520074762294161410,.@omooretweets breaks down GMV retention for marketplaces here: https://t.co/1jZyespBcy
154,@future,2022-04-29 16:17:18+00:00,https://twitter.com/future/status/1520074759228166146,Retention metrics from 16 of the top marketplace startups in recent years ⬇️ https://t.co/k5ToWD6uDF
155,@future,2022-04-29 15:24:41+00:00,https://twitter.com/future/status/1520061518074859520,"From newsletters, to podcasts, and his favorite TikToks, here's what @SolmeKim, president &amp; chief product officer at @Kajabi, reads, follows, listens to, and watches in order to stay ahead of the creator economy curve. https://t.co/0pePzynD3L"
