,0,1,2,3
0,@ThomasOrTK,2023-02-13 18:07:43+00:00,https://twitter.com/ThomasOrTK/status/1625195024794406912,The business impact of cybersecurity threats has every company rethinking its security posture. A new report from @Mandiant found that critical cybersecurity decisions are being made without insights into the adversary and their tactics. https://t.co/LBesL1hjPP
1,@ThomasOrTK,2023-02-13 17:07:26+00:00,https://twitter.com/ThomasOrTK/status/1625179854378520576,"We’re working with @Uber to reimagine the customer experience for users, drivers and merchants by leveraging our reliable, secure-by-design foundation combined with innovative AI and data analytics. https://t.co/Ohs5WyiTBj"
2,@ThomasOrTK,2023-02-09 19:39:22+00:00,https://twitter.com/ThomasOrTK/status/1623768540796059649,We’re proud to be selected as Deutsche Boerse’s preferred cloud partner for the next 10 yrs. Our secure cloud &amp; data analytics capabilities will help advance its data strategy and development of its digital securities platform &amp; digital assets operations.  https://t.co/75Rmm5Rbv1
3,@ThomasOrTK,2023-02-06 23:11:38+00:00,https://twitter.com/ThomasOrTK/status/1622734795825627136,"Excited to continue bringing the best of Google AI to our customers, and help scale these efforts through our Google Cloud partnerships with @CohereAI, @C3_AI, @AnthropicAI, and more. Stay tuned for more developer details soon."
4,@ThomasOrTK,2023-02-03 17:41:14+00:00,https://twitter.com/ThomasOrTK/status/1621564482643456000,Today's announcement with @AnthropicAI is another great example of the ecosystem of AI startups leveraging Google Cloud's reliable and open infrastructure to build their businesses. https://t.co/VB2CjFTd88 https://t.co/0vtxyS1Gta
5,@ThomasOrTK,2023-01-17 18:16:02+00:00,https://twitter.com/ThomasOrTK/status/1615412646769225728,Accelerating drug discovery is a critical application for AI and high-performance computing in the healthcare industry. We’re proud to partner with @Bayer to help get new medicines to patients faster.  https://t.co/vJNRNbyDu6
6,@ThomasOrTK,2023-01-13 17:31:29+00:00,https://twitter.com/ThomasOrTK/status/1613951882598445057,We just unveiled four new AI technologies ahead of #NRF to help retailers transform their in-store shelf checking processes and enhance their e-commerce sites with more fluid and personalized customer experiences. https://t.co/te3zJb6iUe
7,@ThomasOrTK,2023-01-10 17:49:28+00:00,https://twitter.com/ThomasOrTK/status/1612869246220111872,"Thanks, @bobevansIT, for the great conversation on our strategy for 2023."
8,@ThomasOrTK,2023-01-02 02:52:07+00:00,https://twitter.com/ThomasOrTK/status/1609744317567963136,"Happy New Year. Whatever resolutions you have, I hope 2023 brings you good health and happiness."
9,@ThomasOrTK,2022-12-15 18:36:01+00:00,https://twitter.com/ThomasOrTK/status/1603458877017640960,Exciting to see @NAVSEA use @GoogleWorkspace to improve communication and collaboration to help repair and maintain ships. https://t.co/1N8g68EGNl
10,@ThomasOrTK,2022-12-14 23:32:00+00:00,https://twitter.com/ThomasOrTK/status/1603170975310233600,Thank you @constellationr for this recognition - it's an honor.
11,@ThomasOrTK,2022-11-30 16:54:39+00:00,https://twitter.com/ThomasOrTK/status/1597997549214134272,"Today we are announcing our partnership with international home improvement leader @kingfisherplc to deliver the freedom, speed and value they need to more effectively respond to shifting market conditions and deliver first-class customer experiences. https://t.co/70AfJp2BLc"
12,@ThomasOrTK,2022-11-28 18:25:20+00:00,https://twitter.com/ThomasOrTK/status/1597295593898250240,"We’re working with leading Indian game developer @SuperGamingNPC to empower game developers to make better games with the SuperPlatform, it’s live-ops engine that’s capable of managing player analytics, server scaling, Web3 support and more. https://t.co/TvPXa0exRh"
13,@ThomasOrTK,2022-11-22 16:52:59+00:00,https://twitter.com/ThomasOrTK/status/1595098024036159494,Delighted to expand our partnership with Korean social commerce platform @wemakeprice_kr and deliver greater personalized services to their 23M users. https://t.co/qgtnTwXx8n
14,@ThomasOrTK,2022-11-17 17:49:05+00:00,https://twitter.com/ThomasOrTK/status/1593300203771027456,"We’re partnering with @TelkomIndonesia to empower local businesses and communities by better serving customers with data-driven intelligence, co-creating digitalization solutions and developing local tech talent. https://t.co/Pzvx9dueqZ"
15,@ThomasOrTK,2022-11-14 22:19:22+00:00,https://twitter.com/ThomasOrTK/status/1592281061018726401,"It was an honor to join @axios editor @TreedinDC on stage at #HLTH2022 to discuss how cloud is transforming healthcare, along with a few exciting announcements, including Healthcare Data Engine accelerators and some news with Epic. https://t.co/KeCOCU2wJB"
16,@ThomasOrTK,2022-11-11 17:00:45+00:00,https://twitter.com/ThomasOrTK/status/1591113712404156416,"This Veterans Day &amp; Armistice Day, we salute those who've served their countries. In the US, we're partnering w/ @AmericanLegion to provide veterans free access to Google Cloud Skills Boost to build their technical expertise &amp; fast-track their careers. https://t.co/bgsgphlAm1"
17,@ThomasOrTK,2022-11-09 16:48:31+00:00,https://twitter.com/ThomasOrTK/status/1590385859324674049,"Data-driven innovation is growing exponentially in healthcare, and we’re proud to work with @ManipalHealth to enable virtual care services, create a new e-pharmacy platform and deliver remote patient monitoring. https://t.co/TKbmYWtivM"
18,@ThomasOrTK,2022-11-08 18:26:43+00:00,https://twitter.com/ThomasOrTK/status/1590048185212612608,Proud to expand our partnership with @renaultgroup to power its software-defined vehicles with our Android Auto and cloud technologies. https://t.co/EZVVZQBUp0
19,@ThomasOrTK,2022-11-03 22:40:37+00:00,https://twitter.com/ThomasOrTK/status/1588300139885522945,We’ve been on a mission to improve data interoperability in healthcare. Now we’re extending that to medical imaging to support customers like @HMHNewJersey and @Hologic who are working on cancer detection and diagnosis. https://t.co/fdejnGHPmU
20,@ThomasOrTK,2022-11-03 14:47:16+00:00,https://twitter.com/ThomasOrTK/status/1588181020553072640,Our work with @PMPMLPune in India is helping to make commuting easier with an intelligent transit management system that can track buses live via Google Maps. https://t.co/xaWHndhIIr
21,@ThomasOrTK,2022-11-01 17:43:52+00:00,https://twitter.com/ThomasOrTK/status/1587500686953963520,Today we’re announcing package tracking in Gmail to make it easier for consumers to keep tabs on their online shopping deliveries and timelines. https://t.co/setMG85PjC
22,@ThomasOrTK,2022-10-28 17:58:18+00:00,https://twitter.com/ThomasOrTK/status/1586054767171682304,"Blockchain is changing the way the world stores and moves information. Today we’re announcing Blockchain Node Engine, which will support Ethereum &amp; enable developers to provision fully managed Ethereum nodes with secure blockchain access. https://t.co/2PGstyupYU"
23,@ThomasOrTK,2022-10-24 21:39:45+00:00,https://twitter.com/ThomasOrTK/status/1584660944265048064,"We’re partnering with @WellsFargo to launch the new Fargo virtual assistant. Powered by @GoogleCloud's conversational AI, Fargo provides a more personalized and convenient customer experience. https://t.co/67cjLgAwNw"
24,@ThomasOrTK,2022-10-19 19:17:40+00:00,https://twitter.com/ThomasOrTK/status/1582813250130833409,Great conversation with @alexandr_wang at #TransformX today about how @googlecloud is investing in AI capabilities with input from our customers and partners like @scale_AI. https://t.co/VxoQzCTqvv
25,@ThomasOrTK,2022-10-19 15:06:15+00:00,https://twitter.com/ThomasOrTK/status/1582749976731389952,"With our expanded partnership with Bloomberg @TheTerminal, our goal is to simplify our mutual customers’ cloud journeys and expand access to the most important data and tools. https://t.co/pPiJGPdtVd"
26,@ThomasOrTK,2022-10-18 21:16:18+00:00,https://twitter.com/ThomasOrTK/status/1582480715878305793,"Excited to see the great content around the future of security coming out of @Mandiant's #mWISE event this week. If you’re in DC, check out the #ElevateWICS luncheon on 10/19 celebrating women leaders in cybersecurity. https://t.co/e7UKj1SzuP"
27,@ThomasOrTK,2022-10-18 18:11:17+00:00,https://twitter.com/ThomasOrTK/status/1582434156507602944,"Threat actors continue to escalate the sophistication and aggressiveness of their attacks. To help organizations combat these threats, we’re announcing the General Availability of @Mandiant Breach Analytics for @chroniclesec. https://t.co/JYpXSi3igp"
28,@ThomasOrTK,2022-10-17 16:14:19+00:00,https://twitter.com/ThomasOrTK/status/1582042331267493888,Mandiant is at the forefront of cybersecurity and the team is sharing critical insights at #mWISE this week. Follow along with @mWISEConference tomorrow at 9am ET for live coverage as @Mandiant CEO Kevin Mandia &amp; @googlecloud CISO @philvenables take the stage. https://t.co/sGP9mLGh97
29,@ThomasOrTK,2022-10-14 17:07:36+00:00,https://twitter.com/ThomasOrTK/status/1580968576164327432,Thank you @NpowerOrg for an incredible evening earlier this week. Excited about the work we’re doing together with @Googleorg to help empower young people with meaningful careers in technology. https://t.co/36I2KE53rQ
30,@ThomasOrTK,2022-10-14 00:05:44+00:00,https://twitter.com/ThomasOrTK/status/1580711416599760896,Excited to be working with Australia’s leading securities exchange company @ASX to help build its data innovation strategy &amp; bring new products and services to market faster. https://t.co/XOciJVQQjA
31,@ThomasOrTK,2022-10-12 21:53:10+00:00,https://twitter.com/ThomasOrTK/status/1580315668758417409,"We're always looking for ways to help organizations thrive in a hybrid world. This week, @GoogleWorkspace  opened up smart canvas for third party applications, and announced new immersive connections for Meet and enhanced security across our tools. https://t.co/T1daZRDKTs"
32,@ThomasOrTK,2022-10-12 20:18:24+00:00,https://twitter.com/ThomasOrTK/status/1580291817144086528,The retail experience continues to evolve with advances in AI. It’s inspiring to see the way @riteaid and @Wayfair  are empowering their teams with technology to deliver great shopping experiences for customers. https://t.co/WmPRTu4JY0
33,@ThomasOrTK,2022-10-12 19:02:12+00:00,https://twitter.com/ThomasOrTK/status/1580272642749177856,Thrilled to be teaming up with @TMobile to take their customer obsessed approach to the next level with new data-driven experiences. https://t.co/6clunPRfKQ
34,@ThomasOrTK,2022-10-12 16:50:05+00:00,https://twitter.com/ThomasOrTK/status/1580239395344424965,"Looking forward to bringing Google Cloud regions to meet growing customer needs in five new countries: Austria, Greece, Norway, South Africa &amp; Sweden.

It’s a privilege helping our global customers stay connected. https://t.co/4mdzTflUdv"
35,@ThomasOrTK,2022-10-11 21:06:23+00:00,https://twitter.com/ThomasOrTK/status/1579941503652491270,"We’re deepening our partnership with @Accenture with a dedicated Google Cloud services group and plans to certify 15,000 more Google Cloud professionals so we can help even more customers. https://t.co/f4anfPErA0"
36,@ThomasOrTK,2022-10-11 20:20:35+00:00,https://twitter.com/ThomasOrTK/status/1579929978635833345,"So much news around how we help protect customers -- from Software Delivery Shield to protect the software supply chain to sovereign solutions to Chronicle Security Operations to detect, investigate and respond to threats. https://t.co/FpLnDvCzNK"
37,@ThomasOrTK,2022-10-11 17:49:04+00:00,https://twitter.com/ThomasOrTK/status/1579891847517773824,"@sundarpichai @googlecloud Great to have you with us today at #GoogleCloudNext, Sundar!"
38,@ThomasOrTK,2022-10-11 17:47:22+00:00,https://twitter.com/ThomasOrTK/status/1579891422672846850,Proud to have @Ford CEO @jimfarley98 on stage at #GoogleCloudNext sharing Ford's transformation story using AI and high-performance computing.
39,@ThomasOrTK,2022-10-11 17:18:15+00:00,https://twitter.com/ThomasOrTK/status/1579884093772165120,Our new partnership with @Coinbase is all about Web3 innovation. https://t.co/qWQ2HJNT4Z
40,@ThomasOrTK,2022-10-11 15:58:22+00:00,https://twitter.com/ThomasOrTK/status/1579863991429787648,Our expanded partnership with @PrudentialPLC will make it easier for people to access healthcare and protect their finances across Asia &amp; Africa. https://t.co/6KHtFgW0CA
41,@ThomasOrTK,2022-10-11 13:43:30+00:00,https://twitter.com/ThomasOrTK/status/1579830050278772736,"Today at #GoogleCloudNext we outline our vision for the future of cloud. Data and AI are transforming everything around us, and open, connected ecosystems are essential to everything we do. Lots of exciting announcements from the team! https://t.co/CqcRo5PFvl"
42,@ThomasOrTK,2022-10-10 22:23:07+00:00,https://twitter.com/ThomasOrTK/status/1579598428346384384,"Getting ready for tomorrow’s keynote at #GoogleCloudNext! Tune in to learn how the latest cloud innovations across data &amp; analytics, cybersecurity, collaboration and open infrastructure are helping our customers. https://t.co/UxCK3lkUwA"
43,@ThomasOrTK,2022-10-06 19:14:51+00:00,https://twitter.com/ThomasOrTK/status/1578101499531386881,"Today we announced an expanded partnership with @MLB to bring new personalized experiences for baseball fans around the world to their media products and properties, including https://t.co/KnIyQg2AuS.
https://t.co/k20YXHDCj4"
44,@ThomasOrTK,2022-10-05 18:26:10+00:00,https://twitter.com/ThomasOrTK/status/1577726858107371520,We’re thrilled to announce our first Google Cloud region in South Africa! South Africa joins Google Cloud’s global network of 35 cloud regions and 106 zones worldwide. https://t.co/kYNTs4Q4nG
45,@ThomasOrTK,2022-10-04 21:18:14+00:00,https://twitter.com/ThomasOrTK/status/1577407771921682432,"Google pioneered the use of AI and computer vision, and now we’re applying that expertise to healthcare and life sciences with our Medical Imaging Suite. https://t.co/TuxRTMkjO3"
46,@ThomasOrTK,2022-10-04 20:36:01+00:00,https://twitter.com/ThomasOrTK/status/1577397148131287040,"We’re proud to announce a major Google Public Sector win – we will provide up to 250,000 @USArmy soldiers with Google Workspace to help enable secure, seamless communication &amp; collaboration. https://t.co/DHEcgyywYQ"
47,@ThomasOrTK,2022-09-27 23:35:59+00:00,https://twitter.com/ThomasOrTK/status/1574905723808493568,We’re introducing Device Connect for Fitbit to help healthcare &amp; life sciences enterprises like @HagaZiekenhuis Hospital in the Netherlands unlock insights about patients to better manage chronic conditions and advance clinical research.  https://t.co/AfzOF0Fmfm
48,@ThomasOrTK,2022-09-23 18:24:48+00:00,https://twitter.com/ThomasOrTK/status/1573377860618027008,We are working with @Travelers to improve the commercial insurance underwriting process by quickly synthesizing vast amounts of information to unlock insights and help underwriters more efficiently evaluate risks. https://t.co/gt0PxiqjUf
49,@ThomasOrTK,2022-09-21 16:43:52+00:00,https://twitter.com/ThomasOrTK/status/1572627682776739842,"Thank you @BWrightAFA and @SpaceForceCSO for an insightful discussion yesterday at #ASC22 about innovation, leadership and digital transformation."
50,@ThomasOrTK,2022-09-15 18:22:10+00:00,https://twitter.com/ThomasOrTK/status/1570478095559438336,"We’re helping @LifePointHealth bring data together from a large number of sources, and apply AI &amp; ML to transform patient care - from helping identify high-risk patients to reducing physician burn out.  https://t.co/sDTmcl5jov"
51,@ThomasOrTK,2022-09-14 16:43:57+00:00,https://twitter.com/ThomasOrTK/status/1570090990761025536,"Our work with @BNBCHAIN will help early-stage Web3 and blockchain startups develop and scale high-performance, efficient and sustainable innovations for users and the entire industry. https://t.co/lIF0ke1u7m"
52,@ThomasOrTK,2022-09-12 14:27:45+00:00,https://twitter.com/ThomasOrTK/status/1569331936358969344,"Proud to share we’ve completed the @Mandiant acquisition. A big welcome to the Mandiant team, I’m excited to see the impact we'll have on our customers and partners. https://t.co/4xeA55YyHB"
53,@ThomasOrTK,2022-09-06 23:38:48+00:00,https://twitter.com/ThomasOrTK/status/1567296287686668288,We’ve joined @tmforumorg to help communication service providers transform their network with AI and ML and find new paths of growth. https://t.co/OTbKus6npY
54,@ThomasOrTK,2022-09-01 16:54:03+00:00,https://twitter.com/ThomasOrTK/status/1565382491241820160,Our partner ecosystem is a critical part of our new Google Cloud Ready Sustainability program that will help our customers combat climate change and deliver on their ESG goals. https://t.co/Jml4u7YE1u
55,@ThomasOrTK,2022-08-29 22:01:55+00:00,https://twitter.com/ThomasOrTK/status/1564372804706783233,"Thank you, @Joubinmir and @kleinerperkins, for the conversation. I enjoyed sharing stories about my path to Google Cloud and discussing how we’ve reached incredible growth over the past 3+ years (hint: it boils down to being customer-obsessed). https://t.co/pkHE6Az9L0 https://t.co/nvgnPHy1uk"
56,@ThomasOrTK,2022-08-25 22:01:14+00:00,https://twitter.com/ThomasOrTK/status/1562923078681645056,"One of the easiest ways to help manufacturers save time and money is to get production right the first time. Google Cloud's AI capabilities are helping customers catch flaws faster, increasing quality and efficiency. https://t.co/6XQ3UsLEhV"
57,@ThomasOrTK,2022-08-19 21:25:51+00:00,https://twitter.com/ThomasOrTK/status/1560739848478109696,"@HL7 @judywawira @AashimaTweets @googlecloud Congratulations, Aashima."
58,@ThomasOrTK,2022-08-19 20:19:53+00:00,https://twitter.com/ThomasOrTK/status/1560723247552901120,Our new strategic partnership with @americanas will explore co-innovation projects and deliver a seamless consumer experience with personalized services and product recommendations.
59,@ThomasOrTK,2022-08-19 18:23:33+00:00,https://twitter.com/ThomasOrTK/status/1560693969947766784,"It was great meeting with the @OoredooQatar executive delegation. We're proud to help local businesses in Qatar use AI to deliver best-in-class customer experiences, lower contact center costs, and provide better interactions."
60,@ThomasOrTK,2022-08-18 23:01:03+00:00,https://twitter.com/ThomasOrTK/status/1560401418829189120,"It’s critical that companies protect their applications in the cloud, especially as the attack surface grows and tactics continue to evolve. We recently helped a customer block the largest reported Layer 7 DDoS attack ever.  https://t.co/TqzdE9EWLh"
61,@ThomasOrTK,2022-08-09 18:32:57+00:00,https://twitter.com/ThomasOrTK/status/1557072458842136580,"Next month marks Google's 21st anniversary in Asia Pacific. Today we're deepening our commitment to APAC and announcing three new @GoogleCloud regions coming to Malaysia, New Zealand and Thailand, adding to our 11 cloud regions today. https://t.co/JPJC5t7xUQ"
62,@ThomasOrTK,2022-08-08 16:43:39+00:00,https://twitter.com/ThomasOrTK/status/1556682565041266689,We’re working with @RenttheRunway to help their IT infrastructure map to business needs to support their sustainability goals &amp; empower their developers to innovate. https://t.co/KrmAIX1UdV
63,@ThomasOrTK,2022-08-03 15:47:25+00:00,https://twitter.com/ThomasOrTK/status/1554856472667832320,"In order for us to grow responsibly as a company and as an industry, we must invest in the career success of everyone, including our channel partners. https://t.co/l9njLcFlmU"
64,@ThomasOrTK,2022-07-28 15:55:42+00:00,https://twitter.com/ThomasOrTK/status/1552684229921611776,"Thank you for sharing your story, @PSchill_1994. You’re an inspiration to all of us at Google. https://t.co/TKKtHn0V8S"
65,@ThomasOrTK,2022-07-26 19:23:56+00:00,https://twitter.com/ThomasOrTK/status/1552011855849082880,"We need people like @Speak2Lead in influential roles in order to build a more diverse cloud ecosystem. Thank you, Wayne, for putting people first and creating Black+TechAmplify. https://t.co/tGxaFur5k3"
66,@ThomasOrTK,2022-07-21 20:56:35+00:00,https://twitter.com/ThomasOrTK/status/1550223233344909312,"Our five-year partnership will help @arvestbank reinvent and transform community banking, from reshaping credit risk modeling to better supporting underserved communities. https://t.co/uL0Cd98PlL"
67,@ThomasOrTK,2022-07-21 19:38:16+00:00,https://twitter.com/ThomasOrTK/status/1550203524931153920,"Today we announced that Mexico will be the site of a new cloud region for Google Cloud, becoming our third in Latin America, joining Santiago, Chile and São Paulo, Brazil. https://t.co/SzuTNvZ7Z5"
68,@ThomasOrTK,2022-07-20 19:10:07+00:00,https://twitter.com/ThomasOrTK/status/1549834053502636032,"After two years of virtual events, I’m looking forward to this year’s #GoogleCloudNext, with global in-person events and on-demand content. Join us to hear how we’re helping solve the challenges of tomorrow.https://t.co/PQ5j6bJAZ0"
69,@ThomasOrTK,2022-07-12 21:39:45+00:00,https://twitter.com/ThomasOrTK/status/1546972605458038786,"Today, we announced a deepened partnership with @DeutscheTelekom to create more secure, reliable and scalable cloud-native networks. https://t.co/9rrTs3z71n"
70,@ThomasOrTK,2022-07-12 16:41:36+00:00,https://twitter.com/ThomasOrTK/status/1546897573276950529,"Felicidades to the first 50 Latino-led startups selected to receive funding, Google mentorship and Google Cloud credits."
71,@ThomasOrTK,2022-07-11 19:15:44+00:00,https://twitter.com/ThomasOrTK/status/1546573977421844482,"We’re excited to give Google One members access to some of our best @GoogleWorkspace features like longer group video calls, noise cancellation and call recording in Google Meet. https://t.co/pfFVVqbuXD"
72,@ThomasOrTK,2022-07-08 23:13:12+00:00,https://twitter.com/ThomasOrTK/status/1545546574591320065,"When it comes to solving a problem as urgent as climate change, strong leadership and collaboration are key to making progress. Great insights from @justinkeeble about the ways leaders can take action in driving action via @FastCompany  https://t.co/ALxeX8j0T7"
73,@ThomasOrTK,2022-07-07 18:23:21+00:00,https://twitter.com/ThomasOrTK/status/1545111241135247361,"Great to see @Kelly_Ducourty’s insights on what we look for in candidates—ownership, passion for excellence and a focus on the customer."
74,@ThomasOrTK,2022-07-07 17:10:21+00:00,https://twitter.com/ThomasOrTK/status/1545092870381658112,Our VP of Financial Services @yolandepiazza shares why it’s critical for payment providers to build the right underlying technology foundation to thrive in the future. https://t.co/p3EIH8xEU5
75,@ThomasOrTK,2022-07-06 19:38:44+00:00,https://twitter.com/ThomasOrTK/status/1544767824702218240,"As air pollution continues to impact the world, the state of New York is working with Google Public Sector to measure air quality and monitor greenhouse gases to better address climate change. https://t.co/YgwNssKYLu"
76,@ThomasOrTK,2022-06-30 21:33:20+00:00,https://twitter.com/ThomasOrTK/status/1542622338092523521,"We’re proud to support our partner @Thalesgroup and its subsidiary S3NS on this milestone towards the French “cloud de confiance."" https://t.co/WfObzA4l6I"
77,@ThomasOrTK,2022-06-30 20:11:04+00:00,https://twitter.com/ThomasOrTK/status/1542601634106195968,Today we’re announcing a new strategic partnership with H&amp;M Group to create stronger omnichannel customer experiences and optimize supply chain enablement through an enterprise data backbone and advanced AI/ML capabilities. https://t.co/c8BGrPL1UW
78,@ThomasOrTK,2022-06-30 15:54:38+00:00,https://twitter.com/ThomasOrTK/status/1542537101002014726,Bonjour Paris and bonjour la France! I am excited to announce that our cloud region in France is now officially open. https://t.co/TA194DxYNv
79,@ThomasOrTK,2022-06-30 14:21:39+00:00,https://twitter.com/ThomasOrTK/status/1542513700619243520,"Built on Google Cloud’s open, scalable, and secure-by-design infrastructure and data services, @biofarmaID’s new digital health initiative will provide a holistic view of how lifestyle factors like nutrition and sleep can impact health and wellness. https://t.co/VUfeY6oYLn"
80,@ThomasOrTK,2022-06-28 15:55:19+00:00,https://twitter.com/ThomasOrTK/status/1541812498042654721,"Sustainability has always been a core value to Google, and we’re committed to helping organizations transition to resilient, carbon-free systems. Today, we’re announcing new solutions to help our customers accelerate their efforts. https://t.co/JFjY4j7YVR"
81,@ThomasOrTK,2022-06-23 19:27:58+00:00,https://twitter.com/ThomasOrTK/status/1540054072727785473,It was a pleasure speaking with @DGoodison and I'm grateful for the vote of confidence from our customers. None of this would've been possible without my @googlecloud colleagues. https://t.co/nxbZ4Xy8m7
82,@ThomasOrTK,2022-06-23 16:40:44+00:00,https://twitter.com/ThomasOrTK/status/1540011987819630592,"Proud to share that 2021 was our 5th consecutive year of matching 100% of our global energy use w/ renewable energy purchases. As the cleanest cloud in the industry, we’re committed to going one step further: running entirely on carbon free energy by 2030. https://t.co/7u94XY6yXL"
83,@ThomasOrTK,2022-06-22 21:29:34+00:00,https://twitter.com/ThomasOrTK/status/1539722285229084672,Next week is our first ever Sustainability #GoogleCloudSummit. We'll hear from leading experts and share some exciting news to better support customers’ sustainable digital transformation. https://t.co/EpPRybqNOs
