,0,1,2,3
167,@ThomasOrTK,2021-12-31 15:46:26+00:00,https://twitter.com/ThomasOrTK/status/1476942834640965641,"As we end the year, I’ve been reflecting on the power of the human spirit and the capabilities of technology. I’m very optimistic about what’s in store for 2022 and wish you all a very happy and healthy new year."
168,@ThomasOrTK,2021-12-20 16:44:24+00:00,https://twitter.com/ThomasOrTK/status/1472971155367620608,"To better meet the security, privacy and sovereignty needs of customers in Spain, we are announcing a joint sovereign cloud with @minsaitbyindra. https://t.co/5ifbapQQyE"
169,@ThomasOrTK,2021-12-16 20:32:50+00:00,https://twitter.com/ThomasOrTK/status/1471579090721275906,"From powering autonomous mobile robots to automating the factory floor, our work with @Verizon will enable companies to unlock the full power of 5G and mobile edge computing. https://t.co/GH8gW4elWr"
170,@ThomasOrTK,2021-12-16 18:49:27+00:00,https://twitter.com/ThomasOrTK/status/1471553072048766977,It’s inspiring to see how the cloud can play a significant role in breaking down barriers in cancer research - we’re grateful for the opportunity to partner with @theNCI on such important work. https://t.co/gGs24fAsro
171,@ThomasOrTK,2021-12-14 16:53:28+00:00,https://twitter.com/ThomasOrTK/status/1470799111209177098,Honored to partner with @CNRailway to reimagine the future of the railway industry and support their team's sustainability goals.
172,@ThomasOrTK,2021-12-09 17:09:09+00:00,https://twitter.com/ThomasOrTK/status/1468991115147689984,"Our partnership with @Kyndryl will focus on developing solutions to help enterprises build more data-driven, sustainable and AI-centric businesses. https://t.co/7uz8Lqx9yx"
173,@ThomasOrTK,2021-12-08 16:42:42+00:00,https://twitter.com/ThomasOrTK/status/1468622071991205888,"As we approach the end of the year, our CISO @philvenables recaps the most pressing security themes from 2021, from securing open source software, to enabling zero trust architectures and more."
174,@ThomasOrTK,2021-12-01 17:00:51+00:00,https://twitter.com/ThomasOrTK/status/1466089926756208640,"@btaylor @salesforce Congratulations, @btaylor - excited to see what's ahead for Salesforce!"
175,@ThomasOrTK,2021-12-01 16:57:37+00:00,https://twitter.com/ThomasOrTK/status/1466089111354179591,"Our Santiago Cloud Region is now live, bringing our technology and on-demand network closer to customers and partners across the region. https://t.co/OLDD05xMnd"
176,@ThomasOrTK,2021-11-30 20:03:41+00:00,https://twitter.com/ThomasOrTK/status/1465773548069285890,Today we're building on our @tsystemsde partnership with a new Co-Innovation Center in Munich focused on supporting sustainable digital transformation across Germany. https://t.co/ZUz5tsCWCU
177,@ThomasOrTK,2021-11-30 16:57:40+00:00,https://twitter.com/ThomasOrTK/status/1465726734532157440,Good read about how our partner @Cyclica is using Google Cloud AI to help with drug discovery. https://t.co/VbKUgy57Nb
178,@ThomasOrTK,2021-11-29 23:23:58+00:00,https://twitter.com/ThomasOrTK/status/1465461565914681345,Thanks @bobevansIT for a great conversation about the future of cloud -- always enjoy catching up.
179,@ThomasOrTK,2021-11-25 16:22:18+00:00,https://twitter.com/ThomasOrTK/status/1463905898330345476,"Happy Thanksgiving! I am grateful for my family, our teams at Google Cloud, and our customers across the globe. It’s amazing how we’ve come together to support each other and maintain a spirit of optimism throughout the pandemic."
180,@ThomasOrTK,2021-11-24 20:26:45+00:00,https://twitter.com/ThomasOrTK/status/1463605028531294213,It’s been inspiring to see organizations come together during the pandemic. Our work with @VodafoneGroup and the European Commission is a great example where secure mobile network data was used to track the spread of COVID-19 across the EU. https://t.co/gIML0yGgC3
181,@ThomasOrTK,2021-11-24 17:03:50+00:00,https://twitter.com/ThomasOrTK/status/1463553960292220931,"For nearly a decade, we’ve helped @Roche fuel innovation and collaboration with @GoogleWorkspace. Look forward to continuing the journey!"
182,@ThomasOrTK,2021-11-23 16:31:27+00:00,https://twitter.com/ThomasOrTK/status/1463183422629691392,We are committed to making AI more accessible to businesses in every industry. Our VP of Cloud AI @awmcmu recently shared more on our work at @brainstorm_ai. https://t.co/tTL6YXHPAs
183,@ThomasOrTK,2021-11-18 16:18:23+00:00,https://twitter.com/ThomasOrTK/status/1461368193956544518,We’re making it easier for you to find your holiday gifts online. @Macys saw a 2% increase in conversion and a 1.3% increase in revenue per visit in recent tests using Google Cloud Retail Search. https://t.co/iL7q8Xt6DY
184,@ThomasOrTK,2021-11-17 16:02:43+00:00,https://twitter.com/ThomasOrTK/status/1461001863797489664,"Excited about our multi-year partnership to power @CohereAI’s natural language processing technology with Cloud TPUs, making it easier and more cost-effective for any organization to use AI to better understand their customers. https://t.co/a51q6woE0Z"
185,@ThomasOrTK,2021-11-16 01:01:37+00:00,https://twitter.com/ThomasOrTK/status/1460412707824308224,Today marks a significant Google investment to support Australian innovation. Looking forward to seeing the next wave of growth for people &amp; businesses across the country!
186,@ThomasOrTK,2021-11-15 15:57:15+00:00,https://twitter.com/ThomasOrTK/status/1460275712292626439,"We are honored to be selected as @TelenorGroup’s strategic partner for their transformation journey, and to fuel future business growth and bring digital capabilities to customers across Norway and beyond. https://t.co/Wse7DSQ4uL"
187,@ThomasOrTK,2021-11-09 17:13:56+00:00,https://twitter.com/ThomasOrTK/status/1458120684438102026,"Indonesia is one of the world's fastest growing consumer markets, and we're proud to partner with @aaneama and his team at @IndosatOoredoo to help Indonesian SMBs and enterprises digitize, creating new engines for long-term innovation and growth. https://t.co/BLJvHn1moO"
188,@ThomasOrTK,2021-11-04 13:26:47+00:00,https://twitter.com/ThomasOrTK/status/1456251582610169863,Our partnership with @CMEGroup will help bring new products and services to market faster &amp; ultimately transform how global derivatives markets operate with technology. https://t.co/rkvIFKoWCz
189,@ThomasOrTK,2021-11-03 21:05:03+00:00,https://twitter.com/ThomasOrTK/status/1456004519007948800,"We also support researchers with tools like RAD Lab — a sandbox environment to help facilitate R&amp;D while maintaining compliance and still giving researchers access to the latest technology. The faster we can experiment, the faster we can make progress. https://t.co/JPuDxQ4P16"
190,@ThomasOrTK,2021-11-03 21:05:02+00:00,https://twitter.com/ThomasOrTK/status/1456004517741301762,"Google Cloud also just passed 2 major milestones: 

Workspace has now achieved FedRAMP High authorization, and Google Cloud Platform services received DoD IL4. https://t.co/R0EAmZOV70"
191,@ThomasOrTK,2021-11-03 21:05:02+00:00,https://twitter.com/ThomasOrTK/status/1456004516445184001,"Supporting the public sector is a key priority for @GoogleCloud. By working with state and local governments, we’re able to help deliver essential federal assistance to families and communities who need it most. But that’s not all we do... https://t.co/fc3Ee0030r"
192,@ThomasOrTK,2021-11-02 20:15:07+00:00,https://twitter.com/ThomasOrTK/status/1455629567096279041,This is an uplifting story about how Nigeria-focused NGO @NewIncentives is using @appsheet to improve infant mortality rates through immunization efforts during COVID. https://t.co/GFy9yz0P6H
193,@ThomasOrTK,2021-11-01 22:39:35+00:00,https://twitter.com/ThomasOrTK/status/1455303536074391556,"Great to see one of Brazil’s largest newspapers, @folha digitize its century-old archive using our cloud."
194,@ThomasOrTK,2021-11-01 16:48:57+00:00,https://twitter.com/ThomasOrTK/status/1455215293882531841,"With #COP26 underway, here's a look at how we're helping our partners, enterprise customers and the billions of people who use Google products every day be more sustainable with the cleanest cloud in the industry.  https://t.co/5qXaOihk5L"
195,@ThomasOrTK,2021-10-28 15:50:20+00:00,https://twitter.com/ThomasOrTK/status/1453750990373462020,"I am delighted about our new partnership with @GroupeRocher, who will use our sustainable infrastructure to help its brands Arbonne, Yves Rocher &amp; Petit Bateau boost their online retail initiatives and reduce their carbon footprint. https://t.co/L3l1EkVe3X"
196,@ThomasOrTK,2021-10-27 22:25:41+00:00,https://twitter.com/ThomasOrTK/status/1453488097472106496,"We are excited to expand our partnership with Keralty to develop new, innovative solutions that will advance patient care in Colombia."
197,@ThomasOrTK,2021-10-25 17:17:20+00:00,https://twitter.com/ThomasOrTK/status/1452685720695369731,"I'm proud to work with leaders like @vgcerf and @innovatewithjim who champion diversity, equity, and inclusion, and do the work to change structures and systems in the workplace that don’t work for everyone. https://t.co/HhdaPCclfL"
198,@ThomasOrTK,2021-10-21 20:07:29+00:00,https://twitter.com/ThomasOrTK/status/1451278990371549189,Our goal is to involve partners in 100% of our customer engagements. Last week at #GoogleCloudNext we announced 20+ new and expanded partnerships to bring the best of our ecosystem to customers. https://t.co/oNOGN9Evah
199,@ThomasOrTK,2021-10-19 17:23:01+00:00,https://twitter.com/ThomasOrTK/status/1450512826162843652,"It’s critical we equip the next generation of cloud leaders with the skills they need to grow their careers, which is why we launched our Google Cloud Skills Boost to train more than 40 million people. https://t.co/YZJfFApgp3"
200,@ThomasOrTK,2021-10-15 19:33:31+00:00,https://twitter.com/ThomasOrTK/status/1449096114049716225,Thank you to everyone who could join us this year at #GoogleCloudNext. I hope to see you all in person next year. https://t.co/sqsEujyPRR
201,@ThomasOrTK,2021-10-15 17:59:09+00:00,https://twitter.com/ThomasOrTK/status/1449072366265401353,"This week we continued to evolve Workspace and make it easier for customers to navigate hybrid work, with new innovations that extend the value of our collaboration &amp; communication platform. https://t.co/E2HIX9E1Zr"
202,@ThomasOrTK,2021-10-14 15:56:37+00:00,https://twitter.com/ThomasOrTK/status/1448679143449657346,Our new Work Safer program provides organizations of all sizes access to a range of industry-leading offers from Google and our partners @PaloAltoNtwks and @CrowdStrike to better protect against rising cybersecurity threats. https://t.co/c7v9x4LmN5
203,@ThomasOrTK,2021-10-13 21:36:42+00:00,https://twitter.com/ThomasOrTK/status/1448402339702849540,"@amit_walia @googlecloud @Informatica Thanks, Amit! It's been great working alongside your team, discovering new ways to help customers like @PayPal and @CharlesSchwab make the most of their data strategies."
204,@ThomasOrTK,2021-10-13 18:56:17+00:00,https://twitter.com/ThomasOrTK/status/1448361969212264451,"We’re giving customers more choice for how and where to run their workloads with Google Distributed Cloud, a new portfolio of solutions including hardware and software that extend our infrastructure to the edge and into your data centers. https://t.co/r1yVKdYNSH"
205,@ThomasOrTK,2021-10-13 15:05:41+00:00,https://twitter.com/ThomasOrTK/status/1448303937241505796,We look forward to helping @Siemens_Energy meet their ambitious goal of becoming climate neutral by 2030. https://t.co/BS95OWz9jQ
206,@ThomasOrTK,2021-10-12 20:17:19+00:00,https://twitter.com/ThomasOrTK/status/1448019976418316291,We are working hand-in-hand with our customers to develop new solutions that help every company build a more sustainable future. Thanks @harrymccracken for the insightful conversation about our initiatives. https://t.co/xLfZqy8CjL
207,@ThomasOrTK,2021-10-12 19:12:15+00:00,https://twitter.com/ThomasOrTK/status/1448003601431810054,"It was an honor to have you with us today, Sundar!"
208,@ThomasOrTK,2021-10-12 18:14:50+00:00,https://twitter.com/ThomasOrTK/status/1447989150196527105,"Cybersecurity is at the top of every C-level and board agenda, and our new Google Cybersecurity Action Team is part of our commitment to be the best security partner to our customers. https://t.co/6zdz5To5sn"
209,@ThomasOrTK,2021-10-12 17:16:12+00:00,https://twitter.com/ThomasOrTK/status/1447974393515151360,"This week, we're sharing our latest cloud innovations, celebrating the achievements of our customers and partners, and providing a view into the future. #GoogleCloudNext https://t.co/BEdMnDwuDu"
210,@ThomasOrTK,2021-10-12 17:14:17+00:00,https://twitter.com/ThomasOrTK/status/1447973914169077769,@DHenschen @googlecloud We're having fun over here!
211,@ThomasOrTK,2021-10-12 15:39:29+00:00,https://twitter.com/ThomasOrTK/status/1447950053918732294,We’re almost live at #GoogleCloudNext! Tune in here → https://t.co/IWBlguNT6q https://t.co/BEWsgOGoey
212,@ThomasOrTK,2021-10-11 17:17:02+00:00,https://twitter.com/ThomasOrTK/status/1447612214874021888,Every year I look forward to #GoogleCloudNext and connecting with all of our customers &amp; partners. Tomorrow @sundarpichai and I look forward to sharing our latest cloud innovations and providing a view into the future of digital transformation.https://t.co/ysB9Ne2wPD
213,@ThomasOrTK,2021-10-06 17:23:26+00:00,https://twitter.com/ThomasOrTK/status/1445801887354142722,We’re building on our commitment to supporting European customers with a new partnership with @thalesgroup to develop a trusted cloud offering in France.
214,@ThomasOrTK,2021-10-04 22:20:47+00:00,https://twitter.com/ThomasOrTK/status/1445151944809476097,This is an inspiring leadership message from @GenCQBrownJr on the future of the @usairforce. We're proud to support @airforcerso and the whole USAF team on their modernization journey.
215,@ThomasOrTK,2021-10-04 20:51:24+00:00,https://twitter.com/ThomasOrTK/status/1445129449918197762,"Enjoyed our important dialogue on cybersecurity as a business and policy priority at Singapore International Cyber Week today with @mpjoteo, @haslindatv and Anand Swaminathan. #SICW2021"
216,@ThomasOrTK,2021-09-30 15:55:41+00:00,https://twitter.com/ThomasOrTK/status/1443605477447766021,"Supporting the startup ecosystem is a priority for us, and I'm pleased to share that we're giving $100K in @googlecloud credits to each of the 50 this year’s recipients of the Black Founders Fund in the US. #FundBlackFounders"
217,@ThomasOrTK,2021-09-29 16:00:43+00:00,https://twitter.com/ThomasOrTK/status/1443244357969088512,"Looking forward to making banking experiences even better and more personalized for @scotiabank customers through data, analytics and AI. https://t.co/V8C75vFHBF"
218,@ThomasOrTK,2021-09-24 15:49:12+00:00,https://twitter.com/ThomasOrTK/status/1441429519647215623,We are honored to take the next step in our relationship with @vingroupvietnam as it continues to play a leading role in the long term success of Vietnam’s digital transformation. https://t.co/X82zVU23Su
219,@ThomasOrTK,2021-09-22 17:20:06+00:00,https://twitter.com/ThomasOrTK/status/1440727621176758279,"Congratulations @philvenables on joining @WHOSTP #PCAST. The work you do with this group will be critical to addressing challenges in areas like education, security, climate change and more."
220,@ThomasOrTK,2021-09-20 16:02:33+00:00,https://twitter.com/ThomasOrTK/status/1439983327360937995,This year at #GoogleCloudNext you can build and share custom session playlists with our playlist builder. Keep an eye on @googlecloud's Twitter feed for playlists from cloud experts and executives. https://t.co/85heTvpje6
221,@ThomasOrTK,2021-09-15 15:41:05+00:00,https://twitter.com/ThomasOrTK/status/1438165986805354496,"We’re honored to partner with @WellsFargo on its #multicloud journey, from legacy IT to cloud-native infrastructure with new solutions powered by @googlecloud https://t.co/oMoFbZVDed"
222,@ThomasOrTK,2021-09-14 21:52:18+00:00,https://twitter.com/ThomasOrTK/status/1437897019205455873,"We're proud to share that our Grace Hopper subsea cable has landed in Cornwall, England. This is our first cable to the UK and marks our ongoing investment in the country to support business growth. More at https://t.co/AhQpRvg7fX https://t.co/sNbVjzGei1"
223,@ThomasOrTK,2021-09-14 16:48:11+00:00,https://twitter.com/ThomasOrTK/status/1437820484066840576,Our second Canada Cloud Region is now live in Toronto - helping Canadian businesses and organizations better leverage Google Cloud’s growing capabilities.
224,@ThomasOrTK,2021-09-10 15:17:13+00:00,https://twitter.com/ThomasOrTK/status/1436348041833771010,"Supply chains are transforming, and this is a timely read from @HansThalbauer on how AI/ML and analytics are making them more resilient and sustainable. https://t.co/RraFOJYFMn"
225,@ThomasOrTK,2021-09-08 20:29:25+00:00,https://twitter.com/ThomasOrTK/status/1435701830671949825,"As hybrid work increasingly becomes the new normal, we’re excited to bring companies and users new innovations in @GoogleWorkspace. #HowItsDone"
226,@ThomasOrTK,2021-09-08 15:23:29+00:00,https://twitter.com/ThomasOrTK/status/1435624841760030725,"Today, we’re unveiling the next step in our approach to digital sovereignty: ‘Cloud. On Europe’s Terms,’ starting with a partnership with @tsystemscom to create a Sovereign Cloud for Germany. https://t.co/kUtjcaJ4ka"
227,@ThomasOrTK,2021-09-03 15:07:13+00:00,https://twitter.com/ThomasOrTK/status/1433808810519392258,"We hear from customers that unlocking data insights is key to their success, but it isn’t always clear or easy to do. @IDC found that organizations running @SAP relied on BigQuery to better optimize data, resulting in improved business results. https://t.co/YahH12kJ89"
228,@ThomasOrTK,2021-09-01 15:50:09+00:00,https://twitter.com/ThomasOrTK/status/1433094837415202819,"It’s been a pleasure working with @TomSiebel and his team, who share our vision about AI’s potential to solve business problems. Organizations in healthcare, manufacturing, financial services and more can now use @C3_AI’s solutions on Google Cloud. https://t.co/CIK9ShTCkZ"
229,@ThomasOrTK,2021-08-31 18:17:22+00:00,https://twitter.com/ThomasOrTK/status/1432769499598508039,"We look forward to further supporting Germany’s digital transformation through the expansion of our cloud region in Frankfurt, a new Google Cloud region in Berlin-Brandenburg, and a first-of-its-kind investment in carbon-free energy with @ENGIEgroup."
230,@ThomasOrTK,2021-08-26 15:46:20+00:00,https://twitter.com/ThomasOrTK/status/1430919547649888262,"#BacktoSchool season is here. The last 18+ months have taught us many things about remote learning, and we’ve taken these lessons to heart to improve education for students around the world with @GoogleWorkspace for Education. https://t.co/bN3VQRp7zD"
231,@ThomasOrTK,2021-08-25 17:20:10+00:00,https://twitter.com/ThomasOrTK/status/1430580775158648838,"We recently celebrated the two year anniversary of Partner Advantage, which is a testament to the role partners play in the success of Google Cloud. I’m grateful for this community and the work we’re doing to better serve our joint customers. https://t.co/JGgal1AtYC"
232,@ThomasOrTK,2021-08-24 18:08:31+00:00,https://twitter.com/ThomasOrTK/status/1430230556034297857,"Two weeks ago I spoke at @HIMSS about the importance of transforming healthcare through innovation. That’s always meant bringing together the best of Google &amp; Alphabet, and we’re continuing this work with world-class teams across @Google &amp; @GoogleHealth."
233,@ThomasOrTK,2021-08-19 15:31:47+00:00,https://twitter.com/ThomasOrTK/status/1428379174754942983,We are excited about our work with @GEAppliancesCo to reimagine the next generation of smart appliances and create an elevated experience in the kitchen and home.
234,@ThomasOrTK,2021-08-16 18:16:49+00:00,https://twitter.com/ThomasOrTK/status/1427333539771535367,Thank you @kelseyhightower for reinforcing our commitment to customer empathy. https://t.co/JcsldMWKKw
235,@ThomasOrTK,2021-08-13 16:11:38+00:00,https://twitter.com/ThomasOrTK/status/1426214873885679616,A @forrester study states the top two IT initiatives for the next 12 months are to increase innovation &amp; invest in technology that helps employees do their jobs better. @RobertEnslin shared his thoughts on how our customers are achieving this. https://t.co/pfW5C9OZaB
236,@ThomasOrTK,2021-08-10 20:33:55+00:00,https://twitter.com/ThomasOrTK/status/1425193717485346817,"Together with @workday, we will enable businesses to accelerate their digital transformations and run core Workday applications across healthcare, financial services, and retail on @googlecloud. https://t.co/o5fwk6UYD0"
237,@ThomasOrTK,2021-08-10 03:47:34+00:00,https://twitter.com/ThomasOrTK/status/1424940459135168513,"If you're looking for a suggestion, I recommend Carl Sandburg's Abraham Lincoln. It's a reminder of how a good student of history will actively seek out new (and old) voices to deepen their understanding of the past."
238,@ThomasOrTK,2021-08-09 15:37:05+00:00,https://twitter.com/ThomasOrTK/status/1424756626829889540,The microscope 🔬helped doctors identify diseases they couldn’t see before &amp; today AI is doing the same for healthcare. Join me this afternoon at #HIMSS21 for a conversation w/ @HalWolfIII about how data-driven innovations are moving the industry forward. https://t.co/FGxVY64Aan
239,@ThomasOrTK,2021-08-05 19:32:10+00:00,https://twitter.com/ThomasOrTK/status/1423366238365917186,Can't wait to see what we accomplish with @CISAJen  and @CISAgov on this important initiative that will help prevent and reduce the impact of cyber threats.
240,@ThomasOrTK,2021-08-04 23:15:50+00:00,https://twitter.com/ThomasOrTK/status/1423060137804058624,"Excited to see @USWNT compete for the Bronze...…and yes, it’s football and not soccer ⚽️ Who are you rooting for? #Tokyo2020"
241,@ThomasOrTK,2021-07-29 19:11:09+00:00,https://twitter.com/ThomasOrTK/status/1420824233450541060,"It’s been an honor to work with you, @ChrstnKlein and your team to expand our partnership and help businesses securely migrate their most critical @SAP workloads to the cloud. https://t.co/rCMpHnruUI"
242,@ThomasOrTK,2021-07-28 22:27:12+00:00,https://twitter.com/ThomasOrTK/status/1420511181610049538,And we're live! Join us today at the Melbourne Cloud Region virtual launch where we'll explore how a #CloudForANZ can enable digital transformation for local businesses large and small. https://t.co/SttpIyqRuC
243,@ThomasOrTK,2021-07-26 17:58:53+00:00,https://twitter.com/ThomasOrTK/status/1419718883322257408,"We’re partnering with the @StanfordMed Neurodiversity Project on our new Google Cloud Autism Career Program to ensure our hiring process is accessible and equitable, and to train managers to support autistic talent. https://t.co/JadmhWPkn6"
244,@ThomasOrTK,2021-07-23 16:19:32+00:00,https://twitter.com/ThomasOrTK/status/1418606717957550085,"Join me on October 12-14 for #GoogleCloudNext. Looking forward to connecting with our customers, partners and industry experts on how the cloud can solve today’s greatest business challenges. https://t.co/HiPZFwyfXW https://t.co/349PXwrvph"
245,@ThomasOrTK,2021-07-22 23:44:14+00:00,https://twitter.com/ThomasOrTK/status/1418356243505287169,We’re very proud to help make it easier for Toyota customers to get the information they need with a voice-activated car manual.
246,@ThomasOrTK,2021-07-20 16:38:41+00:00,https://twitter.com/ThomasOrTK/status/1417524371166568451,"We are so grateful for the ways in which our partners are supporting the needs of our customers, particularly throughout this past year. Congratulations to our 2020 partner award winners!"
247,@ThomasOrTK,2021-07-15 14:38:12+00:00,https://twitter.com/ThomasOrTK/status/1415682114675265536,"Proud to announce the newest @GoogleCloud region in Delhi! This is our second cloud region in India, designed to support the growth and digitization of businesses across the country."
248,@ThomasOrTK,2021-07-07 16:20:20+00:00,https://twitter.com/ThomasOrTK/status/1412808711144284166,"Welcome aboard, @AdaireFoxMartin! @GoogleCloud and our #customers are fortunate to have you at the helm in EMEA."
249,@ThomasOrTK,2021-06-29 16:11:21+00:00,https://twitter.com/ThomasOrTK/status/1409907349456777219,Thank you @TW_Seal for speaking with both @HeuveldopNiklas and me on how @ericsson and @GoogleCloud will work together to help enterprises and communications service providers like @TIM_official accelerate digital transformation with 5G and edge solutions. https://t.co/bsxK5Uc5Ti
250,@ThomasOrTK,2021-06-24 15:57:02+00:00,https://twitter.com/ThomasOrTK/status/1408091805883670529,"We are honored to partner with @reliancejio to support their mission to digitize India. We are working together to bring 5G to both companies and consumers across the country, and they are migrating many of their core businesses to Google Cloud infrastructure."
251,@ThomasOrTK,2021-06-23 20:39:56+00:00,https://twitter.com/ThomasOrTK/status/1407800614600396800,"Congratulations to Dr. @LaraSuzuki who was named as one of the 2021 Top 50 Women in Engineering winners by @WES1919, for her work improving mammogram images, which has helped the early diagnosis of breast cancer. We are proud to have you on our team at @googlecloud."
252,@ThomasOrTK,2021-06-22 23:40:48+00:00,https://twitter.com/ThomasOrTK/status/1407483741446959104,"Our newly-launched Visual Inspection AI solution will help manufacturers automate quality control &amp; improve accuracy up to 10X compared w/ general-purpose ML. Pilots helped customers reduce rework for circuit boards, auto parts &amp; semiconductors.

More at: https://t.co/9I3rAcb0S7 https://t.co/IK8kR31bXH"
