,0,1,2,3
253,@ThomasOrTK,2021-06-18 22:10:46+00:00,https://twitter.com/ThomasOrTK/status/1406011531876200451,Thank you @LisaSu for the great partnership with your @AMD team.
254,@ThomasOrTK,2021-06-17 17:47:04+00:00,https://twitter.com/ThomasOrTK/status/1405582784123469826,Thanks @nicolasbarre_ for the conversation at @vivatech -- happy to share how we're helping empower European companies to take advantage of all the cloud has to offer.
255,@ThomasOrTK,2021-06-16 15:18:45+00:00,https://twitter.com/ThomasOrTK/status/1405183070966140928,"Excited to partner with you and your team, @antoniobelloni to create new, personalized customer experiences at @LVMH and to support your sustainability commitments. https://t.co/Dv6joAOTdZ"
256,@ThomasOrTK,2021-06-14 16:40:44+00:00,https://twitter.com/ThomasOrTK/status/1404478927255474182,"We’re bringing @GoogleWorkspace to everyone to make it easier for people to stay connected, get organized and achieve more together."
257,@ThomasOrTK,2021-06-09 22:06:24+00:00,https://twitter.com/ThomasOrTK/status/1402748943436443651,"Proud to announce Firmina, our newest open subsea cable from the U.S. to South America, giving our South American users faster access to Google products and Google Cloud services."
258,@ThomasOrTK,2021-05-26 16:02:19+00:00,https://twitter.com/ThomasOrTK/status/1397583888197709824,"Every company is on a journey to become more data-driven. Today, we are announcing new services to help businesses in every industry develop a unified data platform that delivers real-time insights. https://t.co/auzYpicTdl"
259,@ThomasOrTK,2021-05-18 20:48:26+00:00,https://twitter.com/ThomasOrTK/status/1394756789036470272,"We're one step closer to achieving our 24/7 carbon-free energy goal, with the first-ever corporate agreement to develop a geothermal project that will help power our data centers and cloud region in Nevada. #GoogleIO https://t.co/7p4MNSM10j"
260,@ThomasOrTK,2021-05-18 17:26:21+00:00,https://twitter.com/ThomasOrTK/status/1394705935205994496,"Today at #GoogleIO we shared the next step in the future of work with smart canvas, a new product experience in @GoogleWorkspace, to help people build deeper connections and transform collaboration. https://t.co/Zb6cp0kgbp"
261,@ThomasOrTK,2021-05-13 14:11:46+00:00,https://twitter.com/ThomasOrTK/status/1392845023629037571,"Proud to bring @SpaceX’s 1,500+ Starlink satellites together with @GoogleCloud's infrastructure to provide the world’s businesses with broader connectivity to our fast, secure cloud network. https://t.co/9QR2YysbuR"
262,@ThomasOrTK,2021-05-07 21:26:11+00:00,https://twitter.com/ThomasOrTK/status/1390780021963333632,Great to see @GoogleWorkspace playing a central role in the future of work.
263,@ThomasOrTK,2021-05-03 13:15:18+00:00,https://twitter.com/ThomasOrTK/status/1389206934692130816,Honored to expand our partnership with @VodafoneGroup to support their @SAP environment and create a new data platform that will help them offer more personalized services and improved customer experiences. https://t.co/0POeBpwLIF
264,@ThomasOrTK,2021-04-26 22:04:27+00:00,https://twitter.com/ThomasOrTK/status/1386803384800350210,Thank you for the leadership and collaboration!
265,@ThomasOrTK,2021-04-26 15:36:36+00:00,https://twitter.com/ThomasOrTK/status/1386705779630116874,"I decided to join Twitter so I could share more of my team's innovative work and @GoogleCloud customers' success - starting with one of our newest, largest partnerships with @Univision. Look forward to collaborating on your digital transformation! https://t.co/SZDQsnUT6p"
